created_utc;edited;id;is_self;locked;name;num_comments;over_18;permalink;score;selftext;spoiler;title;url
1549995142.0;False;apwal4;False;False;t3_apwal4;0;False;/r/AdobeIllustrator/comments/apwal4/created_a_more_beginner_vector_line_work_tutorial/;5;;False;Created a more beginner vector line work tutorial!;https://www.youtube.com/watch?v=obeP1ME8tfU
1549987201.0;False;apurxe;False;False;t3_apurxe;0;False;/r/AdobeIllustrator/comments/apurxe/illustration_speed_arts_jungle_river_at_night/;0;;False;Illustration Speed Arts | Jungle River at Night;https://youtu.be/sHOAKJ3B_1w
1549981890.0;False;aptw8x;False;False;t3_aptw8x;8;False;/r/AdobeIllustrator/comments/aptw8x/jackalope/;154;;False;Jackalope;https://imgur.com/hrcxTdX
1549979425.0;False;aptin7;False;False;t3_aptin7;15;False;/r/AdobeIllustrator/comments/aptin7/my_first_human_to_cartoon_conversion/;48;;False;My first human to cartoon conversion;https://i.redd.it/zxfeels375g21.jpg
1549978293.0;False;aptcoo;True;False;t3_aptcoo;6;False;/r/AdobeIllustrator/comments/aptcoo/nodes_manipulation_curves_and_straight_lines_mixed/;1;[Following this documentation](https://helpx.adobe.com/illustrator/using/editing-paths.html#convert_an_anchor_point_precisely_using_the_convert_anchor_point_tool) it's fairly easy to convert a corner to a smooth curve and then to a cusp curve. Now, keeping the same example of an initial angular V shape, how to proceed if I want to keep the first segment of the V straight and transform only the second segment as a curve? (without 'cheating' by moving the handle in a way the curve look straight) thanks;False;Nodes manipulation -> curves and straight lines mixed;https://www.reddit.com/r/AdobeIllustrator/comments/aptcoo/nodes_manipulation_curves_and_straight_lines_mixed/
1549959755.0;False;apr6n7;False;False;t3_apr6n7;6;False;/r/AdobeIllustrator/comments/apr6n7/til_export_for_screens_can_convert_fonts_to/;10;;False;TIL: Export for Screens can convert fonts to outlines w/o touching the original fonts in the .ai file. 🎉;https://i.redd.it/01m6msd6j3g21.png
1549939581.0;False;apoff0;False;False;t3_apoff0;0;False;/r/AdobeIllustrator/comments/apoff0/wip_of_previous_post/;2;;False;WIP of previous post;https://i.redd.it/fw2qcydkw1g21.jpg
1549939344.0;False;apoe2y;False;False;t3_apoe2y;0;False;/r/AdobeIllustrator/comments/apoe2y/low_poly_self_portrait/;6;;False;Low poly self portrait;https://i.redd.it/7ckxnt1xv1g21.jpg
1549938480.0;False;apo998;False;False;t3_apo998;2;False;/r/AdobeIllustrator/comments/apo998/berlin_fashion_week_poster_i_did_a_few_years_ago/;8;;False;Berlin Fashion Week Poster I did a few years ago (2017);https://i.redd.it/qrsbp310t1g21.jpg
1549928406.0;False;apmnr6;False;False;t3_apmnr6;7;False;/r/AdobeIllustrator/comments/apmnr6/circlism_piece_of_cam_newton_i_did_a_few_years/;29;;False;Circlism piece of Cam Newton I did a few years ago, about 12 hours of work. Each circle was individually placed as well;https://i.redd.it/9g9vqh5ez0g21.jpg
1549923206.0;False;aplrj5;False;False;t3_aplrj5;5;False;/r/AdobeIllustrator/comments/aplrj5/one_of_my_first_illustrations_for_my_graphic/;8;;False;One of My First Illustrations for my Graphic Design Internship, What do you All Think?;https://i.redd.it/76mbk5fsj0g21.jpg
1549923182.0;False;aplrds;False;False;t3_aplrds;3;False;/r/AdobeIllustrator/comments/aplrds/4hire_background_animation_job/;1;;False;[4HIRE] BACKGROUND ANIMATION JOB;https://imgur.com/gallery/PLd3if8
1549922399.0;False;aplm7f;True;False;t3_aplm7f;4;False;/r/AdobeIllustrator/comments/aplm7f/linework_help_shapes_that_do_not_overlap/;1;Hello,I’m looking to draw county boundaries so each county can be shaded different colors.  Is there a tool or workflow that will allow me to draw linework where each county's boundary is its own shape that does not overlap with neighboring shapes?  I understand you can edit overlapping shapes with the Pathfinder tool, but I’m hoping for a simpler solution.  Thank you for your help.;False;Linework Help - Shapes That Do Not Overlap;https://www.reddit.com/r/AdobeIllustrator/comments/aplm7f/linework_help_shapes_that_do_not_overlap/
1549919050.0;False;apkzn2;False;False;t3_apkzn2;2;False;/r/AdobeIllustrator/comments/apkzn2/hand_tool_on_macos_parallaxing/;2;;False;Hand tool on MacOs parallaxing;https://v.redd.it/uy9bbac270g21
1549918049.0;False;apkt3r;True;False;t3_apkt3r;3;False;/r/AdobeIllustrator/comments/apkt3r/strange_text_on_spline_behavior/;1;"I'm getting an odd behavior with text on a circle spline. Some letters are randomly being offset. Any help is appreciated. BTW, this is Futura PT (heavy) from Adobe. Thanks,Chad&#x200B;&#x200B;https://i.redd.it/1yzel1dd40g21.png";False;Strange text on spline behavior...;https://www.reddit.com/r/AdobeIllustrator/comments/apkt3r/strange_text_on_spline_behavior/
1549917946.0;False;apksey;True;False;t3_apksey;3;False;/r/AdobeIllustrator/comments/apksey/square_tool_question/;1;"This is probably a very simple fix but I'm definitely not skilled with Illustrator. I have a sticker that is 2.25"" wide x 8.875"" tall but the bottom of the sticker needs to be 1.25"" on the bottom. I'm not sure how to make the bottom 1.25 while keeping the top 2.25. Thanks for the help!";False;Square Tool Question;https://www.reddit.com/r/AdobeIllustrator/comments/apksey/square_tool_question/
1549910496.0;False;apjeoz;False;False;t3_apjeoz;0;False;/r/AdobeIllustrator/comments/apjeoz/18_wins_in_a_row_and_counting/;1;;False;18 wins in a row and counting;https://i.redd.it/k178q945izf21.jpg
1549910307.0;False;apjdgd;False;False;t3_apjdgd;2;False;/r/AdobeIllustrator/comments/apjdgd/is_it_good/;10;;False;Is it good?;https://i.redd.it/93v9onpkhzf21.jpg
1549906577.0;False;apioam;True;False;t3_apioam;3;False;/r/AdobeIllustrator/comments/apioam/city_poster_of_a_teeny_city_in_a_teeny_state/;1;"Bought my first home in Woonsocket, RI and I have tremendous pride in it. Despite it's lackluster reputation, it's a town that is starting to come alive![Please show some love for \\""the Woo\\"". It's a neat place with a cool history.](https://i.redd.it/0nyjiag84zf21.png)";False;City poster of a teeny city in a teeny state;https://www.reddit.com/r/AdobeIllustrator/comments/apioam/city_poster_of_a_teeny_city_in_a_teeny_state/
1549906561.0;False;apio66;False;False;t3_apio66;5;False;/r/AdobeIllustrator/comments/apio66/hi_friends_this_is_my_first_project_the_dog_is/;8;;False;Hi friends. This is my first project. The dog is copied, the rest was done by me. What interests me is, when you started. Did you copy some parts or draw on your own? Feedback appreciated. Btw the image can be used as phone background :);https://i.redd.it/wypfa6nc6zf21.jpg
1549904032.0;False;api7ff;False;False;t3_api7ff;45;False;/r/AdobeIllustrator/comments/api7ff/my_first_project_done_in_illustrator_theres/;476;;False;My first project done in Illustrator! There’s definitely flaws but overall I’m really happy with how it turned out!;https://i.redd.it/ldscjn4xyyf21.jpg
1549899238.0;False;aphdq4;True;False;t3_aphdq4;6;False;/r/AdobeIllustrator/comments/aphdq4/why_cant_i_use_the_bucket_tool/;1;https://imgur.com/Z8XpC4BI want to color the other parts, but it won't let me :/;False;Why can't I use the bucket tool?;https://www.reddit.com/r/AdobeIllustrator/comments/aphdq4/why_cant_i_use_the_bucket_tool/
1549893135.0;False;apggkk;False;False;t3_apggkk;6;False;/r/AdobeIllustrator/comments/apggkk/1st_poster_on_illustrator_and_photoshop_whatchya/;0;;False;1st poster on illustrator and photoshop! whatchya think?;https://i.redd.it/ef5bwc2i2yf21.jpg
1549890084.0;False;apg184;False;False;t3_apg184;4;False;/r/AdobeIllustrator/comments/apg184/hi_guys_just_did_another_piece_with_the_same/;2;;False;Hi guys just did another piece with the same style and i just want some opinions on whether this kind of style would look good with shadows? Any feedback would be awesome!;https://i.redd.it/5t2jtn2gtxf21.png
1549879916.0;False;apeu2y;False;False;t3_apeu2y;5;False;/r/AdobeIllustrator/comments/apeu2y/illustrator_after_effects_what_do_you_think/;18;;False;Illustrator + After Effects. What do you think? - Behance link: http://bit.ly/2E3wdBQ;https://v.redd.it/at1bl7g0twf21
1549869040.0;False;apdr93;True;False;t3_apdr93;5;False;/r/AdobeIllustrator/comments/apdr93/question_confused_about_illustrator_seeming_to/;1;"I'm currently trying to export my project as a PNG. I had it set to export based on the artboard, which is currently sized to my desired dimensions. However, after I set it to export as a 300ppi PNG, I'm finding that the resulting dimensions are now way too large. After doing some math it seems to be increased to make it 4x larger, or basically the difference between a resolution of 72 and 300. In order to get this to work, I had to resize my artboard to 24% of it's original size, manually resize my art and re-position it in the artboard. Even with all that, it finally exports out close to where it should be, but it's still a pixel off due to some rounding issue when the size is getting increased. I double-checked and my ""Document Raster Effects Settings"" is currently set to 300ppi.It appears like Illustrator is working in a default resolution of 72. I just don't understand- I thought that Illustrator being a vector program meant it had no working resolution per se, and that any project could be exported as you wished. I have several projects that I'm trying to all export at the same size, and this workaround is very annoying, but more than that just feels wrong. Any help would be appreciated!";False;[Question] Confused about Illustrator seeming to have a working resolution;https://www.reddit.com/r/AdobeIllustrator/comments/apdr93/question_confused_about_illustrator_seeming_to/
1549866627.0;False;apdh85;False;False;t3_apdh85;3;False;/r/AdobeIllustrator/comments/apdh85/champsélysées/;21;;False;Champs-Élysées;https://i.redd.it/4pi7b93pvvf21.jpg
1549860197.0;False;apcn0f;True;False;t3_apcn0f;9;False;/r/AdobeIllustrator/comments/apcn0f/how_to_create_morphing_halftones_with_various/;2;I know you can have custom dot shapes in Ps but they don't come out looking this cool. Any idea how this is done?https://i.redd.it/711ib0b9cvf21.jpg;False;How to create morphing halftones with various shapes instead of the usual dots;https://www.reddit.com/r/AdobeIllustrator/comments/apcn0f/how_to_create_morphing_halftones_with_various/
1549851293.0;False;apbdt8;False;False;t3_apbdt8;1;False;/r/AdobeIllustrator/comments/apbdt8/teddy_friends_for_my_daughters_birthday_invitation/;6;;False;Teddy Friends for my daughter's birthday invitation;https://i.redd.it/u5gk4qoyluf21.png
1549849218.0;False;apb2zf;False;False;t3_apb2zf;3;False;/r/AdobeIllustrator/comments/apb2zf/mountain_design_i_made/;8;;False;Mountain Design I Made;https://i.redd.it/152eibkxfuf21.jpg
1549846929.0;False;apaqwv;True;False;t3_apaqwv;1;False;/r/AdobeIllustrator/comments/apaqwv/does_anyone_have_any_tips_for_shading/;3;I’m just looking for any tips someone might have on shading things like people. ;False;Does anyone have any tips for shading?;https://www.reddit.com/r/AdobeIllustrator/comments/apaqwv/does_anyone_have_any_tips_for_shading/
1549846317.0;False;apano0;False;False;t3_apano0;3;False;/r/AdobeIllustrator/comments/apano0/one_for_rredditgetsdrawn/;5;;False;One for r/redditgetsdrawn;https://i.redd.it/9lea2boa7uf21.jpg
1549844767.0;False;apaf38;False;False;t3_apaf38;13;False;/r/AdobeIllustrator/comments/apaf38/my_first_illustrator_artwork/;204;;False;My first illustrator “artwork”;https://i.redd.it/1t5ihmzo2uf21.jpg
1549844331.0;False;apacor;False;False;t3_apacor;14;False;/r/AdobeIllustrator/comments/apacor/not_my_first_project_but_probably_the_first_one/;30;;False;Not my first project but probably the first one I'm actually proud of! Finally feel like I'm learning how to use this program!;https://i.redd.it/fdvqjdce1uf21.png
1549844308.0;False;apacjl;False;False;t3_apacjl;3;False;/r/AdobeIllustrator/comments/apacjl/question_why_doesnt_my_guides_start_at_0/;1;;False;Question: Why doesn't my guides start at 0 vertically?;https://i.redd.it/lca5ef1b1uf21.png
1549839034.0;False;ap9ifk;False;False;t3_ap9ifk;0;False;/r/AdobeIllustrator/comments/ap9ifk/another_linocut_stamp_study_this_time_david_bowie/;9;;False;Another linocut stamp study. This time, David Bowie.;https://i.redd.it/71c4jblmltf21.jpg
1549832818.0;False;ap8fie;True;False;t3_ap8fie;0;False;/r/AdobeIllustrator/comments/ap8fie/problème_with_my_invedia_not_working_with_adobe/;1;Hello reddit, Have u ever had this problème no matter how much my computer needs power it still doesn't use my gtx960 only integrated graphic card 😡What should i do ? ;False;Problème with my invedia not working with Adobe;https://www.reddit.com/r/AdobeIllustrator/comments/ap8fie/problème_with_my_invedia_not_working_with_adobe/
1549821912.0;False;ap6g8v;False;False;t3_ap6g8v;2;False;/r/AdobeIllustrator/comments/ap6g8v/new_to_illustrator_decided_to_create_my_best/;21;;False;New to illustrator. Decided to create my best friend for my first project.;https://i.redd.it/wb7n4xeq6sf21.png
1549821381.0;False;ap6cyc;False;False;t3_ap6cyc;1;False;/r/AdobeIllustrator/comments/ap6cyc/what_do_you_think_about_my_latest_work/;1;;False;What do you think about my latest work?;https://i.redd.it/2e947ho45sf21.png
1549820812.0;False;ap69e4;False;False;t3_ap69e4;3;False;/r/AdobeIllustrator/comments/ap69e4/an_iphone_case_design_i_made_a_while_back_what/;2;;False;An iPhone case design I made a while back. What are your thoughts?;https://i.redd.it/y75zauvy0sf21.png
1549818824.0;False;ap5wvc;False;False;t3_ap5wvc;11;False;/r/AdobeIllustrator/comments/ap5wvc/my_take_of_the_classic_dirt_harry_pose_still_wip/;39;;False;My take of the classic Dirt Harry pose. Still WIP with the body.;https://i.redd.it/eayiih7dxrf21.jpg
1549817507.0;False;ap5ol7;True;False;t3_ap5ol7;5;False;/r/AdobeIllustrator/comments/ap5ol7/how_do_i_convert_text_to_just_an_single_path_for/;1;"Good morning, all! I have a project I'm going to laser engrave. There are some pieces of text in it, and I'd like to have the laser just follow a single ""interior"" path for the text, not an exterior stroke. For example, I'd like [something like this red path](https://imgur.com/Izh9YxJ), as opposed to the [blue path in this example](https://imgur.com/4JkN5JX).Does that make sense? It will let the laser just move like a hand holding a pen, and burn the thin text in one path. Doing the whole exterior will make it too thick, I think";False;How do I convert text to just an single path (for vector laser engraving);https://www.reddit.com/r/AdobeIllustrator/comments/ap5ol7/how_do_i_convert_text_to_just_an_single_path_for/
1549815546.0;False;ap5cin;False;False;t3_ap5cin;18;False;/r/AdobeIllustrator/comments/ap5cin/how_do_i_get_these_rough_strokes_in_illustrator/;55;;False;How Do I Get These Rough strokes In Illustrator? Original Artist Is Joe Sparrow;https://i.redd.it/y97xy9ojnrf21.png
1549811257.0;False;ap4nwy;False;False;t3_ap4nwy;6;False;/r/AdobeIllustrator/comments/ap4nwy/i_used_ai_to_create_some_new_app_icon_concepts/;1;;False;I used AI to create some new app icon concepts. (Vid in comments);https://imgur.com/pL5TGNo
1549802128.0;False;ap3j8w;False;False;t3_ap3j8w;21;False;/r/AdobeIllustrator/comments/ap3j8w/illustration_for_an_upcoming_ep_cover/;126;;False;Illustration for an upcoming EP cover 😀;https://i.redd.it/pkbmbemwjqf21.jpg
1549788902.0;False;ap2bgu;False;False;t3_ap2bgu;7;False;/r/AdobeIllustrator/comments/ap2bgu/did_a_little_hedgehog_with_cacti_for_a_linocut/;137;;False;Did a little hedgehog with cacti for a linocut stamp study;https://i.redd.it/xeihawwjgpf21.jpg
1549771241.0;False;ap0gie;True;False;t3_ap0gie;2;False;/r/AdobeIllustrator/comments/ap0gie/creatingusing_text_outlines/;1;I’m working with outlined text in Illustrator and I’m wanting to grab the tittle on the “i” and delete just the tittle alone. I have the letters ungrouped from each other but I don’t have the option to ungroup the pieces of the “i”. It’s probably some easy solution I’m not thinking of but any advice would be great! ;False;Creating/Using Text Outlines;https://www.reddit.com/r/AdobeIllustrator/comments/ap0gie/creatingusing_text_outlines/
1549763472.0;False;aozesw;False;False;t3_aozesw;21;False;/r/AdobeIllustrator/comments/aozesw/how_do_i_improve_this_im_stuck/;19;;False;How do I improve this? I'm stuck!;https://i.redd.it/7ky4sjrvcnf21.jpg
1549761607.0;False;aoz5ka;True;False;t3_aoz5ka;0;False;/r/AdobeIllustrator/comments/aoz5ka/two_tone_vector_fills/;1;I have a vector I'd like to make two tone but when I try changing the fill color for one section, it fills the entire image. Couldn't find an answer anywhere online. Any ideas? ;False;Two Tone Vector Fills?;https://www.reddit.com/r/AdobeIllustrator/comments/aoz5ka/two_tone_vector_fills/
1549753507.0;False;aoxx5h;True;False;t3_aoxx5h;1;False;/r/AdobeIllustrator/comments/aoxx5h/when_i_open_most_pdf_files_through_ai_it_prompts/;1;"My question is: How do I save PDF files so that when I open them through AI, it prompts me to select a page (or artboard) to open?&#x200B;Sorry if the question is confusing, I've been having difficulty searching for the answer mainly because of my inability to phrase the question clearly.&#x200B;Thanks in advance!";False;When I open most PDF files through AI, it prompts me to pick which artboard (or page) to open. When I save designs with multiple artboards as a PDF (using the default settings) and then re-open them via AI, it opens all the artboards in the same design.;https://www.reddit.com/r/AdobeIllustrator/comments/aoxx5h/when_i_open_most_pdf_files_through_ai_it_prompts/
1549742401.0;False;aow0h4;False;False;t3_aow0h4;0;False;/r/AdobeIllustrator/comments/aow0h4/hair_tutorial_adobe_draw/;5;;False;Hair tutorial Adobe Draw;https://youtu.be/rRs2syixSOw
1549738281.0;False;aov98g;True;False;t3_aov98g;7;False;/r/AdobeIllustrator/comments/aov98g/pathfinder_question/;2;If I had a red star inside of a blue circle such that the points of the star were sticking out of the circles range, what can I do to get rid of the part of the red star that is inside of the blue circle without deleting the underlying blue section? The end result should be a solid blue circle with 5 little red triangles  sticking out of it.;False;Pathfinder question!;https://www.reddit.com/r/AdobeIllustrator/comments/aov98g/pathfinder_question/
1549738151.0;False;aov8f5;False;False;t3_aov8f5;2;False;/r/AdobeIllustrator/comments/aov8f5/beautomax_3000/;9;;False;Beauto-Max 3000;https://i.redd.it/elp0hd4j9lf21.png
1549728057.0;False;aotjic;False;False;t3_aotjic;4;False;/r/AdobeIllustrator/comments/aotjic/im_an_amatuer_and_aspiring_artist_any_feedback/;13;;False;Im an amatuer and aspiring artist! Any feedback would be appreciated :);https://i.redd.it/uah9k5nnfkf21.jpg
1549710561.0;False;aorg3i;False;False;t3_aorg3i;39;False;/r/AdobeIllustrator/comments/aorg3i/my_first_creation_what_do_you_guys_think/;351;;False;My first creation, what do you guys think?;https://i.redd.it/ij6u6l3crif21.png
1549708746.0;False;aor9g9;True;False;t3_aor9g9;4;False;/r/AdobeIllustrator/comments/aor9g9/help_please/;1;"&#x200B;[I'm just a newbie in Illustrator and i dont get how to delete the green spaces out of the blue circle.  I know that the clipping mask exists, but it seems like it does't work... I'm probably doing something wrong. Can someone help me out?](https://i.redd.it/xhx3iklmtif21.png)";False;Help please;https://www.reddit.com/r/AdobeIllustrator/comments/aor9g9/help_please/
1549708403.0;False;aor894;False;False;t3_aor894;7;False;/r/AdobeIllustrator/comments/aor894/wizard_dog_now_feeling_like_the_glow_looks_cheap/;30;;False;Wizard Dog 😎 now feeling like the glow looks cheap but good to learn it existed in illustrator!;https://i.redd.it/kbh6rar7tif21.jpg
1549699349.0;False;aoqe4u;True;False;t3_aoqe4u;7;False;/r/AdobeIllustrator/comments/aoqe4u/i_am_trying_to_move_a_shape_on_top_of_another/;1;;False;I am trying to move a shape on top of another shape so they share a line between them, but when i try to move one on top of the other it shifts itself slightly. What should I do?;https://www.reddit.com/r/AdobeIllustrator/comments/aoqe4u/i_am_trying_to_move_a_shape_on_top_of_another/
1549698000.0;False;aoq9nj;False;False;t3_aoq9nj;6;False;/r/AdobeIllustrator/comments/aoq9nj/design_the_ukrainian_cost_of_arms_for_my_phone/;2;;False;Design the Ukrainian cost of arms for my phone wallpaper. Question about white line on the left in the comments.;https://imgur.com/a/GJDGfWq/
1549692018.0;False;aopmxv;True;False;t3_aopmxv;6;False;/r/AdobeIllustrator/comments/aopmxv/i_feel_really_really_dumb_how_do_i_do_this/;1;"[https://imgur.com/gallery/Owg6Yae](https://imgur.com/gallery/Owg6Yae)&#x200B;I need to make the white line segment match the blue curve behind it with no overlap or anything. I tried making it go past and using pathfinder to 'minus back' kind of thing, can't figure it out.&#x200B;Note: this is a .png and the white ""background,"" as this is the top left section of a circle, so the white outside the blue part of the circle isn't actually white - it's transparent and should not be infringed upon.&#x200B;What's the best way to make my line segments match exactly the curve behind them? I've tried just option-click-dragging with the pen tool to match the curve, but I need it to be more exact than that.";False;I feel really, really dumb. How do I do this?;https://www.reddit.com/r/AdobeIllustrator/comments/aopmxv/i_feel_really_really_dumb_how_do_i_do_this/
1549683734.0;False;aoompn;False;False;t3_aoompn;2;False;/r/AdobeIllustrator/comments/aoompn/21_savage/;9;;False;21 Savage;https://i.redd.it/5fl7gsisrgf21.png
1549677324.0;False;aonsn0;True;False;t3_aonsn0;2;False;/r/AdobeIllustrator/comments/aonsn0/printing_wrong_colours/;2;Hi,I recently had some prints but the colour on screen is different to what I see on print. I don't know that it's my monitor because I've tried d to calibrate it but I notice that switching from the Web to Adobe, it does get darker. I know CMYK is supposed to be duller. I had the right colour profile as the printing company's and I even proofed the print on PDF first. I'm not sure what's going on =/;False;Printing wrong colours;https://www.reddit.com/r/AdobeIllustrator/comments/aonsn0/printing_wrong_colours/
1549673332.0;False;aon8ob;False;False;t3_aon8ob;2;False;/r/AdobeIllustrator/comments/aon8ob/stay_lifted/;7;;False;STAY LIFTED;https://i.redd.it/pi357byuwff21.png
1549672670.0;False;aon57j;False;False;t3_aon57j;8;False;/r/AdobeIllustrator/comments/aon57j/never_stop_exploring_tattoo_design_made_in/;6;;False;NEVER STOP EXPLORING - Tattoo Design Made in Illustrator;https://i.redd.it/jaj5988yuff21.jpg
1549668988.0;False;aomkyw;True;False;t3_aomkyw;1;False;/r/AdobeIllustrator/comments/aomkyw/first_illustration_feedback_would_be_greatly/;1;"&#x200B;https://i.redd.it/lntuqd68jff21.jpg&#x200B;Hi r/AdobeIllustrator! &#x200B;Recently I've decided to learn illustrator on my own (through youtube and even this subreddit) and even though its pretty challenging, it is lots of fun and I am enjoying it so much! I had an opportunity to design a poster for an event and this is what I came up with. Points of improvement and general feedback is greatly appreciated!  (Also, just to clarify this is not self-promotion, I really just want feedback on my design)&#x200B;Thanks in advance!&#x200B;&#x200B;&#x200B;";False;First illustration. Feedback would be greatly appreciated!;https://www.reddit.com/r/AdobeIllustrator/comments/aomkyw/first_illustration_feedback_would_be_greatly/
1549668033.0;False;aomfmj;True;False;t3_aomfmj;3;False;/r/AdobeIllustrator/comments/aomfmj/too_many_layers_affect_exporting/;1;Hi,Usually when I'm creating an image, I will do different coloured backgrounds. I will create a different layer for each background in the same art board. However, I've just read that you can create a different art board for each colour in the same file. When you're exporting to Pdf or jpg, do the layers affect anything? E.g. Image quality or size?Also if you're making different art boards for each colour, how do you export each one separately??Thanks! ;False;Too many layers affect exporting?;https://www.reddit.com/r/AdobeIllustrator/comments/aomfmj/too_many_layers_affect_exporting/
1549666832.0;1549687277.0;aom8l3;True;False;t3_aom8l3;6;False;/r/AdobeIllustrator/comments/aom8l3/how_is_these_effects_achieved_it_conquered_the/;1;"[https://imgur.com/EnXjEfi](https://imgur.com/EnXjEfi)Hello, I follow an Instagram page dedicated towards old and new horror movies and found this one interesting. I'm still pretty new, and I'm wondering what effect (or filter?) is applied on the creature in the background. Or is it all Illustrator hand vector work (brush tool and pen tool)? Because I see that ""style"" a lot on tshirts, skateboard designs, etc.And while I'm here I might as well ask about the female on the poster. Is it some type of Photoshop mixer brush at work?Any input would be appreciated! :)Edit: Realized the titled should say ARE and not is.";False;How is these effects achieved? (It Conquered the World movie poster);https://www.reddit.com/r/AdobeIllustrator/comments/aom8l3/how_is_these_effects_achieved_it_conquered_the/
1549661769.0;False;aolekh;True;False;t3_aolekh;4;False;/r/AdobeIllustrator/comments/aolekh/help_with_image_trace/;1;Really struggling with things like this using image trace. Quite often people send low quality jpgs.   For context: These are to sublimation printed onto clothing...   No matter how much I play with the sliders, or different presents I use. Just can't get it looking crisp. Any tips? Any reading resources ?  Cheers https://i.redd.it/6jcm5dc4yef21.jpg;False;Help with image trace;https://www.reddit.com/r/AdobeIllustrator/comments/aolekh/help_with_image_trace/
