created_utc;edited;id;is_self;locked;name;num_comments;over_18;permalink;score;selftext;spoiler;title;url
1550880303.0;False;atosb1;False;False;t3_atosb1;1;False;/r/AdobeIllustrator/comments/atosb1/trying_to_improve_on_the_basics_feedback_wanted/;3;;False;Trying to improve on the basics, feedback wanted and welcome!;https://imgur.com/a/sTHFFWb
1550873852.0;False;atnnzk;False;False;t3_atnnzk;5;False;/r/AdobeIllustrator/comments/atnnzk/any_suggestions_for_improvement_are_more_than/;7;;False;Any suggestions for improvement are more than welcome :);https://i.redd.it/wft3ti5d07i21.png
1550859643.0;False;atkxdv;False;False;t3_atkxdv;0;False;/r/AdobeIllustrator/comments/atkxdv/work_in_progress_lebron_james/;2;;False;Work in progress. Lebron James;https://i.redd.it/r20vmktfw5i21.jpg
1550859325.0;False;atkv6r;False;False;t3_atkv6r;1;False;/r/AdobeIllustrator/comments/atkv6r/my_best_illustrator_project_for_my_computer/;48;;False;My best illustrator project for my Computer Graphics 2 class!;https://i.redd.it/mq4kd9jhv5i21.jpg
1550858014.0;False;atklx7;False;False;t3_atklx7;5;False;/r/AdobeIllustrator/comments/atklx7/editing_text_path/;1;;False;Editing Text Path?;https://i.redd.it/beczqd4kr5i21.png
1550845225.0;False;ati4sl;False;False;t3_ati4sl;1;False;/r/AdobeIllustrator/comments/ati4sl/frida/;7;;False;Frida;https://i.redd.it/mowtv4rjp4i21.jpg
1550845110.0;False;ati43a;False;False;t3_ati43a;3;False;/r/AdobeIllustrator/comments/ati43a/question_is_there_a_way_to_seperate_the_letters/;1;;False;Question: Is there a way to seperate the letters from the box, so my gradient only applies to the letters and not in between them?;https://i.redd.it/n9ko8lr0p4i21.png
1550843256.0;False;athshb;True;False;t3_athshb;2;False;/r/AdobeIllustrator/comments/athshb/question_about_making_a_text_glitched/;0;What i mean is like making a line through the center if the text and mive the lower prt sligjtly to the side so it doesnt line up with the top halfHow can i do that? ;False;"Question about making a text ""Glitched""";https://www.reddit.com/r/AdobeIllustrator/comments/athshb/question_about_making_a_text_glitched/
1550842278.0;False;athmm5;True;False;t3_athmm5;11;False;/r/AdobeIllustrator/comments/athmm5/huge_illustrator_file_size/;0;"Hi there,I'm currently working on a project for a client. It's an A3 size print project.I started off by inserting a raster image as the background from Adobe Stocks. It was 11mb or smthg like that, and I compressed it down to 3mb with squash (I'm on macOS). I don't really need the image to be that high quality since it's really just one color with some shadows and a turquoise piano standing in the center.Now my question: I went on to save the file, and Illustrator blew this 3mb, 6000x4000 image up to 85mb in the .ai file!!! How does this work?? I am at a complete loss of words. Illustrator is laggy as hell now because of this ""huge file"" it's working with.Any solutions to this? Maybe the  answer is obvious and I'm just too big of a goon to get it.Thanks";False;HUGE Illustrator file size;https://www.reddit.com/r/AdobeIllustrator/comments/athmm5/huge_illustrator_file_size/
1550841116.0;False;athfjf;False;False;t3_athfjf;21;False;/r/AdobeIllustrator/comments/athfjf/im_not_sure_how_to_classify_thisparody_retro/;94;;False;I’m not sure how to classify this....Parody retro product design? Anyways, I made this in illustrator, then made my first ever mock-up...How’d I do?;https://imgur.com/gallery/a3zAhJs
1550836109.0;False;atgmt8;False;False;t3_atgmt8;6;False;/r/AdobeIllustrator/comments/atgmt8/lava_lamp/;34;;False;Lava Lamp;https://i.imgur.com/PrO2lRx.jpg
1550815818.0;False;atdz20;False;False;t3_atdz20;5;False;/r/AdobeIllustrator/comments/atdz20/thoughts_how_can_i_make_him_swampier/;7;;False;Thoughts? How can I make him swampier?;https://i.redd.it/rz63d6l4a2i21.png
1550805398.0;False;atcdf2;False;False;t3_atcdf2;8;False;/r/AdobeIllustrator/comments/atcdf2/i_made_an_outrunvaporwave_apex_legends/;81;;False;I made an outrun/vaporwave apex legends illustration. It was made 100% in illustrator with only some raster textures applied at the end.;https://i.imgur.com/TDQ5h06.jpg
1550798745.0;False;atb9x0;True;False;t3_atb9x0;2;False;/r/AdobeIllustrator/comments/atb9x0/why_do_my_blacks_grey_when_saving_as_pdf/;2;"My rich blacks turn grey when exporting as pdf, shown below:&#x200B;[https://prnt.sc/mofcl8](https://prnt.sc/mofcl8)&#x200B;Im working with print, if that helps.";False;Why do my blacks grey when saving as .pdf?;https://www.reddit.com/r/AdobeIllustrator/comments/atb9x0/why_do_my_blacks_grey_when_saving_as_pdf/
1550794450.0;False;atak16;True;False;t3_atak16;4;False;/r/AdobeIllustrator/comments/atak16/artboard_size_for_large_scale_printing_project/;1;"Hello, new here but still semi new to using illustrator. I got this job to design a mural that will be printed on vinyl and installed for a wall. I did the design using illustrator because of the vector aspect so there would be no loss in quality if printed large. I already did the design and they liked, but I have to make some revisions before sending to the printers. Before starting, I converted the wall space (11' 3/4"" x 7' 9"") to inches and put those inches for the dimensions of the artboard. I am concerned if this was a good way to insure the design would fit on the wall exactly. The ai file is not large at all. I am not experienced in printing, as I am not sure if I should make room for the bleed or not, or if it even matters in this case. Has anyone ever had any experience in working and printing in large scale? And how did you prepare your artboard to insure everything was right in the end?";False;Artboard size for large scale printing project?;https://www.reddit.com/r/AdobeIllustrator/comments/atak16/artboard_size_for_large_scale_printing_project/
1550793251.0;False;atacct;True;False;t3_atacct;7;False;/r/AdobeIllustrator/comments/atacct/how_to_change_default_rectangle_tool_from_rounded/;1;Thank you;False;How to change default rectangle tool from rounded back to regular?;https://www.reddit.com/r/AdobeIllustrator/comments/atacct/how_to_change_default_rectangle_tool_from_rounded/
1550786621.0;False;at94uf;False;False;t3_at94uf;26;False;/r/AdobeIllustrator/comments/at94uf/xauen_my_first_take_on_isometric_design/;193;;False;Xauen - My first take on isometric design;https://i.redd.it/k4sak34puzh21.png
1550785046.0;False;at8t6s;False;False;t3_at8t6s;10;False;/r/AdobeIllustrator/comments/at8t6s/what_in_the_holy_hell_is_going_on_here/;1;;False;What in the holy hell is going on here... (Description in comments);https://v.redd.it/ro9dsej9qzh21
1550773097.0;False;at6fvf;True;False;t3_at6fvf;4;False;/r/AdobeIllustrator/comments/at6fvf/simple_problem_making_silhouettes/;1;Hello friends! I'm an enthusiastic newbie. Thank you for your patience! While making simple silhouettes using the pen tool, if I fully complete the silhouette, and the fill is black, sometimes I'll get bizarre unfilled triangle patterns within my supposed to be fully black fill area. Why would this be? No extra strokes going through the fill area. I can put a patch on the mistake, by using the fill bucket tool, but I'd like to know how/why I'm making the mistake in the first place!! ;False;Simple problem making silhouettes.;https://www.reddit.com/r/AdobeIllustrator/comments/at6fvf/simple_problem_making_silhouettes/
1550771226.0;False;at61z4;False;False;t3_at61z4;4;False;/r/AdobeIllustrator/comments/at61z4/newbie_im_trying_to_colorshade_the_interior_of_my/;4;;False;(Newbie) I'm trying to color/shade the interior of my shape like the one on the left, how should I process ?;https://i.redd.it/gi8v2deblyh21.png
1550767934.0;False;at5dpk;False;False;t3_at5dpk;7;False;/r/AdobeIllustrator/comments/at5dpk/mf_doom/;91;;False;MF doom;https://i.redd.it/ylvcctmqbyh21.jpg
1550766048.0;False;at4zs3;False;False;t3_at4zs3;6;False;/r/AdobeIllustrator/comments/at4zs3/enviromentally_friendly_lamp/;9;;False;Enviromentally friendly lamp;https://i.redd.it/7hemryn46yh21.png
1550765972.0;False;at4z8d;False;False;t3_at4z8d;2;False;/r/AdobeIllustrator/comments/at4z8d/second_attempt_at_portrait/;2;;False;Second Attempt at Portrait;https://i.redd.it/x1vurzpw5yh21.png
1550748670.0;False;at23u2;True;False;t3_at23u2;2;False;/r/AdobeIllustrator/comments/at23u2/vexel_art/;0;Vexel art done on sketch app (macOS), please rate the design it would be very helpful for me and if you all could suggest me some cool tutorials on vexel art done on illustrator, please share the links.Vexel - https://dribbble.com/shots/5638920-Vexel;False;Vexel art;https://www.reddit.com/r/AdobeIllustrator/comments/at23u2/vexel_art/
1550746403.0;False;at1tj9;True;False;t3_at1tj9;0;False;/r/AdobeIllustrator/comments/at1tj9/cali_cool/;1;"&#x200B;https://i.redd.it/mzdj812ojwh21.png";False;CALI COOL;https://www.reddit.com/r/AdobeIllustrator/comments/at1tj9/cali_cool/
1550743414.0;False;at1gmk;True;False;t3_at1gmk;3;False;/r/AdobeIllustrator/comments/at1gmk/pls_helpground_tiles/;0;I have created squares with different textures that i am using as the ground. Is there a way i can connect these squares easily do that i dont have to do it really slowly by hand?;False;PLS HELP:Ground Tiles;https://www.reddit.com/r/AdobeIllustrator/comments/at1gmk/pls_helpground_tiles/
1550730855.0;False;aszw3s;False;False;t3_aszw3s;1;False;/r/AdobeIllustrator/comments/aszw3s/just_wanted_to_share_my_process_for_bringing/;8;;False;Just wanted to share my process for bringing sketches to life;https://i.redd.it/qs0cnzlh9vh21.jpg
1550730482.0;False;aszu71;False;False;t3_aszu71;7;False;/r/AdobeIllustrator/comments/aszu71/pick_your_pop/;118;;False;Pick Your Pop;https://i.redd.it/bl0t1vmd8vh21.jpg
1550712091.0;1550730268.0;aswrlu;True;False;t3_aswrlu;7;False;/r/AdobeIllustrator/comments/aswrlu/will_this_laptop_be_good_enough_to_do_some_light/;3;"I am looking to get a laptop for university work that requires Illustrator, will this be able to run some light tasks on illustrator? (Part time uni and full time non-laptop related job)&#x200B;[https://www.jbhifi.com.au/computers-tablets/laptops/acer/acer-aspire-5-a515-i5-15-6-notebook/339302/](https://www.jbhifi.com.au/computers-tablets/laptops/acer/acer-aspire-5-a515-i5-15-6-notebook/339302/)";False;Will this laptop be good enough to do some light project with illustrator?;https://www.reddit.com/r/AdobeIllustrator/comments/aswrlu/will_this_laptop_be_good_enough_to_do_some_light/
1550704698.0;False;asvd59;True;False;t3_asvd59;0;False;/r/AdobeIllustrator/comments/asvd59/how_to_get_rid_of_the_blank_spaces_between_vector/;1;"I recently downloaded my ai file as a png, jpg, and pdf file, and in all instances, there are small cracks between the vector shapes. Does anyone have a solution for this? I'm exporting in the highest quality (300 ppi)&#x200B;The image for reference is linked below. You cant really tell, but if you start zooming in, you can notice the spaces.&#x200B;[https://drive.google.com/file/d/17UtgN49EZTcVvZ2PBNCGKhlFSx8RSUjR/view?usp=sharing](https://drive.google.com/file/d/17UtgN49EZTcVvZ2PBNCGKhlFSx8RSUjR/view?usp=sharing)";False;How to get rid of the blank spaces between vector shapes when exporting file;https://www.reddit.com/r/AdobeIllustrator/comments/asvd59/how_to_get_rid_of_the_blank_spaces_between_vector/
1550703396.0;False;asv3wy;True;False;t3_asv3wy;4;False;/r/AdobeIllustrator/comments/asv3wy/trying_to_get_a_gradient_to_fit_to_an_irregular/;1;I'm new to adobe illustrator, and I'm just trying to get a smooth gradient across this shape. [https://imgur.com/5409AHQ](https://imgur.com/5409AHQ)I've looked all over, and all that I get is people saying to put a gradient along a path, but that doesn't work for the full shape. I'm trying to get something like this: [https://imgur.com/a/bzXmiCr](https://imgur.com/a/bzXmiCr)Any help would be greatly appreciated!;False;Trying to get a gradient to fit to an irregular shape. Help!;https://www.reddit.com/r/AdobeIllustrator/comments/asv3wy/trying_to_get_a_gradient_to_fit_to_an_irregular/
1550695638.0;False;astig3;False;False;t3_astig3;5;False;/r/AdobeIllustrator/comments/astig3/anyone_know_how_i_might_be_able_to_get_this/;1;;False;Anyone know how I might be able to get this effect in Illustrator? (I have tried blend tool);https://i.redd.it/z4vn72rmcsh21.jpg
1550695459.0;False;asth1h;False;False;t3_asth1h;3;False;/r/AdobeIllustrator/comments/asth1h/did_a_one_day_scientific_illustration_course_and/;10;;False;Did a one day scientific illustration course and now I'm practicing drawing primates. Would like critique and tutorial suggestions.;https://i.redd.it/lufmtte8csh21.png
1550695228.0;False;astfd7;False;False;t3_astfd7;6;False;/r/AdobeIllustrator/comments/astfd7/accidently_put_everything_in_outline_should_be/;2;;False;Accidently put everything in outline, should be some setting, can anyone help me change it back please?;https://i.redd.it/1jdmgphibsh21.png
1550692395.0;False;assu5k;False;False;t3_assu5k;1;False;/r/AdobeIllustrator/comments/assu5k/i_did_this_one_for_rredditgetsdrawn/;20;;False;I did this one for r/redditgetsdrawn;https://i.redd.it/x5qa88n23sh21.jpg
1550689377.0;False;ass7ks;True;False;t3_ass7ks;3;False;/r/AdobeIllustrator/comments/ass7ks/trouble_converting_colors_to_iphone_display/;1;I'm new to illustrator. working in RGB color and i made a iphone x background. the dark blue color I'm using is showing up as blue on my PC monitor. When i export it as a .pdf or a .png it still shows up as blue on my monitor, but when i open it in the iphone it's black.  I'm thinking that the issue is my monitor color settings may be off from the iphone, but i'm not sure. I am currently using a laptop with a cable attached to a larger monitor for display.  I've spent a couple hours reading into this and switching things but to no avail. Any ideas? Thanks in advance;False;trouble converting colors to iphone display;https://www.reddit.com/r/AdobeIllustrator/comments/ass7ks/trouble_converting_colors_to_iphone_display/
1550683181.0;False;asqxdj;False;False;t3_asqxdj;4;False;/r/AdobeIllustrator/comments/asqxdj/logo_critique/;1;;False;Logo critique;https://i.redd.it/fudvumbqbrh21.jpg
1550683163.0;False;asqx9d;False;False;t3_asqx9d;3;False;/r/AdobeIllustrator/comments/asqx9d/how_were_the_dizzy_eyes_made/;10;;False;How were the dizzy eyes made?;https://i.redd.it/pegh3t8ebrh21.jpg
1550682699.0;False;asqtxi;False;False;t3_asqtxi;1;False;/r/AdobeIllustrator/comments/asqtxi/how_could_i_go_about_creating_this_text_effect/;1;;False;How could I go about creating this text effect?;https://i.redd.it/mbrtf9oaarh21.jpg
1550681133.0;False;asqimj;True;False;t3_asqimj;1;False;/r/AdobeIllustrator/comments/asqimj/help_can_only_select_the_bottom_of_lines_of_text/;1;"This is really just an issue that affects my workflow. Since I can remember, I've been able to click on any portion of text and it will select that text box and everything within it. I'm not sure what I've changed, but now I can only select the imaginary line at the bottom of each line of text. Even if I click directly on a letter, if it's not the very bottom point of a letter, it will not select. Has this ever happened to you? &#x200B;Note: It's not an issue with a mask or a group or anything - this affects ALL text in ANY document I've opened. Even documents in which I previously didn't have this problem. Thanks in advance!";False;Help! Can only select the bottom of lines of text in illustrator?;https://www.reddit.com/r/AdobeIllustrator/comments/asqimj/help_can_only_select_the_bottom_of_lines_of_text/
1550676173.0;False;aspjf8;False;False;t3_aspjf8;0;False;/r/AdobeIllustrator/comments/aspjf8/stabilizing_time/;6;;False;Stabilizing time;https://i.redd.it/0t4ce24wqqh21.jpg
1550676062.0;False;aspip2;False;False;t3_aspip2;0;False;/r/AdobeIllustrator/comments/aspip2/tada/;18;;False;Ta-Da!;https://i.redd.it/j8x7pm8kqqh21.jpg
1550675380.0;False;aspe2v;True;False;t3_aspe2v;3;False;/r/AdobeIllustrator/comments/aspe2v/whenever_i_save_a_pdf_it_saves_and_opens_the/;1;;False;Whenever I save a pdf, it saves and opens the document in illustrator instead of Adobe Acrobat Reader-what am I doing wrong when saving the file?;https://www.reddit.com/r/AdobeIllustrator/comments/aspe2v/whenever_i_save_a_pdf_it_saves_and_opens_the/
1550669350.0;False;asobto;False;False;t3_asobto;12;False;/r/AdobeIllustrator/comments/asobto/leopard_vector_art/;282;;False;Leopard vector art;https://i.redd.it/tylluejl6qh21.jpg
1550668603.0;False;aso7jt;False;False;t3_aso7jt;0;False;/r/AdobeIllustrator/comments/aso7jt/gems/;3;;False;gems;https://i.redd.it/fdgnvpjd4qh21.png
1550652594.0;False;asm2qf;False;False;t3_asm2qf;3;False;/r/AdobeIllustrator/comments/asm2qf/eyeconic/;0;;False;Eye-conic;https://i.redd.it/ztrodzzrsoh21.jpg
1550639690.0;False;askbvl;False;False;t3_askbvl;2;False;/r/AdobeIllustrator/comments/askbvl/the_office/;17;;False;The office;https://i.redd.it/wjfqpzneqnh21.jpg
1550636744.0;False;asjvt5;True;False;t3_asjvt5;2;False;/r/AdobeIllustrator/comments/asjvt5/y_dimensions_extend_way_past_the_boundaries_of/;1;https://imgur.com/a/xG9FYC5Very new to illustrator so I apologize I'm probably not using the correct terminology, I have attached a photo of the issue. I purchased a simple design from a dude a month a go. Previously I had just messed around with the colors, no issues. Just now I pasted in an empty 12x18 clipboard and needed to scale it and place it on specific axes. I've now hit a roadblock as it seems like the y dimensions extend way way way past the borders of the actual logo. How can I fix this? As you can see in the photo the there's the long blue line, the actual design is circular. ;False;Y dimensions extend way past the boundaries of the actual design which means I can't trasform/scale it, not sure how to fix this.;https://www.reddit.com/r/AdobeIllustrator/comments/asjvt5/y_dimensions_extend_way_past_the_boundaries_of/
1550617084.0;False;asgmyr;False;False;t3_asgmyr;0;False;/r/AdobeIllustrator/comments/asgmyr/first_time_using_adobe_illustrator_d/;5;;False;First time using adobe illustrator :D;https://i.redd.it/ajiy7ig4vlh21.png
1550616965.0;False;asgm6w;False;False;t3_asgm6w;5;False;/r/AdobeIllustrator/comments/asgm6w/a_series_of_logo_redesigns_all_using_illustrator/;1;;False;A series of logo redesigns all using Illustrator;https://www.youtube.com/playlist?list=PLyaPHSdxCjjYpUmi5gxaMCH52rvSWrLaF
1550612624.0;False;asftz8;False;False;t3_asftz8;12;False;/r/AdobeIllustrator/comments/asftz8/i_got_tired_of_trying_to_make_a_new_pattern_out/;200;;False;I got tired of trying to make a new pattern out of stars so instead made a star out of a pattern!;https://i.redd.it/f4d4166phlh21.jpg
1550610817.0;False;asfhsz;True;False;t3_asfhsz;2;False;/r/AdobeIllustrator/comments/asfhsz/recreating_a_logo/;3;Hi, everyone! Beginner in Illustrator, but intermediate in photoshop. I'm trying to recreate this image I made and clean it up a little more but I'm having trouble creating a clipping mask so that the text has the same effect as the original picture. Does anyone have any tutorial links or personal knowledge as to how to do this?https://i.redd.it/lq403r9rblh21.jpg;False;Recreating a logo;https://www.reddit.com/r/AdobeIllustrator/comments/asfhsz/recreating_a_logo/
1550608491.0;False;asf1wx;True;False;t3_asf1wx;7;False;/r/AdobeIllustrator/comments/asf1wx/question_how_do_you_draw_a_line_parallel_to/;2;Context - I'm trying to creat a design with a stylized word on it. For example the capital letter H with a thick trace 4mm away, and a thin trace another 2mm away. Around the whole letter. Right now I typed out the word, then started tracing it with a distance manually or by drawing line segments.The word is HOME Of course willing to switch units to pixels or inches. I just can't figure out how to do it other than manually drawing it.Also willing to switch programs!Thanks in advance!;False;[question] how do you draw a line parallel to another with a constant given distance?;https://www.reddit.com/r/AdobeIllustrator/comments/asf1wx/question_how_do_you_draw_a_line_parallel_to/
1550608309.0;False;asf0nk;True;False;t3_asf0nk;2;False;/r/AdobeIllustrator/comments/asf0nk/is_it_possible_to_color_within_the_lines/;1;Hello friends I’m wondering if there is a way to only color within the lines. I have a pen and tablet and want to begin shading my objects without the frustration of going over my stroke lines and the easy of coloring only what I want to color with the pen Thank you ! ;False;Is it possible to color within the lines ?;https://www.reddit.com/r/AdobeIllustrator/comments/asf0nk/is_it_possible_to_color_within_the_lines/
1550601976.0;False;asdt4r;False;False;t3_asdt4r;0;False;/r/AdobeIllustrator/comments/asdt4r/second_illustration_what_should_i_change/;1;;False;Second illustration, what should I change?;https://i.redd.it/4bwwhu04mkh21.png
1550601802.0;False;asdrww;False;False;t3_asdrww;1;False;/r/AdobeIllustrator/comments/asdrww/monday_hit_me_hard/;8;;False;Monday Hit Me Hard;https://i.redd.it/brl8jixqlkh21.jpg
1550601658.0;False;asdqxd;False;False;t3_asdqxd;2;False;/r/AdobeIllustrator/comments/asdqxd/mac_miller_tribute/;29;;False;Mac Miller Tribute;https://i.redd.it/029ifteblkh21.jpg
1550592087.0;False;asbwwt;False;False;t3_asbwwt;14;False;/r/AdobeIllustrator/comments/asbwwt/got_some_inspiration_after_watching_the_grand/;148;;False;Got some inspiration after watching The Grand Budapest Hotel!;https://i.redd.it/dk44bw4qsjh21.png
1550588069.0;False;asb7py;True;False;t3_asb7py;3;False;/r/AdobeIllustrator/comments/asb7py/question_how_do_you_create_a_font_from_start_to/;1;So last year during the summer I did a little digging around to see if it was possible to create a font in illustrator. Clearly the answer was yes, but how was I going to save it so I could actually use it without going online or buying some plug-in? I still don't have that answer, so this is why I'm turning to all of you.  How do you create a font from start to finish in illustrator? Design, organize, save, and use in illustrator? ;False;[Question] How do you create a font from start to finish in illustrator?;https://www.reddit.com/r/AdobeIllustrator/comments/asb7py/question_how_do_you_create_a_font_from_start_to/
1550582829.0;False;asae2x;True;False;t3_asae2x;1;False;/r/AdobeIllustrator/comments/asae2x/shapes_and_curves_are_very_aliased_while_working/;1;"Upgraded to a new PC last week, and since then it appears there is no anti-aliasing in AI.  Exported images appear fine, but it hurts my eyes seeing all the jagged lines while designing.  Preferences - General - Anti-Alias Artwork is checked; don't notice a change when unchecking it.  Example screen snip, taken at 100%: https://i.imgur.com/RHSG5Oa.png.  Graphics card drivers are up to date.  What could be causing this?";False;Shapes and curves are very aliased while working in AI CC 2015;https://www.reddit.com/r/AdobeIllustrator/comments/asae2x/shapes_and_curves_are_very_aliased_while_working/
1550569477.0;False;as8osa;False;False;t3_as8osa;2;False;/r/AdobeIllustrator/comments/as8osa/mega_knight/;8;;False;Mega knight;https://i.redd.it/hp4b05d9xhh21.jpg
1550563556.0;False;as81if;True;False;t3_as81if;4;False;/r/AdobeIllustrator/comments/as81if/warp_vector_around_circle/;1;"Hi guys, I am very (very) new to Illustrator and enjoying it so far.  I'm stuck on something.  I have some music notes on a staff (as a vector) that I want to wrap around in a circle.  When I try to use Envelope Distort and the arc tool, they are not getting warped ""evenly"" if that makes any sense...  I want them to end up in a circle so that the bend is the same all around and the lower line creates an even circle.   How can I achieve this?  See screenshot here: https://imgur.com/alTbBfr  you can see that the space between the circle I've drawn and the lowest line of the music is not even throughout.";False;Warp vector around circle;https://www.reddit.com/r/AdobeIllustrator/comments/as81if/warp_vector_around_circle/
1550559913.0;False;as7myn;False;False;t3_as7myn;7;False;/r/AdobeIllustrator/comments/as7myn/the_first_in_a_series_of_parody_retro_ads_first/;38;;False;The first in a series of parody retro ads, first subject, climate change.;https://i.redd.it/21yjo3v65hh21.jpg
1550558134.0;False;as7f4s;True;False;t3_as7f4s;0;False;/r/AdobeIllustrator/comments/as7f4s/my_illustrator_kept_on_quitting_everytime_i_try/;0;;False;My Illustrator kept on quitting everytime I try to save my files, I tried making a new file and just copy paste what is in the other file and it quit my illustrator again. I uninstalled and installed it a lot of times,I have tried restarting my computer several times. What should I do?;https://www.reddit.com/r/AdobeIllustrator/comments/as7f4s/my_illustrator_kept_on_quitting_everytime_i_try/
1550549635.0;False;as69o9;True;False;t3_as69o9;2;False;/r/AdobeIllustrator/comments/as69o9/why_do_my_lines_look_like_this/;1;First time user here. For the life of me, I can't figure out why my thin lines look all crunchy. They look bad in preview as well as when I export as PNG or Jpeg, irrespective of resolution or anti-aliasing modes selected. Does Illustrator just have crappy anti-aliasing or something?https://i.redd.it/sj4rjm9r7gh21.png;False;Why do my lines look like this?;https://www.reddit.com/r/AdobeIllustrator/comments/as69o9/why_do_my_lines_look_like_this/
