created_utc;edited;id;is_self;locked;name;num_comments;over_18;permalink;score;selftext;spoiler;title;url
1553460789.0;False;b51ea5;False;False;t3_b51ea5;19;False;/r/AdobeIllustrator/comments/b51ea5/now_im_done_amalfi_italy_travel_poster/;439;;False;Now I'm done! Amalfi, Italy Travel poster Illustration;https://i.redd.it/m4694jmwq4o21.jpg
1553458845.0;False;b510i8;True;False;t3_b510i8;0;False;/r/AdobeIllustrator/comments/b510i8/warp_tool_help/;1;Need to make the warp tool bigger.;False;Warp Tool help;https://www.reddit.com/r/AdobeIllustrator/comments/b510i8/warp_tool_help/
1553452722.0;False;b4zrek;True;False;t3_b4zrek;1;False;/r/AdobeIllustrator/comments/b4zrek/pen_pressure_option_greyed_out/;2;I'm new to Illustrator and currently just using it for the fidelity that comes with the brush. For some reason, when I go into the setting for any brush, I'm not able to change the settings to pen pressure. I've got my tablet connected and enabled with Illustrator, but it's still not working.All the options in brush settings are greyed out except for Fixed and Random. I'm using a calligraphic pen option. Any suggestions would help, thanks!;False;Pen Pressure option greyed out?;https://www.reddit.com/r/AdobeIllustrator/comments/b4zrek/pen_pressure_option_greyed_out/
1553445998.0;False;b4yfqg;True;False;t3_b4yfqg;4;False;/r/AdobeIllustrator/comments/b4yfqg/i_need_some_help_with_a_graphic/;2;"&#x200B;https://i.redd.it/2wtz7jdki3o21.jpgInside the black bit is a white circle. I want the white circle to be a transparency when I export, but if I set the color to transparent, it just turns black. I'll need to do the same with some text, too.";False;I need some help with a graphic.;https://www.reddit.com/r/AdobeIllustrator/comments/b4yfqg/i_need_some_help_with_a_graphic/
1553443499.0;False;b4xyp7;False;False;t3_b4xyp7;1;False;/r/AdobeIllustrator/comments/b4xyp7/curvature_tool_2019_tutorial_in_adobe_illustrator/;7;;False;Curvature Tool (2019) Tutorial in Adobe Illustrator - Graphic Bible;https://www.youtube.com/attribution_link?a=tDzmditYhoQ&u=%2Fwatch%3Fv%3Dx_XwexGxWwQ%26feature%3Dshare
1553441901.0;False;b4xnrm;True;False;t3_b4xnrm;4;False;/r/AdobeIllustrator/comments/b4xnrm/help_erasing_part_of_text/;1;hi, i only want the top part of the F with the flame, but i cant use eraser on it. does anyone know how to erase part of the text? tried rasterizing but doesnt work as well.https://i.redd.it/48lb6oct63o21.png;False;help! erasing part of text;https://www.reddit.com/r/AdobeIllustrator/comments/b4xnrm/help_erasing_part_of_text/
1553441116.0;False;b4xiik;True;False;t3_b4xiik;1;False;/r/AdobeIllustrator/comments/b4xiik/help_with_color_mixes/;1;I am working on a practice project and in the project brief it says color mode CMYK (I understand this) and blue 53/8/1/0, yellow 11/0/70/0 , black 0/0/0/100. What do these ratios mean and where do I plug them in at? Thanks!! ;False;Help with color mixes;https://www.reddit.com/r/AdobeIllustrator/comments/b4xiik/help_with_color_mixes/
1553439380.0;False;b4x74c;True;False;t3_b4x74c;0;False;/r/AdobeIllustrator/comments/b4x74c/ctrl4_repeats_last_pathfinder_operation/;1;Found this by accident. If your the same pathfinder operation again and again [CTRL+4] pc [CMD+4] Mac repeats the last pathfinder effect you did.Also holding down [ALT] when you click on pathfinder allows you to edit the overlapping shapes with the direct selection and modify tools before hitting the [Expand] button to permanently change the path outline.;False;[CTRL+4] Repeats Last Pathfinder operation;https://www.reddit.com/r/AdobeIllustrator/comments/b4x74c/ctrl4_repeats_last_pathfinder_operation/
1553424904.0;False;b4v4az;False;False;t3_b4v4az;3;False;/r/AdobeIllustrator/comments/b4v4az/help_i_cant_disconnect_a_line_in_others_words_no/;2;;False;"[HELP] i cant ""disconnect"" a line, in others words, no matter what I do, the ""line"" will keep follwing my cursor [HELP]";https://i.redd.it/6ijuizq8s1o21.png
1553415051.0;False;b4u011;True;False;t3_b4u011;4;False;/r/AdobeIllustrator/comments/b4u011/trouble_with_deleting_some_things_around_a_letter/;1;You know how you magic wond a letter in illustrator?How do you select a letter but want to delete everything around that letter?hope that makes sense plz help!;False;Trouble with deleting some things around a letter;https://www.reddit.com/r/AdobeIllustrator/comments/b4u011/trouble_with_deleting_some_things_around_a_letter/
1553408869.0;False;b4tbqp;False;False;t3_b4tbqp;2;False;/r/AdobeIllustrator/comments/b4tbqp/poster_for_my_sons_highschool_band/;14;;False;Poster for my son's highschool band;https://imgur.com/IKUuYao
1553408300.0;False;b4t9e5;False;False;t3_b4t9e5;8;False;/r/AdobeIllustrator/comments/b4t9e5/cr7_pop_art/;269;;False;CR7 Pop Art;https://i.redd.it/smaw1g2te0o21.jpg
1553404054.0;False;b4squa;False;False;t3_b4squa;0;False;/r/AdobeIllustrator/comments/b4squa/king_krule_illustration/;25;;False;King Krule Illustration;https://i.redd.it/q3mlewv920o21.jpg
1553397248.0;False;b4rt98;False;False;t3_b4rt98;2;False;/r/AdobeIllustrator/comments/b4rt98/my_dudes_should_the_blue_c_line_up_with_itself_if/;2;;False;My Dudes - Should the blue C line up with itself? If so - how would I go about that? GC;https://i.redd.it/48th84srhzn21.jpg
1553396403.0;False;b4roke;True;False;t3_b4roke;4;False;/r/AdobeIllustrator/comments/b4roke/help/;2;i need help with ai. when i click horizontal/vertical align to center, it goes away further from the center and out of the artboard????? i'm so confused. please help me thank you T\_T my setting is align to artboard;False;help!;https://www.reddit.com/r/AdobeIllustrator/comments/b4roke/help/
1553393650.0;False;b4r8vm;True;False;t3_b4r8vm;0;False;/r/AdobeIllustrator/comments/b4r8vm/blob_brush_shape_builder_help/;2;"Ok so I draw my lines using blob brush, then use shape builder to cut the ends off to get clean intersections. This usually works but once in a while a line will merge with another, and if I try to use shape builder to remove the extra portion of line, it removes the whole line plus the one its intersecting with. What the hell is going on? I can draw 2 lines next to each other and one will not merge and the other does. In the image below, I drew 2 quick lines. One merged to the longer line while the other didn;t, allowing me to use shape builder to subtract the bottom of the line after. So what's going on here?&#x200B;&#x200B;https://i.redd.it/q95kx8067zn21.png";False;Blob Brush & Shape Builder Help;https://www.reddit.com/r/AdobeIllustrator/comments/b4r8vm/blob_brush_shape_builder_help/
1553391511.0;False;b4qwec;True;False;t3_b4qwec;4;False;/r/AdobeIllustrator/comments/b4qwec/best_laptopcomputer_for_illustrator/;2;Im getting into adobe illustrator because of a great class at my high school, we use IMacs for all the adobe products. What is a computer or laptop I can save up for that will be able to run AI well and save a lot of projects? Also, price doesn’t matter!;False;Best laptop/computer for Illustrator?;https://www.reddit.com/r/AdobeIllustrator/comments/b4qwec/best_laptopcomputer_for_illustrator/
1553367478.0;1553367691.0;b4msgo;True;False;t3_b4msgo;2;False;/r/AdobeIllustrator/comments/b4msgo/pierce_brosnan_007/;2;"Pierce Brosnan 007 illustration completed with only the pencil tool. Image comparison and a look at the outline on [imgur](https://imgur.com/gallery/NaJ0Kpc) It takes awhile but theres something enjoyable and almost therapeutic about going pixel by pixel. I'd love to do the other Jame Bonds in the series to have a whole collection.https://i.redd.it/tntk4tim1xn21.jpg&#x200B;https://i.redd.it/4ncuyy852xn21.jpg&#x200B;https://i.redd.it/a7yxlx602xn21.jpg&#x200B;https://i.redd.it/cdvqazz12xn21.jpg&#x200B;https://i.redd.it/1wgbr2y22xn21.jpg";False;Pierce Brosnan 007;https://www.reddit.com/r/AdobeIllustrator/comments/b4msgo/pierce_brosnan_007/
1553364518.0;False;b4m818;False;False;t3_b4m818;12;False;/r/AdobeIllustrator/comments/b4m818/low_poly_tiger/;191;;False;Low Poly Tiger;https://i.redd.it/ng9u2njnrwn21.png
1553352401.0;False;b4jxgz;False;False;t3_b4jxgz;2;False;/r/AdobeIllustrator/comments/b4jxgz/50_minds/;9;;False;50 minds;https://i.redd.it/tgpdukmosvn21.jpg
1553337402.0;False;b4hr6y;False;False;t3_b4hr6y;0;False;/r/AdobeIllustrator/comments/b4hr6y/there_is_a_always_another_way_all_the_routs_lead/;8;;False;There is a always another way. All the routs lead to Rome!;https://i.redd.it/jfb25r43kun21.png
1553329562.0;False;b4gt6a;False;False;t3_b4gt6a;2;False;/r/AdobeIllustrator/comments/b4gt6a/can_anyone_give_some_feedback_please/;3;;False;Can anyone give some feedback please?;https://i.redd.it/f47zebd9wtn21.png
1553320178.0;False;b4fmjc;True;False;t3_b4fmjc;4;False;/r/AdobeIllustrator/comments/b4fmjc/why_am_i_not_able_to_save_my_pictures_as_png/;1;So, I have about 13 pictures that I need to save as png, but for some reason even though all the process has been exactly the same, only a few of the pictures are saving in the correct format. ;False;Why am I not able to save my pictures as png?;https://www.reddit.com/r/AdobeIllustrator/comments/b4fmjc/why_am_i_not_able_to_save_my_pictures_as_png/
1553301812.0;False;b4cuiw;True;False;t3_b4cuiw;0;False;/r/AdobeIllustrator/comments/b4cuiw/export_selection_with_black_color_background_is/;1;"Every time I try to export an object and select ""Color Background: Black"", it's actually white in the exported file.";False;Export selection with black color background is bugged?;https://www.reddit.com/r/AdobeIllustrator/comments/b4cuiw/export_selection_with_black_color_background_is/
1553301556.0;False;b4csyv;False;False;t3_b4csyv;17;False;/r/AdobeIllustrator/comments/b4csyv/sailboat_poster/;275;;False;Sailboat Poster;https://i.redd.it/s5ypn44hlrn21.png
1553301154.0;False;b4cqkn;False;False;t3_b4cqkn;0;False;/r/AdobeIllustrator/comments/b4cqkn/woman_vector_illustration_for_wwd/;3;;False;Woman vector illustration for #WWD;https://www.instagram.com/p/BuwSxybBm6x/?utm_source=ig_share_sheet&igshid=xy1pnufjq080
1553295826.0;False;b4bt3g;True;False;t3_b4bt3g;2;False;/r/AdobeIllustrator/comments/b4bt3g/i_need_some_inspiration_want_to_show_me_your/;0;Let's make a thread where everyone can post it's portfolio. I would love to see what you guys make!;False;I need some inspiration, want to show me your portfolio;https://www.reddit.com/r/AdobeIllustrator/comments/b4bt3g/i_need_some_inspiration_want_to_show_me_your/
1553294596.0;False;b4bksd;False;False;t3_b4bksd;3;False;/r/AdobeIllustrator/comments/b4bksd/a_quick_little_video_of_some_graphic_styles_that/;2;;False;"A quick little video of some graphic styles that I'm working on. I think I'll sell the set when it's done to my satisfaction. I call this product ""Rorschach"". Suggestions are welcome!";https://v.redd.it/rlc4bu4n0rn21
1553292320.0;False;b4b5bg;False;False;t3_b4b5bg;2;False;/r/AdobeIllustrator/comments/b4b5bg/i_spent_2_months_getting_the_lips_right_one_this/;0;;False;I spent 2 months getting the lips right one this. I REALLY liked the way it turned out (Self-taught);https://i.redd.it/5z8742lwtqn21.jpg
1553291849.0;False;b4b1zm;False;False;t3_b4b1zm;5;False;/r/AdobeIllustrator/comments/b4b1zm/here_goes_nothing_any_thoughts/;4;;False;Here goes nothing. Any thoughts!?;https://i.redd.it/lj1on0zmsqn21.png
1553281233.0;False;b48ysd;True;False;t3_b48ysd;0;False;/r/AdobeIllustrator/comments/b48ysd/so_i_tried_to_get_into_illustrator_i_think_i_did/;5;"&#x200B;https://i.redd.it/dcfqdmrwwpn21.png";False;So I tried to get into illustrator... i think i did great for a first;https://www.reddit.com/r/AdobeIllustrator/comments/b48ysd/so_i_tried_to_get_into_illustrator_i_think_i_did/
1553280360.0;False;b48shp;False;False;t3_b48shp;0;False;/r/AdobeIllustrator/comments/b48shp/my_take_on_a_self_portraitsorry_for_the_bad_pic/;1;;False;My take on a self portrait(sorry for the bad pic);https://i.redd.it/0bm4j2wgupn21.jpg
1553279734.0;False;b48nwf;False;False;t3_b48nwf;2;False;/r/AdobeIllustrator/comments/b48nwf/retro_sunset_first_submission/;9;;False;Retro Sunset | First Submission;https://i.redd.it/zibmh63mspn21.jpg
1553272785.0;False;b479jc;True;False;t3_b479jc;2;False;/r/AdobeIllustrator/comments/b479jc/help_im_trying_to_use_the_edit_colors_function/;1;;False;[HELP] Im trying to use the edit colors function but everything is greyed out there;https://www.reddit.com/r/AdobeIllustrator/comments/b479jc/help_im_trying_to_use_the_edit_colors_function/
1553272062.0;False;b474j9;False;False;t3_b474j9;2;False;/r/AdobeIllustrator/comments/b474j9/fully_illustrated_halloween_stream_pack_i_did/;2;;False;Fully illustrated Halloween Stream Pack I did last month!;https://i.redd.it/oltktaoa5pn21.jpg
1553271466.0;False;b470a2;False;False;t3_b470a2;4;False;/r/AdobeIllustrator/comments/b470a2/i_tried_to_emphasize_on_the_length_of_the_two_ls/;1;;False;I tried to emphasize on the length of the two l's by adding that line. Any thoughts!? ( I'm a rookie);https://i.redd.it/2y8svf314pn21.png
1553269766.0;False;b46nwx;True;False;t3_b46nwx;4;False;/r/AdobeIllustrator/comments/b46nwx/quick_noob_question/;1;"Hi,&#x200B;I'm fairly new to illustrator. I recently designed this character for a piano book for children that I'm writing. I grouped all of the layers together and I'm trying to resize him. However, the stroke gets messed up when I enlarge him since it's set to 1 and it doesn't resize accordingly. How do I make it so that the stroke outline will enlarge proportionally to the rest of the layers?&#x200B;Thank you.https://i.redd.it/7f0rx87xyon21.png";False;Quick Noob Question;https://www.reddit.com/r/AdobeIllustrator/comments/b46nwx/quick_noob_question/
1553266187.0;1553269359.0;b45ygn;True;False;t3_b45ygn;2;False;/r/AdobeIllustrator/comments/b45ygn/actions_in_illustrator/;2;"Good morning!So, I work for a promotions company that uses UV printers that we use to print on products like Tile trackers, Mophie chargers, and more. We have a set of jigs that have been 3D printed for each product. In order to save time when we print, the company we get the jigs from have sent us action files to use to place the logos we are printing in the appropriate spot after we align the 1st logo. For Tile Mate trackers, we print about 160 units at a time. The jig holds a grid of 20 x 8 units. We haven't seen any issues until we started printing full bleed.So, here's my issue/question: ***Is there a way to change one step within a series of actions without having to completely recreate the entire set of actions?*** Basically, when the first move action to the right starts it is short by an incredibly small amount. When printing just a logo, you can't tell there is a slight change. All one through twenty look good. However, when you print full bleed you can start to see the shift. By the last unit, number twenty, you can see there is a significant shift in the print. So, is there a way to simply change one move file within the recorded series of actions?I appreciate any and all help I can get. I've been working in Illustrator for eight years, but do not know how to do this. I don't really use the actions channel very often aside from removing any unused panel items.&#x200B;Edit: Updated for spelling, grammar, etc.";False;Actions in Illustrator;https://www.reddit.com/r/AdobeIllustrator/comments/b45ygn/actions_in_illustrator/
1553262889.0;False;b45cki;False;False;t3_b45cki;2;False;/r/AdobeIllustrator/comments/b45cki/new_to_illustrator_let_me_know_what_you_think/;1;;False;New to illustrator, let me know what you think!;https://i.redd.it/sede5c0jeon21.jpg
1553259551.0;False;b44rzo;False;False;t3_b44rzo;0;False;/r/AdobeIllustrator/comments/b44rzo/constructing_a_spider_robot_in_illustrator_with/;2;;False;"Constructing a spider robot in Illustrator, with ""Keycastr"" showing.";https://youtu.be/Tuh9FPFJzQw
1553259420.0;False;b44r7e;False;False;t3_b44r7e;0;False;/r/AdobeIllustrator/comments/b44r7e/adobe_illustrator_cc_tutorial_how_to_make_a/;0;;False;Adobe Illustrator CC Tutorial How to Make a Beautiful Landscape Backgr...;https://www.youtube.com/attribution_link?a=U2v7wSJs-a0&u=%2Fwatch%3Fv%3DrrGzd9NgD3U%26feature%3Dshare
1553259196.0;False;b44pvw;False;False;t3_b44pvw;27;False;/r/AdobeIllustrator/comments/b44pvw/starting_on_my_weekend_project_early_going_to/;193;;False;Starting on my weekend project early, going to finish this up!;https://i.redd.it/xa8ybeh73on21.jpg
1553256699.0;False;b44bdh;False;False;t3_b44bdh;0;False;/r/AdobeIllustrator/comments/b44bdh/boa_toronto_drag_queen/;0;;False;Boa - Toronto Drag Queen;https://i.redd.it/zdan6d9wvnn21.jpg
1553251641.0;False;b43lew;False;False;t3_b43lew;0;False;/r/AdobeIllustrator/comments/b43lew/does_anyone_know_any_tutorials_to_make_these/;2;;False;Does anyone know any tutorials to make these posters?;https://www.instagram.com/p/Buy44bHlSec/?utm_source=ig_share_sheet&igshid=q8e56rbxpd57
1553233936.0;False;b41bj1;True;False;t3_b41bj1;0;False;/r/AdobeIllustrator/comments/b41bj1/best_paid_illustrator_plugins_available/;2;Hello... I run a small print shop where we do a lot of decals.I am looking for programs that can help accelerate the 200+ orders we get per day.What plugins are available that help with vectors?I've found so far:1) Graphic Powers2) Astute GraphicsAny more? I really appreciate your help.;False;Best Paid Illustrator Plugins Available?;https://www.reddit.com/r/AdobeIllustrator/comments/b41bj1/best_paid_illustrator_plugins_available/
1553231981.0;False;b412gf;False;False;t3_b412gf;4;False;/r/AdobeIllustrator/comments/b412gf/grain_texture_outlinehow_to_get_rid_of_there_is/;1;;False;Grain texture outline-how to get rid of? There is no stroke on this object.;https://i.redd.it/lq9j3z07uln21.png
1553223305.0;False;b3zrx2;True;False;t3_b3zrx2;2;False;/r/AdobeIllustrator/comments/b3zrx2/live_paint_gradient_clipping/;1;Hey guys! My live paint is being split even though there is no line between the two areas. Any suggestions on a fix?https://i.redd.it/ken2ii8k3ln21.png;False;Live Paint / Gradient Clipping;https://www.reddit.com/r/AdobeIllustrator/comments/b3zrx2/live_paint_gradient_clipping/
1553219282.0;False;b3z45p;True;False;t3_b3z45p;5;False;/r/AdobeIllustrator/comments/b3z45p/i_need_help_easy_fix_please_help_transparency/;1;Might be an easy fix: I cant get my transparency mask to make the start of my layer completely fade into the white background. You can always see the 3 green end points no matter how far i adjust the gradient. See screenshots at link below. THANK YOU!![https://imgur.com/a/GRCN2ME](https://imgur.com/a/GRCN2ME);False;I need help!! Easy fix. please help. Transparency Mask Issue;https://www.reddit.com/r/AdobeIllustrator/comments/b3z45p/i_need_help_easy_fix_please_help_transparency/
1553218486.0;False;b3yz5q;False;False;t3_b3yz5q;1;False;/r/AdobeIllustrator/comments/b3yz5q/saw_a_bunch_of_low_poly_posts_on_here_so_i_wanted/;6;;False;Saw a bunch of low poly posts on here so I wanted to try it myself. What do you think?;https://i.redd.it/kcr666fbqkn21.jpg
1553212117.0;False;b3xv1a;True;False;t3_b3xv1a;0;False;/r/AdobeIllustrator/comments/b3xv1a/colour_spaces_question/;1;Hi! Sorry if this is a dumb question -Every time I open a file a get a pop up saying “embedded profile mismatch”. I can’t seem to set my working space to RGB automatically when opening old files. I can only do it when I create a new file. Does anyone know how to fix this please?;False;Colour spaces question;https://www.reddit.com/r/AdobeIllustrator/comments/b3xv1a/colour_spaces_question/
1553199638.0;False;b3vh1l;True;False;t3_b3vh1l;1;False;/r/AdobeIllustrator/comments/b3vh1l/better_than_ideal/;0;"New to illustrator, came across this game [https://bezier.method.ac/](https://bezier.method.ac/) and made this[https://imgur.com/a/gF0Yy8j](https://imgur.com/a/gF0Yy8j)&#x200B;Think you can do it better?";False;Better than ideal?;https://www.reddit.com/r/AdobeIllustrator/comments/b3vh1l/better_than_ideal/
1553192790.0;False;b3u2l9;True;False;t3_b3u2l9;8;False;/r/AdobeIllustrator/comments/b3u2l9/creativity_block/;1;Anyone know a good way to start opening your mind to ideas? I find myself so often just sitting doing nothing because I have no new ideas.;False;Creativity block;https://www.reddit.com/r/AdobeIllustrator/comments/b3u2l9/creativity_block/
1553192589.0;False;b3u10f;True;False;t3_b3u10f;4;False;/r/AdobeIllustrator/comments/b3u10f/help_how_can_i_make_my_illustration_seamlessly/;1;Hi Reddit.I've tried googling this for quite abit now and it's just extremely hard to word into a google search.I'm rather new to illustrator and im creating a label design to wrap a can. I've been trying to find a way to make the entire wrap seamlessly go around the entire can. As i'm using gradients it's extremely difficult to do this manually.Is there a way to make the object/gradient etc overlap out of the right side of the art-board and reappear on the left side? So when i add this to my 3D mockup on photoshop it's one seamless illustration on a cylinder rather being able to see where the wrap connects?Really hope you guys can help me,Thank you!;False;[HELP] How can i make my illustration seamlessly wrap around a cylinder? (without seeing where it joins up);https://www.reddit.com/r/AdobeIllustrator/comments/b3u10f/help_how_can_i_make_my_illustration_seamlessly/
1553192280.0;False;b3tyrm;False;False;t3_b3tyrm;2;False;/r/AdobeIllustrator/comments/b3tyrm/custom_tshirt_design_in_adobe_illustrator_tshirt/;3;;False;Custom T-Shirt Design in Adobe Illustrator - T-Shirt Design Tutorial;https://youtu.be/5pIkGkMHyA4
1553191995.0;False;b3twnj;True;False;t3_b3twnj;2;False;/r/AdobeIllustrator/comments/b3twnj/why_do_i_have_two_tools_pallettes_in_ai/;1;"As show below, I opened a file today and found I had double tool pallettes.. I don't remember this being there, but maybe it was. It's been a while. They are mirrored - a change in one is made in the other. Pressing the two arrows in the top minimizes one pallet into the other, which is even worse. The only thing I can think of is that it's somehow related to the file vs the program, but it's just a simple file - ai, with only a few layers. &#x200B;Any ideas?https://i.redd.it/s5j148abjin21.png";False;Why do I have two tools pallettes in ai?;https://www.reddit.com/r/AdobeIllustrator/comments/b3twnj/why_do_i_have_two_tools_pallettes_in_ai/
1553190810.0;False;b3tnfj;False;False;t3_b3tnfj;22;False;/r/AdobeIllustrator/comments/b3tnfj/minimalist_life/;277;;False;minimalist life;https://i.redd.it/wakmonuvdin21.jpg
1553188376.0;False;b3t5kb;True;False;t3_b3t5kb;2;False;/r/AdobeIllustrator/comments/b3t5kb/best_way_to_learn_things_in_illustrator/;1;Hey guys i just got illustrator because i really like all the cool art made by you guys and i want to someday make arts and creative drawings like all of you.But i have never really used illustrator before and i suck at drawing.So if anyone can tell me how i should start and what are the best resources to learn illustrator.Currently im looking at this course on udemy Martin peheniak so if anyone of you has tried it let me know that aswell Thank you;False;Best way to learn things in illustrator;https://www.reddit.com/r/AdobeIllustrator/comments/b3t5kb/best_way_to_learn_things_in_illustrator/
1553186090.0;False;b3somt;True;False;t3_b3somt;3;False;/r/AdobeIllustrator/comments/b3somt/youtube_avatar_and_channel_banner/;0;Hi guys,This is probably something very simple for someone on here but it is definitely not for me and my friend.We have created a logo for our YouTube channel.Just a simple logo.We want it to be the highest quality possible and we dont want half the channel banner art to be cut off when viewing on different devices. For example, when I view my channel on my phone, it cuts some of it out.. almost like the image is too big. We see dimensions etcetera and we have Adobe illustrator if that helps.Could someone talk me through it step-by-step. If you have some spare time.Thanks.;False;YouTube avatar and channel banner;https://www.reddit.com/r/AdobeIllustrator/comments/b3somt/youtube_avatar_and_channel_banner/
1553184996.0;False;b3sggl;True;False;t3_b3sggl;2;False;/r/AdobeIllustrator/comments/b3sggl/what_is_the_easiest_way_to_add_a_fill_color_to_a/;1;"What's the quickest way to create a background for a compound shape that is basically a line (but no longer an outline)? I've been removing the inside bit and layering, but I feel like there has to be an easier way. &#x200B;Example: if i wanted to turn the left image into the right image. [https://imgur.com/HHEezKE](https://imgur.com/HHEezKE)&#x200B;&#x200B;";False;what is the easiest way to add a fill color to a compound shape?;https://www.reddit.com/r/AdobeIllustrator/comments/b3sggl/what_is_the_easiest_way_to_add_a_fill_color_to_a/
1553183057.0;False;b3s281;True;False;t3_b3s281;2;False;/r/AdobeIllustrator/comments/b3s281/pen_tool_blurry/;0;I'm brand new to illustrator and I'm wondering why my pen tool keeps doing this. It's also happening with shape tools as well.https://i.redd.it/kandx943thn21.png;False;Pen tool blurry;https://www.reddit.com/r/AdobeIllustrator/comments/b3s281/pen_tool_blurry/
1553170013.0;False;b3pqg9;True;False;t3_b3pqg9;7;False;/r/AdobeIllustrator/comments/b3pqg9/anyone_know_how_to_create_a_frosted_glass_effect/;1;like the one in ios or windows 10, i love those effects and cant figure it out;False;"anyone know how to create a ""frosted glass"" effect?";https://www.reddit.com/r/AdobeIllustrator/comments/b3pqg9/anyone_know_how_to_create_a_frosted_glass_effect/
