created_utc;edited;id;is_self;locked;name;num_comments;over_18;permalink;score;selftext;spoiler;title;url
1552069504.0;False;ayti37;True;False;t3_ayti37;6;False;/r/AdobeIllustrator/comments/ayti37/been_asked_to_design_a_brochure_and_i_have_a/;1;So I'm pretty new to Illustrator and I'm even newer to the process of printing a Brochure. I've been designing posters and bits and bobs for a charity over a couple of years now. All of which has allowed me to stay firmly within my comfort zone - Photoshop.Recently they've asked for a 4 Page A5 brochure for an upcoming event. I agreed, but now that I've got to work I've realised I haven't a clue about what I do when it comes to getting it printed.I just can't quite get my head around how the pages will need to be arranged when it comes to printing. So there's 4 pages of course with two sides each, which means there's 8 sides (8 art boards). I currently have 8 separate art boards, 2 of which for the front and back covers and 6 for the remaining sides. What are my next steps with the 8 separate art boards? Are the printers able to take and arrange/layout these separate art boards in the desired page order (if i send them off in Ai format, PDF or Tiff is probably preferable)? Or should I not leave them as separate and join two appropriate (A5) art boards together so that they can be printed as one (A4) sheet that can be folded in to two pages?I've expressed my concerns to the the people that asked me to do this but they're pretty clueless. I assume the printers (if asked) should have given them some instructions as to how the pages should be presented to them when it comes to handing the files over for them to arrange and print?I'm aware that indesign exists but unfortunately I don't own a copy.Any help will be greatly appreciated, thanks!;False;Been asked to design a Brochure and I have a couple of questions when it comes to arrangement for printing.;https://www.reddit.com/r/AdobeIllustrator/comments/ayti37/been_asked_to_design_a_brochure_and_i_have_a/
1552068656.0;False;aytc8o;False;False;t3_aytc8o;5;False;/r/AdobeIllustrator/comments/aytc8o/i_work_at_a_wrap_company_and_we_are_sponsoring_a/;17;;False;I work at a wrap company and we are sponsoring a local skatepark so I drew our mascot doing an ollie or something similar... I dunno, I don't know much about skateboarding.;https://i.redd.it/ca0hzo4erxk21.jpg
1552066292.0;1552067108.0;aysw2u;True;False;t3_aysw2u;5;False;/r/AdobeIllustrator/comments/aysw2u/circle_tool_unexcpected_results_is_this_a_bug/;1;* normal circle tool creates ovals* holding shift creates circles* holding ctrl creates a oval from 2 points**holding both dose not create a perfect circle from 2 points.**[Ctrl + shift combination illustrator](https://i.redd.it/yrprxs3smxk21.png)# no, pressing alt dose not change that.[alt combinations illustrator](https://i.redd.it/2m5c61cbjxk21.png);False;Circle tool unexcpected results, is this a bug?;https://www.reddit.com/r/AdobeIllustrator/comments/aysw2u/circle_tool_unexcpected_results_is_this_a_bug/
1552051571.0;False;ayq8u4;False;False;t3_ayq8u4;30;False;/r/AdobeIllustrator/comments/ayq8u4/a_character_illustration_i_did_in_adobe/;287;;False;A character illustration I did in Adobe Illustration.;https://i.redd.it/ylzitl4hcwk21.jpg
1552048759.0;False;ayptlf;True;False;t3_ayptlf;4;False;/r/AdobeIllustrator/comments/ayptlf/how_can_one_get_creative_in_doodling/;0;All kinds of tips are appreciated.;False;How can one get creative in doodling..;https://www.reddit.com/r/AdobeIllustrator/comments/ayptlf/how_can_one_get_creative_in_doodling/
1552041898.0;False;ayowfx;True;False;t3_ayowfx;6;False;/r/AdobeIllustrator/comments/ayowfx/hello_im_trying_to_design_a_simplified_bus_map/;3;;False;Hello! I'm trying to design a simplified bus map, and i have already drawn the bus routes. Is there a way to distribute objects along a path having their center (or whatever point) coincide with the anchor points?;https://www.reddit.com/r/AdobeIllustrator/comments/ayowfx/hello_im_trying_to_design_a_simplified_bus_map/
1552021738.0;False;aymg75;False;False;t3_aymg75;7;False;/r/AdobeIllustrator/comments/aymg75/very_new_to_ai_and_art_in_general_really_drafted/;5;;False;Very new to AI (and art in general, really). Drafted this for a speed friending event at a library, ages 20-35. Still need to add event info. Drew all but the icons in callouts. Feedback/Critique so far? Thanks!;https://i.redd.it/lqbneh0yvtk21.jpg
1552019731.0;1552035858.0;aym5vj;True;False;t3_aym5vj;2;False;/r/AdobeIllustrator/comments/aym5vj/how_to_draw_irregular_trapezoids_with_precise/;2;Most  solutions online are about dragging  and dropping the edges, but I'm  trying to draw these forms with specific  measurements so that doesn't  work.The angles are not round numbers also, which makes this more challenging.Anyone has had success with this?Thanks;False;How to draw irregular trapezoids with precise measurements on Illustrator?;https://www.reddit.com/r/AdobeIllustrator/comments/aym5vj/how_to_draw_irregular_trapezoids_with_precise/
1552015641.0;False;aylkfu;True;False;t3_aylkfu;4;False;/r/AdobeIllustrator/comments/aylkfu/how_do_you_get_rid_of_the_highlighted_lines/;2;"Let's say I make a rectangle. How do I get rid of the pink lines in-between the points? Not the bounding box, just the highlights of the lines themselves.&#x200B;Thanks!";False;How do you get rid​ of the highlighted lines between points?;https://www.reddit.com/r/AdobeIllustrator/comments/aylkfu/how_do_you_get_rid_of_the_highlighted_lines/
1552009949.0;False;aykozd;False;False;t3_aykozd;6;False;/r/AdobeIllustrator/comments/aykozd/i_keep_getting_these_ghost_images_every_time_i/;5;;False;I keep getting these ghost images every time I move things, any idea how to get rid of them?;https://i.redd.it/zk3hpo9gwsk21.png
1551999374.0;False;ayix9a;True;False;t3_ayix9a;4;False;/r/AdobeIllustrator/comments/ayix9a/anyone_using_logitech_mx_master_mouse/;1;"Got the MX master mouse ([https://support.logitech.com/en\_us/product/mx-master](https://support.logitech.com/en_us/product/mx-master)) Like it a lot, comfortable to use, however I am struggling to configure the two thumb buttons. I want them to zoom in and zoom out, I have changed the application specific settings in the logitech app, however, the buttons just scroll left or right in small increments in Illustrator. Anyone had any success with doing what I want to do? Do I have to change anything in the Illustrator options?&#x200B;Thanks for any advice!";False;Anyone using Logitech MX Master Mouse?;https://www.reddit.com/r/AdobeIllustrator/comments/ayix9a/anyone_using_logitech_mx_master_mouse/
1551995077.0;False;ayi51t;False;False;t3_ayi51t;7;False;/r/AdobeIllustrator/comments/ayi51t/can_someone_critic_this_design/;19;;False;Can someone critic this design.;https://i.redd.it/btppts2kork21.png
1551993373.0;False;ayhttt;False;False;t3_ayhttt;0;False;/r/AdobeIllustrator/comments/ayhttt/custom_shape_mosaic/;1;;False;Custom shape mosaic;https://www.reddit.com/r/AfterEffects/comments/ayf7bl/custom_shape_mosaic/
1551991116.0;False;ayhe28;False;False;t3_ayhe28;4;False;/r/AdobeIllustrator/comments/ayhe28/what_is_this_functionerror/;2;;False;What is this function/error?;https://v.redd.it/2w2bm1jtcrk21
1551988473.0;False;aygvxb;True;False;t3_aygvxb;6;False;/r/AdobeIllustrator/comments/aygvxb/question_regarding_saving_ai_files/;3;I'm currently taking an Graphic Design course and it's my first time using Adobe Illustrator (but have used Photoshop in the past.) My professor however keeps on warning us that we need to save our work onto the desktop, and then at the end of the class, we are supposed to move the file into our flash drives or online storage. He warns us that our flash drives can't handle Illustrator files being saved onto the flash drive (as someone who really knows how to use a computer, it didn't seem to make sense to me). So far for a project, I've been saving the file from my flash drive and everything seems fine, no problems with the file or anything. I'm currently wondering if anyone has had problems like this, or if this is a common thing that happens that I'm not aware of, and just gotten lucky so far.;False;Question regarding saving .ai files;https://www.reddit.com/r/AdobeIllustrator/comments/aygvxb/question_regarding_saving_ai_files/
1551976137.0;False;ayegvk;True;False;t3_ayegvk;4;False;/r/AdobeIllustrator/comments/ayegvk/not_rotating_anymore/;1;A few days ago on my illustrator I wasn't able to rotate using the touch screen with two fingers or with the rotate tool anymore, this happened to me before but it fixed it's self some how but now I'm not sure how to fix it. I've tried resetting my sureface pro and defiantly am up to date on all oft he updates and latest versions, can any one help?;False;Not rotating anymore :(;https://www.reddit.com/r/AdobeIllustrator/comments/ayegvk/not_rotating_anymore/
1551968083.0;False;ayd1gq;False;False;t3_ayd1gq;0;False;/r/AdobeIllustrator/comments/ayd1gq/custom_skateboard_art_design_i_did_last_year_it/;19;;False;Custom Skateboard Art / Design I did last year. It is one of the 11 illustrations for a big project!;https://i.redd.it/cavxmc1dfpk21.jpg
1551967299.0;False;aycwv8;True;False;t3_aycwv8;7;False;/r/AdobeIllustrator/comments/aycwv8/tracing_an_image_in_illustrator/;1;Hi, just getting to know Illustrator at the minute and want to know if there are any tutorial videos showing how to trace an image using touch screen and a stylus. All the tutorials I find are for using the pen tool!Thanks!;False;Tracing an image in illustrator?;https://www.reddit.com/r/AdobeIllustrator/comments/aycwv8/tracing_an_image_in_illustrator/
1551966831.0;False;aycu8c;False;False;t3_aycu8c;1;False;/r/AdobeIllustrator/comments/aycu8c/the_mountains_are_calling/;0;;False;The mountains are calling;https://imgur.com/a/CxEkc7K
1551947090.0;False;ayad2x;True;False;t3_ayad2x;6;False;/r/AdobeIllustrator/comments/ayad2x/how_to_export_multiple_art_boards_at_different/;1;"What am I doing wrong here?When I try to export multiple artboards as shown below, it only ever exports them at the first size on the list (in this case, 28px). Even though it says ""Total Export: 6"" it will only create 2 files.Do I have to add a suffix for each size?&#x200B;Thanks!https://i.redd.it/vm3qfbgnpnk21.jpg";False;How to export multiple art boards at different sizes?;https://www.reddit.com/r/AdobeIllustrator/comments/ayad2x/how_to_export_multiple_art_boards_at_different/
1551932471.0;False;ay8gtr;True;False;t3_ay8gtr;2;False;/r/AdobeIllustrator/comments/ay8gtr/workspacespanels_not_showing_up/;1;I am in the most recent version of Illustrator CC and every time I open a new or existing file, the workspace is gone and it says it's using Essentials Classic if I try to select any of the workspaces, but still nothing shows and it won't let me select a different one.I can manually bring up panels, but when I close Illustrator and open it again, panels are gone again. Is there a way to fix this?;False;Workspaces/Panels not showing up?;https://www.reddit.com/r/AdobeIllustrator/comments/ay8gtr/workspacespanels_not_showing_up/
1551928492.0;False;ay7v3o;False;False;t3_ay7v3o;5;False;/r/AdobeIllustrator/comments/ay7v3o/i_just_started_out_with_illustrator_what_are_some/;12;;False;I just started out with Illustrator, what are some things I can do to make this better? Especially regarding how the water looks?;https://i.redd.it/lyyz11xb6mk21.png
1551925214.0;False;ay7bwo;False;False;t3_ay7bwo;14;False;/r/AdobeIllustrator/comments/ay7bwo/rainy_day/;260;;False;Rainy day!;https://i.redd.it/5haeu35jwlk21.jpg
1551923110.0;False;ay6z8a;False;False;t3_ay6z8a;2;False;/r/AdobeIllustrator/comments/ay6z8a/how_to_fix_loading_forever_when_it_boots_ai_cc/;1;;False;How to fix Loading forever when it boots. AI CC 23.0.1;https://i.redd.it/a5fcsk0fqlk21.jpg
1551921991.0;False;ay6sqo;False;False;t3_ay6sqo;3;False;/r/AdobeIllustrator/comments/ay6sqo/self_portrait/;26;;False;Self Portrait.;https://i.redd.it/2sdv3079nlk21.png
1551910044.0;False;ay4oca;False;False;t3_ay4oca;2;False;/r/AdobeIllustrator/comments/ay4oca/the_finished_product_of_the_logo_i_posted_a_few/;1;;False;The finished product of the logo I posted a few days ago. I might have to mess around with the drop shadows. Thoughts and critiques?;https://i.redd.it/2z23bgmtnkk21.jpg
1551908478.0;False;ay4dbx;False;False;t3_ay4dbx;3;False;/r/AdobeIllustrator/comments/ay4dbx/quick_sloth_illustration_i_whipped_up_for_my_wife/;30;;False;Quick Sloth Illustration I Whipped Up For My Wife;https://i.redd.it/5cqmc853jkk21.jpg
1551893472.0;False;ay1fcf;True;False;t3_ay1fcf;4;False;/r/AdobeIllustrator/comments/ay1fcf/is_there_a_best_practices_for_setting_up/;2;I've been using Adobe tools for many years (self taught) and always felt like the snapping was lacking though I've never really thought to ask anyone until now if there is a better way. Am I doing something wrong or is the snapping just really that bad?I mainly use Illustrator for Logo Design & Flat Illustrations if that makes any difference.;False;"Is there a ""best practices"" for setting up snapping/smart guides?";https://www.reddit.com/r/AdobeIllustrator/comments/ay1fcf/is_there_a_best_practices_for_setting_up/
1551885052.0;False;axzubf;True;False;t3_axzubf;6;False;/r/AdobeIllustrator/comments/axzubf/money_roll/;10;"&#x200B;https://i.redd.it/8f0rmw2dlik21.jpg";False;Money Roll!;https://www.reddit.com/r/AdobeIllustrator/comments/axzubf/money_roll/
1551873033.0;False;axxz4w;False;False;t3_axxz4w;39;False;/r/AdobeIllustrator/comments/axxz4w/my_first_work_in_illustrator/;373;;False;My first work in illustrator;https://i.redd.it/gsh81mnqlhk21.jpg
1551869652.0;False;axxkay;False;False;t3_axxkay;3;False;/r/AdobeIllustrator/comments/axxkay/why_is_my_live_paint_tool_just_selecting_this_part/;2;;False;Why is my Live Paint Tool just selecting this part?;https://i.redd.it/1ieedxbmbhk21.png
1551867354.0;False;axxacc;False;False;t3_axxacc;3;False;/r/AdobeIllustrator/comments/axxacc/my_first_work_in_illustrator/;5;;False;My first work in illustrator;https://i.redd.it/9orz9wqu4hk21.jpg
1551863078.0;False;axwsvy;True;False;t3_axwsvy;0;False;/r/AdobeIllustrator/comments/axwsvy/colour_issues_in_illustrator/;1;"Hey everyone,I'm working on a project at the moment which involves making parodies of popular websites in illustrator.I've been using a screenshot of the real website as a template and drawing over it, to get the colours right i've been using the eye dropper tool on the screenshot and on screen everything looks fine.An issue arises when I save the finished document as a PDF, some of the colours are ok, but some aren't, just wondering if anyone can offer suggestions of why this might be happening?I understand that colours can vary from screen to print if you haven't calibrated properly, but i thought i wouldn't have this issue keeping everything digital, especially since i'm capturing the exact colour code.&#x200B;Cheers for any help!";False;Colour Issues in Illustrator;https://www.reddit.com/r/AdobeIllustrator/comments/axwsvy/colour_issues_in_illustrator/
1551859301.0;False;axwdrp;False;False;t3_axwdrp;2;False;/r/AdobeIllustrator/comments/axwdrp/northern_lights_rate_and_suggest_improvements/;3;;False;Northern Lights - Rate and suggest improvements?;https://i.redd.it/pgk4vkevggk21.png
1551859071.0;False;axwcu6;False;False;t3_axwcu6;3;False;/r/AdobeIllustrator/comments/axwcu6/i_love_this_how_can_i_recreate_this/;12;;False;I love this how can I recreate this?;https://i.redd.it/sfrk8bi4ggk21.png
1551855248.0;False;axvwvy;True;False;t3_axvwvy;11;False;/r/AdobeIllustrator/comments/axvwvy/hello_everyone_i_am_new_to_illustrator_and_im/;2;;False;Hello everyone, I am new to illustrator and I’m learning all myself. I have a big project to create my procreate drawing into a big banner...any suggestions to make my life a little easier???;https://www.reddit.com/r/AdobeIllustrator/comments/axvwvy/hello_everyone_i_am_new_to_illustrator_and_im/
1551852438.0;False;axvjhb;True;False;t3_axvjhb;2;False;/r/AdobeIllustrator/comments/axvjhb/im_a_noob_help_please/;1;"&#x200B;[You can see that on the left side of the screen my toolbar is gone and i don't know how it happend. Please can someone tell me how I make the toolbar reappear.](https://i.redd.it/usuz74zcwfk21.png)";False;I'm a Noob Help Please;https://www.reddit.com/r/AdobeIllustrator/comments/axvjhb/im_a_noob_help_please/
1551848530.0;False;axuztw;True;False;t3_axuztw;1;False;/r/AdobeIllustrator/comments/axuztw/how_to_remove_asset_from_filename_of_assets/;1;"This seems like something that is obvious and I'm just missing:   How the heck do I get Illustrator to stop exporting files with the filename I want, but followed by ""asset"". Like if I want a file called ""cells.png"" it will export it as ""cellsAsset.png"". I'm not using most of my files for websites, so it's annoying sharing them with my coworkers (who are not designers) who probably think I'm crazy for naming my files all weird.";False;"How to remove ""asset"" from filename of assets";https://www.reddit.com/r/AdobeIllustrator/comments/axuztw/how_to_remove_asset_from_filename_of_assets/
1551839245.0;1551916048.0;axtkck;True;False;t3_axtkck;5;False;/r/AdobeIllustrator/comments/axtkck/need_help_on_using_the_pen_tool_and_making/;1;"Hey guys, I really need some help  with this one. I have a project due tomorrow morning and I think I got  in a little over my head. Basically I traced a picture of Stan Lee and  traced most of the fine details to make him into a vector illustration  but I realized the shapes aren't whole when I finished. I've been  searching on how to fix this issue for hours with no luck. It is hard to  explain but I attached an image that may help explain a little better. I  am sure its a common mistake but I was hoping there is a quick solution  so I can get onto coloring each shape.&#x200B;[Stan Lee Spider-man ](https://i.redd.it/hx9iwju4tek21.png)I  colored some lines that are connected to the path of other lines but do  not make a whole shape like I need. Is there an easy way to make every  line it's own shape? Maybe by highlighting everything and expanding  appearance or something? (I'm new to illustrator and may not know what  I'm saying lol)Thank you in advance for help.&#x200B;EDIT: I used the live paint tool to  create multiple individual shapes, saving me hours of work! Here is the final product. &#x200B;*Processing gif 2rbk2h7n5lk21...*";False;Need help on using the pen tool and making individual shapes (making a vector image);https://www.reddit.com/r/AdobeIllustrator/comments/axtkck/need_help_on_using_the_pen_tool_and_making/
1551836221.0;False;axt2kr;False;False;t3_axt2kr;10;False;/r/AdobeIllustrator/comments/axt2kr/home_what_can_i_add_to_make_this_more_complete/;32;;False;"""Home"" - What can I add to make this more complete?";https://imgur.com/lblRWkn
1551832102.0;False;axsekx;True;False;t3_axsekx;1;False;/r/AdobeIllustrator/comments/axsekx/where_do_you_look_for_a_font_to_create_a_logo/;2;;False;Where do you look for a font to create a logo?;https://www.reddit.com/r/AdobeIllustrator/comments/axsekx/where_do_you_look_for_a_font_to_create_a_logo/
1551818407.0;False;axpxdn;True;False;t3_axpxdn;3;False;/r/AdobeIllustrator/comments/axpxdn/help_with_copypasting/;1;I can't seem to paste objects from my artwork onto my artwork (like a shape next to another shape). Any ideas? I'm on windows 10 with AI version 23. ;False;Help with copy/pasting;https://www.reddit.com/r/AdobeIllustrator/comments/axpxdn/help_with_copypasting/
1551818208.0;False;axpvzh;False;False;t3_axpvzh;2;False;/r/AdobeIllustrator/comments/axpvzh/my_experiment_what_do_you_think/;15;;False;My experiment, what do you think?;https://i.redd.it/ncyfyj6q2dk21.jpg
1551815180.0;False;axpbho;False;False;t3_axpbho;3;False;/r/AdobeIllustrator/comments/axpbho/since_i_did_make_more_doodles_in_this_style_back/;8;;False;since I did make more doodles in this style back in the day heres another one recreated in vector, feel free to rip it appart <3;https://i.redd.it/34wuxnyitck21.png
1551811315.0;False;axokmb;True;False;t3_axokmb;2;False;/r/AdobeIllustrator/comments/axokmb/auto_formatting_on_new_boxes/;1;Hey everyone. When I create a new rectangle, it automatically adds the opacity change, directional feather FX, and fill that one of my other boxes has. Why would it do that automatically, and how can I turn it off? Thanks!;False;Auto formatting on new boxes;https://www.reddit.com/r/AdobeIllustrator/comments/axokmb/auto_formatting_on_new_boxes/
1551810892.0;False;axohrg;True;False;t3_axohrg;1;False;/r/AdobeIllustrator/comments/axohrg/support_of_eps_files_being_eliminated/;1;Hi all,I'm a casual Illustrator user at work (simple stuff, not a whole lot of design but editing and typesetting, etc.).  A client is trying to send me an .eps file and it's not opening.  Not sure what the issue is but that's not why I'm posting.  He's claiming now that he's reading Illustrator is no longer supporting the .eps format, but I can't find a source for his claim.  I have quite a bit of .eps art in my files for clients that would be rendered useless by this change.  Has anyone else heard this or can you shed some light on this?;False;Support of .eps Files Being Eliminated?;https://www.reddit.com/r/AdobeIllustrator/comments/axohrg/support_of_eps_files_being_eliminated/
1551807047.0;False;axnqmu;True;False;t3_axnqmu;0;False;/r/AdobeIllustrator/comments/axnqmu/organ_mountains_in_las_cruces_nm/;1;"I am having trouble trying to add a gloss to this image around the black outer line. Any good tutorials that can help me would be appreciated. Also, do you like it?&#x200B;[https://imgur.com/3KzGTHv](https://imgur.com/3KzGTHv)";False;Organ Mountains in Las Cruces, NM;https://www.reddit.com/r/AdobeIllustrator/comments/axnqmu/organ_mountains_in_las_cruces_nm/
1551800107.0;False;axmf18;True;False;t3_axmf18;8;False;/r/AdobeIllustrator/comments/axmf18/question_how_do_i_save_an_image_without_space/;1;A project colleague has asked me for an image I've made to be saved without any padding/space around the image so that it can be used for display as a logo on a website. It'll be an image URL in a banner that should have some transparency to it so that the page's graphics behind the banner subtlety bleed through it. My image is only 1 layer that has a design and text both fill white and 80% opacity, with the layer stroke/fill is set as / If I 'Save for Web' and select Transparent and save as PNG-24 will this achieve what I'm trying to do?;False;Question: How do I save an image without space around it? Need it for a website;https://www.reddit.com/r/AdobeIllustrator/comments/axmf18/question_how_do_i_save_an_image_without_space/
1551796800.0;False;axluab;False;False;t3_axluab;37;False;/r/AdobeIllustrator/comments/axluab/harbor/;350;;False;Harbor;https://i.redd.it/gwiphi31bbk21.png
1551784494.0;False;axk10w;True;False;t3_axk10w;2;False;/r/AdobeIllustrator/comments/axk10w/changing_the_pen_tool_controls/;4;Strange question, but is there any option to switch the pen tool settings so that they match the settings in adobe flash/animate when drawing? i mean the control settings and all, i am much more proficient in it than in the illustrator or photoshop pen tool. Any add-on or something of the sort would help too.;False;Changing the pen tool controls;https://www.reddit.com/r/AdobeIllustrator/comments/axk10w/changing_the_pen_tool_controls/
1551783747.0;1551809079.0;axjxmt;True;False;t3_axjxmt;0;False;/r/AdobeIllustrator/comments/axjxmt/low_print_quality/;0;"About three years ago i replaced my Windows setup at home with an iMac. Since i use Illustrator on macOS i noticed, that printing directly from Illustrator gives me a lower resolution of my document. Opening the exact same document with Acrobat produces a nice smooth print. You can clearly see the difference in the example below. The upper part shows the scan of a Illustrator document printed with Acrobat, the lower part shows the same part of the same document printed directly from Illustrator (of course also using the same settings for the printer driver).I already tried completely removing the printer driver and reinstalling it. The problem persists even after a clean reinstall of macOS and Illustrator - also for different types of printers (Canon and Epson).I also tried different combination of settings in Illustrator (Color modes, Printing as bitmap, raster effects) none of which had an effect.The only workaround at the moment is to print the documents using Acrobat.Is there anyone else experiencing these problems? Or does someone even know how to fix this?&#x200B;Thanks in advance!https://i.redd.it/axt4qpho6ak21.jpg";False;Low print quality;https://www.reddit.com/r/AdobeIllustrator/comments/axjxmt/low_print_quality/
