created_utc;edited;id;is_self;locked;name;num_comments;over_18;permalink;score;selftext;spoiler;title;url
1549918988.0;False;apkzdh;True;False;t3_apkzdh;7;False;/r/indesign/comments/apkzdh/edit_text_across_multiple_spreads/;1;"I have a project with multiple spreads. The text is always the same across all the spreads. Is there a way to ""link"" the text boxes So if I change one it changes across all spreads?";False;Edit Text across Multiple Spreads;https://www.reddit.com/r/indesign/comments/apkzdh/edit_text_across_multiple_spreads/
1549899952.0;False;aphhvk;True;False;t3_aphhvk;2;False;/r/indesign/comments/aphhvk/help_can_someone_transform_my_indd_into_a_idml/;1;"Hey guys,I am to poor to use indesign haha, especially because I only use it to do my CV every now an then and as a student its too expensive. My friend would usually do it for me but he is travelling and i need help ASAP. Can I send to any of you my cv indesign file and you help to convert it to .idlm file? So i can use i.e. lucidpress?Thank you so much,&#x200B;Best, Jul";False;Help: Can someone transform my .indd into a .idml file?;https://www.reddit.com/r/indesign/comments/aphhvk/help_can_someone_transform_my_indd_into_a_idml/
1549884022.0;False;apfa7i;True;False;t3_apfa7i;6;False;/r/indesign/comments/apfa7i/is_there_an_easy_way_to_link_multiple_variations/;2;"I'm having to produce a number of personalised brochures where the layout will remain the same throughout, but the logo and some copy will change for each brochure.Previously I just saved a copy of the brochure for each new company (changing their logos and the copy in the documents) but this meant if there was a single layout change after the point, I had to manually change it in each document.I understand I can do a data merge for the copy, but don't think there is an equivalent for merging different logos.Does there exist a function to almost parent a document to something else, so I may change an image or copy on the individual versions, but a layout change etc can be reflected across all documents by editing from a ""Master"" so to speak?Thank you! ";False;Is there an easy way to link multiple variations to a master file?;https://www.reddit.com/r/indesign/comments/apfa7i/is_there_an_easy_way_to_link_multiple_variations/
1549820269.0;False;ap661r;True;False;t3_ap661r;6;False;/r/indesign/comments/ap661r/has_anyone_here_recently_taken_the_adobe/;9;;False;Has anyone here recently taken the Adobe Certified Associate exam? What should I expect, study etc. Also some online resources if you know of any. Thank you!;https://www.reddit.com/r/indesign/comments/ap661r/has_anyone_here_recently_taken_the_adobe/
1549820857.0;False;ap69nl;True;False;t3_ap69nl;1;False;/r/indesign/comments/ap69nl/simple_box_button/;2;Does anyone know how to setup a square button in indesign where if you click on the button it stays in final state when exported to a pdf? Thanks for any info. ;False;Simple Box Button;https://www.reddit.com/r/indesign/comments/ap69nl/simple_box_button/
1549829463.0;False;ap7tjf;True;False;t3_ap7tjf;8;False;/r/indesign/comments/ap7tjf/breaking_apart_pages_without_removing_images/;1;I had a document that will be printed and glued in the back to make a booklet. I've designed it as spreads, but it has to be handed in as seperate pages with bleed.If I export it as-is, some of the bleed of the one page, appears in the bleed of the facing page, because I made it as spreads.So no biggie, I break up the spreads and turn them into single pages. That way I can have a bleed on 4 sides.The thing is, I have images that go across both pages on one spread. When I break the pages apart, the image stays behind on one page and is removed from it's facing page.Is there anyway to lock it down so it will basically just cut my images in half along the inside of the spread?;False;Breaking Apart pages without removing images;https://www.reddit.com/r/indesign/comments/ap7tjf/breaking_apart_pages_without_removing_images/
1549809777.0;False;ap4gbx;True;False;t3_ap4gbx;5;False;/r/indesign/comments/ap4gbx/is_there_a_plugin_to_visualize_measurements_with/;1;"What I absolutely miss in InDesign is the ability to hold the **alt-button** to show measurements of selected elements, just like in Adobe XD, Sketch, Figma and similar design tools.&#x200B;I wonder if there is a plugin available in order to get a similar feature right in Adobe InDesign?&#x200B;For reference: this screenshot shows what I meant.&#x200B;https://i.redd.it/f2fhjntf6rf21.png";False;Is there a plugin to visualize measurements with a single button click like in Adobe XD?;https://www.reddit.com/r/indesign/comments/ap4gbx/is_there_a_plugin_to_visualize_measurements_with/
1549740472.0;False;aovnc1;True;False;t3_aovnc1;5;False;/r/indesign/comments/aovnc1/when_planning_to_make_a_bookzine_am_i_right_in/;3;;False;When planning to make a book/zine, am I right in thinking the number of pages needs to be in multiples of 4? If so, how does this work if you have fold-out pages?;https://www.reddit.com/r/indesign/comments/aovnc1/when_planning_to_make_a_bookzine_am_i_right_in/
1549734124.0;False;aouiyy;True;False;t3_aouiyy;5;False;/r/indesign/comments/aouiyy/place_link_text_in_master_not_transfering/;1;"Hi all,I'm currently working in CS6 InDesign, and was wondering if any one knew of a way to create 4 master pages that have the same repeating text box and then once I move into my working documents, I change the text on page 1 and then pages 2-4 all update with the same text. &#x200B;Currently I have set up Place & Link on the master for both text and an image, but when I go to use the working documents and use Override to manipulate the items, the Place & Link feature no longer works(both the image and the text have lost their link capabilities). I'm still learning how to use this software and am wondering if I am missing a feature that I don't know about?&#x200B;Thank you all for the help!";False;Place & Link Text in Master not transfering;https://www.reddit.com/r/indesign/comments/aouiyy/place_link_text_in_master_not_transfering/
1549607927.0;False;aoduhp;True;False;t3_aoduhp;11;False;/r/indesign/comments/aoduhp/where_is_a_good_place_on_the_net_to_ask_questions/;2;I have a link to a .CSV file I used as a source of data long ago, but deleted the file and every time I open ID it complains.  Status: Missing and I can't delete it from the Links list.*Some* text boxes have a gap at the top.  They don't lie flush with the line at the top of the page.  Some text boxes are fine.  I don't know what the difference is.  Example: the left is fine, the right has a gap: https://i.imgur.com/WLWm4wY.jpg;False;Where is a good place on the net to ask questions about indesign cs4? it's the version I learned on, the software was paid for long ago, and I still know how to use it.;https://www.reddit.com/r/indesign/comments/aoduhp/where_is_a_good_place_on_the_net_to_ask_questions/
1549583182.0;False;aoaan5;True;False;t3_aoaan5;3;False;/r/indesign/comments/aoaan5/how_to_create_two_column_text_boxes_such_that/;2;"Hello! Super new to InDesign and couldn't figure out how to search for the right answer without knowing the terminology so thought maybe I can ask here. Apology if it is a simple question!  I am trying to create a 2-column scientific journal styled magazine for my organisation, and is running into a problem where I find it really tedious trying to copy and paste text into the text boxes individually (like copy and try to fit them into one of the column in a single page till it is full, then move on to the next column, then next page etc.) and wondering if there's a way for this to ""flow"", like how they would had in a Miccrosoft Word? I needed this because if I adjust the spacing on those columns (e.g. added another empty line for ease of reading), I'll have to re-do the whole thing and it is getting out of hand.&#x200B;Thanks in advance!";False;How to create two column text boxes such that text will overflow/wrap from one side to the other, and to next page;https://www.reddit.com/r/indesign/comments/aoaan5/how_to_create_two_column_text_boxes_such_that/
1549566038.0;False;ao75m4;True;False;t3_ao75m4;9;False;/r/indesign/comments/ao75m4/were_seeking_workflow_advice_for_a_studentrun/;3;We are a small student-run college newspaper and we are looking to improve our workflow.We are curious if InCopy might help us streamline our typesetting process. **Our dream is to be able to work in parallel à la Google Docs, but we're not sure if that is even remotely feasible.**Could you suggest some improvements to our workflow?\--------------------------------------------------------------------------------------------------------------------------------------------------------------Our current workflow is as follows:We use a shared Google Drive folder. We have subdirectories for each edition, and another layer of folders for each section (News, Features, Opinions, etc). Article authors write their articles in Google Docs. Our section editors make the necessary changes to the documents. **We'd like to keep this process, as it works well and isn't technically challenging** (low barrier to entry for writers and editors)**.**The text from those documents is then copied (1) onto our WordPress site and (2) into InDesign, where our layout team pieces together our six-page print edition. Here's where it gets tricky.Tools:* three aging iMacs (might soon be upgraded)* Creative Suite, soon upgrading to Creative Cloud* A relatively large budget (at least this year)Putting together six pages (while adhering to our design and brand guidelines) is rather laborious, taking anywhere between five and eight hours. This means that we split typesetting between two or three people.We've been able to split the labor in various ways:* 3 individuals, 3 iMacs, 2 pages per individual. Three PDFs are merged at the end to form a 6-page edition.   * Pro: concurrent work   * Con: throwing articles (page 1 story continued on page 3) is near impossible      * Therefore NOT a good solution!* 2-3 individuals working in shifts using one InDesign station.   * Pro: we don't worry about transferring files   * Pro: all contained in one file   * Con: detailed communication is required during shift change   * Con: not concurrent      * Therefore this takes forever!* Haphazard combo (what we've been doing this year):Individual 1 starts layout on their personal laptop well in advance. Individual 1 sends a 70-80% complete copy to Individual 2, who then adds content via our iMac station. Individual 2 sends back to Individual 1, who makes visual tweaks and sends to printer.   * Pro: semi-concurrency   * Con: INDD -> IDML conversion (will be fixed with CC), loss of assets, messyThe obvious con to splitting the labor is that the print edition is subject to inconsistencies, but hey, we're all busy students who need to split the work :)\--------------------------------------------------------------------------------------------------------------------------------------------------------------**Question:** Can InCopy help us here? Is it a pipe dream to hope for a collaborative solution (à la Google Docs, MS Word Online)? How might we better this workflow? What else can we tell you that would help answer these questions?;False;We're seeking workflow advice for a student-run college newspaper. Is a 'collaborative' workflow possible?;https://www.reddit.com/r/indesign/comments/ao75m4/were_seeking_workflow_advice_for_a_studentrun/
1549563204.0;1549563489.0;ao6mov;True;False;t3_ao6mov;2;False;/r/indesign/comments/ao6mov/is_it_possible_to_apply_a_drop_shadowstroke_to/;1;I've made a grouped object consisting of a few different frames. The bottom edge of the entire grouped object is comprised of two shorter bottom edges of the frames that I've grouped.When I choose the grouped object as a whole and attempt to apply a drop shadow, it seems like ID is applying it to each frame in the grouped object, not the grouped object as a whole. This results in some funky shadows.Is there a way I can make ID do any of the following:* Treat the outer perimeter of the grouped object as the only edge, ignoring the edges inside the grouped object?* Apply that drop shadow to the grouped object as a whole as opposed to each individual frame of the grouped object?* Or apply a drop shadow to the specific edges of the grouped frames so that the grouped object as a whole has the appearance of a drop shadow?Does any of that make sense? Thanks for the help!;False;Is it possible to apply a drop shadow/stroke to only certain edges of grouped shapes?;https://www.reddit.com/r/indesign/comments/ao6mov/is_it_possible_to_apply_a_drop_shadowstroke_to/
1549548182.0;False;ao411j;True;False;t3_ao411j;16;False;/r/indesign/comments/ao411j/a_true_font_subscription_service_that_doesnt/;2;I'm tired of font companies literally squeezing every....single....penny of our their fonts. X amount for this, X amount for that. They can't track any of this stuff. I want to be legit, but this is so outrageous it borders on insanity. (rant over). Does anyone here have a good alternative? I'm a small designer, and I can't afford these absurd prices/restrictions. Any direction would be appreciated.;False;A true font subscription service that doesn't gouge or suck.;https://www.reddit.com/r/indesign/comments/ao411j/a_true_font_subscription_service_that_doesnt/
1549496826.0;1549562428.0;anxbgc;True;False;t3_anxbgc;17;False;/r/indesign/comments/anxbgc/is_it_possible_to_create_multiple_shapes_by/;4;I think I sorted it. I was overthinking it, I just made a few shapes, grouped them and now I have the look I was going for.Thanks everyone.;False;Is it possible to create multiple shapes by bisecting one shape with lines?;https://www.reddit.com/r/indesign/comments/anxbgc/is_it_possible_to_create_multiple_shapes_by/
1549500249.0;False;anxvee;True;False;t3_anxvee;4;False;/r/indesign/comments/anxvee/indesign_slow_to_start_up_could_it_be_my/;2;Not sure if this is the correct subreddit to ask for help on this? Indesign takes about 30 mins to start up and always has done for the past 3-4 years. I have reinstalled it and deleted preferences.I would like to try some sort of font application that I can turn off and on fonts as I need them for different projects as I think this might make it quicker (I don't know). Does anyone know of a good programme to use for this? Or any other suggestions?;False;Indesign slow to start up, could it be my thousands of fonts?;https://www.reddit.com/r/indesign/comments/anxvee/indesign_slow_to_start_up_could_it_be_my/
1549509553.0;1549509831.0;anzbam;True;False;t3_anzbam;10;False;/r/indesign/comments/anzbam/weird_green_aliasing_on_blue_text_in_pdfs/;1;I’m trying to design a large banner intended for print. When I export it to PDF, the blue text has a very thin but noticeable green outline around it. I’m pretty sure it’s some kind of aliasing. Zooming out makes it significantly worse, and scrolling around makes it super blurry and pixelated. Will this show up in print? Is there a way to make it stop showing on the PDF? Here’s a screenshot of what I mean https://m.imgur.com/aXD04r7 (This screenshot is zoomed-in to make the green more obvious. The actual text is vector.);False;Weird green aliasing on blue text in PDFs;https://www.reddit.com/r/indesign/comments/anzbam/weird_green_aliasing_on_blue_text_in_pdfs/
1549406058.0;False;anjn8v;True;False;t3_anjn8v;2;False;/r/indesign/comments/anjn8v/adding_java_script_to_a_fillable_form/;4;I’m a police officer who is trying to lead my PD from the dark ages.After taking a Motor Vehicle Report, I provided all the involved drivers a card that that states	•	incident date	•	report number	•	date when a copy of the report can be picked up (10 business day after the incident date)𝘏𝘢𝘯𝘥𝘸𝘳𝘪𝘵𝘪𝘯𝘨 𝘰𝘯 𝘢 𝘩𝘦𝘢𝘷𝘺 𝘥𝘶𝘵𝘺 𝘤𝘢𝘳𝘥 𝘪𝘴 𝘯𝘰𝘵 𝘷𝘦𝘳𝘺 𝘦𝘧𝘧𝘪𝘤𝘪𝘦𝘯𝘵 𝘯𝘰𝘳 𝘪𝘴 𝘪𝘵 𝘤𝘰𝘴𝘵-𝘦𝘧𝘧𝘦𝘤𝘵𝘪𝘷𝘦.I created and formatted a fillable form1 that can be printed out using the printer in the Radio Car (𝑣𝑖𝑎 𝑡𝒉𝑒 𝑝𝑟𝑖𝑛𝑡𝑒𝑟 𝑡𝒉𝑎𝑡 𝑖𝑠 𝑢𝑠𝑒𝑑 𝑡𝑜 𝑝𝑟𝑖𝑛𝑡 𝑜𝑢𝑡 𝑎 𝑠𝑢𝑚𝑚𝑜𝑛𝑠).I started to create a this shortcut that takes that will take the current Date and calculate what the date will be in 10 business days.	•	I assume I can do it with a bunch of “if” statement but it seemed to clunky.	•	then I figured it could be done using RegEx and “Match Text.” I just started to read “Mastering Regular Expression,” but I’m a slow reader and learner LOL.Of course the OCD in me would love for the Shortcut to take into account federal holidays and adjust the output accordingly, but I wouldn’t even know how to do that. (Prob more “if” values)Can someone help me with taking a date, add 10 business days to the input and return MM/dd/yyyy?I work with Cops, and in my 17-year career, I have learned that change is difficult. However, if you can lessen the friction it is more likely that it will be adopted.	1.	I noticed when creating my fillable form that javascript can be added to entries. So I’m hoping that when a coworker or I enter the incident date, the pickup date will be calculated using the script.  ↩;False;Adding Java Script to a fillable form?;https://www.reddit.com/r/indesign/comments/anjn8v/adding_java_script_to_a_fillable_form/
1549382851.0;False;anfk0k;False;False;t3_anfk0k;12;False;/r/indesign/comments/anfk0k/i_cannot_figure_out_how_to_edit_these_red_lines/;5;;False;I cannot figure out how to edit these red lines. The entire thing is almost acting like a table, but i cant find a solution.;https://i.redd.it/dxcx9by0xre21.png
1549372324.0;False;andyi0;True;False;t3_andyi0;1;False;/r/indesign/comments/andyi0/how_to_report_bugs_and_request_features/;7;**Report and vote for bugs/feature requests here:** [**https://indesign.uservoice.com/**](https://indesign.uservoice.com/)This is pretty much the official channel, and the indd developers actually read, respond and address things posted there. If there is a bug that has been plaguing you since the dawn of time, go report it, because there is a chance that the developers dont actually know about it. There is another [uservoice for illustrator](https://illustrator.uservoice.com/forums/333657-illustrator-feature-requests/suggestions/31150012-improve-graph-chart-tool) ;False;How to report bugs, and request features.;https://www.reddit.com/r/indesign/comments/andyi0/how_to_report_bugs_and_request_features/
1549365368.0;False;and4p3;True;False;t3_and4p3;1;False;/r/indesign/comments/and4p3/need_help_importing_pdf/;2;So I have these a4 format pdf pages with text I want to import into an a3 format document. I made two frames of the same size where I import the pdf in. The import settings are the same (on media). For a reason Indesign still makes one document bigger and outside the frame when importing. Is this a known problem and is there a solution?;False;Need help importing pdf;https://www.reddit.com/r/indesign/comments/and4p3/need_help_importing_pdf/
1549347571.0;False;anbd72;True;False;t3_anbd72;7;False;/r/indesign/comments/anbd72/newbie_help_with_booklet_settings_and_blank_pages/;3;"I am trying to create a booklet I want to print for a table top rpg.. When I export the booklet it puts in empty pages and when i try to set the paper size to custom it is grayed out. can someone please take a look and tell me what I am doing wrong?&#x200B;[https://drive.google.com/open?id=1JRYRdwGZuwMAlfvWcFZVBkzmtRQbCTUg](https://drive.google.com/open?id=1JRYRdwGZuwMAlfvWcFZVBkzmtRQbCTUg)";False;Newbie help with booklet settings and blank pages;https://www.reddit.com/r/indesign/comments/anbd72/newbie_help_with_booklet_settings_and_blank_pages/
1549308116.0;1549316925.0;an56yh;True;False;t3_an56yh;4;False;/r/indesign/comments/an56yh/info_panel_problem/;2;"My info panel is acting up and is not displaying information properly. It won't resize the information boxes when the panel is resized and I subsequently can't see the values of placed images, words, characters, and the x/y-values are behaving strangely; sometimes displaying double values superimposed on each other. It does not help to re-start InDesign and delete preferencesThe problem occurs both when the panel is free floated and when locked to a panel group to the right Does anyone have any idea what is the problem and most importantly, how can I fix it? I'm running InDesign CC 2018 on a MacOS High SierraI have attached the screen shot of this issue:https://imgur.com/a/Mqdl8qs";False;Info panel Problem;https://www.reddit.com/r/indesign/comments/an56yh/info_panel_problem/
1549280255.0;False;an0uo6;True;False;t3_an0uo6;13;False;/r/indesign/comments/an0uo6/macos_indesign_data_merge_with_images_not_working/;3;"MacOS Indesign 14.0.1 trouble with data merge with images.  For the project directory that the indesign file is in, all images are in a subdirectory  ""images"" I have tried the following:    ..:images:tile08.png    images:tile08.png    images/tile08.png    Each time, I get an error message that the data file references missing images.  Any suggestions?  Thanks!!!!&#x200B;";False;MacOS indesign data merge with images not working;https://www.reddit.com/r/indesign/comments/an0uo6/macos_indesign_data_merge_with_images_not_working/
1549120910.0;False;ameyw4;True;False;t3_ameyw4;9;False;/r/indesign/comments/ameyw4/beginning_with_indesign/;8;Hi everyoneJust for context, I am a digital marketer and my previous jobs have entailed creating and managing campaigns -Adwords, Social Media and email. As such I do have a basic understanding of Photoshop and creating some Basic Content on it. The most work I had previously done on PS was upto providing the layouts and color schemes for brochuresRecently started my own venture and given it being a startup, i am the one who has to design all the brochures and marketing materials as such. Have researched online a bit and can't seem to decide what would be the best resource to learn Indesign from.TLDR : Digital marketing guy needs to learn Indesign to make brochures and marketing materials.;False;Beginning with Indesign?;https://www.reddit.com/r/indesign/comments/ameyw4/beginning_with_indesign/
1549047571.0;False;am5gph;True;False;t3_am5gph;8;False;/r/indesign/comments/am5gph/very_confused_with_how_to_print_a5_booklets_in/;6;"So  I don't really used InDesign very often. I'm making an A5 booklet and I  am planning to send it to a professional printers. I have the document  set up to 'Facing Pages' with a 3mm bleed. On some of these spreads I  have one A4 sized background image placed into cover both pages, with  text written over. See pic related:&#x200B;&#x200B;https://i.redd.it/72bt6nw980e21.png&#x200B;When I export this as PDF it obviously looks okay, but the Printer  says they need a PDF set to individual pages and not spreads.Do I need to go through my whole Indesign file and slice in half  every element/type/picture I have that spreads across two pages? Would appreciate any help (I know I haven't explain this well sorry!)";False;Very confused with how to print A5 booklets in InDesign (Proffesionally);https://www.reddit.com/r/indesign/comments/am5gph/very_confused_with_how_to_print_a5_booklets_in/
1549031655.0;False;am2l4q;True;False;t3_am2l4q;3;False;/r/indesign/comments/am2l4q/list_of_bookmarks_in_single_button/;4;"Hello,can you help me how to create a button that will display list of multiple bookmarks?Kinda like Button with Go to bookmark action, but in this case I want the button to show me 6 bookmarks and user can select any of them.&#x200B;This is how the document looks like in PDF.  But I cannot replicate this functionality in indesign.&#x200B;https://i.redd.it/chsce1rgwyd21.jpg";False;list of bookmarks in single button ?;https://www.reddit.com/r/indesign/comments/am2l4q/list_of_bookmarks_in_single_button/
1549034149.0;False;am2zxu;True;False;t3_am2zxu;8;False;/r/indesign/comments/am2zxu/need_help_understanding_canopy_top_template/;5;Hello friends, I am working on a project for a client, and am trying to figure out the best way to interpret the template she sent my way. I've reached out to her for clarification, but in case she can't find the answer, I thought I'd reach out to the group. I am creating panels for a display canopy, and though the dimensions for the wall panels are clear, obviously, I'm not sure how to set up a document for the top, based on the breakdown below.   I’m not unsure if I should make a giant rectangle template with the dimensions of 19.49’ x 9.91’ (which doesn't make sense to me, considering the vertical height of the canopy, or if I’m supposed to make 4 separate templates for each side. If I need to make 4 rectangles, then I’m missing some of the the dimensions I would need, correct?https://i.redd.it/gafmviiw3zd21.pngTIA! ;False;Need help understanding canopy top template;https://www.reddit.com/r/indesign/comments/am2zxu/need_help_understanding_canopy_top_template/
1549018236.0;False;am0uiw;True;False;t3_am0uiw;3;False;/r/indesign/comments/am0uiw/any_way_to_combine_fonts/;3;I have two different versions of the font, Meta. One is called MetaOT and the other Meta OT. As [pictured here](https://imgur.com/a/VNsnzEQ), the Light cut doesn't sit with the rest of the family and it's mildly maddening to work with. Is there a simple way I can combine/rename these so they do work?I appreciate this isn't strictly an InDesign question, but this community has been helpful in the past and probably knows the answer!Thanks in advance.;False;Any way to combine fonts?;https://www.reddit.com/r/indesign/comments/am0uiw/any_way_to_combine_fonts/
