created_utc;edited;id;is_self;locked;name;num_comments;over_18;permalink;score;selftext;spoiler;title;url
1548878780.0;False;algtju;False;False;t3_algtju;9;False;/r/indesign/comments/algtju/export_color_source_profile_error/;4;;False;Export - Color Source Profile Error;https://imgur.com/a/CxFzxVA
1548835342.0;False;alajxv;True;False;t3_alajxv;8;False;/r/indesign/comments/alajxv/different_black_when_exporting_pdf/;6;I placed a logo (PDF-format) in to my InDesign file, and I used the eye dropper tool to get the same black as a bakground. But when I open the exported file in Acrobat the blacks are different, despite having the same color value (100 % black) as you can see in the picture.This problem occurs from time to time but I haven't found any solutions, do you know what I can do?(Also, it's a bonus if you can figure out why the white line occurs under the logo...)https://i.redd.it/0v2wki8xmid21.png;False;Different black when exporting PDF;https://www.reddit.com/r/indesign/comments/alajxv/different_black_when_exporting_pdf/
1548846522.0;False;albnt5;True;False;t3_albnt5;2;False;/r/indesign/comments/albnt5/placing_image_over_texture_in_cc/;3;Hi guys, I've done this before but can't seem to get it to work this time. I have a Bitmap texture (also in TIFF and PSD if needed) which I want to lay an image over the top of, to use the textured edges. I could have sworn you put the texture in, then right-click and 'place into' the new image and it sits over the texture, using that as a kind of frame? ;False;Placing image over texture in CC;https://www.reddit.com/r/indesign/comments/albnt5/placing_image_over_texture_in_cc/
1548804927.0;False;al6boh;True;False;t3_al6boh;8;False;/r/indesign/comments/al6boh/any_possible_way_to_open_an_indd_file_anywhere/;4;I have Photoshop and Lightroom but need to open an indd file... any way to do this without Indesign?  Every how-to I can find involves changing the export in Indesign.  Which I don't have. ;False;Any possible way to open an indd file anywhere else?;https://www.reddit.com/r/indesign/comments/al6boh/any_possible_way_to_open_an_indd_file_anywhere/
1548794540.0;False;al4gyr;True;False;t3_al4gyr;16;False;/r/indesign/comments/al4gyr/difficulty_with_data_merge_from_a_csv_file/;3;For a periodical journal I tried performing [this article](https://helpx.adobe.com/indesign/using/data-merge.html#adding_data_field_placeholders_to_master_pages) to have a copies printed with shipping addresses from a CSV file. The CSV file (which is originally an Excel spreadsheet) seems to have imported correctly. The data merge box I imported it has each entry titled as the first entry of each column in the spreadsheet. I then dragged each of the entries from the data merge box (formatted: <<Full Name>>) to a text box. After printing the singular page (instead of the whole booklet) instead of printing the data from the box, the entry from the data merge box with the arrows was printed. How do I fix this?;False;Difficulty with data merge from a csv file;https://www.reddit.com/r/indesign/comments/al4gyr/difficulty_with_data_merge_from_a_csv_file/
1548784285.0;False;al2ktr;True;False;t3_al2ktr;4;False;/r/indesign/comments/al2ktr/import_pdf_comments_working_for_anyone/;4;"I have exported test PDFs for clients to mark up in Acrobat with their edits. When I import those comment using the new function, the comments show up in the panel, but they are not indicated on the page. There is an error icon in the panel that says ""Not mapped on Page"". Occasionally they will be mapped on the page, but there is never any rhyme or reason to which ones work Is anyone else having this problem?";False;Import PDF Comments working for anyone?;https://www.reddit.com/r/indesign/comments/al2ktr/import_pdf_comments_working_for_anyone/
1548784177.0;False;al2k2o;True;False;t3_al2k2o;7;False;/r/indesign/comments/al2k2o/stop_autocreating_text_boxes_on_new_documentspages/;5;For the last couple of days, every time I create a new document on InDesign (or even a new page on an existing document), it always creates a text box the size of my margins. I hadn't changed any settings, but I did try turning off Smart Text Reflow. But, the problem is still persisting. Any way to fix this?;False;Stop Auto-creating text boxes on new documents/pages;https://www.reddit.com/r/indesign/comments/al2k2o/stop_autocreating_text_boxes_on_new_documentspages/
1548757342.0;False;akypqw;True;False;t3_akypqw;6;False;/r/indesign/comments/akypqw/font_not_showing/;3;"https://en.wikipedia.org/wiki/Kirtipur The first type script "" कीर्तिपुर ""shows here, on word etc. The moment I paste it into Indesign I get boxes and pink. It says sans serif. I've installed. Nothing. It works everywhere on my computer aside from Indesign. Can anyone else get this font to work in Indesign? If yes, how did you do it! ";False;Font not showing;https://www.reddit.com/r/indesign/comments/akypqw/font_not_showing/
1548757953.0;False;akyrw7;True;False;t3_akyrw7;8;False;/r/indesign/comments/akyrw7/ipad_app_through_indesign/;2;Hi!Does anyone know how to release an iPad app through indesign in 2019? What kind of subscription would I need and so on?  ;False;iPad app through indesign;https://www.reddit.com/r/indesign/comments/akyrw7/ipad_app_through_indesign/
1548721754.0;False;aku72e;True;False;t3_aku72e;2;False;/r/indesign/comments/aku72e/opening_files_in_older_indesign_versions/;3;I am transferring my work from my Indesign CC to my schools CC. However their program has not updated yet and I am unable to open the file with their program. If I save it as an IDML with my program will I be able to open it with theirs?;False;Opening files in older Indesign versions.;https://www.reddit.com/r/indesign/comments/aku72e/opening_files_in_older_indesign_versions/
1548696783.0;False;akpqvw;True;False;t3_akpqvw;9;False;/r/indesign/comments/akpqvw/randomly_bolded_text_when_i_export_as_a_pdf_and/;8;"I have a 20(or so) page document that looks fine on my screen both in InDesign and when opened as a PDF. When I print the document, there are random lines of text that look bold. Any clue why/how to fix?&#x200B;Thanks!";False;Randomly bolded text when I export as a PDF and print?;https://www.reddit.com/r/indesign/comments/akpqvw/randomly_bolded_text_when_i_export_as_a_pdf_and/
1548663729.0;False;aklhv7;True;False;t3_aklhv7;5;False;/r/indesign/comments/aklhv7/how_can_i_get_a_somethimg_like_a_grass_green/;2;I just need a simple green coloured box.It has to be CMYK. Everytime I try to get a nice green and click on ok it just gets yellowish. Can someone recommend a nice green colour that I can use?Thanks in advance;False;How can I get a somethimg like a grass green;https://www.reddit.com/r/indesign/comments/aklhv7/how_can_i_get_a_somethimg_like_a_grass_green/
1548639768.0;False;akigja;True;False;t3_akigja;2;False;/r/indesign/comments/akigja/where_do_i_find_people_who_can_write_custom_in/;2;Like the title says, I’m looking for a resource where I can find somebody who will write me a script/plugin to automate some of the work my department does in InDesign. We are definitely willing to pay but the script writer would need to be reliable and available for updates if we encounter bugs. Where do I go about hiring someone that can do this? ;False;Where do I find people who can write custom in design scripts for my work?;https://www.reddit.com/r/indesign/comments/akigja/where_do_i_find_people_who_can_write_custom_in/
1548623773.0;False;akfx3f;True;False;t3_akfx3f;5;False;/r/indesign/comments/akfx3f/indesign_book_pdf_to_ps_gif/;3;Is there an easy way to create a GIF from an 80 page PDF file?  ;False;InDesign Book (PDF) to PS (GIF);https://www.reddit.com/r/indesign/comments/akfx3f/indesign_book_pdf_to_ps_gif/
1548551620.0;False;ak7cbc;True;False;t3_ak7cbc;4;False;/r/indesign/comments/ak7cbc/problems_with_type_accents/;6;"Hey, how are you guys? I'm having a hard time to actually put my problem into words, so bear with me (english is not my main language).So, both with Indesign and Illustrator (so probably with every Adobe product), every time I'm doing text with accents (think é, ã and such), the result is just something wierd.For example, on my keyboard, I have a key labelled with a ""´"". If I press that and the letter ""A"", the result is ""á"".However, if I'm on Indesign, and I press the exact same keys, I get an ""[a"". And heres where it gets wierder. This only happens if I open a new text box. If I'm editing an old one, the keys work as usual. If I open a new box, both the new and the old ones get all wierd.I tried changing the ""English: USA"" option on the top bar, but that didn't change anything. It's not my keyboard either, because it works the way it should on everything else.Im currently running CC 2018, but the same problem was present on CS6, which was the reason I changed my version.";False;problems with type accents;https://www.reddit.com/r/indesign/comments/ak7cbc/problems_with_type_accents/
1548535491.0;False;ak4uo1;False;False;t3_ak4uo1;8;False;/r/indesign/comments/ak4uo1/need_help_creating_rounded_box_ive_looked_it_up/;5;;False;Need help creating rounded box. I've looked it up everywhere and I need to remake this for an assignment and cant find how to. I keep getting results on beveled edges.;https://i.redd.it/9phy0ydjxtc21.png
1548522978.0;False;ak2rqu;True;False;t3_ak2rqu;8;False;/r/indesign/comments/ak2rqu/how_does_one_go_about_setting_up_a_document_for_a/;7; ;False;How does one go about setting up a document for a book that will have fold-out pages?;https://www.reddit.com/r/indesign/comments/ak2rqu/how_does_one_go_about_setting_up_a_document_for_a/
1548435489.0;False;ajr0ke;True;False;t3_ajr0ke;7;False;/r/indesign/comments/ajr0ke/what_is_the_best_flip_book_page_turning_website/;10;"Preferably HTML and will work across all media.&#x200B;Has anyone had success or failure in doing this?&#x200B;";False;What is the best flip book, page turning website for catalogues/brochures? A client wants to put up 5-10 different .pdf brochures in a flip book format online.;https://www.reddit.com/r/indesign/comments/ajr0ke/what_is_the_best_flip_book_page_turning_website/
1548453112.0;False;aju422;False;False;t3_aju422;4;False;/r/indesign/comments/aju422/new_to_indesign_and_i_cant_click_on_create_merged/;2;;False;New to InDesign and I can’t click on ‘Create Merged Document’. I’ve looked everywhere but can’t find anything that would help. Please!;https://i.redd.it/nhnmndtk4nc21.jpg
1548431462.0;False;ajqbx2;True;False;t3_ajqbx2;0;False;/r/indesign/comments/ajqbx2/is_there_a_plugin_that_will_import/;3;"Hi.I work for a niche business where we do a lot of taking content from Microsoft Word and transferring it to InDesign.When we do this, we have to make sure that the character and paragraph characteristics in the Word documents transfer over to InDesign. For many years, we have been doing this manually. For instance:1. Copy a page of text from a Word document.2. Paste the copied text into a frame in InDesign.3. Look at the Word document and find any text that is bold, italic, centered, indented, etc.4. Manually update the InDesign file to match the formatting of the Word document. In other words, if we see bold font in the Word document, we will go apply our Bold character style to the corresponding text in the InDesign file. If we see that paragraphs have tabs in the Word document, we will apply a paragraph style in InDesign that contains a first-line indent.Our InDesign files are very text-heavy and don't contain many graphics. We do use quite a few tables in our files, but they're not extremely complicated. Most of our work is very basic typesetting.Due to the huge volume of work we have that involves this process, transferring content from Word to InDesign and manually formatting the character styles is very, very time consuming. We have researched ways to automate this process but we have not been able to find a reliable way to do this without having to do a lot of manual overrides. We are open to spending money on an InDesign extension/plugin that will handle this character and paragraph styling for us.Does anyone know of any tools out there that could help us?&#x200B;Thanks.";False;Is there a plugin that will import paragraph/character styles from Word to InDesign reliably?;https://www.reddit.com/r/indesign/comments/ajqbx2/is_there_a_plugin_that_will_import/
1548365230.0;False;ajhgqf;True;False;t3_ajhgqf;11;False;/r/indesign/comments/ajhgqf/getting_the_balance_right_pdf_output_file_size/;9;"I produce sales proposals for government contracts, in the range of 30-200 pages. They consist of text, images, screenshots, tiny-print legalese, and every type of table, list, and inserted element you can name.In the last year or so, the majority of contracting opportunities have switched to allowing electronic submissions, instead of printing and binding 15 copies of a 100+ page document.These are primarily for on-screen reading, but some people still like to print out the whole document, or at least certain pages.I'm trying to find an output type that properly balances between reasonable file size and ""looks reasonable printed on a regular office printer"".* The document I am working on now is just under 50 pages, and is about 2.5Mb when output with the Adobe Output Presets > Smallest File Size option.* Using the ""Press Quality"" produces a file over 20Mb, which many email systems and web portal bidding sites reject as being too large.* The interim size seems to be ""High Quality Print"", but still runs 15Mb.Are these the ""best"" settings to go with? Or are there tweaks and adjustments that can shave 5Mb off a file size?I wondering about placing the PDFs of our product data sheets, for example... should I output them as high quality JPEGs or PNGs, and place those files in my InDesign doc instead?Are there other tricks for producing large documents like this, and outputting them to a reasonable size file?";False;Getting the balance right - PDF output, file size versus resolution;https://www.reddit.com/r/indesign/comments/ajhgqf/getting_the_balance_right_pdf_output_file_size/
1548361324.0;1548364385.0;ajglmr;True;False;t3_ajglmr;5;False;/r/indesign/comments/ajglmr/trouble_formatting_text_between_carets_grep/;3;"So I'm trying to use GREP to automatically format tagged text. I want to make all text between carets (^) bold and then get rid of the carets. I've got this for my search:(\^)( *.*\w*\d*)(\^)And my Change to is:$2This works when there is only one bold word or phrase in a paragraph. But it breaks when there are two or more as it only recognizes the first and last carets.For example in this statement:I want the ^ reddish brown^ ball with the ^ yellow^ star.it ends up bolding ""reddish brown ball^ with the ^ yellow"" instead of just ""reddish brown"" then ""yellow"".Any advice on how to fix this?";False;Trouble formatting text between carets. GREP;https://www.reddit.com/r/indesign/comments/ajglmr/trouble_formatting_text_between_carets_grep/
1548336798.0;1548336984.0;ajcg21;True;False;t3_ajcg21;16;False;/r/indesign/comments/ajcg21/few_questions_about_making_a_book/;5;"Hello guys i have a question for you:  &nbsp;The format of my life is A4 and i plan to print like this i wanna know if all of this is gonna be printed or the print is gonna cut something (image: https://imgur.com/a/1ceyCMl)&nbsp;Is like i wanna know if these edges parts are gonna be cut or they are gonna get printed";False;Few questions about making a book;https://www.reddit.com/r/indesign/comments/ajcg21/few_questions_about_making_a_book/
1548273001.0;False;aj3nx3;True;False;t3_aj3nx3;8;False;/r/indesign/comments/aj3nx3/indesign_template_help/;10;Hi im fairly new to indesign, the only I did before was a trifold brochure. I had recently had a request to do a folder/brochure with a pocket in the middle, document size is still uncertain:[Example of the document that I need to design](https://i.imgur.com/dfyfEnd.jpg)Is there a template or guides that can help me design this with a pocket?? Thanks!;False;Indesign template help;https://www.reddit.com/r/indesign/comments/aj3nx3/indesign_template_help/
1548263997.0;False;aj202g;True;False;t3_aj202g;8;False;/r/indesign/comments/aj202g/how_to_separate_text_behavior_in_linked_frames/;3;"Hi, it's difficult for me to explain this but I will try:  When you have two (or more) frames of linked text, is there a break character, or any way, that lets me distort the first frame, but not affect the second (and subsequent) text frames? The text has to remain linked, and the idea is that I can handle the first text frame in whichever way I want, but the next text frames are not affected by my manipulation. I don't care if the frame that I distort ""hides"" the text and shows me the red \[+\] on the right bottom corner. What I want is that the text remains linked but the next frames are not affected.   Hope to have explained myself. ";False;How to separate text behavior in linked frames?;https://www.reddit.com/r/indesign/comments/aj202g/how_to_separate_text_behavior_in_linked_frames/
1548262008.0;False;aj1muu;True;False;t3_aj1muu;3;False;/r/indesign/comments/aj1muu/data_merge_that_completes_bubble_sheets/;3;I've got a file set up to complete most of a form for many people (about 250 individual forms). However the form has bubble sheet info (you know, the kind where you enter the number/letter at the top of the column, then pencil in the corresponding bubble in the column below). Any idea how I can automatically fill in those bubbles? It's a requirement of the job to have these all filled in before sending out. The only place with bubbles to complete is numbers, no letters. But there are 10 columns per sheet (10 columns x 250 sheets = 2,500 bubbles to fill in. Yikes).My only thought right now is to make corresponding fields in the csv that have an image reference the size of a column and a bubble is filled in. I would make say 10 of those (0, 1, 2, 3, 4, 5, 6, 7, 8, and 9), and then have to choose the correct file for each individual numeral. That sounds almost like MORE work than just filling all the bubbles in by hand.Any ideas?;False;Data merge that completes bubble sheets?;https://www.reddit.com/r/indesign/comments/aj1muu/data_merge_that_completes_bubble_sheets/
1548237517.0;False;aiy773;True;False;t3_aiy773;5;False;/r/indesign/comments/aiy773/radio_button_styled_as_a_check_box/;4;I feel like the answer to this might be a resounding 'no, you can't' but figured I'd ask here just in case I'm looking in the wrong place!I have an interactive form that I'm designing. Said form has a selection of Yes/No check boxes (which the client wants to be check boxes with ticks) but I need them to behave like radio buttons so that only one out of the two can be selected at once.I've managed to style them in the document, but when exported and selected the tick disappears and is replaced with the standard circle selection.I've also managed to do this on past projects in Acrobat, but was hoping to format the form fields in InDesign as it would be a lot quicker to go back and make adjustments if I need to.Is there a way to do this? Or am I hitting my head against a brick wall and should just format the form in Acrobat?;False;Radio Button styled as a Check Box?;https://www.reddit.com/r/indesign/comments/aiy773/radio_button_styled_as_a_check_box/
1548199106.0;False;aiszab;True;False;t3_aiszab;13;False;/r/indesign/comments/aiszab/indesign_noob_needs_an_advice/;4;"I am trying to create a simple logo. I need to change a color of a background from white to Blueish black.  After I changed a color, and export the file in JPEG format, I see the the logo on a standard white background.&#x200B;How to keep a background color after exporting the file?";False;Indesign noob needs an advice;https://www.reddit.com/r/indesign/comments/aiszab/indesign_noob_needs_an_advice/
1548159172.0;False;aim98n;False;False;t3_aim98n;10;False;/r/indesign/comments/aim98n/bending_font_like_that_in_indesign/;10;;False;Bending Font like that in InDesign?;https://imgur.com/YOJRGxr
1548123291.0;False;aihzlf;True;False;t3_aihzlf;3;False;/r/indesign/comments/aihzlf/cant_find_font/;3;For some reason I can't find a Stockholm and Helvetica fonts when searching the Adobe Font library, however I have a colleague who says he is already using them on his InDesign. Does anybody know what might be the problem? ;False;Can't find font?;https://www.reddit.com/r/indesign/comments/aihzlf/cant_find_font/
1548087485.0;False;aiblx8;False;False;t3_aiblx8;8;False;/r/indesign/comments/aiblx8/i_updated_cant_find_something_feeling_dumb_cannot/;13;;False;I updated, can't find something. Feeling dumb. Cannot find this anywhere in type settings. Help please.;https://i.redd.it/96ysscj9xsb21.jpg
1548092265.0;False;aicgkd;True;False;t3_aicgkd;7;False;/r/indesign/comments/aicgkd/is_there_a_script_for_setting_a_word_in_different/;4;Hi, I'm trying to figure out if there is a script/action that can set type in various type faces.How I'm picturing this is, if I'm setting the word Plant.The script/action would* 1. Window would pop out asking _what word would you like to set?_* 2. User would type in _plant_ and press okay* 3. inDesign would create a text box in the center, align center and type _plant_ in times new roman* 4. inDesign would then create a new page, new text box in the center, align center, and type _plant_ in Helvetica * 5. it would go down your entire type library.is this possible? or does something like this exist?;False;Is there a script for setting a word in different typefaces?;https://www.reddit.com/r/indesign/comments/aicgkd/is_there_a_script_for_setting_a_word_in_different/
1548038304.0;False;ai5hex;True;False;t3_ai5hex;6;False;/r/indesign/comments/ai5hex/how_to_remove_outside_bleed/;4;Like so [I would like to remove the gradient off the sides](https://imgur.com/a/dHZ3ri8);False;How to remove outside bleed?;https://www.reddit.com/r/indesign/comments/ai5hex/how_to_remove_outside_bleed/
1547987443.0;False;ahx1m0;True;False;t3_ahx1m0;9;False;/r/indesign/comments/ahx1m0/is_it_possible_to_findchange_hyphens_i_want_to/;5;;False;"Is it possible to find/change hyphens? I want to change ""-"" to "":""";https://www.reddit.com/r/indesign/comments/ahx1m0/is_it_possible_to_findchange_hyphens_i_want_to/
1547933903.0;False;ahqkwx;True;False;t3_ahqkwx;9;False;/r/indesign/comments/ahqkwx/what_does_p6_mean_when_it/;5;"This may be a dumb question: I have required dimensions of ""48p6 wide by 62p6 high"". What, pray tell, is 'p6'?";False;What does 'p6' mean when it;https://www.reddit.com/r/indesign/comments/ahqkwx/what_does_p6_mean_when_it/
1547911362.0;False;ahmxc2;False;False;t3_ahmxc2;13;False;/r/indesign/comments/ahmxc2/title_disappears_when_exporting_to_pdf_any_ideas/;2;;False;Title disappears when Exporting to pdf. Any ideas why?;https://i.redd.it/9xvgzgkodeb21.jpg
1547828910.0;False;ahc60n;True;False;t3_ahc60n;4;False;/r/indesign/comments/ahc60n/best_resources_for_beginner/;6;Hi, brand new to this. Ive used photoshop and Lightroom for about three years now so I have some basic knowledge of adobe language. I am in a new position where it would really benefit me to have working knowledge of in design (and illustrator but that’s for a different sub). Where do you all go for continued learning? ;False;Best resources for beginner?;https://www.reddit.com/r/indesign/comments/ahc60n/best_resources_for_beginner/
1547832060.0;False;ahcpto;True;False;t3_ahcpto;7;False;/r/indesign/comments/ahcpto/compound_path_elements_causing_bad_pdf_for_print/;3;"The artwork I'm working on has multiple ""compound path"" elements in it, and I can't really figure out what they are.The yellow text here: https://i.imgur.com/1AVUVMC.pngEverything else in the file is simple: image or text.  I've exported it a hundred different ways, and no matter what I do our printeres nearly die when I send them the PDFSorry, I'm pretty new to this, but I don't understand the ""compound path"" part of this design file. Additional picture: https://i.imgur.com/OT5iPUs.png";False;Compound Path elements causing bad PDF for print?;https://www.reddit.com/r/indesign/comments/ahcpto/compound_path_elements_causing_bad_pdf_for_print/
1547821288.0;False;ahaw3z;True;False;t3_ahaw3z;6;False;/r/indesign/comments/ahaw3z/help/;3;I started recently working in indesign, creating the content of the book. I work on indesign 14.0, my colleague who is giving the ok for print checks my work in 13.1 and we always see diferent formating on pages, we blame the convert procces but how do we fix this?[what I see](https://prnt.sc/m8wvt8), [what he sees](http://prntscr.com/m8xddd). I checked online but didn't find my problem or I didn't know how to search, saving for other versions aparently doesn't help, I know it's a small detail somewhere but I cannot figure it out.;False;Help?;https://www.reddit.com/r/indesign/comments/ahaw3z/help/
1547816636.0;False;aha8ip;False;False;t3_aha8ip;6;False;/r/indesign/comments/aha8ip/does_anybody_know_how_to_edit_the_object_frame/;3;;False;Does anybody know how to edit the object frame color?;https://i.redd.it/6e3xk5mzj6b21.png
