created_utc;edited;id;is_self;locked;name;num_comments;over_18;permalink;score;selftext;spoiler;title;url
1551827670.0;False;axrnk6;True;False;t3_axrnk6;4;False;/r/indesign/comments/axrnk6/auto_horizontal_scale_squeeze_text/;3;Is there anyway to auto horizontal scale (squeeze) text to keep it on one line, column, or text frame?My project involves a long list of menu items that I've placed in a Paragraph Style with Split Column. There are a couple title names that are too long for the column and continue on another line.I have a lot of these menus to do, so manually editing each line of text would consume a lot of time.;False;Auto Horizontal Scale (Squeeze) Text;https://www.reddit.com/r/indesign/comments/axrnk6/auto_horizontal_scale_squeeze_text/
1551831439.0;False;axsan2;False;False;t3_axsan2;7;False;/r/indesign/comments/axsan2/i_am_changing_the_fill_of_the_green_box_with_the/;1;;False;I am changing the fill of the green box, with the eyedropper tool. When I use eyedropper on the pink heart, the resulting color is actually less saturated than the actual heart's color.;https://i.redd.it/hmhxtyc26ek21.png
1551807970.0;False;axnx7v;False;False;t3_axnx7v;14;False;/r/indesign/comments/axnx7v/could_i_get_some_feedback_ita_been_awhile_since_i/;0;;False;Could I get some feedback? It’a been awhile since I made a poster and my committee hasn’t been helpful.;https://i.redd.it/hklyxtta8ck21.jpg
1551778838.0;False;axjcwa;False;False;t3_axjcwa;5;False;/r/indesign/comments/axjcwa/can_i_add_more_pages_on_top_and_under_the_double/;3;;False;Can I add more pages on top and under the double page that is in the middle of the A4 (id like to be a double sided print);https://imgur.com/a/pCwRwBO
1551764054.0;1551772258.0;axhhyv;True;False;t3_axhhyv;13;False;/r/indesign/comments/axhhyv/how_can_i_change_the_way_indesign_splits_text/;1;Is is possible to change the way InDesign splits text into columns?Currently, it changes this:> 1 Cats> > 2 Dogs> > 3 Fish> > 4 Elephants> into this:    1 Cats | 3 Fish------|------2 Dogs | 4 Elephants    I would like it to be:1 Cats | 2 Dogs------|------3 Fish | 4 ElephantsI guess I can work around it by changing the order of the text before splitting or even using tables, but the document I'm working on is very large so I'd rather not have to go through that (unless necessary, I suppose).Edit: Adding some images for clarification.Currently my doc looks like [image 1](https://i.ibb.co/09Xwjw3/1.jpg).When I split it it comes out like [image 2](https://i.ibb.co/xhFvKYd/2.jpg).If I edit the doc to look like [image 3](https://i.ibb.co/BnQ7Fb2/3.jpg),And then split it, it'll look like [image 4](https://i.ibb.co/3Nn7mtW/4.jpg).So, my current input is 1, and desired output is 4. Any way I can do that? InDesign converts 1 to 2 by default.;False;How can I change the way InDesign splits text into columns?;https://www.reddit.com/r/indesign/comments/axhhyv/how_can_i_change_the_way_indesign_splits_text/
1551762625.0;False;axhaj5;True;False;t3_axhaj5;7;False;/r/indesign/comments/axhaj5/how_to_add_a_picture_into_a_table_cell/;1;For a class I’m taking, we need images to be placed into a table cell so when the table is moved, the image will be moved with it, because I’m currently using a frame over the top of a table cell, it becomes very annoying to move it constantly ;False;How to add a picture INTO a table cell;https://www.reddit.com/r/indesign/comments/axhaj5/how_to_add_a_picture_into_a_table_cell/
1551728141.0;False;axba74;False;False;t3_axba74;6;False;/r/indesign/comments/axba74/working_on_a_boardgame_any_chance_i_can/;5;;False;Working on a boardgame - Any chance I can automate/make my text centred and follow the ellipse 360 degrees?;https://i.redd.it/5shq7b0im5k21.png
1551753260.0;False;axfwyw;True;False;t3_axfwyw;7;False;/r/indesign/comments/axfwyw/creating_a_table_of_contents/;1;Hi there, I'm coming to make a table of contents for a pretty short document of about 20 pages, however when I go to create the table and select the paragraph style and click done it just brings up the entirety of the document in one text box. Am I doing something wrong or have I not set the paragraph style correctly? ;False;Creating a table of contents;https://www.reddit.com/r/indesign/comments/axfwyw/creating_a_table_of_contents/
1551737477.0;False;axd4zd;True;False;t3_axd4zd;5;False;/r/indesign/comments/axd4zd/pathfinder_is_not_addingsubtractingcombining/;2;"This seems like it should be pretty straight forward, but for some reason Pathfinder isn't working as it seems it should.&#x200B;This pitcher shape I made, I'm trying to subtract the top half from the bottom half so that only the bottom half remains. I draw a box, drag it over the pitcher shape, make sure both are selected and hit the subtract pathfinder tool. Nothing happens.https://i.redd.it/98cheswtd6k21.pngDoes this have something to do with the pitcher being a shape I've already made? I'm not understanding why it's not working. Can anyone explain?";False;Pathfinder is not adding/subtracting/combining shapes, what's the deal?;https://www.reddit.com/r/indesign/comments/axd4zd/pathfinder_is_not_addingsubtractingcombining/
1551706370.0;False;ax761q;False;False;t3_ax761q;15;False;/r/indesign/comments/ax761q/please_help_me_why_my_files_end_up_like_this/;10;;False;Please help me, why my files end up like this after printing?;https://i.redd.it/cwwgbo76u3k21.jpg
1551718982.0;1551719355.0;ax9f01;True;False;t3_ax9f01;5;False;/r/indesign/comments/ax9f01/is_there_any_way_to_preserve_groups_from_indesign/;2;"Or perhaps you guys can suggest a better work flow for me? I often have to generate svgs and ai8 files with variable data for laser engraving; our lasers accept ai8 and svg (ideally I need a solution for both).&#x200B;So currently I use indesign to generate the variable data, export it as a pdf, and then open that in illustrator. The main issue is that indesign -> pdf does not preserve groups so I then have to manually go and regroup everything. When dealing with 1000's of objects this becomes very tedius very quickly. Lastly I have to seperate each group into its own layer because the laser software is inconsistent, sometimes it understand groups properly, sometimes it doesn't, there doesn't appear to be any rhyme or reason to this. This is easy to do with the ""build to sequence"" function in AI's layers though so no biggie.&#x200B;I have found that if I create a group in illustrator and then copy/paste it into indesign that the grouping is in fact preserved when exporting it back to a pdf. I do not know how this is handled internally in indesign. This is not a solution however as I need the variable data to also be included in the group so I'm still left with the original problem. If I could find a solution or better work flow to this it would save me so much time in the long run. I watch jobs come in that used to be 30 sets of data grow and grow and I know we're going to reach a point where it's simply not feasible to touch all of these things manually as I currently have to do.&#x200B;edit: I am on CS5 by the way. If CC would help I could upgrade, but currently I have no reason to do so.";False;Is there any way to preserve groups from indesign to illustrator?;https://www.reddit.com/r/indesign/comments/ax9f01/is_there_any_way_to_preserve_groups_from_indesign/
1551714224.0;False;ax8hlu;True;False;t3_ax8hlu;2;False;/r/indesign/comments/ax8hlu/help_rotating_pages_one_page_only/;1;I have a four page document all pages are currently at portrait, how would I change page 3 to landscape ? And leave pages 1,2,4 as portait;False;Help rotating pages (one page only);https://www.reddit.com/r/indesign/comments/ax8hlu/help_rotating_pages_one_page_only/
1551557516.0;False;awls0q;True;False;t3_awls0q;10;False;/r/indesign/comments/awls0q/rearranged_layout_all_pages_are_a_now_instead_of/;1;"As you can see everything is now an A page. How can I fix this?&#x200B;[https://imgur.com/a/J5ZhX9i](https://imgur.com/a/J5ZhX9i)&#x200B;Thanks :)";False;"Re-arranged Layout, all pages are ""A"" now instead of ""A"" & ""B"" which is messing up the master. How do I set ""B"" pages back?";https://www.reddit.com/r/indesign/comments/awls0q/rearranged_layout_all_pages_are_a_now_instead_of/
1551477043.0;False;awa727;False;False;t3_awa727;6;False;/r/indesign/comments/awa727/help_how_do_i_pull_that_damn_blue_column_down/;4;;False;HELP: How do I pull that damn blue column down???;https://i.redd.it/yg93gv98wkj21.png
1551469322.0;1552395046.0;aw8u0m;True;False;t3_aw8u0m;6;False;/r/indesign/comments/aw8u0m/master_page_text_box_help/;1;"I am working on converting a .docx file into an InDesign file and am having a little trouble with the text box on the master pages.I created a little graphic at the bottom that will interfere with the text when I place it on the .indd document. I tried setting up a text box on the master pages that will allow me to set the parameters of the text box. I got it where i want it, but when I place the text (shift+click), it only shows up on the right (odd) page. The left (even) page is left blank. How can I fix it so the text will appear on both pages?You will notice there is text on the left pages 1-6. That is because I placed them individually and not using the shift+click flow method.Thanks all! &#x200B;https://i.redd.it/y5yzzrpf9kj21.pnghttps://i.redd.it/hwwm2tpf9kj21.png";False;Master Page text box help;https://www.reddit.com/r/indesign/comments/aw8u0m/master_page_text_box_help/
1551450991.0;False;aw5lkp;True;False;t3_aw5lkp;4;False;/r/indesign/comments/aw5lkp/eyedropper_not_sampling_text_attributes_correctly/;2;Sampling text isn't working for me at the moment.  I'll sample a headline treatment and the text becomes a stroked mess, instead of what I intended.  Any ideas?Using character/paragraph styles as a workaround, but it's not a quick process.;False;Eyedropper not sampling text attributes correctly? CC 2019;https://www.reddit.com/r/indesign/comments/aw5lkp/eyedropper_not_sampling_text_attributes_correctly/
1551428262.0;False;aw2fh9;True;False;t3_aw2fh9;11;False;/r/indesign/comments/aw2fh9/can_strokes_be_assigned_per_side/;3;I have two text boxes meeting in the middle of my page, but I don't want the stroke on the edge where they meet. Is there a way to turn it off? Or alternatively, is there a way to put a text box inside another text box so that the outside box has a stroke but then the inner ones don't?https://i.redd.it/tu9upq13vgj21.png;False;Can strokes be assigned per side?;https://www.reddit.com/r/indesign/comments/aw2fh9/can_strokes_be_assigned_per_side/
1551426535.0;False;aw28gb;True;False;t3_aw28gb;6;False;/r/indesign/comments/aw28gb/scaling_logos_across_different_documents/;2;Hi, I'm going to try and articulate this the best I can. Is there any innate way to scale an image or a logo across different projects on InDesign?Let's say we're working on a poster with the dimensions 100x100 and the logo in that poster is 40x40. If I create a new document that is now 150x150, is there a way to get the logo to be the same scale as the last documents without manually calculating it?It's just when you start working with weird dimensions like 573x276 and your logo is 156x247 it becomes very difficult to manually calcuate the size difference? Or am I doing this completely wrong? Any help would be greatly appreciated. ;False;Scaling logos across different documents;https://www.reddit.com/r/indesign/comments/aw28gb/scaling_logos_across_different_documents/
1551398700.0;False;avxztt;True;False;t3_avxztt;2;False;/r/indesign/comments/avxztt/help_cannot_select_more_than_2_objects_in_a_group/;0;"Hi all, I'm currently having a problem as written in the title. Everytime I select the third object (also in the same group with the other 2), it will select the whole group instead. It's been annoying me since months...  Oh I'm using InDesign CC 2015 btw&#x200B;Thanks in advance!";False;[HELP] Cannot select more than 2 objects in a group;https://www.reddit.com/r/indesign/comments/avxztt/help_cannot_select_more_than_2_objects_in_a_group/
1551386710.0;1551386952.0;avvyjr;True;False;t3_avvyjr;11;False;/r/indesign/comments/avvyjr/can_anyone_help_me_figure_out_how_to_make_funky/;0;"Using the latest Indesign CC (14.0.1 ?) on the Mac,  I am trying to make a TOC as pictured in the attached image. I can't figure it out. Any thoughts?&#x200B;The keys are I want to right align the page numbers in one column, then left align the titles in a subsequent column. I don't care about the rest of the features.https://i.redd.it/q15791degdj21.jpg&#x200B;";False;Can anyone help me figure out how to make funky tabs in Table of Contents;https://www.reddit.com/r/indesign/comments/avvyjr/can_anyone_help_me_figure_out_how_to_make_funky/
1551370834.0;False;avsx5k;True;False;t3_avsx5k;8;False;/r/indesign/comments/avsx5k/auto_filling_color_why/;2;I have my fill set to none, but every time I make a shape or line it fills with black.;False;Auto filling color, why?;https://www.reddit.com/r/indesign/comments/avsx5k/auto_filling_color_why/
1551344931.0;False;avp1n9;True;False;t3_avp1n9;5;False;/r/indesign/comments/avp1n9/a_specialised_data_merge_question/;3;"I've used inDesign for years, and used the data merge to pull in not just photos, but associated texts with the photos. I'm trying to do something that may not be possible, but I'll ask anyway. I've created a double page spread with odd shaped picture frames. They are in a grid, but not a regular grid (as in they are not in a column / row setup). I want to do the equivalent of a data merge to pull in over 400 photos and also text, but populate my own created grid. I've tried the scripts folder, but nothing works. &#x200B;Anyone ever tried something like this and succeeded? ";False;A specialised data merge question;https://www.reddit.com/r/indesign/comments/avp1n9/a_specialised_data_merge_question/
1551321673.0;False;avlv73;True;False;t3_avlv73;10;False;/r/indesign/comments/avlv73/resume_creation/;2;"I recently finished redesigning my resume using InDesign, and would like to know your thoughts/recommendations/critiques. Thank you in advance!&#x200B;https://i.redd.it/mg3q6z7p18j21.png";False;Resume Creation;https://www.reddit.com/r/indesign/comments/avlv73/resume_creation/
1551313381.0;False;avkk8j;True;False;t3_avkk8j;3;False;/r/indesign/comments/avkk8j/looking_for_inspiration/;1;"Good evening, all. Let me apologize in advance for the noob question. I work for a small nonprofit and I'm about to start a design for our quarterly publication. I am looking for inspiration. Do you know any online places I can go to find really great magazine design examples? &#x200B;Thanks! ";False;Looking for inspiration;https://www.reddit.com/r/indesign/comments/avkk8j/looking_for_inspiration/
1551305259.0;1551491700.0;avj461;True;False;t3_avj461;8;False;/r/indesign/comments/avj461/import_failed_when_placing_images/;1;"Hi guys. This week InDesign has started giving me an error message when I try to place certain image files (this has happened with .tif and .jpg files so far). It'll place some images just fine, but when it won't it only gives me this error message: https://i.redd.it/nylc13lrl6j21.pngwhich doesn't really help. I'm using InDesign CC 2019 on Windows 7. Sometimes it'll let me copy and paste from another InDesign file that already has the image. I tried it today and it seemed to work, but when I exported to a PDF the pasted image was just a gray rectangle frame. I've tried selecting show import options, but even that dialog box won't show up for some files, it'll just give me the ""import failed"" message.I suspect that it's because the files I'm trying to place are old (like, circa Y2K) but I'm not sure of that. I don't know why it's just started happening now, no updates right before this started or anything. Has anyone had anything like this happen before? If not, any ideas on how I could figure out what's causing it?UPDATE: turns out it's a problem with the server backups, not with InDesign. A whole bunch of files got corrupted for reasons unknown. So problem not really solved, but at least explained.";False;"""Import failed"" when placing images";https://www.reddit.com/r/indesign/comments/avj461/import_failed_when_placing_images/
1551304078.0;False;aviwda;True;False;t3_aviwda;3;False;/r/indesign/comments/aviwda/paste_in_place_isnt_pasting_my_snippet_in_the/;1;I created a group (a couple text boxes and a pic) for page footers, then I created a snippet of this group so that I can paste them in place at the bottom of pages.I create a new page, then ctrl+D to place the snippet, ID then loads the footer onto my cursor, I right click then choose to paste it in place. Shouldn't this then paste that snippet in the exact place where it was when it was created?What's happening for me is that after clicking paste in place, ID only pastes the image from the snippet. The image is pasted in the correct place, but none of the footer text (which it's grouped with) appears. Furthermore, the cursor stays loaded with the snippet I'm attempting to place. Any idea why this is happening? ;False;Paste in place isn't pasting my snippet in the correct place, also it isn't pasting the whole snippet, only part of it.;https://www.reddit.com/r/indesign/comments/aviwda/paste_in_place_isnt_pasting_my_snippet_in_the/
1551278827.0;False;ave8fz;True;False;t3_ave8fz;8;False;/r/indesign/comments/ave8fz/change_default_settings_for_rectangles/;2;Whenever I draw a solid rectangle, it always defaults to the same thing- a shape with a dotted outline and no fill. I always have to remove the outline and add a fill each time and it's pretty annoying. I want it to by default draw a solid black filled rectangle with no outline, is that possible?;False;Change default settings for rectangles;https://www.reddit.com/r/indesign/comments/ave8fz/change_default_settings_for_rectangles/
1551278743.0;False;ave7xt;True;False;t3_ave7xt;4;False;/r/indesign/comments/ave7xt/cant_seem_to_figure_out_why_verso_headline_is_so/;2;I'm using a template supplied to me, and for some reason the chapter titles that repeat in the headlines appear condensed, but only on the recto pages. I'm new to InDesign, and can't seem to figure out how to adjust it on the master page. Any help wouldbe greatly appreciated.;False;Can't seem to figure out why verso headline is so squashed...;https://www.reddit.com/r/indesign/comments/ave7xt/cant_seem_to_figure_out_why_verso_headline_is_so/
1551280119.0;False;avegh2;False;False;t3_avegh2;1;False;/r/indesign/comments/avegh2/recto_headlines_appearing_condensed_any_ideas/;1;;False;Recto headlines appearing condensed - any ideas?;https://i.redd.it/0q5m8h1qm4j21.jpg
1551307172.0;False;avjgoo;True;False;t3_avjgoo;4;False;/r/indesign/comments/avjgoo/can_anybody_take_my_indesign_test/;0;It's an easy ass 40 question test and all i want is a fucking B I'm going thru a rough depressing patch of my life and this grade is fucking killing me. I don't wanna even be in the class. So if you feel bad for a 16 year old at crossroads in his life just hmu.;False;Can anybody take my indesign test?;https://www.reddit.com/r/indesign/comments/avjgoo/can_anybody_take_my_indesign_test/
1551238672.0;False;av8nvd;True;False;t3_av8nvd;8;False;/r/indesign/comments/av8nvd/set_up_bifold_flyer_for_print_and_pdf/;3;Hi guys,I'm making a flyer which will be printed on A3 (double sided) and folded to A4 portrait. So four pages of content.I will need to export the file as A3 PDF as 2 pages which will print double sided on one piece of A3 and folded in half. I know I could set this up in InD as two A3 sized pages, with pages 4 and 1 on the first page, and 2 and 3 on the second.However I want to be able to export the document as a PDF for emailing, which will be the four single A4 pages in 1,2,3,4 order.What's the best way to set up my file so I can achieve these two things? Is it possible to do this without creating a 'print' file and a 'digital' file? I've been playing around with facing pages etc, can't get it right! Many thanks;False;Set up bifold flyer for print and PDF;https://www.reddit.com/r/indesign/comments/av8nvd/set_up_bifold_flyer_for_print_and_pdf/
1551240503.0;False;av8yl9;False;False;t3_av8yl9;7;False;/r/indesign/comments/av8yl9/does_indesign_have_a_solution_to_this_problem/;1;;False;Does InDesign have a solution to this problem?;https://www.reddit.com/r/creativecloud/comments/av7rc0/does_adobe_have_a_solution_to_this_problem/
1551204692.0;False;av2jgb;False;False;t3_av2jgb;12;False;/r/indesign/comments/av2jgb/white_objects_keep_printing_with_phantom_edges/;6;;False;White objects keep printing with phantom edges. These don’t show up in InDesign, just when I export or print my page. Anyone else had this problem?;https://i.redd.it/o2fapx1geyi21.jpg
1551216402.0;False;av4t2m;True;False;t3_av4t2m;3;False;/r/indesign/comments/av4t2m/tiff_linked_file_is_possessed/;2;Issue is a black & white TIFF linked image. NB: There are 24 different TIFFs, all are having same issue. Original Artwork from different company.I opened TIFF in 'shop and do a small edit. Update link, but it still shows pre-edit image. Triple check that it's the right file, open in 'shop, Mac preview and file thumbnail all show new edited version. Delete TIFF in InD, place back, nope still showing old version.Place TIFF into unrelated InD document and it's showing the new edited version. Copy/paste that link into original InD file, it STAYS as the new edited version. Repeat, but now it shows OLD version. Third time, new version. ?!?'Save As' on InD (which makes new file and clears image cache). Close, reopen. Update link, still showing old version. Delete, re-place, still old version.Now have original InD file with 2 instances of the SAME TIFF, one showing updated TIFF, one the old TIFF.Conclusion: TIFF file is possessed. Help. ;False;TIFF linked file is possessed!;https://www.reddit.com/r/indesign/comments/av4t2m/tiff_linked_file_is_possessed/
1551206048.0;False;av2su2;True;False;t3_av2su2;0;False;/r/indesign/comments/av2su2/is_it_possible_to_link_a_button_to_a_certain_time/;2;I'm creating an interactive PDF and i'd like to link to the same video (starting at different times) with different buttons. Is this possible?Also, a quick google search has told me that I cannot preview GIFs with buttons, only link them. Don't suppose anyone has found a workaround to this?Thanks.;False;Is it possible to link a button to a certain time of video?;https://www.reddit.com/r/indesign/comments/av2su2/is_it_possible_to_link_a_button_to_a_certain_time/
1551187767.0;1551195573.0;auzguf;True;False;t3_auzguf;24;False;/r/indesign/comments/auzguf/booklet_issue_center_pages_blank/;3;"Hoping someone has solved this problem before.  I have a 16-page Indesign doc that I am trying to print as a booklet.  Everything looks great, except the center pages (page 5 & 6) are converting to blanks.  (They have full page content on them.)  Any ideas for me?[https://drive.google.com/file/d/1bDuQt0\_h9js9rwbqDv9gt3kAP31IvIsA/view?usp=sharing](https://drive.google.com/file/d/1bDuQt0_h9js9rwbqDv9gt3kAP31IvIsA/view?usp=sharing)&#x200B;Edited:  Screenshot showing pages 5 & 6.https://i.redd.it/872z0x1l1xi21.jpgEdit 2:  I tried converting just pages 5-6 to a booklet.  They converted okay (but on opposite sides of the page).  Tried converting pages 4-7 to a booklet and pages 5&6 are blank again.  Grrr!!!  I'm even open to a work-around at this point (although I would love to figure out the root cause).Edit 3:  When I preview the booklet during the File | Print Booklet process, it shows Pages 5 & 6 correctly.https://i.redd.it/ug4yb8fhgxi21.jpgEdit 4:  Workaround that worked. Thanks intelligentfail!   I printed as single pages, then opened the file in Adobe Acrobat. I then used the Adobe Acrobat function to print as a booklet. I had never used that function before, but OMG! SO MUCH EASIER!  So, from now on, F\*CK Adobe InDesign's Print Booklet function.  I'll use Adobe Acrobat's fuction instead from here on out.";False;Booklet issue -- center pages blank;https://www.reddit.com/r/indesign/comments/auzguf/booklet_issue_center_pages_blank/
1551202495.0;False;av23xr;False;False;t3_av23xr;2;False;/r/indesign/comments/av23xr/could_someone_help_me_with_this_asap_please_and/;1;;False;Could someone help me with this ASAP? Please and thanks.;https://i.redd.it/3cfakvqw7yi21.jpg
1551198971.0;False;av1evw;False;False;t3_av1evw;6;False;/r/indesign/comments/av1evw/how_do_i_recreate_this_pattern_in_indesign_or_is/;1;;False;How do I recreate this pattern in Indesign? Or is there some way to use the same swatch in indesign?;https://i.redd.it/ep5gqkifxxi21.jpg
1551120299.0;False;auoo5g;False;False;t3_auoo5g;16;False;/r/indesign/comments/auoo5g/theres_this_odd_blank_space_in_the_page_im_making/;3;;False;There's this odd blank space in the page I'm making. It's not a text issue and sticks around no matter what I try. Any ideas where I can find a solution?;https://i.redd.it/4ckqc7vafri21.jpg
