created_utc;edited;id;is_self;locked;name;num_comments;over_18;permalink;score;selftext;spoiler;title;url
1553421976.0;False;b4url8;True;False;t3_b4url8;8;False;/r/indesign/comments/b4url8/setting_for_bilingual_printing_reverse_and/;3;"Hello, I am currently working on a publication where I produced two separate InDesign documents already - one for English and one for Chinese.  I wanted to create an InDesign file for printing, where the English version and Chinese version are combined together to form one booklet, where the Chinese version is printed from the reverse side, and inverted so they flip like normal book.  So imagine if you pick up a book, it looks like whatever language you chanced upon, then you can flip over the book, and inverted it to read it from that side in the other language.&#x200B;Is there a way to achieve this in InDesign? Or is this a common practice in publishing industry where InDesign has a preset/function/setting like this in-built?";False;Setting for Bilingual Printing (reverse and inverted for two languages);https://www.reddit.com/r/indesign/comments/b4url8/setting_for_bilingual_printing_reverse_and/
1553440645.0;False;b4xffo;True;False;t3_b4xffo;1;False;/r/indesign/comments/b4xffo/cant_change_findchangelisttxt_because_its_locked/;1;I'm trying to edit the FindChangeList.txt to add some script so that I can change tagged text from placed word docs.All the tutorials I find casually talk about changing the .txt file (after creating a duplicate as a backup of course) but they don't seem to have the problem of the file being locked. Has anyone ever encountered this, and have any ideas how to get around it?;False;Can't change FindChangeList.txt because it's locked - anyone got the key??;https://www.reddit.com/r/indesign/comments/b4xffo/cant_change_findchangelisttxt_because_its_locked/
1553351130.0;False;b4jpp6;True;False;t3_b4jpp6;6;False;/r/indesign/comments/b4jpp6/template_has_rectangles_that_invert_when_they/;3;Very very new to inDesign, so bear with me.  I'm using a template where every time I create two shapes with fill, instead of one just sitting over the other, the colors become inverted wherever they intersect.  Even if I create two shapes of the same color, the intersecting part turns a lighter shade.I tried it in a regular document and everything works as expected, so is there some project setting or artboard attribute I need to change?  They're on the same layer, and arranging to send backwards or forwards doesn't seem to do anything.Can anybody help?;False;template has rectangles that invert when they overlap each other - how do I turn that off?;https://www.reddit.com/r/indesign/comments/b4jpp6/template_has_rectangles_that_invert_when_they/
1553323318.0;False;b4g1r0;True;False;t3_b4g1r0;2;False;/r/indesign/comments/b4g1r0/collaboration_but_with_limited_access_to_assets/;3;I would like to share a project file I am working on with others, but I don't want to share all the font settings and paragraph styles that I have used, only some. Is there a way to 'turn off ' or 'hide' certain settings/fonts/etc when you share an indesign file?;False;Collaboration but with limited access to assets;https://www.reddit.com/r/indesign/comments/b4g1r0/collaboration_but_with_limited_access_to_assets/
1553294294.0;False;b4biux;True;False;t3_b4biux;2;False;/r/indesign/comments/b4biux/failed_to_export_pdf/;3;I'm creating an interactive PDF and I've narrowed the issue down to some HD video I'm trying to have play on one of the pages. If the videos I have are hidden, I am able to export. If even one of the videos is visible, i get the failed to create error. The video has been scaled down, which Adobe has stated can be an issue with images scaled down creating an image with too high of a resolution.  [https://helpx.adobe.com/indesign/kb/failed-export-pdf-downsample-large.html](https://helpx.adobe.com/indesign/kb/failed-export-pdf-downsample-large.html) Has anyone come across this issue before? I've watched videos of people creating spreads with video in a frame that must have been scaled down without issues...Thanks in advance.;False;Failed to export PDF;https://www.reddit.com/r/indesign/comments/b4biux/failed_to_export_pdf/
1553272812.0;False;b479qa;True;False;t3_b479qa;6;False;/r/indesign/comments/b479qa/best_practices_for_images_and_copy/;3;I'm currently working on a multi-chapter guide book.  Should I keep my copy in a separate text-editor file or just have it in InDesign?  If I use a text-editor file, should I keep it linked?I have MANY pictures.  What is the best may to organize and manage all of the image assets?  Folders for different chapters?  Numbered naming scheme?  The problem is that, while the images will stay in their respective chapters, the order is likely to change around a lot and if I numbered them in the file names I would need to re-name them every time.  What other methods have you found work well?;False;Best practices for images and copy?;https://www.reddit.com/r/indesign/comments/b479qa/best_practices_for_images_and_copy/
1553254995.0;False;b4427z;True;False;t3_b4427z;0;False;/r/indesign/comments/b4427z/proposal_with_dynamic_content/;1;I'm looking at creating a dynamic multi-page proposal template that has a variety of dynamic content (text fields on different pages, a few different tables, dynamic images etc...) Any suggestions on how to import this content? I was reading about using datamerge but I suspect the 1 source cvs per target document wouldn't work well with multiple types of content that I need to pull in. Should I be looking at a different approach? Thanks.;False;Proposal with dynamic content?;https://www.reddit.com/r/indesign/comments/b4427z/proposal_with_dynamic_content/
1553231736.0;False;b4118t;True;False;t3_b4118t;5;False;/r/indesign/comments/b4118t/matching_cmyk_colors_with_hex_numbers/;3;I'm designing a magazine for a client that only provided me with hex numbers for their brand colors, and I'm aware that that they'll translate differently in a CMYK document, so should I enter the hex codes into Indesign as they were given to me, or should I ask the client for a specific CMYK color palette?;False;Matching CMYK colors with Hex numbers;https://www.reddit.com/r/indesign/comments/b4118t/matching_cmyk_colors_with_hex_numbers/
1553223971.0;False;b3zvti;True;False;t3_b3zvti;3;False;/r/indesign/comments/b3zvti/no_links_missing_but_photos_still_blurry_after/;1;I have to work on InDesign for my school project. I have the newest version downloaded on my home computer but then the Macs at my school have a previous version. Transferring my documents to the Mac has no issue once I've added the links but opening it back up on my PC causes the file to get stuck on converting at 80%. It says there are no links missing but the font and pictures are still blurry. I've changed the display performance to high quality but that hasn't helped it. ;False;No links missing but photos still blurry after opening my file on another computer;https://www.reddit.com/r/indesign/comments/b3zvti/no_links_missing_but_photos_still_blurry_after/
1553185762.0;False;b3sm9p;True;False;t3_b3sm9p;3;False;/r/indesign/comments/b3sm9p/page_order_on_a_booklet_help/;3;I found on this sub someone having the exact same problem as me. Only thing thats different is that exporting as a spread may not be doing what I want it to be doing. I want to export as spread so I can staple all 1-22 pages together and it reads as a book. But when I hit export as spread it doesnt re order the pages as 1,22 and 2, 21 and so on. Also my front page and by back page refuse to get into a spread with other pages. I am in InDesign CC 2019.;False;Page order on a booklet. Help!;https://www.reddit.com/r/indesign/comments/b3sm9p/page_order_on_a_booklet_help/
1553181522.0;False;b3rr0x;True;False;t3_b3rr0x;5;False;/r/indesign/comments/b3rr0x/bleed_without_bleed_marks/;3;"Hello! For specific purposes I need to export my files with bleed but without bleed marks. With extra mms, without lines.&#x200B;That way the PDF will be bigger than the document itself (let's say, A3 + bleed) but without any crop marks whatsoever.&#x200B;Is that possible with indesign?";False;Bleed without bleed marks;https://www.reddit.com/r/indesign/comments/b3rr0x/bleed_without_bleed_marks/
1553139507.0;False;b3lrhr;True;False;t3_b3lrhr;7;False;/r/indesign/comments/b3lrhr/how_to_pack_a_project_with_rasterize_version_of/;2;"...to be added to the package of all the indesign project.Hi! I searched and saw posts of 2010 asking this kind of stuff and not being solved.There is a high chance I need to deliver an indesign project for editing. All my images are linked illustrator files, pointing to artworks inside those files. I am using 1 file of illustrators to link several images. I dont want to also deliver my illustrator files, just the indesign project, and I was thinking that maybe there is an option for rasterizing and linking those rasterize images automatically when packing the project. Is there an option available like that right now? Or am I screwed and will need to export all my artworks and then manually relink them? I really dont want to send my editing files of my illustrations. Im working with many pages.&#x200B;Thanks in advance,";False;how to pack a project with rasterize version of the images linked? avoiding my illustrator files;https://www.reddit.com/r/indesign/comments/b3lrhr/how_to_pack_a_project_with_rasterize_version_of/
1553079493.0;False;b3alfx;False;False;t3_b3alfx;0;False;/r/indesign/comments/b3alfx/free_indesign_essentials_course/;16;;False;Free InDesign Essentials Course;https://www.youtube.com/watch?v=jVgG8IPnPPA&list=PLttcEXjN1UcHN3f3jGukxgPfkVARZaGCI
1553113998.0;False;b3h1nl;True;False;t3_b3h1nl;1;False;/r/indesign/comments/b3h1nl/is_there_a_way_to_only_include_certain_pages_from/;2;I'm making a book composed of about 20 other InDesign documents that each have their own title page and table of contents.  I'd like to include all of these documents into the book, but without their title pages and TOCs.  Is there a way to do this?;False;Is there a way to only include certain pages from a document into an InDesign Book?;https://www.reddit.com/r/indesign/comments/b3h1nl/is_there_a_way_to_only_include_certain_pages_from/
1553094594.0;False;b3d5n3;True;False;t3_b3d5n3;14;False;/r/indesign/comments/b3d5n3/ive_googled_but_still_struggle_how_do_you/;5;I have a document I intend to print to the size of 11x17. Since my screen isn't that big, it's hard for me to tell how it will print. On the info pane I can see the images as 300 dpi, but I've. Been stretching and resizing images. How will I know if  I've resized an image in such a way that it will pixellate when I go to print? Thanks in advance for any help given!;False;I've Googled but still struggle: How do you determine whether the images you see on screen will pixellate when printed?;https://www.reddit.com/r/indesign/comments/b3d5n3/ive_googled_but_still_struggle_how_do_you/
1553069749.0;False;b39dwo;True;False;t3_b39dwo;3;False;/r/indesign/comments/b39dwo/turn_off_ligature_on_only_one_letter_combination/;1;I'm currently using a typeface for a brand project at the moment which has an odd ff ligature. Is there anyway to disable that one particular ligature while leaving the others intact?;False;Turn off ligature on only one letter combination;https://www.reddit.com/r/indesign/comments/b39dwo/turn_off_ligature_on_only_one_letter_combination/
1553033009.0;False;b33krq;False;False;t3_b33krq;4;False;/r/indesign/comments/b33krq/having_a_strange_issue_with_idcc_2019_open_recent/;6;;False;Having a strange issue with IDCC 2019 ‘Open Recent’ opening everything but the file I am trying to open.;https://v.redd.it/wm3pgcrje5n21
1553043661.0;False;b35kl6;True;False;t3_b35kl6;1;False;/r/indesign/comments/b35kl6/how_to_make_pdfs_self_destruct/;3;Any simple (script) solutions so I can batch process multiple password-protected pdfs to self destruct after X days? https://answers.acrobatusers.com/how-create-destruct-pdf-q56856.aspxhttps://www.quora.com/Is-there-a-way-to-make-a-PDF-or-other-document-self-destruct-or-self-password-protect-after-a-certain-amount-of-time;False;How to Make Pdfs Self Destruct?;https://www.reddit.com/r/indesign/comments/b35kl6/how_to_make_pdfs_self_destruct/
1553027569.0;False;b32hhv;True;False;t3_b32hhv;8;False;/r/indesign/comments/b32hhv/how_to_put_a_simple_vector_graphic_into_my/;1;I made a few simple vector icon images in Illustrator for a document I'm working on in InDesign.  The icons are a triangle with rounded corners with an exclamation mark inside and a circle with an lower-case i inside.  However, I can't figure out how to get them into InDesign from Illustrator. I've tried saving as an .svg and then placing that file, but that puts in a bunch of HTML text.  Even if no text frame is selected it will just create one and populate it with HTML.I've tried copy and paste but that only partly works.  The outline shape pastes over, but the text shows up as an off-center, broken text box.I've also tried placing the .ai file, but that generates lots and lots of extra white space around the icon. Any ideas of how I can get this to work?;False;How to put a simple vector graphic into my InDesign document?;https://www.reddit.com/r/indesign/comments/b32hhv/how_to_put_a_simple_vector_graphic_into_my/
1552973284.0;False;b2tedr;True;False;t3_b2tedr;11;False;/r/indesign/comments/b2tedr/issues_with_transparency_on_printing_pdfs/;3;In my documents, I place a PSD file that has transparency (also RGB), into a poster / booklet, that's exported into a PDF, then printed.It looks completely fine on screen, but when it's printed, there is a faint transparent white colour to the images' bounding box. I've attached an image  that shows this (with green lines to guide, you'll probably need to zoom in to see it properly). This happens over different printers.Has anyone had this type of issue before? Is it a setting I'm not adjusting? Have I not given enough to the InDesign gods?Please help!https://i.redd.it/lx50nc5ch0n21.jpg;False;Issues with transparency on printing PDFs;https://www.reddit.com/r/indesign/comments/b2tedr/issues_with_transparency_on_printing_pdfs/
1552977845.0;False;b2u10k;True;False;t3_b2u10k;1;False;/r/indesign/comments/b2u10k/is_there_a_way_to_convert_master_page_numbers_to/;2;Hi /r/inDesign.I have an A and B master page for the left and right pages respectively. On these master pages I have a text box with a text marker for the current page number. When the time comes to convert all text to curves for print, is there a way to curve the page numbers which are on the master pages? I can't seem to figure out a way to do this.If anyone knows if this is possible, please let me knowThanks!;False;Is there a way to convert master page numbers to outlines?;https://www.reddit.com/r/indesign/comments/b2u10k/is_there_a_way_to_convert_master_page_numbers_to/
1552975535.0;False;b2tplz;True;False;t3_b2tplz;2;False;/r/indesign/comments/b2tplz/how_to_export_a_36page_idd_into_separate_jpeg/;2;pls help! thank u in advance;False;How to export a 36-page IDD into separate JPEG files?;https://www.reddit.com/r/indesign/comments/b2tplz/how_to_export_a_36page_idd_into_separate_jpeg/
1552936761.0;False;b2mtgb;True;False;t3_b2mtgb;8;False;/r/indesign/comments/b2mtgb/what_does_11110_leading_mean/;2;Working with someone’s brand guidelines and they are describing their body text with 1.1/100% leading.I can’t imagine this is a typo, cause they also describe another body of text as 1.2/120% leading.First time seeing a description like this.;False;What does 1.1/110% Leading mean?;https://www.reddit.com/r/indesign/comments/b2mtgb/what_does_11110_leading_mean/
1552918703.0;False;b2j9eu;True;False;t3_b2j9eu;13;False;/r/indesign/comments/b2j9eu/what_is_the_most_correct_way_to_format_regular/;4;"I'm working on a rules booklet for a game, in which I have several recurring elements resembling the following:**Name**: [Critter name], **Type**: [Critter type]  **Power**: [Critter power]  **Rules**: [Special rules for critter]  *flavor text*In an ideal world, I'd like some kind of template I could easily insert and just modify the various specific elements; failing that, I'd like a paragraph where I can interweave bolding or italicizing specific parts of the text without flagging them as customized.What is the best way to do this?Thanks!";False;What is the most correct way to format regular text blocks with mixed fonts or weights?;https://www.reddit.com/r/indesign/comments/b2j9eu/what_is_the_most_correct_way_to_format_regular/
1552933525.0;False;b2m6d8;True;False;t3_b2m6d8;3;False;/r/indesign/comments/b2m6d8/google_font_indesign/;1;Hi all, what is the best way to synch google font directly to ID? I have extensis suitcase fusion but it appears my version no longer works in ID as a plug-in. Before I upgrade my suitcase fusion, I want to ask if you have other recommendations?I use a lot of Adobe Fonts and Google Fonts for my work. iOS;False;Google Font & InDesign;https://www.reddit.com/r/indesign/comments/b2m6d8/google_font_indesign/
1552895801.0;False;b2fvrn;True;False;t3_b2fvrn;0;False;/r/indesign/comments/b2fvrn/xml_attributes_into_text/;2;I'm new to InDesign and I have a book that I imported as an XML file. It has chapters and verses, with the chapter/verse numbers as attributes. How can I bring these into the main body of the test?;False;XML attributes into text;https://www.reddit.com/r/indesign/comments/b2fvrn/xml_attributes_into_text/
1552863212.0;False;b2b5ri;True;False;t3_b2b5ri;15;False;/r/indesign/comments/b2b5ri/any_way_to_untrace_text_once_it_has_been_traced/;1;;False;Any way to un-trace text once it has been traced?;https://www.reddit.com/r/indesign/comments/b2b5ri/any_way_to_untrace_text_once_it_has_been_traced/
1552857354.0;False;b2a4ah;True;False;t3_b2a4ah;19;False;/r/indesign/comments/b2a4ah/export_multiple_pdfs/;1;Hi everyone. Is it possible to export multiple PDF's in one export.For example, I have 7 pages and I want to export page 1,7 2,7 3,7 4,7 ,5,7, 6,7. Do I need to export 6 files or is there a way to export ones and for all? Thanks in advance..;False;Export Multiple PDF's;https://www.reddit.com/r/indesign/comments/b2a4ah/export_multiple_pdfs/
1552698034.0;False;b1mo6o;True;False;t3_b1mo6o;7;False;/r/indesign/comments/b1mo6o/if_i_update_styling_and_layout_in_a_template_that/;1;Basically it's all in the title  ↑ .  If this doesn't happen, is there a way to get this behavior?;False;If I update styling and layout in a template that I've used to create several documents will the documents that use the template also update?;https://www.reddit.com/r/indesign/comments/b1mo6o/if_i_update_styling_and_layout_in_a_template_that/
1552665703.0;False;b1gndi;True;False;t3_b1gndi;4;False;/r/indesign/comments/b1gndi/collaboration_over_cloud_drive_lock_files_not/;3;We have a few people that work on the same InDesign files from time to time.  We recently moved to cloud storage (Business OneDrive), and the lock files don't appear to do anything.  When we used a server, if a person had a file open, it would warn anyone else that the file was already open, but now it doesn't do anything.  Does anyone have any experience with InDesign collabs on a cloud drive, or have a workaround for this?;False;Collaboration over cloud drive, lock files not working?;https://www.reddit.com/r/indesign/comments/b1gndi/collaboration_over_cloud_drive_lock_files_not/
1552671187.0;False;b1hq6p;True;False;t3_b1hq6p;2;False;/r/indesign/comments/b1hq6p/text_in_a_text_frame_will_not_justify_vertically/;2;I have a text frame with an anchored object in it and I want to vertically justify the text in that frame. However, the anchored object prevents me from vertically justifying the text. If I remove the anchored object, the text justifies vertically just fine. Additionally, when I remove the anchored object, justify the text, then try to replace the anchored object, then, when I try to move the anchored object it undoes all of the justification.Is there a way to vertically justify text in a text box if it contains an anchored object?;False;Text in a text frame will not justify vertically if there is an anchored object in that frame, is there a way around this?;https://www.reddit.com/r/indesign/comments/b1hq6p/text_in_a_text_frame_will_not_justify_vertically/
1552665513.0;False;b1gm0v;True;False;t3_b1gm0v;6;False;/r/indesign/comments/b1gm0v/index_across_book_documents/;2;"Working on a big Spec catalogue for a company, it's 212 pages, I've separated out the sections to compile as a book (so many images would kill the MAC if 1 document)&#x200B;Problem is Indexing... I can index each section, but some products run over... Emergency and Hospitality range share products,, I can't find any trace of how to Index across multiple sections of a book..&#x200B;Do I have to Index each section then manually merge them at the end? This is going to be a nightmare to Index the product codes especially";False;Index across book documents?;https://www.reddit.com/r/indesign/comments/b1gm0v/index_across_book_documents/
1552615653.0;False;b193yw;True;False;t3_b193yw;16;False;/r/indesign/comments/b193yw/can_someone_help_me_set_up_my_page/;2;"I'm a bit new to InDesign and have been requested by my supervisor to create an ad using these specifications: ""Your ad is a full page:Non-bleed: 7 x 10Trim: 7.5 x 10.5Bleed: Please remember to add 0.125 to all sides for bleed making it 7.75 x 10.75 Digital guidelines you will need to follow:All images and graphics should be in CMYK color mode.PDF’s need to be saved/exported as PDF/X-1a.""Could someone explain to me how to set this up?";False;Can someone help me set up my Page?;https://www.reddit.com/r/indesign/comments/b193yw/can_someone_help_me_set_up_my_page/
1552586618.0;1552618118.0;b13ko1;True;False;t3_b13ko1;9;False;/r/indesign/comments/b13ko1/suggestions_for_mock_assignments_to_hone_my_skills/;8;So I'm looking to practice and build upon my InDesign skills. I'm still new to it but I already have a strong grasp of Photoshop and Illustrator. Are there resources online to build mock assignments from? Can anyone recommend strategies for creating a fictional project to help build and practice within InDesign? The mock assignment battles on r/logodesign have been a big help in practicing for logos. Didn't know if there's something comparable for creating layouts in InDesign. Thanks!EDIT: Great suggestions all around!;False;Suggestions for mock assignments to hone my skills?;https://www.reddit.com/r/indesign/comments/b13ko1/suggestions_for_mock_assignments_to_hone_my_skills/
1552621151.0;False;b19zdr;True;False;t3_b19zdr;8;False;/r/indesign/comments/b19zdr/starting_project_for_indesign/;1;I’ve been able to teach myself photoshop and illustrator using YouTube videos. I want to start figuring out indesign but I’m having trouble finding a good place to start. What’s a good starting project and how does the application differ from features already built into photoshop? ;False;Starting project for indesign?;https://www.reddit.com/r/indesign/comments/b19zdr/starting_project_for_indesign/
1552609445.0;False;b182zs;True;False;t3_b182zs;11;False;/r/indesign/comments/b182zs/photoshop_equivalent_clipping_mask/;1;Hey all.I'm definitely a noob with InDesign, but I've been trying to find a way to do pic related in InDesign: [https://imgur.com/a/V9unwnB](https://imgur.com/a/V9unwnB)In photoshop it is dead simple, I put the text in, put the picture layer over, right click and create a clipping mask and it's done.  The text is still live, I can easily move the layers around, everything is great.For the life of me I can't seem to find a simple way to do this in InDesign? It seems like the only way I can do it is convert text to vectors or basically create a stencil with a background and show something through it.Is there any easier way to do this in InDesign?? Hopefully I'm just missing something really simple?;False;Photoshop Equivalent Clipping Mask?;https://www.reddit.com/r/indesign/comments/b182zs/photoshop_equivalent_clipping_mask/
1552602551.0;False;b16t0t;True;False;t3_b16t0t;3;False;/r/indesign/comments/b16t0t/trying_to_print_a_5x7_project_need_help/;1;So I've been working in InDesign for a couple years for custom printing. I've come across a problem that I can't seem to figure out. In the past it has worked but for some reason it's not working now. I set my project to be 5x7. I've tried with margins and without. When I go to print I set my paper size to be the same. Both the input and output paper. I've even put it in as user defined.  I'm trying to make it borderless so it doesn't require any cutting. I'm working with an Epson r2000 sylus printer. Like I said in the past it has worked making everything 5x7 from the project itself and the input/output paper and checking the borderless option. Now when I set it up like that it's cutting off the top and the left side of my project when printed. I've gotten it to be close to where it needs to be but there is a white border on top. I'm trying to make some flat note cards on glossy paper but no matter what I do it cuts it off or gives a white border on one side or all the sides. It would be a huge help if anyone knows why this is happening. It's for work and we are a small time paper store that does custom printing. I'm some what know what I'm doing but sometimes these sort of things come up and I don't know why. I would greatly appreciate it. I've even searched online and could find anything that works. Please help. Thanks;False;Trying to print a 5x7 project. Need help;https://www.reddit.com/r/indesign/comments/b16t0t/trying_to_print_a_5x7_project_need_help/
