created_utc;edited;id;is_self;locked;name;num_comments;over_18;permalink;score;selftext;spoiler;title;url
1548840347.0;False;alb1b2;True;False;t3_alb1b2;2;False;/r/MicrosoftWord/comments/alb1b2/justification_weird_spacing_word_2013/;2;"I have searched high and low for a solution to this but for the life of me cannot find a fix for Word 2013. I thought it was close before but in changing settings, it reverted to a left alignment - which...doesn't work. When doing a reference page, I have tried writing these in and rewriting but once I hit justify, I get the same result &#x200B;https://i.redd.it/sdfp81to2jd21.jpgWithout condensing the text to the point it's unreadable, is there a way to fix the spacing issue so that it looks...well, professional? I have kerning for fonts turned on and have tried every solution I could find from Google. I'm assuming it's an ID10T error with the issue existing between user and keyboard but I am at a loss. Any help would be greatly appreciated! ";False;Justification & Weird spacing Word 2013;https://www.reddit.com/r/MicrosoftWord/comments/alb1b2/justification_weird_spacing_word_2013/
1548836577.0;False;alaoeo;True;False;t3_alaoeo;2;False;/r/MicrosoftWord/comments/alaoeo/is_there_an_upper_limit_to_file_size_how_about/;1;;False;is there an upper limit to file size? how about 50K words, is it too much for one file? should I split them?;https://www.reddit.com/r/MicrosoftWord/comments/alaoeo/is_there_an_upper_limit_to_file_size_how_about/
1548814971.0;False;al7vjg;False;False;t3_al7vjg;6;False;/r/MicrosoftWord/comments/al7vjg/how_do_i_fix_this_i_cant_double_space_my_essay/;2;;False;How do I fix this? I can’t double space my essay for class.;https://v.redd.it/xs71kivd0hd21
1548804150.0;False;al66xm;False;False;t3_al66xm;2;False;/r/MicrosoftWord/comments/al66xm/references_numbering_issue/;1;;False;References numbering issue;https://i.redd.it/ki3moemd4gd21.jpg
1548794042.0;False;al4dss;True;False;t3_al4dss;5;False;/r/MicrosoftWord/comments/al4dss/what_is_the_easiest_way_to_find_all_then_bold_and/;3;I go to replace all, and try to replace all with bold, but then it won't let me ALSO replace it with italics. Why can't I just find all, and bold all?? ;False;what is the easiest way to find all, then bold and italics that word?;https://www.reddit.com/r/MicrosoftWord/comments/al4dss/what_is_the_easiest_way_to_find_all_then_bold_and/
1548778420.0;False;al1jse;True;False;t3_al1jse;1;False;/r/MicrosoftWord/comments/al1jse/word_documents_tag_my_name_at_the_end_of_the_file/;1;"Hi, is there anyway to stop WORD from doing this? Taking a class that I have to submit documents to but the files have to be exactly named or it won't upload. &#x200B;Appreciate the feedback.";False;Word Documents tag my name at the end of the file?;https://www.reddit.com/r/MicrosoftWord/comments/al1jse/word_documents_tag_my_name_at_the_end_of_the_file/
1548778059.0;False;al1hj9;True;False;t3_al1hj9;4;False;/r/MicrosoftWord/comments/al1hj9/creating_bullets_horizontally_instead_of/;1;Is there a way to equally space out bullets horizontally so that I can list things from left to right?;False;Creating bullets horizontally instead of vertically;https://www.reddit.com/r/MicrosoftWord/comments/al1hj9/creating_bullets_horizontally_instead_of/
1548763353.0;False;akzch4;True;False;t3_akzch4;3;False;/r/MicrosoftWord/comments/akzch4/adjust_list_indents_equivalent_in_word_for_mac/;1;"Hello,I've tried searching for this in the forum (and online) but I can't seem to find an answer, unless my answer is just ""it's not possible"". I'm used to using Word on Windows, where it's possible to right-click on a bullet/numbered list and select 'Adjust List Indents' which allows you to set the option to 'Follow number with' a space instead of a tab. I've recently switched over to a Mac for work, and this option doesn't exist. Do you know of any workaround to place a space instead of a tab after a bullet/numbered list? I didn't expect this to be such a difficult thing to do! Unfortunately, I'm at a new company, so i can't even open up a former document where I had spaces set to see how they would be handled on the Mac.Any thoughts/help would be much appreciated. Thanks!";False;'Adjust List indents' Equivalent in Word for Mac (Office 365, Version 16.20);https://www.reddit.com/r/MicrosoftWord/comments/akzch4/adjust_list_indents_equivalent_in_word_for_mac/
1548755418.0;False;akyiqk;True;False;t3_akyiqk;6;False;/r/MicrosoftWord/comments/akyiqk/how_can_i_order_number_my_references_to/;1;"First of all I'll outline what I'm doing. I usually do all of my referencing manually and edit all of the number when I add a new reference. For my dissertation however, given that it's a bigger document, I decided to use word's auto referencing/citation function.&#x200B;I've been doing this by going into the `references tab > insert citation > add new source`  and then going to insert citation again and placing them where necessary. They don't seem to number themselves logically though and if I add one between some others it just seems to be \[1\] which is frustrating as i was hoping that they would auto number. &#x200B;When i add a reference list at the end, they all show up numbered in a logical order but then again, when I add one of these (say the one that i know is number 7 for example), it will just show us as \[1\] in the text even though the citation that i picked is not one. &#x200B;How can i resolve the numbering issue?&#x200B;And then also, how can I order the reference list itself in the order that the references appear in the text as opposed to the order in which the sources were added?&#x200B;I hope this makes sense and thanks in advance!";False;How can I order & number my references to correspond with the order in which they appear in the text?;https://www.reddit.com/r/MicrosoftWord/comments/akyiqk/how_can_i_order_number_my_references_to/
1548753656.0;False;akycc7;True;False;t3_akycc7;0;False;/r/MicrosoftWord/comments/akycc7/mail_merge_type_is_not_being_retained_as_letter/;1;We have a lot of letters we need to copy from one folder to another but every time we do the mail merge changes from ‘Letter’ to ‘Word doc’ meaning we have to undo this for each individual document. Anyone know how to prevent this?;False;Mail Merge type is not being retained as ‘letter’ when document copied from one location to another - Word 2016;https://www.reddit.com/r/MicrosoftWord/comments/akycc7/mail_merge_type_is_not_being_retained_as_letter/
1548655807.0;False;akkmrj;True;False;t3_akkmrj;1;False;/r/MicrosoftWord/comments/akkmrj/funky_endnote_section_placement_please_advise/;2;"Hi, so I'm publishing a small academic journal through my university. We're getting ready to publish and I've pretty much gotten the articles into their basic editing shape. However, one annoyance has cropped up for every article and that has to do with the placement of the endnotes section at the end of each paper.Basically, I want there to be about three lines of space after the last sentence of the main body. Then it should have the heading of ""Notes"", follow immediately by the endnotes. However, most often the endnotes list does not want to sit right under the heading. It automatically goes to the next page, leaving a large amount of space blank. To fix it, what I've had to do is either increase the amount of lines before the Notes heading, or I'll just increase the font size of one of the blank lines. When it gets to a certain point, the footnotes list will pop up right below the Notes heading like I want it to be, but it's finicky. For instance, increasing the line spacing to say, 12 pt might do the trick of getting the footnotes onto the correct page, but increasing it to 13 (or decreasing it to 11) will just make the footnotes go to the wrong page like before.Does anyone know what is going on? The only thing I can think is it has something to do with me deleting the endnote line separator and continuous separator in draft view, but I can't have these lines show up in the final product, so I'm at a loss. I'm prepared to swallow my annoyance since the articles look great otherwise, but I'd really like to get this figured out. If anyone can help I'd be so appreciative and I can send you one of the problematic articles through direct message so you can fool around for yourself. Thanks.";False;Funky endnote section placement, please advise.;https://www.reddit.com/r/MicrosoftWord/comments/akkmrj/funky_endnote_section_placement_please_advise/
1548653062.0;False;akkadk;True;False;t3_akkadk;2;False;/r/MicrosoftWord/comments/akkadk/i_edited_a_word_document_with_changes_tracking/;2;Will the changes still show up as changes? if not, is there a way to make them do so such that the person I send the doc to can know everything I changed?;False;"I edited a word document with changes tracking, but went through and ""accepted"" all of my changes. Will they still show up, somehow?";https://www.reddit.com/r/MicrosoftWord/comments/akkadk/i_edited_a_word_document_with_changes_tracking/
1548644443.0;False;akj4bh;True;False;t3_akj4bh;3;False;/r/MicrosoftWord/comments/akj4bh/mla_formatting_and_tab_spacing_question/;1;I have office for my chrome book and I copy and pasted my citations from the source (using my universities libraries article pages, there was an option to copy directly the citation, and I chose MLA as that is what is expected)now I am working on my page, and I have it all in alphabetical order, but I am having issues tab indenting the second + lines on each citation. every time I tab it, it moves the entire citation across, and manually using the space key doesn't do anything. I am not sure what to do? (please note that I am very new to citations and also to microsoft word, for academic purposes) thank you in advance.;False;MLA formatting and tab spacing question;https://www.reddit.com/r/MicrosoftWord/comments/akj4bh/mla_formatting_and_tab_spacing_question/
1548561539.0;False;ak8n3t;True;False;t3_ak8n3t;2;False;/r/MicrosoftWord/comments/ak8n3t/when_ever_i_press_the_app_does_nothing_only_if_i/;1;how can I turn this behavior off, I want to press the key and get an apostophof. thanks. ;False;when ever I press ' the app does nothing, only if I follow it by Space it will write an ',;https://www.reddit.com/r/MicrosoftWord/comments/ak8n3t/when_ever_i_press_the_app_does_nothing_only_if_i/
1548529354.0;False;ak3uck;True;False;t3_ak3uck;0;False;/r/MicrosoftWord/comments/ak3uck/certain_images_not_printing/;1;I have a document with multiple images, same file type, same source material, but some of the images print, and some appear as big blank spots. Even printing to PDF results in the big blank spots for some of the images. I was on the phone with Microsoft for an hour to no avail. Has anyone else had this problem/found a solution? ;False;Certain images not printing;https://www.reddit.com/r/MicrosoftWord/comments/ak3uck/certain_images_not_printing/
1548441311.0;False;ajs26l;True;False;t3_ajs26l;5;False;/r/MicrosoftWord/comments/ajs26l/how_to_make_text_appear_in_two_places_by_typing/;1;How to make text appear in two places by typing it in one?I am trying to make a document in which the writer fills out a text box, which simultaneously fills out text in another location. I can't quite figure out how to do this, despite knowing many other things about word. I am also on mac, which doesn't help i don't think. Thanks in advance I would be eternally grateful. ;False;How to make text appear in two places by typing it in one?;https://www.reddit.com/r/MicrosoftWord/comments/ajs26l/how_to_make_text_appear_in_two_places_by_typing/
1548438299.0;False;ajritt;True;False;t3_ajritt;1;False;/r/MicrosoftWord/comments/ajritt/question_about_linking_to_a_specific_pdf_page_in/;1;Essentially, I would need to be able to create a hyperlink in a word document that would open a PDF to a specific page where I'm citing to. Is there a way to do this with the PDF opening in Adobe as opposed to being hosted somewhere online? Further, if I were to combine each of my referenced documents into one large PDF, would I be able to set it up so each hyperlink from the initial word document makes the large PDF switch back and forth for page number rather than opening a new window each time? I can't seem to find clear answers to these questions, and was wondering if anyone had any experience with that. ;False;Question about linking to a specific PDF page in a new window from a word document;https://www.reddit.com/r/MicrosoftWord/comments/ajritt/question_about_linking_to_a_specific_pdf_page_in/
1548428444.0;False;ajpu04;True;False;t3_ajpu04;1;False;/r/MicrosoftWord/comments/ajpu04/how_do_i_set_page_numbers_for_individual_pages/;1;I want the pages to have different numbers but when i edit one page number, they all change ;False;How do I set page numbers for individual pages?;https://www.reddit.com/r/MicrosoftWord/comments/ajpu04/how_do_i_set_page_numbers_for_individual_pages/
1548347904.0;False;aje7we;True;False;t3_aje7we;7;False;/r/MicrosoftWord/comments/aje7we/the_line_spacing_thing/;1;So I need to do a project right now and my word is still not fixed, where in the letters are spaced out from each other and I tried many solutions tho it didnt go back to normal.. Any of you know the solution for this? really need to fix this asap thanks in advancehttps://i.redd.it/zmm6kr6pfec21.png;False;The line spacing thing;https://www.reddit.com/r/MicrosoftWord/comments/aje7we/the_line_spacing_thing/
1548346498.0;False;ajdz06;True;False;t3_ajdz06;3;False;/r/MicrosoftWord/comments/ajdz06/word_2016_does_not_recognize_file_changes_by_cloud/;1;"Hi,I have opend a word document (which is contained in cloud's directory local on this computer). When the word file is updated by cloud service, **Word doesn't refresh and shows the new version. I have to close word and open the document anew.**&#x200B;Is there a possibility to change this behaviour. I think this is crucial question as more and more people use cloud services together with word (without be forced to use onedrive).";False;Word 2016 does not recognize file changes (by cloud);https://www.reddit.com/r/MicrosoftWord/comments/ajdz06/word_2016_does_not_recognize_file_changes_by_cloud/
1548345906.0;False;ajdvag;True;False;t3_ajdvag;2;False;/r/MicrosoftWord/comments/ajdvag/superscript_causing_an_exponential_headache/;1; MS Word does not let me superscript a word. Instead it superscripts the whole line of text. Does anyone have a solution? Thank you in advance. ;False;Superscript causing an exponential headache;https://www.reddit.com/r/MicrosoftWord/comments/ajdvag/superscript_causing_an_exponential_headache/
1548338270.0;False;ajcnnt;True;False;t3_ajcnnt;0;False;/r/MicrosoftWord/comments/ajcnnt/work_like_anki_with_word_2016/;1;Hello i use table for my studies , i would like to know if it possible to click on the case, or erase all / or hide it and if i click back it appear again . i would like to work like anki with my word document Do you know how to do it ? maybe with a macro ? thxhttps://i.redd.it/1tg0kv2qmdc21.png;False;Work like anki with word 2016 ?;https://www.reddit.com/r/MicrosoftWord/comments/ajcnnt/work_like_anki_with_word_2016/
1548304010.0;False;aj8puf;False;False;t3_aj8puf;1;False;/r/MicrosoftWord/comments/aj8puf/guide_for_easy_numbering_table_of_contents_images/;1;;False;Guide for easy numbering, table of contents, images and figures 😁;https://youtu.be/4c2ncMwMTWo
1548299544.0;False;aj830i;True;False;t3_aj830i;0;False;/r/MicrosoftWord/comments/aj830i/is_it_possible_to_customise_the_colour_of_comment/;1;I discovered that you can change the colour of comments by going to view>tracking>Advanced Track Changes Options. This changes the default colour for all documents, however I want to have different colours for different documents (to match the colour scheme).Is there any way to accomplish this? ;False;Is it possible to customise the colour of comment boxes in Word for individual documents?;https://www.reddit.com/r/MicrosoftWord/comments/aj830i/is_it_possible_to_customise_the_colour_of_comment/
1548250414.0;False;aizqgh;True;False;t3_aizqgh;3;False;/r/MicrosoftWord/comments/aizqgh/styles_difference_between_list_paragraph_and/;1;"Hello!&#x200B;I'm having a hard time creating a Word template for my company. I'm setting the styles for the Bullet Point List, only to find that there is also a List Paragraph that looks completely different.Which one should I use and what are their differences? It looks like you can only have one List Paragraph style but many Bullet Point List styles.  Thanks in advance!";False;Styles: difference between List Paragraph and Bullet Point List;https://www.reddit.com/r/MicrosoftWord/comments/aizqgh/styles_difference_between_list_paragraph_and/
1548226937.0;False;aix3ld;True;False;t3_aix3ld;3;False;/r/MicrosoftWord/comments/aix3ld/word_2013/;1;Hi, has anyone else that is still living in the dark ages had Microsoft Word 2013 disappear off your PC since the new Micrisoft Silverlight update? My boyfriend is currently talking to a Microsoft rep online and shes basically using the Apple approach and is just telling him he needs to subscribe to/buy Office 365, even though he BOUGHT the entire 2013 suite. Maybe we're dumb and we just don't know what is going on anymore but has anyone experienced anything similar? Was there a solution?;False;Word 2013;https://www.reddit.com/r/MicrosoftWord/comments/aix3ld/word_2013/
1548213447.0;False;aiva48;True;False;t3_aiva48;0;False;/r/MicrosoftWord/comments/aiva48/cant_open_wordadobeexcel_files_after_recovering/;3;"&#x200B;Hey everyone! Any data recovery specialists? I’m at a total loss here. I have someone who accidentally reset their Windows 10 HP laptop and lost a whole bunch of documents. I took the HDD out and used R-Studio NFTS recovery to scan the entire 500 GB drive. It did find the lost partition and it actually found all the files! &#x200B;Problem is after I recovered them, every time I try to open any word or adobe file I get an error. Word gives me the option to repair but then nothing happens after. Some (like few) of the files do open just fine but most of them won’t. They’re not empty either since windows explorer shows a size on them. I have tried the “zip trick,” “notepad trick,” “open and repair trick,” the “Blessing the word files with holy water trick,” the “hoping praying, the cursing and crying trick,” and I’m about to try the smash the “head against my desk repeatedly trick” soon. &#x200B;I’m aware that reinstalling windows overwrites some files but I’m hoping somehow since it did find them and they do have the original titles, time stamps and sizes, that maybe...just maybe there is hope. &#x200B;Any help is highly appreciated!&#x200B;";False;Can't Open Word/Adobe/Excel Files After Recovering Them;https://www.reddit.com/r/MicrosoftWord/comments/aiva48/cant_open_wordadobeexcel_files_after_recovering/
1548197112.0;False;aismpx;True;False;t3_aismpx;1;False;/r/MicrosoftWord/comments/aismpx/is_there_a_way_to_autopopulate_a_document_for/;1;"I need to send out 500 letters. The letter will be the same other than the salutation (Dear Mr John Doe) and an address (123 Main St, Anywhere USA).  I have an excel sheet with 500 rows containing two columns (Name | Address).&#x200B;Is there a way to automatically insert the name and address, print, then move on to the next name/address, print, and so on?  Thanks for the help!";False;Is there a way to auto-populate a document for mailers?;https://www.reddit.com/r/MicrosoftWord/comments/aismpx/is_there_a_way_to_autopopulate_a_document_for/
1548175564.0;False;aioopn;True;False;t3_aioopn;0;False;/r/MicrosoftWord/comments/aioopn/how_to_create_a_doc_attached_to_a_template_on_an/;1;"Does anyone know how to create a document where the attached template would be an http/https URL? * I have tried adding a template to create a new document type on SharePoint and while it copies the styles, etc., it leaves the new document attached to Normal.dot(x|m).* I have tried setting my Workgroup Template location to a SharePoint page, but Word won't permit that.**Background:**Health Canada (the organization that regulates drugs and medical devices in Canada) has published rules for documents submitted to them. Recently they have added a check preventing ""references to external templates."" When I asked them what that means, they said that they had encountered documents that had a reference to a dotx file over http, and this can be viewed in the document's word\\settings.xml.rels file, e.g.    <Relationships xmlns=""http://schemas.openxmlformats.org/package/2006/relationships"">      <Relationship  Id=""rID1""     Type=""http://schemas.openformats.org/officeDocument/2006/relationships/AttachedTemplate""        Target=""https://something.sharepoint.com/sites/foo/Templates/somethingelse/sometemplate.dotx""        TargetMode=""External""/>    </Relationships>I have not found any means of creating such a document. Some clues would be helpful, thank you.";False;How to create a doc attached to a template on an http/https address?;https://www.reddit.com/r/MicrosoftWord/comments/aioopn/how_to_create_a_doc_attached_to_a_template_on_an/
1548154886.0;False;ailrut;True;False;t3_ailrut;1;False;/r/MicrosoftWord/comments/ailrut/best_way_to_share_word_files/;1;Hey guys!! I have a folder that contains about 5,000 Word files!! And I wanna share it with some people but I don’t want them to be able to edit them at all! What is the best way to do it ?? It’s fine if they read them and even printed them but I don’t want to make any change. Thanks in advance!!;False;Best way to share Word files..??;https://www.reddit.com/r/MicrosoftWord/comments/ailrut/best_way_to_share_word_files/
1548140910.0;False;aikcbl;False;False;t3_aikcbl;2;False;/r/MicrosoftWord/comments/aikcbl/i_make_the_numbers_that_come_before_formulas_eg/;2;;False;I make the numbers that come before formulas (e.g. 38.) bold and want formulats themselves (starting with f'(x)) to not be bold. But every time i save it like this and then reopen it, some letters and numbers in the formulas also get bold. Hoe can i deal with this?;https://i.redd.it/v9uigcp7cxb21.jpg
1548104582.0;False;aievuc;True;False;t3_aievuc;2;False;/r/MicrosoftWord/comments/aievuc/how_to_add_page_numbers_starting_from_a_position/;1;Is it possible to add page numbers staring from a page that I want? (in my case, the 3rd page)Usually I'd do it manually myself but I dont think it would be very productive doing that for 260 pages.;False;How to add page numbers starting from a position at my choice?;https://www.reddit.com/r/MicrosoftWord/comments/aievuc/how_to_add_page_numbers_starting_from_a_position/
1548099927.0;False;aidw4w;True;False;t3_aidw4w;4;False;/r/MicrosoftWord/comments/aidw4w/text_color/;1;"Hello,Forgive me if this has been answered before, but I tried to do the research first before submitting this, but I was unsuccessful in finding an answer. Nevertheless, I just got Word 2016, and I am having the issue where I am writing a bullet point style outline, but I can't get the font color to stick on every line. The default font color is black, but when I change the font color to blue, only the current bullet point line stays blue and the following line will revert back to black. Is there a way to keep the font color the same if needed for the entire outline, or until I change it myself?&#x200B;Thanks.";False;Text Color;https://www.reddit.com/r/MicrosoftWord/comments/aidw4w/text_color/
1548031127.0;1548031774.0;ai4g98;True;False;t3_ai4g98;0;False;/r/MicrosoftWord/comments/ai4g98/notetaking_revolution_will_we_see_more_penstylus/;2;"**Background** (NoteTaking): I'm currently using lectureNotes with stylus on android to make notes([best note app on android](https://android.stackexchange.com/a/184612/240180)). Besides that I'm using text files on my computer to make notes there. I now want to combine that and the only solution at the moment is onenote which i'm testing at the moment.But onenote isn't imo a good option for this (maybe it is for idea conception but imo not for note taking). The underlying concept is that every object (something handwritten, something machine written) has an absolut position. This is annoying because in normal every day use one would write some notes with the computer and later add some things handwritten for which you always have to make space and reshift and so on (and making space in between isn't even possible on android version at the moment).In contrast word's underlying concept is that every object is enqued in a list. Thus when you add things on the top everything automatically shifts back. Another reason why this is much better is, that you don't have  a patchwork rug of text (like in oneNote). Instead you have a coherent text in a fine piece of software which many people use and have used anyway.**Background TL;DR:** *Word is imo much better for crossplattform (windows/android), crossinput (keyboard/stylus) note-taking than everything else.***Questions**:a) I only have Word 2016 accessible. Does somebody have Word 2019 or 365 and can tell how stylus support has improved? Is there e.g. a good lasso tool for moving,resizing and so on? Where are limits of stylus using in newest Word?b) Where can be seen which features will be added (are there pages for that)? Does somebody know about upcoming features relating stylus tools?";False;Note-taking revolution: Will we see more pen/stylus tools in the future?;https://www.reddit.com/r/MicrosoftWord/comments/ai4g98/notetaking_revolution_will_we_see_more_penstylus/
