created_utc;edited;id;is_self;locked;name;num_comments;over_18;permalink;score;selftext;spoiler;title;url
1549750568.0;False;aoxfnt;True;False;t3_aoxfnt;4;False;/r/MicrosoftWord/comments/aoxfnt/toc_help/;2; I am wrapping up my dissertation in APA format and I am stuck with the TOCs. By the 3rd level sub headings in APA, the paragraph begins in the same line as the subheadings and not on the following line. What ends up happening is all the text appears in the TOC. I googled and found a few tips but I was unsuccessful or the steps were vague. I would really appreciate if someone knew the solution or work around to this.For example, one paragraph I am defining terms, so it looks like below:     Action Research. This is where the paragraph starts per APA. It keeps going and going.     Next term. This is where it is defined.In the TOC, the subheading 'action research' is listed but so is the information in the paragraph to since it starts on the same line. And for reference, I have Win10 and, I believe, the recent version/updated Word (Office365 ProPlus) on a Surface XP. ;False;TOC help;https://www.reddit.com/r/MicrosoftWord/comments/aoxfnt/toc_help/
1549705214.0;False;aoqxfj;True;False;t3_aoqxfj;2;False;/r/MicrosoftWord/comments/aoqxfj/insert_current_date_automatically_one_time_when/;1;At the office we have a document in which we keep a daily journal. The first person that day open the base doc and enters the date in the date field, saves it with the date in the name and continues. Unfortunately everybody writes the date in a different way, which is quite annoying when trying to find stuff. I have been trying to find a way to have Word automagically insert a date in the date place when that field is empty. I don't use forms or even templates because it confuses the hell out of ppl here, their computer literacy is sub-zero. A button next to the place in the document which they can click and have the date inserted for them is about the max in advanced Word capabilities, I fear.  Ideas anyone?  Thx!;False;Insert current date automatically one time when opening Word document, or perhaps a macro button?;https://www.reddit.com/r/MicrosoftWord/comments/aoqxfj/insert_current_date_automatically_one_time_when/
1549700783.0;False;aoqitq;True;False;t3_aoqitq;1;False;/r/MicrosoftWord/comments/aoqitq/i_is_autocapitalising_even_when_the_leading/;1;This is driving me slightly mad. It is only happening in one document, and happens on both the laptop keyboard and the full keyboard I use. Whenever I type a word starting with the letter 'i' it is auto-capitalises. I have looked at auto-correct options, and have removed and re-added the auto-capitalise of the singular 'i' but still the problem persists. I am sorry to ask here, but I have found it very hard to google the issue...!Does anyone have any ideas?;False;I is auto-capitalising, even when the leading character in a word;https://www.reddit.com/r/MicrosoftWord/comments/aoqitq/i_is_autocapitalising_even_when_the_leading/
1549682510.0;False;aooh0b;True;False;t3_aooh0b;6;False;/r/MicrosoftWord/comments/aooh0b/how_to_press_down_and_delete_a_lot/;1;"Would be amazing if one of you could help me with this....I got a somewhat formatted version of a whatsapp chat. It already has a new line for every new reply. The only problem is that between every reply there is an empty line (so it's ""manually doublespaced"" and can't be changed by reducing the spacing).Now I could just press ""down"" and ""delete"" a lot since this gets rid off all the empty lines (I honestly dont care about deleting random letters if something someone wrote is longer than 1 line on occasion). Only problem: It's like 500 pages so that would take a rather long time.I guess I got 2 questions.First one: Is there a way in word to get rid off those empty lines after every reply? (this would be a big surprise tbh)Second one: Is there ANY way to automate the ""Down"", ""Delete"", ""Down"", ""Delete"" loop? Like could I make it so a single buttonpress just does that 100 times?Any help is appreciated!";False;How to press down and delete a lot?;https://www.reddit.com/r/MicrosoftWord/comments/aooh0b/how_to_press_down_and_delete_a_lot/
1549673760.0;False;aonaxx;True;False;t3_aonaxx;1;False;/r/MicrosoftWord/comments/aonaxx/assignment_style_questionsuggestions/;1;"So i'm doing a school assignment, and i've opted to copy the text of the questions from the original assignment PDF into the word document. The issues is how everything just kinda looks the same, it blends together in an almost amateurish way. I was wondering if there is a nice way to format the professors questions text versus my own answer text. I tried changing the size and font of only the questions but it ended of looking pretty messy. The idea is that there are two ""voices"", the question and the answer, and i was wondering if there was a nice subtle way to differentiate them.";False;Assignment Style Question/suggestions;https://www.reddit.com/r/MicrosoftWord/comments/aonaxx/assignment_style_questionsuggestions/
1549662167.0;False;aolgxq;True;False;t3_aolgxq;2;False;/r/MicrosoftWord/comments/aolgxq/manual_numbered_paragraphs/;1;Hi all. I have never liked automatic numbering in word. It can make editing large documents quite annoying. On my old computer i could create numbered paragraphs quite easily - i would type in the number, press tab after it, and press tab again on the second line of the paragraph, and the whole para would shift to the right. On my new computer, pressing tab will only create a space between words. Does anybody know of a way to change back to the old setting? I know I can move the para using the ruler, but it is so much more time consuming.;False;Manual Numbered Paragraphs;https://www.reddit.com/r/MicrosoftWord/comments/aolgxq/manual_numbered_paragraphs/
1549574970.0;False;ao8v6p;True;False;t3_ao8v6p;4;False;/r/MicrosoftWord/comments/ao8v6p/descending_numbered_list/;1;"If I have a list of 55 entries, is there a way to have #55 appear at the top and #1 last, at the bottom? &#x200B;Working on a academic CV for a physician and he wants his publications to appear this way (hundreds from years and years of practice). ";False;Descending numbered list?;https://www.reddit.com/r/MicrosoftWord/comments/ao8v6p/descending_numbered_list/
1549571379.0;False;ao86pb;True;False;t3_ao86pb;3;False;/r/MicrosoftWord/comments/ao86pb/how_do_you_label_the_second_page_on_a_word/;1;I can't figure it out. I hate chicago style;False;How do you label the second page on a word document as the first page in the header?;https://www.reddit.com/r/MicrosoftWord/comments/ao86pb/how_do_you_label_the_second_page_on_a_word/
1549564756.0;False;ao6x5b;True;False;t3_ao6x5b;0;False;/r/MicrosoftWord/comments/ao6x5b/disable_tabbing_in_a_table_adding_a_new_row/;1;I am trying to make a form with locked fields.  I can't Protect the document because I still need spellcheck to be possible and I don't want to introduce macros/VBA into this if there is any way it can be avoided.I have been using content control to lock a bunch of stuff but now run into the issue that when the user tabs from the last field in the table at the top of the document it adds a row to the table instead of tabbing to the field below the table.  All my google-fu has come up blank.  Is there any way to disable the adding of new rows to the table without protecting the document and therefore disabling spellcheck?;False;Disable tabbing in a table adding a new row?;https://www.reddit.com/r/MicrosoftWord/comments/ao6x5b/disable_tabbing_in_a_table_adding_a_new_row/
1549529579.0;False;ao1t76;True;False;t3_ao1t76;2;False;/r/MicrosoftWord/comments/ao1t76/changing_autofill_information_based_on_time/;1;I'm putting together a shipping document for work and I'd like to have it automatically change certain information based on the time. For example, if it's currently between 4:00am and 8:00am I'd like it to display 8am. I need it to update every 4 hours for 12am, 4am, 8am, etc. Any help is greatly appreciated. Thank you. ;False;Changing autofill information based on time?;https://www.reddit.com/r/MicrosoftWord/comments/ao1t76/changing_autofill_information_based_on_time/
1549491923.0;False;anwfv2;True;False;t3_anwfv2;5;False;/r/MicrosoftWord/comments/anwfv2/images_keep_dropping_out/;1;"I'm making a manual, so I have a bunch of images placed throughout my document, and my images are going missing when I re-open it. I'm just getting ""The linked image cannot be displayed."" It's not all of the images doing that, just a few here and there. Any suggestions?";False;Images keep dropping out;https://www.reddit.com/r/MicrosoftWord/comments/anwfv2/images_keep_dropping_out/
1549488078.0;False;anvpc4;False;False;t3_anvpc4;5;False;/r/MicrosoftWord/comments/anvpc4/accidentally_i_created_a_really_short_page_how/;1;;False;Accidentally I created a really short page - how can I change it? Normally a new tab stop creates a din a4 page - what am I doing wrong?;https://i.redd.it/20wlvwspl0f21.png
1549487297.0;False;anvjx8;True;False;t3_anvjx8;3;False;/r/MicrosoftWord/comments/anvjx8/formatting_issue/;2;I have an old document created in an older version of word that was originally 1 page. When I open the same document in Word 2016, it's become 2 pages. How do I make it so it opens with correct formatting that was 1 page?;False;Formatting Issue;https://www.reddit.com/r/MicrosoftWord/comments/anvjx8/formatting_issue/
1549395346.0;False;anhrti;True;False;t3_anhrti;0;False;/r/MicrosoftWord/comments/anhrti/looking_for_stylelayout_inspiration/;1;Hi all, I'm looking for resources to improve the visual aesthetics of my documents. I understand the use of styles,  my documents look fine, but I *really* want them to pop.      FYI- I most often use Word for class outlines, technical How-To's, work procedures, etc.;False;Looking for style/layout inspiration;https://www.reddit.com/r/MicrosoftWord/comments/anhrti/looking_for_stylelayout_inspiration/
1549392900.0;False;anhc4b;True;False;t3_anhc4b;4;False;/r/MicrosoftWord/comments/anhc4b/controlled_content/;1;I am trying to create a template in word that uses controlled content with a reference to another content box. Word has a template that does this but I can't figure out how to replicate it on my own.;False;Controlled content;https://www.reddit.com/r/MicrosoftWord/comments/anhc4b/controlled_content/
1549375106.0;False;anec5d;True;False;t3_anec5d;8;False;/r/MicrosoftWord/comments/anec5d/is_there_a_way_to_to_open_up_old_microsoft_word/;1;**My question:** I need to open an old Microsoft word .doc file but the permissions(on the old file) are set up in such a way that it cannot be opened in modern word(comparability mode is a no go). Currently the only way to open it is to use a Linux environment to open it and save it as an open office format. I don’t have access to a Linux environment and my supervisor tasked me to research if there is a way I can open it without the need for a Linux environment.* Also I should note I work for the government and my workstation is idiot proofed and locked to the extreme so I can’t use third party apps/programs or plugins.* I have(minus Visio) the entire Microsoft office suite. ;False;Is there a way to to open up old Microsoft word .doc files when comparability mode is unable to do it?;https://www.reddit.com/r/MicrosoftWord/comments/anec5d/is_there_a_way_to_to_open_up_old_microsoft_word/
1549361780.0;False;ancrpv;True;False;t3_ancrpv;3;False;/r/MicrosoftWord/comments/ancrpv/how_to_get_a_clickable_document_outline_like_in/;1;In google docs you can insert a document outline on the side of your document / text field in which you can click headers (e.g. Chapter 1, Chapter 2, etc.). Clicking it will bring you there at once. Is this possible in word? Because now I have to scroll through the entire document.;False;How to get a clickable document outline like in Google Docs?;https://www.reddit.com/r/MicrosoftWord/comments/ancrpv/how_to_get_a_clickable_document_outline_like_in/
1549336467.0;False;an9v55;True;False;t3_an9v55;0;False;/r/MicrosoftWord/comments/an9v55/downloaded_fonts_not_rendering/;1;I have Windows 10. I downloaded 4 new fonts from Dafont.com and installed them on my computer with no problem. When I open Word, my new fonts all show up in the drop down menu. And yet when I try to use them, they appear differently, just a basic san serif. The fonts work in other applications such as OneNote. I've tried many things and am at a loss now. I can't even uninstall the fonts because it constantly says they are in use somewhere. Help?;False;Downloaded fonts not rendering;https://www.reddit.com/r/MicrosoftWord/comments/an9v55/downloaded_fonts_not_rendering/
1549321264.0;False;an7jj7;True;False;t3_an7jj7;0;False;/r/MicrosoftWord/comments/an7jj7/getting_unlicensed_product_error_for_mw/;1;HeySo as in the title, I got an unlicensed version error (came out of nowhere been using it for years). I enter my product key and it says incompatible or something. I'm running Windows Vista Business 7, but how do I get the word version for that product?;False;"Getting ""unlicensed product"" error for MW. Activating my product key doesen't work. How do I get the version of Word for my product key?";https://www.reddit.com/r/MicrosoftWord/comments/an7jj7/getting_unlicensed_product_error_for_mw/
1549319031.0;False;an76jr;True;False;t3_an76jr;0;False;/r/MicrosoftWord/comments/an76jr/storing_reference_data_in_microsoft_word_template/;1;"I searched this subreddit and found some other people asking for [a similar solution](https://www.reddit.com/r/MicrosoftWord/comments/7vf90g/creating_shortcutstemplatesmacros_need_help/) but no good answers. Apologize if I missed something in my search.I have a relatively complex Word Template to be used by multiple people for building large documents. It already has some VBA code for automatically importing Excel data and generating content from them as well as styles. These documents are going to have many specifications that we'd like to commonize. Basically a table of values that we can refer to multiple times throughout the document.I can use {SET reference ""ref value""} and {REF reference} in a table pretty easily. But how can I store this data in the template and be able to update it later? It doesn't seem like there's anywhere besides the VBA code to store data in a template. I'd like to be able to update or add to these values in the template and cascade those changes through any document that uses them.Options that I've found:* Write a VBA script to import the values from a sidecar document then generate a series of {SET} tags to populate them. This has the advantage of being able to store the sidecar doc on a server.* Create a Quick Part with the {SET} tag table?* If I could have a common first page to all documents based on the template I could keep all the {SET} tags there as well as some other UI elements for my VBA scripts but haven't found a good way to do that.I feel like I might be missing an obvious included feature here.";False;Storing Reference Data in Microsoft Word Template;https://www.reddit.com/r/MicrosoftWord/comments/an76jr/storing_reference_data_in_microsoft_word_template/
1549313070.0;False;an63ls;True;False;t3_an63ls;4;False;/r/MicrosoftWord/comments/an63ls/help/;2;Hey, so I accidentally clicked something while writing this document, and I don't know how to remove it, every (space) is replaced with a dot, and every time it changes sentence it does that weird mark.  Any help is appreciated.https://i.redd.it/dw2nsyzm5me21.png;False;Help;https://www.reddit.com/r/MicrosoftWord/comments/an63ls/help/
1549301667.0;False;an40md;True;False;t3_an40md;1;False;/r/MicrosoftWord/comments/an40md/document_created_on_mac/;2;Hello,  I have a document that was originally created in a Mac.   When we try to edit it in windows, the lines are not the same , and the move as you type in them.  I was wondering if there was a format I can save it in that would leave the document as it was in the Mac ? ;False;Document created on Mac;https://www.reddit.com/r/MicrosoftWord/comments/an40md/document_created_on_mac/
1549255831.0;False;amy6rp;True;False;t3_amy6rp;2;False;/r/MicrosoftWord/comments/amy6rp/numbering_equations_in_word/;1;"Ive got microsoft office 365 proplus.  I  want to add equation numbers in the right side of the equation.   I remember seeing somewhere on the internet that you could do this by typing the equation and then using the ""#"" sign followed by the equation and pressing enter or something.&#x200B;But for the life of me I cant find it right now.&#x200B;Does anyone know of that method or any other way I could enter an equation number in word?  (I have seen the method of using a table, that method doesnt work for me with the size of the equations I have so Im looking for any other method.)";False;Numbering equations in word;https://www.reddit.com/r/MicrosoftWord/comments/amy6rp/numbering_equations_in_word/
1549205312.0;False;amq5ig;True;False;t3_amq5ig;6;False;/r/MicrosoftWord/comments/amq5ig/two_separate_columns/;1;Is there a way to separate the text into two columns where the text runs straight down the page and onto the next one?Something like:abcdend of pageefgand so on... with the idea to be able to do the same in the adjacent column. Does that make sense?;False;Two separate columns;https://www.reddit.com/r/MicrosoftWord/comments/amq5ig/two_separate_columns/
1549133245.0;1549419525.0;amh07p;True;False;t3_amh07p;7;False;/r/MicrosoftWord/comments/amh07p/im_trying_to_change_from_27_to_28_and_so_on_im/;1;" im trying to change from 27 to 28, and so on (im trying to test something withing a program) how can i do this on office word or notepad++? &#x200B;screenshot: [https://i.imgur.com/bLrF0Jd.png](https://i.imgur.com/bLrF0Jd.png)edit: i was able to accomplish this by following [this](https://superuser.com/questions/717912/complete-the-sequence-1-2-3-up-to-156-in-notepad), im pretty sure there are other ways and softwere to accomplish this but im going to stop here. hopefully this can be useful to somebody. thanks to all that commented";False;im trying to change from 27 to 28, and so on (im trying to test something within a program) how can i do this on office word or notepad++? screenshot: https://i.imgur.com/bLrF0Jd.png;https://www.reddit.com/r/MicrosoftWord/comments/amh07p/im_trying_to_change_from_27_to_28_and_so_on_im/
1549119307.0;False;ameq8m;True;False;t3_ameq8m;2;False;/r/MicrosoftWord/comments/ameq8m/is_there_a_way_to_search_all_ms_word_documents/;3;I have hundreds of MS Word documents in my PC, most of them are stories or story ideas which are ideas or works in progress. I was working on a story a while back, but I do not remember what I titled the file as, or when I was working on it. Is there a way to search all of my Word documents for a particular word which I know was in it? Or is there another way to find it?;False;Is there a way to search all MS Word documents for a particular word?;https://www.reddit.com/r/MicrosoftWord/comments/ameq8m/is_there_a_way_to_search_all_ms_word_documents/
1549058532.0;False;am7czc;True;False;t3_am7czc;2;False;/r/MicrosoftWord/comments/am7czc/removing_spellinggrammar_checking_on_just_a/;1;Hi all I have documents reminding me of what I've learned so far with programming and I have some code examples pasted in there. Is there a way I can remove the red and green underlining on just the code bits but not on all of Word?    Thanks in advance!;False;Removing spelling/grammar checking on just a specific bit of text?;https://www.reddit.com/r/MicrosoftWord/comments/am7czc/removing_spellinggrammar_checking_on_just_a/
1549056578.0;False;am71cf;True;False;t3_am71cf;7;False;/r/MicrosoftWord/comments/am71cf/help_with_changing_table_borders/;1;Hey, I've been using tables to keep my study sheets organized and allow me to resize them as the need arises. However, after I printed [this one](https://i.imgur.com/rzpqf2V.png), the borders turned out to be too thin.I tried selecting the whole table and picking a thicker border weight from the toolbar, and it gave me a pencil tool to draw in the borders. Tracing over all of the borders and making sure I don't miss any would just be a pain, especially if I have to do it multiple times to find the right thickness, so I tried changing the thickness through the Properties dialog box, and... nothing happened. I'm sure there has to be a way to change all of the borders at once, but it seems to be hidden.;False;Help with changing table borders?;https://www.reddit.com/r/MicrosoftWord/comments/am71cf/help_with_changing_table_borders/
1549050415.0;False;am5z8t;True;False;t3_am5z8t;2;False;/r/MicrosoftWord/comments/am5z8t/showing_a_lot_of_space_when_single_space_is/;1;"I've noticed this happen a lot when using word but i cant pinpoint why it happens, i usually just end up copy and pasting the text into browser to lose all formatting and start over again.&#x200B;I'll high light all the text and select single space and bam still big spaces. double space just makes it look like quadruple space. Help me out!";False;Showing a lot of space when single space is selected;https://www.reddit.com/r/MicrosoftWord/comments/am5z8t/showing_a_lot_of_space_when_single_space_is/
1549024640.0;False;am1l57;True;False;t3_am1l57;1;False;/r/MicrosoftWord/comments/am1l57/quick_print_on_certain_paper/;1;"Hey,&#x200B;In work we have a printer with four kinds of paper. 1. Cover sheet / letter head2. Letter body3. blank white4. blank redThe document settings vary. Sometimes they will be set to blank white (3) and sometimes blank red (4). Also any saved documents and recently printed will have first page Letter head (1) and the rest of the document Letter body (2).&#x200B;I would love a shortcut in the ribbon for quick printing in either totally blank white (3) or as letter with the first page Letter head (1) and the rest of the document Letter body (2).&#x200B;Are there any ways to do this?&#x200B;Thanks";False;Quick print on certain paper;https://www.reddit.com/r/MicrosoftWord/comments/am1l57/quick_print_on_certain_paper/
1549005981.0;False;alzmhe;True;False;t3_alzmhe;2;False;/r/MicrosoftWord/comments/alzmhe/table_of_contents_oddly_split_over_two_sections/;1;I've got a table of contents set up that is 2-pages long. For some strange reason, the first page of ToC is in section 2 and the second page is automatically placed into section 3. The next page after ToC is also section 3. Anyone know what's up? It's really stuffing with my formatting. Thanks.;False;Table of Contents oddly split over two sections;https://www.reddit.com/r/MicrosoftWord/comments/alzmhe/table_of_contents_oddly_split_over_two_sections/
1548955171.0;False;alrr7x;True;False;t3_alrr7x;4;False;/r/MicrosoftWord/comments/alrr7x/help_with_a_bulleted_list/;1;"Hello. I am using Office for the mac and I am feeling totally defeated by nothing more than setting a default bullet list in word. I'm working on word 15.38 on Mac. I'm doing something for my boss that contains a bulleted list, but he wants to set custom indents for the bullets. Basically we're going back and forth drafting something and I want to make it so I can send him a document that does the following for a bulleted list:&#x200B;1st bullet: .25 indent2nd bullet: .56 indent3rd bullet: .88 indent4th bullet: 1.2 indent&#x200B;These are the custom spacing he indicated that he wanted. And I want to be able to force the document to do those indents, and when I send it back to him and he starts to type on it, it also does those indents. I feel useless and really would like some help. Can someone please tell me how to do this? ";False;Help with a bulleted list;https://www.reddit.com/r/MicrosoftWord/comments/alrr7x/help_with_a_bulleted_list/
1548871243.0;False;alferf;True;False;t3_alferf;2;False;/r/MicrosoftWord/comments/alferf/columns_not_lining_up_vertically/;1;"Having a weird and very annoying issue with word. I've been doing multiple pages of brands my company carries and now one column decided it doesn't want to line up with the column next to it on word.&#x200B;I've attached the picture. There is no spacing there whatsoever and the white space is not a part of any imported logo...&#x200B;[https://imgur.com/a/ZnEyrBc](https://imgur.com/a/ZnEyrBc)&#x200B;Any help would be appreciated.";False;Columns not lining up vertically?;https://www.reddit.com/r/MicrosoftWord/comments/alferf/columns_not_lining_up_vertically/
1548855776.0;False;alcshf;True;False;t3_alcshf;4;False;/r/MicrosoftWord/comments/alcshf/template_set_a_different_header_to_each_section/;1;"Hello,  I would like to know if there was a way to set a different header to each section after a section break and to save that setting for each new document based on that template.  Example: Section 1 - Header ASection 2 - Header BSection 3 - Header C  The thing is that when I start a new document based on that template with only one page preloaded, I only have one header and if I set new section breaks I either get an empty header or the header from Section 1 despite unchecking the ""Link to previous one"".  How can I save the headers to automatically update with each new section?";False;Template: set a different header to each section;https://www.reddit.com/r/MicrosoftWord/comments/alcshf/template_set_a_different_header_to_each_section/
