created_utc;edited;id;is_self;locked;name;num_comments;over_18;permalink;score;selftext;spoiler;title;url
1553358611.0;False;b4l35f;True;False;t3_b4l35f;1;False;/r/MicrosoftWord/comments/b4l35f/help_editing_tables_in_word/;1;"I have to redesign a word table into a single column, out of 4.So now the table is like this: 1 2 3 45 6 7 89 10 11 12 i want to reduce the number of columns, but keep the data, so it looks like this:123456&#x200B;do you know how can i do this?&#x200B;&#x200B;";False;Help editing tables in word.;https://www.reddit.com/r/MicrosoftWord/comments/b4l35f/help_editing_tables_in_word/
1553316406.0;False;b4f32k;True;False;t3_b4f32k;0;False;/r/MicrosoftWord/comments/b4f32k/how_to_dodge_protected_view_for_websites_you/;1;I don't want to turn Protected View off entirely.But you can't add http(s) URLs to Trusted Locations unless they support WebDAV.However, some sites, like my content management system, I want to trust. Is there any reasonable way to have those not out documents into Protected View jail?Barring that, is there an event my add-in can notice for when you press Enable Editing so the same code that is run on Open will execute?;False;How to dodge Protected View for websites you really trust;https://www.reddit.com/r/MicrosoftWord/comments/b4f32k/how_to_dodge_protected_view_for_websites_you/
1553255958.0;False;b4475h;True;False;t3_b4475h;0;False;/r/MicrosoftWord/comments/b4475h/word_keeps_changing_my_documents_to_read_only/;1;Very annoying , all my college essays keep changing to read only version and won’t let me continue editing the document .How do I change it back and how do I stop this happening ?;False;Word keeps changing my documents to read only ?;https://www.reddit.com/r/MicrosoftWord/comments/b4475h/word_keeps_changing_my_documents_to_read_only/
1553185623.0;False;b3sla1;True;False;t3_b3sla1;1;False;/r/MicrosoftWord/comments/b3sla1/word_on_mac_everytime_i_reopen_the_document_my/;2;Title. I'm not asking how to change tab stops, I am asking how to ensure that each time I open word the tab stops aren't automatically set to ridiculous lengths;False;"Word on Mac; everytime i re-open the document, my tab stops are waaay too far. It is annoying to have to change the tab stops each time i open word. How do I change this?";https://www.reddit.com/r/MicrosoftWord/comments/b3sla1/word_on_mac_everytime_i_reopen_the_document_my/
1553137350.0;False;b3lej5;True;False;t3_b3lej5;1;False;/r/MicrosoftWord/comments/b3lej5/changing_keystrokes_on_word_for_mac/;1;"Help!  I use Word on a PC at work and have ""muscle memory"" for most keystroke commands.  On Word for Mac, OPTION + SHIFT + Arrow highlights words.  However, on a PC it is CTRL + SHIFT + Arrow key.  The problem is I am so used to the PC keystroke that every time I am using word on my mac at home I hit the PC keystroke and it starts doing an outline promote/demote.  How can I change the keystroke on my mac so that if I hat CTRL + SHIFT + Arrow it will highlight by word instead of doing the promote/demote?Hope that makes sense.  ";False;Changing keystrokes on Word for Mac;https://www.reddit.com/r/MicrosoftWord/comments/b3lej5/changing_keystrokes_on_word_for_mac/
1553121492.0;1553122031.0;b3ikf1;True;False;t3_b3ikf1;2;False;/r/MicrosoftWord/comments/b3ikf1/is_there_anyway_to_see_tracked_data_on_a_word_doc/;1;"I was working on a word document, saved it, closed it, and didn't realize the tracking data was off. Is there any way to recover the tracked data?&#x200B;I was doing a midterm practicum on my laptop in class. I didn't save the final version of the word document but instead submitted the last saved version, which was missing a lot of information. When I got home I saw that I didn't submit the final version. I panicked and saved the still open word document and them emailed it to my TA explaining what happened. I have to show them the metadata of the file to prove when/what changes were made and when. But when I pull up the word document and go into properties it has the last time modified as after class ended because that's when I saved it. I didn't have the tracking data on. So i'm trying to find if and where the timestamps are of every word/picture added to the word document. Does anyone know where to find it.";False;"Is there anyway to see ""tracked"" data on a word doc after it's been saved with the tracked data off?";https://www.reddit.com/r/MicrosoftWord/comments/b3ikf1/is_there_anyway_to_see_tracked_data_on_a_word_doc/
1553114209.0;False;b3h3c5;True;False;t3_b3h3c5;9;False;/r/MicrosoftWord/comments/b3h3c5/having_trouble_turning_read_only_file_into/;1;Can I turn a PDF into a word file and then edit it and make it back into a PDF into the original format that it came in? If anyone can do it for me I would greatly appreciate it or tell me how to do it. If this is the wrong section to post this in my bad.;False;Having trouble turning read only file into editable;https://www.reddit.com/r/MicrosoftWord/comments/b3h3c5/having_trouble_turning_read_only_file_into/
1553107493.0;False;b3fqgy;False;False;t3_b3fqgy;1;False;/r/MicrosoftWord/comments/b3fqgy/cant_remove_folding_marks/;1;;False;Can't remove folding marks?;https://i.imgur.com/wVv3sXT.png
1553102997.0;False;b3ett6;False;False;t3_b3ett6;6;False;/r/MicrosoftWord/comments/b3ett6/spacing_help_more_info_in_comments/;0;;False;Spacing help (more info in comments);https://i.redd.it/t902jpv27bn21.jpg
1553095145.0;False;b3d9fk;True;False;t3_b3d9fk;2;False;/r/MicrosoftWord/comments/b3d9fk/headings_in_headings/;1;"I've created a cookbook just for our family of recipes we use often. I've chosen to us Headings instead of Chapters because I want to have subheadings   For Example: * SOUP   * Beef   * Chicken   * Vegetable&#x200B;I'd like to be able to put the name of the heading into the heading on each page to make it easier to find recipes (I'm almost to 200 pages).   Any ideas how to do this?   Or does anyone have a better way to accomplish my goal?   &#x200B;";False;Headings in Headings?;https://www.reddit.com/r/MicrosoftWord/comments/b3d9fk/headings_in_headings/
1553046680.0;False;b3630q;True;False;t3_b3630q;0;False;/r/MicrosoftWord/comments/b3630q/can_i_flip_2_ranked_items_without_copypaste/;1;I'm revising some rankings as I realized that one item is actually better than another. I noticed that I can highlight the numbers but can't figure out how to flip them;False;Can I flip 2 ranked items without copy/paste?;https://www.reddit.com/r/MicrosoftWord/comments/b3630q/can_i_flip_2_ranked_items_without_copypaste/
1553044484.0;False;b35pp5;True;False;t3_b35pp5;7;False;/r/MicrosoftWord/comments/b35pp5/trying_to_see_changes_made_by_someone_else/;1;Hey guys, I sent a document to a professor and she said that she made some changes in red. how do I look at these changes that she made? ;False;trying to see changes made by someone else;https://www.reddit.com/r/MicrosoftWord/comments/b35pp5/trying_to_see_changes_made_by_someone_else/
1553000052.0;False;b2x1yo;False;False;t3_b2x1yo;2;False;/r/MicrosoftWord/comments/b2x1yo/why_arent_my_sequential_numbering_fields_working/;1;;False;Why aren't my sequential numbering fields working?;https://i.redd.it/l2ymshjvo2n21.png
1552917918.0;False;b2j4cw;True;False;t3_b2j4cw;0;False;/r/MicrosoftWord/comments/b2j4cw/how_can_i_prevent_running_a_macro_that_generates/;1;Recently my work upgraded my MS word from an older version to MS 2013.  A lot of what I do is entering information into a template that has several legacy form fields.In the older version of word, when I tabbed into a legacy form field and ran a macro that generated text, it would place the text INSIDE the legacy form field without deleting the field.  Now in 2013 it seems like every time I run a macro it deletes the form field and places the text where the field used to be.  Anyone know if there is a way of preventing this?Thanks,;False;How can I prevent running a macro that generates text from deleting a form field I want the text to show up inside;https://www.reddit.com/r/MicrosoftWord/comments/b2j4cw/how_can_i_prevent_running_a_macro_that_generates/
1552894452.0;False;b2fq8k;False;False;t3_b2fq8k;1;False;/r/MicrosoftWord/comments/b2fq8k/find_and_replace_between_end/;1;;False;"Find and replace between ""("" & ""end)""";https://i.redd.it/ztouq7nsytm21.png
1552766140.0;False;b1wjz4;True;False;t3_b1wjz4;1;False;/r/MicrosoftWord/comments/b1wjz4/word_wont_open_help/;2;"My dumbass of an ex downloaded Microsoft Word from piratebay for me on my mac. It stopped working and none of my documents would open. I decided to install it the ""right way"". I signed up with my email from the school I work at because it was free. I installed Word onto my mac from their website but it didn't change anything. Still, nothing will open. When I try to open a document, an error reporting window pops up and reads ""Microsoft Word has encountered a problem and needs to close We are sorry for the inconvenience."" How can I fix this problem?";False;Word won't open, help!;https://www.reddit.com/r/MicrosoftWord/comments/b1wjz4/word_wont_open_help/
1552759630.0;False;b1vb99;True;False;t3_b1vb99;1;False;/r/MicrosoftWord/comments/b1vb99/is_there_a_way_to_automatically_contract_words/;1;I have a big wall of text and every time I read it I find new words that need contracting (was not -> wasn't). Is there a way to automatically find all cases of could, would, do, have etc. without ctrl+f-ing every time?e: to clarify, it's a casual piece so I _want_ the contractions;False;Is there a way to automatically contract words?;https://www.reddit.com/r/MicrosoftWord/comments/b1vb99/is_there_a_way_to_automatically_contract_words/
1552723766.0;False;b1q4w3;True;False;t3_b1q4w3;0;False;/r/MicrosoftWord/comments/b1q4w3/changing_default_developer_properties_for_check/;1;"Hi All, &#x200B;Am new to playing around with developer and designer mode in word. I have wrist and hand mobility problems so I am trying to simplify the number of clicks I do with macros, designer, etc. while I am waiting for adaptive technology for my computer. I want to change the default property for the ""Check Box Content Control"" developer from the X filled in box to the check mark filled in box (Unicode 2611). I have been able to do this individually one by one for each box, but have yet to be able to figure out how to change it to default this way or how to change multiple boxes at once. So - how do you change the default properties of developer tools? What is the easiest way? And secondarily, can you highlight or control click somehow more than one and change their properties at once? I am normally pretty capable but I'm struggling with this, thanks for any help you can provide. ";False;Changing Default Developer Properties for Check Box;https://www.reddit.com/r/MicrosoftWord/comments/b1q4w3/changing_default_developer_properties_for_check/
1552651478.0;False;b1e3jq;True;False;t3_b1e3jq;2;False;/r/MicrosoftWord/comments/b1e3jq/any_way_to_disable_the_bouncy_effect_of_the/;1;I don't know how to describe but I think it's fairly obvious if you have type on Mword vs google docs side by side. Microsoft word have this bouncy effect when the blinking thing moves with the addition of each letter. I really hate it but not enough to not use word but still would like to get rid of it so how do I go on about doing that? Thank you.;False;"Any way to disable the ""bouncy"" effect of the flashing line thingy?";https://www.reddit.com/r/MicrosoftWord/comments/b1e3jq/any_way_to_disable_the_bouncy_effect_of_the/
1552645065.0;False;b1d5y4;True;False;t3_b1d5y4;2;False;/r/MicrosoftWord/comments/b1d5y4/how_can_i_achieve_this_formatting_effect/;2;"Hey guys,&#x200B;I am trying to work on long Word documents, and I need to achieve the effect shown down.Is there anyway to lock the formatting properties, where it would not change no matter where I click to write? That way I can highlight the whole text, then do the edits inside that I need. And not select every section and undo the highlighting.Or any other technique that will save me time.&#x200B;Thanks in advance.&#x200B;&#x200B;[This effect right here.](https://i.redd.it/8fb46ppad9m21.png)";False;How can I achieve this formatting effect?;https://www.reddit.com/r/MicrosoftWord/comments/b1d5y4/how_can_i_achieve_this_formatting_effect/
1552580860.0;False;b12dlc;True;False;t3_b12dlc;0;False;/r/MicrosoftWord/comments/b12dlc/was_sent_a_document_with_a_template_i_want_to_use/;1;;False;Was sent a document with a template. I want to use that template. How do I pull the template from the doc I was sent to save for later use?;https://www.reddit.com/r/MicrosoftWord/comments/b12dlc/was_sent_a_document_with_a_template_i_want_to_use/
1552569404.0;False;b10855;True;False;t3_b10855;1;False;/r/MicrosoftWord/comments/b10855/table_of_contents_doesnt_show_in_navigation/;1;Hi all, I am running Microsoft 365. And I am creating a big word document in which I would like to make some indexing with a Table of contents on the left hand side of the screen whiles working on the document (ie. Navigation). I am working on the document with several Headings but for some reason the headings are not appearing in the table of contents. Does anyone has any ideas of why are not appearing there please?.Thanks;False;Table of contents doesn't show in navigation sidebar;https://www.reddit.com/r/MicrosoftWord/comments/b10855/table_of_contents_doesnt_show_in_navigation/
1552546011.0;False;b0x2zj;True;False;t3_b0x2zj;5;False;/r/MicrosoftWord/comments/b0x2zj/help_creating_different_margins_for_a_single_page/;1;I'm writing my thesis and I need help with the margins. The margins have to be different for individual pages but I can't find a way to do this with out it changing the margins on multiple pages or creating weird spaces. Is there a way to set margins for a single page?;False;Help creating different margins for a single page;https://www.reddit.com/r/MicrosoftWord/comments/b0x2zj/help_creating_different_margins_for_a_single_page/
1552501218.0;False;b0pbh1;True;False;t3_b0pbh1;1;False;/r/MicrosoftWord/comments/b0pbh1/how_to_grab_a_special_font_from_one_word_document/;1;I have a word document that has a special version of a font.  It is named GL1TCHRegular, but looks nothing like that font usually does.  It's a custom font I'm guess and I'm trying to use it in a new document.  However, when I copy and paste into the new document, the font looses it's cool look.  I am pasting to keep source formatting.  Any ideas on how I can get this to work?;False;How to grab a special font from one Word document to use in another;https://www.reddit.com/r/MicrosoftWord/comments/b0pbh1/how_to_grab_a_special_font_from_one_word_document/
1552485561.0;False;b0mbxn;True;False;t3_b0mbxn;1;False;/r/MicrosoftWord/comments/b0mbxn/mail_merge_with_separate_pdf/;1;I have a four-page PDF I need to print/mail along with a cover letter. What's the best way to do this? Can I get everything in one document, or should I print separately.;False;Mail Merge with Separate PDF;https://www.reddit.com/r/MicrosoftWord/comments/b0mbxn/mail_merge_with_separate_pdf/
1552466136.0;False;b0jm4b;True;False;t3_b0jm4b;0;False;/r/MicrosoftWord/comments/b0jm4b/insert_subdocument_from_sharepoint_into_word/;2;"I want to insert a document into word from my workplace sharepoint server as a subdocument. When I try using the macro recorder it shows adding the temporary created file on my drive instead the online location.Is it possible to do this?&#x200B;I found the same question on stackoverflow unanswered: [https://stackoverflow.com/q/51860021](https://stackoverflow.com/q/51860021)";False;insert subdocument from sharepoint into word using macro;https://www.reddit.com/r/MicrosoftWord/comments/b0jm4b/insert_subdocument_from_sharepoint_into_word/
1552415775.0;False;b0bahc;True;False;t3_b0bahc;2;False;/r/MicrosoftWord/comments/b0bahc/text_spilling_over_onto_the_to_next_line_with/;1;"Basically the text in each line of a given word document is spilling over to the next lineKind of like this <How do I solve this issue? I can't find anything concrete online for some reason.&#x200B;Thanks!";False;Text spilling over onto the to next line with Word 2016;https://www.reddit.com/r/MicrosoftWord/comments/b0bahc/text_spilling_over_onto_the_to_next_line_with/
1552369319.0;False;b043xm;True;False;t3_b043xm;1;False;/r/MicrosoftWord/comments/b043xm/forgot_word_file_password/;1; I need to recover data from a word file. The password is required to open it and I can not use the trick of saving it as another file type ;False;Forgot Word File Password;https://www.reddit.com/r/MicrosoftWord/comments/b043xm/forgot_word_file_password/
1552346140.0;False;b00c62;True;False;t3_b00c62;2;False;/r/MicrosoftWord/comments/b00c62/can_i_change_the_default_indentation_for_bullet/;1;hi so i know that you can manually set the distance of a specific set of bullet points either by clicking and dragging, or right clicking and then selecting 'adjust list indents'. but  both of these options only work for that 'set of bullet points. so when i start another batch of bullet points (same symbols and what not) the indent values return to the default.is there a way to change this, either so that all future bullet points will be at my desired indentation level, or to change all set of  bullet points at once?  thanks in advance;False;Can i change the default indentation for bullet points across an entire document?;https://www.reddit.com/r/MicrosoftWord/comments/b00c62/can_i_change_the_default_indentation_for_bullet/
1552341742.0;False;azzh7h;True;False;t3_azzh7h;0;False;/r/MicrosoftWord/comments/azzh7h/word_going_crazy/;1;"Okay, so I'm editing an info brochure for work in Word, using a Mac.  Every time I make a change and go to save it, the document reverts back to the state it was in when first opened. &#x200B;I've been at it for a good two hours now fiddling with freeform layers deleting them one by one only to have them all reappear when I try to save my work in deleting them.&#x200B;Does anyone have any ideas how to deal with this? I've never heard of a problem like this before.&#x200B;Thanks,Dustin";False;Word Going Crazy..?;https://www.reddit.com/r/MicrosoftWord/comments/azzh7h/word_going_crazy/
1552338274.0;False;azyrhp;True;False;t3_azyrhp;0;False;/r/MicrosoftWord/comments/azyrhp/change_the_default_font_weight_for_the_bold/;1;I use Microsoft Word on a Mac.The typeface I use is Avenir Next, which has multiple weights. However, when I click the bold key in the toolbar (or ⌘B), it converts it to Avenir Next Black, the thickest weight. I prefer it be Avenir Next Demi Bold.Is there a way to set it so that the bold key uses Avenir Next Demi Bold when I hit the bold key? Going into the font settings each time I want to change the weight to demi bold is time consuming.Thanks in advance.;False;Change the default font weight for the bold version of a typeface;https://www.reddit.com/r/MicrosoftWord/comments/azyrhp/change_the_default_font_weight_for_the_bold/
1552331856.0;False;azxgii;True;False;t3_azxgii;1;False;/r/MicrosoftWord/comments/azxgii/can_i_see_changes/;1;Hi, I just got a word document from my boss. the original document is from 14/2, as far as I can see in the file info, but  I can also see that it has been changed 6/3. Is it possible for me to see this change in any way?I dont have the original document;False;Can I see changes?;https://www.reddit.com/r/MicrosoftWord/comments/azxgii/can_i_see_changes/
1552265255.0;False;azmseq;True;False;t3_azmseq;2;False;/r/MicrosoftWord/comments/azmseq/linked_word_variables/;1;"I have a variable that is repeated throughout a document. I would like to code it in such a way that if I change this particular word at one place in the document, it will change all instances of it. (I know I can do it with find/replace, but I'm looking for something more elegant.)&#x200B;Originally, I thought of making the first page of a complex document a ""variable list"" such that I can input the values for each variable in this list, and it populates the rest of the document. Then, if I find out I goofed, I can go back to the variable list, correct it, and it automagically corrects itself.&#x200B;Is this doable?";False;Linked Word variables?;https://www.reddit.com/r/MicrosoftWord/comments/azmseq/linked_word_variables/
1552264072.0;False;azmlcn;True;False;t3_azmlcn;1;False;/r/MicrosoftWord/comments/azmlcn/proper_code_to_make_page_x_of_y_for_a_section/;0;"I have a big document that is really several smaller documents, in sections.&#x200B;Section 1 is 5-6 pages. Section 2 is 2-3, etc. I'd like a footer that would say, ""Page x of y"" where y is the number of pages in that section, not the number pages in the entire document. Is this doable?";False;"Proper code to make ""Page x of y"" for a Section?";https://www.reddit.com/r/MicrosoftWord/comments/azmlcn/proper_code_to_make_page_x_of_y_for_a_section/
1552261467.0;False;azm5mi;False;False;t3_azm5mi;1;False;/r/MicrosoftWord/comments/azm5mi/does_anyone_know_how_to_get_rid_of_these_l_sep/;1;;False;Does anyone know how to get rid of these L Sep boxes in the Mac version of MS word?;https://i.redd.it/io9fsw8rodl21.png
1552256157.0;False;azl86h;True;False;t3_azl86h;0;False;/r/MicrosoftWord/comments/azl86h/word_wont_correct_a_word/;1;I always write a word wrong so it corrects me, i did this because one of my keys broke. Now for absolutely no reason it wont check the misspelled word as wrong and just ignore it.No, it wasnt added to the dictionaryNo, i didnt change languages God, word really makes my blood boil;False;Word wont correct a word.;https://www.reddit.com/r/MicrosoftWord/comments/azl86h/word_wont_correct_a_word/
1552249113.0;False;azjwcw;True;False;t3_azjwcw;1;False;/r/MicrosoftWord/comments/azjwcw/is_there_a_way_to_change_the_window_background/;1;I'm not looking to change the document background color. Is there a way to change the grey color behind the page to a different color like black?;False;Is there a way to change the window background color in Microsoft Word?;https://www.reddit.com/r/MicrosoftWord/comments/azjwcw/is_there_a_way_to_change_the_window_background/
1552192312.0;False;azc5le;True;False;t3_azc5le;0;False;/r/MicrosoftWord/comments/azc5le/will_i_be_able_to_work_on_my_copy_of_word_if_i/;1;I currently enter my win10 with my microsoft account but I want to do it with a local account, will I still be able to work on my word? office is installed on my p.c. will I be asked to sign in with my microsoft account before working on word? thanks. ;False;will I be able to work on my copy of word if I log into my computer using local account and not microsoft account?;https://www.reddit.com/r/MicrosoftWord/comments/azc5le/will_i_be_able_to_work_on_my_copy_of_word_if_i/
1552178745.0;1552179216.0;aza9eu;True;False;t3_aza9eu;0;False;/r/MicrosoftWord/comments/aza9eu/automatic_numbering_not_working/;1;I use Microsoft Word 2010 and up until now, whenever I entered a number (followed by a dot) or a dash, then entered text and press return/enter - the line was automatically indented and in the second line another number or en dash was added. For some reason it stopped working. I googled a lot and nothing works. I have automatic numbering enabled in autocorrect as well as autocorrect when typing tabs. Do you have any ideas what is the reason for this?Edit: I managed to make automatic numbering work by disabling it in both tabs, restaring Word, and then enabling again. But the problem with hypen and en dash persists, and this is the one I am more concerned about.;False;Automatic numbering not working;https://www.reddit.com/r/MicrosoftWord/comments/aza9eu/automatic_numbering_not_working/
1552100705.0;1552101071.0;ayywr3;True;False;t3_ayywr3;0;False;/r/MicrosoftWord/comments/ayywr3/need_help_with_writing_format/;1;"Recently, I was writing a story of mine and I was trying to type in a piece of text that will appear to be corrupted but I don't know how to. I read a few fanfictions online and some of them have this kind of corrupted text and I really want to know to to type texts like that.The type of typing I'm looking for:  Tͨ͗̆͘҉̻͚́h̤̬̔̔ͨ̐̓e̤̠̰̝̠̳͛ͤ͘ͅ ͉̜̤͚̱͕̆͜͝O͋̍ͥ͒̑͆͒̃͡҉̗̙̯͇͍̲̬̗́u̠̣̠̫̗̠̹̘̔ͪ̅̎͐̌́t̷̪̰̬̟̺͍̜̼̉̒s̤̰͐̂̀̕ï̷͈̜̤̆̿͂͢ḏ̬̫̼͈̩͇̱͑ͧ͘͝͠ẻ̩̥̹ͤ͐ͫ̏͛̚r̸͈͙̘̣͛̈̀  .&#x200B;&#x200B;Edit: Nevermind. Just found out from a friend that it's a form of Zalgo text.";False;Need help with writing format.;https://www.reddit.com/r/MicrosoftWord/comments/ayywr3/need_help_with_writing_format/
1552050717.0;False;ayq454;True;False;t3_ayq454;0;False;/r/MicrosoftWord/comments/ayq454/send_an_email_when_a_doc_is_changed_is_this/;1;Is there a program out there that will send am email to a select group when a word doc has been changed or altered?;False;Send an Email when a doc is changed, is this possible?;https://www.reddit.com/r/MicrosoftWord/comments/ayq454/send_an_email_when_a_doc_is_changed_is_this/
1552011727.0;False;aykz3b;True;False;t3_aykz3b;1;False;/r/MicrosoftWord/comments/aykz3b/using_different_versions/;1;If I make a project in one version of Word, and email it to myself and open it on another computer with a different version of Word, will that affect or change anything? Thanks.;False;Using Different Versions;https://www.reddit.com/r/MicrosoftWord/comments/aykz3b/using_different_versions/
1551998831.0;False;ayitqj;True;False;t3_ayitqj;6;False;/r/MicrosoftWord/comments/ayitqj/multilevel_lists_how_do_i_make_them_work/;1;I'm making an MLA outline. I have the level order all set up and such, but how do I actually go down subcategories? If I'm on I., how do I go down to A., or from A. to 1.?I'm using Word 2016 btw;False;Multi-Level Lists: How do i make them work?;https://www.reddit.com/r/MicrosoftWord/comments/ayitqj/multilevel_lists_how_do_i_make_them_work/
