created_utc;edited;id;is_self;locked;name;num_comments;over_18;permalink;score;selftext;spoiler;title;url
1550742608.0;False;at1d57;True;False;t3_at1d57;0;False;/r/MicrosoftWord/comments/at1d57/creating_a_bibliography_ordered_by_numbers_in/;1;Hi! I've used another reference system before but my current supervisor would like me to use the word referencing system.  Is it possible to create a bibliography ordered by numbers? I quite like the editing using citations, but I want my citation to reference a number instead of an author. Is is possible to do this without using endnotes?;False;Creating a bibliography ordered by numbers in Word 2016;https://www.reddit.com/r/MicrosoftWord/comments/at1d57/creating_a_bibliography_ordered_by_numbers_in/
1550727481.0;False;asze16;True;False;t3_asze16;7;False;/r/MicrosoftWord/comments/asze16/help_with_dissertation_formatting/;1;"Hello everyone, I need a little guidance with this program. &#x200B;I'm currently working on my dissertation, and fortunately, my University has a basic template for us to follow in order to keep margins and spacings all lined up. I have been trying to create entries in the table of contents, but for some reason, the program does not register that I'm adding extra chapters. The other things I'm struggling with is the fact that my document seems to have random blank pages throughout. Might anyone be able to help me with this? Thanks! ";False;Help with dissertation formatting;https://www.reddit.com/r/MicrosoftWord/comments/asze16/help_with_dissertation_formatting/
1550726471.0;1550726728.0;asz8cm;True;False;t3_asz8cm;3;False;/r/MicrosoftWord/comments/asz8cm/table_of_figures_disabled_please_help_enable/;1;Hi redditors, I hope you guys can help me. I have MS Office 365 ProPlus. I'm working on a lab report but for some reason the table of figures tab is grayed out, it's disabled. However, I am able to create a table of contents. How do I insert a table of figures!? Pleaseeee help. Thanks!!!https://imgur.com/a/eE2kCRX;False;Table of Figures disabled - Please help enable;https://www.reddit.com/r/MicrosoftWord/comments/asz8cm/table_of_figures_disabled_please_help_enable/
1550693294.0;False;ast14z;True;False;t3_ast14z;5;False;/r/MicrosoftWord/comments/ast14z/help_labels_in_world_doc/;1;Hi folks, I need an advice on a world document I’m working for a project at work. Story is - I have a document that we add shipper labels in alphabetical order (European countries). So this world doc has a table, when I need add a new label image I insert a row and after move label by label to keep it in alphabetical order. I was wondering if three a easier way that I can insert a row, and for example hit enter and get the labels moving all along between 2 columns so I wouldn’t need move each label. Would you be able to advise me ?  Is there a way this can be done on world. The document contains only labels. They are aligned in two columns following alphabetical order.  Can someone help me please? Thank you in advance. ;False;Help - labels in world doc;https://www.reddit.com/r/MicrosoftWord/comments/ast14z/help_labels_in_world_doc/
1550683056.0;False;asqwi6;True;False;t3_asqwi6;0;False;/r/MicrosoftWord/comments/asqwi6/help_creating_letterhead/;1;"I'm trying to create a letterhead template. I need to have fillable forms in the body, as well as the footer, and I need the document protected. On the real document there would be a picture inserted with logo and corporate officers on the top. That's why there's a section break at the top. Right now, on the document I linked I have the ""footer"" text in the body. That would be cool, but when you type in the body that text would flow to the next page. And the problem with putting it in the footer is that you can't put fillable forms in the footer.  We really want the user to be able to tab thru the fields.Anyone know how to lock those fields on that line on the first page at the bottom.I didn't protect the linked doc, but it would need fillable forms protection to protect the layout. I know, I know.  Any help is greatly appreciated. https://drive.google.com/file/d/19s5G2LtFH6nYCpEZoOr2HWAYkpiuqKsa/view?usp=drivesdk";False;Help Creating Letterhead;https://www.reddit.com/r/MicrosoftWord/comments/asqwi6/help_creating_letterhead/
1550651161.0;False;aslwhf;True;False;t3_aslwhf;0;False;/r/MicrosoftWord/comments/aslwhf/making_a_masterdocument_that_holds_the_newest/;1;When adding a subdocument to a master document it creates a copy of the sub. When a change happens in the subdocument it does't change in the master document, because the master only sees the 'old' copy of the subdocument.So, how can I make sure the master document holds the newest version of the subdocument? I have been searching the web for a while and have little experience with macro's and VBA.Thank you for your help.;False;Making a masterdocument that holds the newest version of the subdocument;https://www.reddit.com/r/MicrosoftWord/comments/aslwhf/making_a_masterdocument_that_holds_the_newest/
1550612651.0;False;asfu5x;True;False;t3_asfu5x;1;False;/r/MicrosoftWord/comments/asfu5x/creating_a_macro_using_shift_and_tab/;1;It would seem that TAB and SHIFT are not recordable keys. I know how to Program in C++ and I would prefer to not learn to program the macro in Visual Basic, but I will if I need to.Is there a different way to do this?;False;Creating a Macro using Shift and Tab?;https://www.reddit.com/r/MicrosoftWord/comments/asfu5x/creating_a_macro_using_shift_and_tab/
1550593758.0;False;asc7xp;True;False;t3_asc7xp;3;False;/r/MicrosoftWord/comments/asc7xp/resume_turns_into_2_pages_when_i_save_it_as_a_pdf/;2;"In Microsoft Word my resume is 1 page but when I export it as a PDF (Either the ""best for print"" for ""electronic distribution"" methods) it brings 3 lines onto a second page. Does anyone know how I can fix this?";False;Resume turns into 2 pages when I save it as a PDF;https://www.reddit.com/r/MicrosoftWord/comments/asc7xp/resume_turns_into_2_pages_when_i_save_it_as_a_pdf/
1550592971.0;False;asc2re;True;False;t3_asc2re;3;False;/r/MicrosoftWord/comments/asc2re/can_word_auto_correct_spelling_as_i_type_not_auto/;1;I've enabled autocheck so Word checks my spelling as I type, but is there any way to get it to auto correct the words so I don't need to go back and click to correct?;False;Can Word auto CORRECT spelling as I type (not auto check but CORRECT);https://www.reddit.com/r/MicrosoftWord/comments/asc2re/can_word_auto_correct_spelling_as_i_type_not_auto/
1550538172.0;False;as4hrj;False;False;t3_as4hrj;1;False;/r/MicrosoftWord/comments/as4hrj/my_footnote_get_pushed_to_the_top_of_the_next/;1;;False;My footnote get pushed to the top of the next page. I’m doing an assignment for school and it told me step by step how to do this but somehow my paper ended up wrong. Any solutions before midnight tonight?;https://i.redd.it/8rz6zphjcfh21.jpg
1550527490.0;False;as2plp;True;False;t3_as2plp;6;False;/r/MicrosoftWord/comments/as2plp/cant_delete_second_page/;1;Hey guys, so I'm currently using this resume template found [here](https://www.wallstreetoasis.com/forums/investment-banking-resume-template). In that template, the first page is obviously the resume, while the second page is something I want to remove. However I can't do anything to get rid of the second page even when it is blank - any solutions?;False;Can't delete second page;https://www.reddit.com/r/MicrosoftWord/comments/as2plp/cant_delete_second_page/
1550509754.0;False;arze09;True;False;t3_arze09;3;False;/r/MicrosoftWord/comments/arze09/gaps_between_my_footnotes_how_to_get_rid_of_them/;1;I am using Word 2016, and I am unhappy with the formatting in some work I am doing - there are gaps between my footnotes, causing them to occupy far more space than necessary (to make matters worse, this is inconsistent - some footnotes will squeeze right next to each other, but others will not budge).I have tried searching for a solution, but I can only find old guides, and the interface seems to have changed since then, so these have been fairly useless to me. How can I fix the formatting of the footnotes?Thanks in advance for any help.;False;Gaps between my footnotes - how to get rid of them?;https://www.reddit.com/r/MicrosoftWord/comments/arze09/gaps_between_my_footnotes_how_to_get_rid_of_them/
1550464897.0;False;artc7m;True;False;t3_artc7m;0;False;/r/MicrosoftWord/comments/artc7m/permanent_removal_of_file_properties/;1;I am trying to find a way to remove author and metadata information automatically for all documents without having to run the document inspector each time. I don't think there is a global setting for this but I think there might be a way with a macro or addon or maybe something about creating a special template? Anyone know how to do this? Looking for a Super word nerd here on this one. Hahaha;False;Permanent removal of file properties;https://www.reddit.com/r/MicrosoftWord/comments/artc7m/permanent_removal_of_file_properties/
1550369029.0;False;arfvnw;True;False;t3_arfvnw;3;False;/r/MicrosoftWord/comments/arfvnw/how_to_combine_graphs_with_a_text_box/;1;Hi everybody! I was wondering if there was a way to combine graphs, pictures, tables, etc with a text box? For example, if I make a graph and place a text box underneath to act as a caption, how can I combine the two so that when I want go to move the graph to another area, the text box will automatically follow with? Hopefully this makes sense, and I appreciate any help. ;False;How to combine graphs with a text box?;https://www.reddit.com/r/MicrosoftWord/comments/arfvnw/how_to_combine_graphs_with_a_text_box/
1550351295.0;False;ard2xj;True;False;t3_ard2xj;0;False;/r/MicrosoftWord/comments/ard2xj/how_to_make_a_picture_resize_within_the_margins/;1;so when i insert a picture in word, and i want to make it larger, i drag on the corners of it. but is there a way to resize it but not make it go over my margins that are set? ;False;how to make a picture resize within the margins that are set?;https://www.reddit.com/r/MicrosoftWord/comments/ard2xj/how_to_make_a_picture_resize_within_the_margins/
1550320303.0;False;ar8eih;True;False;t3_ar8eih;3;False;/r/MicrosoftWord/comments/ar8eih/what_chart_smartart_to_use_for_displaying/;1;Hi. I'm listening to an audiobook and the relationships are really complicated. I want to make a simple chart on who loves who and who hates who with boxes and arrows.Thank you;False;What Chart / SmartArt to use for Displaying Relationships?;https://www.reddit.com/r/MicrosoftWord/comments/ar8eih/what_chart_smartart_to_use_for_displaying/
1550241107.0;False;aqx3uv;True;False;t3_aqx3uv;5;False;/r/MicrosoftWord/comments/aqx3uv/productivity_collapse_enumerationbullets_on/;1;"Hi,imo the **best way writing informations/knowledge efficiently is using hierachy enumerations/bullets** (because 1. every knowledge excerpt can be interprted as an hierachy 2. enumeration hierachy makes use of form stressing content principle).You can see in the picture Topic 1, Topic 2, Topic 3. Often the text in subpoints is even longer than now and you have more topic points (much more ""Information"" ).The **problem with this is, that an important thing for understanding is having an overview over things,** that are on a same semantic level (good associative). E.g. later and when you look at the document again or generally when you want to get an overview.**So it would be nice to fold/collape certain bullets, e.g. all bullet of level 1 or 2.**Is there a possibility to do that? I found some features for headings, there you can fold/collapse the content (as you can see in the picture, ""Fasdf""'s content is folded).**So, is this possible directly or using macros?**&#x200B;https://i.redd.it/idodyrm9rqg21.png";False;productivity: Collapse enumeration/bullets on certain levels?;https://www.reddit.com/r/MicrosoftWord/comments/aqx3uv/productivity_collapse_enumerationbullets_on/
1550240682.0;False;aqx1iv;True;False;t3_aqx1iv;5;False;/r/MicrosoftWord/comments/aqx1iv/spellcheck_for_different_languages_on_mac/;1;hey ya’lli can’t figure out what i’m doing wrong, my word doesn’t recognise german words but i’ve set the language to german … i also can’t seem to install a new dictionary or download one, all i’m finding are instructions for what seem to be other versions of word. i’m on a mac os 10.11.16 with word for mac 15.26;False;spell-check for different languages on mac;https://www.reddit.com/r/MicrosoftWord/comments/aqx1iv/spellcheck_for_different_languages_on_mac/
1550234041.0;False;aqw4dt;True;False;t3_aqw4dt;6;False;/r/MicrosoftWord/comments/aqw4dt/whats_the_most_annoying_thing_of_ms_word/;1;;False;What's the most annoying thing of MS Word?;https://www.reddit.com/r/MicrosoftWord/comments/aqw4dt/whats_the_most_annoying_thing_of_ms_word/
1550191345.0;False;aqquvg;True;False;t3_aqquvg;2;False;/r/MicrosoftWord/comments/aqquvg/how_to_change_color_text_without_automatically/;1;"Hi, &#x200B;I want to take notes on lecture notes while my professor is lecturing. However whenever I change to the color I want and click on the next line or paragraph, it reverts back to black and I do not want to click on the font color bucket every single time. how do I do this? I want to have my notes color coded in text and DO NOT WANT TO USE THE COMMENT functionality in word since i find it ugly to look at, hence why I want my notes to be inside the text with the color I want. ";False;How to change color text without automatically reverting to original text color;https://www.reddit.com/r/MicrosoftWord/comments/aqquvg/how_to_change_color_text_without_automatically/
1550159156.0;False;aql2r1;True;False;t3_aql2r1;4;False;/r/MicrosoftWord/comments/aql2r1/i_am_creating_a_training_manual_with_a_table_of/;2;I am creating a large training manual with a table of contents. Each heading is a procedure listed on the table of contents. My issue is while going through and making adjustments to procedures making them longer or shorter, it will ruin the formatting of the rest of the procedures by pushing the content up or down. Also by adding new procedures, it creates a larger table of contents and pushes the rest of the content down, again creating a formatting issue.  I would like each procedure heading to be locked to the top of a page, this way I can easily move them around without messing of the formatting.  Hopefully this makes sense what I am trying to explain. I feel like there is something I need to adjust on page options with spacing to get this to work right. ;False;I am creating a training manual with a table of contents. Is there a way to lock each heading to the top of a page?;https://www.reddit.com/r/MicrosoftWord/comments/aql2r1/i_am_creating_a_training_manual_with_a_table_of/
1550150091.0;False;aqjmms;False;False;t3_aqjmms;2;False;/r/MicrosoftWord/comments/aqjmms/anyone_know_why_the_destination_theme_button_is/;1;;False;Anyone know why the Destination Theme button is missing sometimes?;https://i.redd.it/bu1ke32kajg21.jpg
1550116152.0;False;aqfjj8;True;False;t3_aqfjj8;1;False;/r/MicrosoftWord/comments/aqfjj8/accent_marks_over_consonants/;1;Is there any way to put a standard accent (as in ć) over any other consonant, specifically b and t? I need to create a fictional language for a class project and, ideally, those two letters would exist in my alphabet.;False;Accent Marks Over Consonants?;https://www.reddit.com/r/MicrosoftWord/comments/aqfjj8/accent_marks_over_consonants/
1550103454.0;False;aqdkmc;True;False;t3_aqdkmc;2;False;/r/MicrosoftWord/comments/aqdkmc/formatting_issues_with_mock_congress_bill/;1;Hello, as the title suggests I am creating a mock Congress bill for class. I have already written the entirety of the bill and the only thing that I am having trouble with is creating a numbered column on the left for citation purposes. I will link some examples of what I mean below:<https://static1.squarespace.com/static/54f7f4bee4b0d7e31eb5857c/t/552042d0e4b066aeb4b23f72/1428177616179/BENSH_PMC_2010.pdf><https://www.congress.gov/116/bills/hres109/BILLS-116hres109ih.pdf><https://www.govinfo.gov/content/pkg/BILLS-116hjres37rh/pdf/BILLS-116hjres37rh.pdf>Any help would be greatly appreciated. Have a nice day.;False;Formatting Issues With Mock Congress Bill;https://www.reddit.com/r/MicrosoftWord/comments/aqdkmc/formatting_issues_with_mock_congress_bill/
1550098663.0;False;aqcqwr;True;False;t3_aqcqwr;0;False;/r/MicrosoftWord/comments/aqcqwr/insert_excel_table_into_word_and_have_it_take_up/;1;When I use the 'right click, edit' function, I intend to manually drag the sides of the table to expand it to encompass the entire page. However often it opens the table in Excel instead.   Manually extending the table to view more cells, and take up the entire page is finicky anyway, is there a way to auto fit the table?  P.S. I am using excel for engineering equations for study.;False;Insert Excel table into word and have it take up an entire page.;https://www.reddit.com/r/MicrosoftWord/comments/aqcqwr/insert_excel_table_into_word_and_have_it_take_up/
1550095383.0;False;aqc563;True;False;t3_aqc563;0;False;/r/MicrosoftWord/comments/aqc563/free_word_templates_for_handouts/;1;I need some free Word Templates for handouts.  I'm giving a presentation on the European Middle Ages.  Anything with knights, parchment, and similar things would be useful.  A fair amount of choice would be good.;False;Free Word Templates for handouts?;https://www.reddit.com/r/MicrosoftWord/comments/aqc563/free_word_templates_for_handouts/
1550092812.0;False;aqbnpv;True;False;t3_aqbnpv;1;False;/r/MicrosoftWord/comments/aqbnpv/changing_tab_length/;1;Hello,I received a document I need to format. Everything is straightforward, but for some reason the tab length is super short. I've tried a few different things, but I can't find something that changes the tab lengths to normal.;False;Changing tab length;https://www.reddit.com/r/MicrosoftWord/comments/aqbnpv/changing_tab_length/
1550081997.0;False;aq9m3s;True;False;t3_aq9m3s;1;False;/r/MicrosoftWord/comments/aq9m3s/can_someone_please_help_me_the_layout_on/;1;My Microsoft Word looks like this at the moment: [https://imgur.com/a/5dP6j3Q](https://imgur.com/a/5dP6j3Q)It's appearing as a big white page but I can only write the text on one side. Before I just had A4 white pages on my Microsoft Word with breaks in between each new page and I just want to get back to that setting - any suggestions?;False;Can someone please help me the layout on Microsoft Word?;https://www.reddit.com/r/MicrosoftWord/comments/aq9m3s/can_someone_please_help_me_the_layout_on/
1549938644.0;False;apoa5v;True;False;t3_apoa5v;3;False;/r/MicrosoftWord/comments/apoa5v/basic_question_how_do_i_clear_indent_in_table/;1;"So I am working with table with number. Positive is ""123"" and negative is ""(456)"". Ideally the number should align to the right, and the ""3"" should align with the ""6"" and not the "")"".The idiot predecessor aligns by manually changing the table indent (i.e manually drag the indent so that the ""6"" aligns with ""3"", cell by cell). The problem is this time the negative number ""(456)"" becomes positive ""456"". So now I'm stuck with the 456 looking out of place. And I don't want to be another idiot who drags the indent one by one again.Hence, is there any other way to do this quickly. Thanks alot.";False;Basic question, how do I clear indent in table cells?;https://www.reddit.com/r/MicrosoftWord/comments/apoa5v/basic_question_how_do_i_clear_indent_in_table/
1549932775.0;False;apnd3p;True;False;t3_apnd3p;3;False;/r/MicrosoftWord/comments/apnd3p/can_you_make_index_cards_in_word/;2;So I tried looking it up but I couldn't find anything. Is there a way where I can use the standard printer paper size and divide it into six sections with fronts and backs. Like, printing it out in a way where I can cut it after to make small index cards?;False;Can you make index cards in word?;https://www.reddit.com/r/MicrosoftWord/comments/apnd3p/can_you_make_index_cards_in_word/
1549932747.0;False;apncxd;True;False;t3_apncxd;0;False;/r/MicrosoftWord/comments/apncxd/tips_about_drawing_on_word_with_an_ipad/;2;I take notes using Word mainly in text but sometimes with drawing. I do most of the editing and typing on desktop Word. But for drawing, I'm currently doing this with the Word app on iPad with Apple Pencil (pencil inks), which in a while syncs on OneDrive so that I can continue my work on PC. But this can be quite annoying as it takes a while for pencil inks to appear on my desktop Word. OneDrive sometimes fails to sync as well. The worst thing is that I cannot resize the pencil inks easily on Word. I always need to adjust the size of these pencil inks so it's really annoying. I do this first by selecting EVERY stroke of the inks (as each stroke or even a single dot drawn with a pencil is considered a separate object) and grouping them as one object. It would save some much work if Word had the lasso select too which are available on so many note-taking apps and OneNote but not Word!I'm considering buying a drawing tablet connected to PC but this still doesn't solve the resizing annoyance!;False;Tips about drawing on Word with an iPad?;https://www.reddit.com/r/MicrosoftWord/comments/apncxd/tips_about_drawing_on_word_with_an_ipad/
1549905236.0;False;apifgd;True;False;t3_apifgd;8;False;/r/MicrosoftWord/comments/apifgd/syntax_error_when_using_if_formula_in_table/;1;"As the title implies, I'm having a hard time with this. I've looked this up online but everything keeps coming back to using brackets ""{}"" which doesn't make sense for using the Formula option that's available when I select my table.All I want to do is run an IF(C29=""Yes"", 3.5*500, ""N/A"") formula. Is there something about that formula that doesn't play well in Word's table formatting? Maybe it doesn't handle text and numbers well at the same time?I'm so lost, help!";False;Syntax error when using IF formula in table;https://www.reddit.com/r/MicrosoftWord/comments/apifgd/syntax_error_when_using_if_formula_in_table/
1549887054.0;False;apfnbu;True;False;t3_apfnbu;0;False;/r/MicrosoftWord/comments/apfnbu/making_permanent_changes_to_equations_in_word/;1;"I am writing a lot of equations in Word and it annoys me that every time I am writing an equation the *cursive-*""font"" turns on, and the equation gets ""justify"" adjusted. Is there any way of changing this to it not being in cursive and the alignment to the left? And do it in a permanent way. I use the font Cambria in my regular text so I have no problem with the font in the equations, only these ""minor"" bugs.";False;Making permanent changes to equations in Word;https://www.reddit.com/r/MicrosoftWord/comments/apfnbu/making_permanent_changes_to_equations_in_word/
1549842310.0;False;apa19o;True;False;t3_apa19o;3;False;/r/MicrosoftWord/comments/apa19o/word_applies_chciago_citation_style_incorrectly/;1;"Dear subreddit,  I am writing my thesis, and am supposed to use Chicago citation style. My Word (part of Office 365) now applies a wrong order to the citations in the bibliography.It is supposed to be ""Author Name. Year. *Title of the book.*"" But for some reason, it generates it as ""Author Name. *Title of the book.* Year.""  I event tried replacing the ""CHICAGO.XSL"" in ""Program Files (x86)\\Microsoft Office\\root\\Office16\\Bibliography\\Style"" - received it from a friend of mine where the same version of Word displays it correctly. Does not help in my case unfortunately, still applies the citation style the wrong way.Any ideas ;)? Thanks in advance.";False;Word applies Chciago citation style incorrectly;https://www.reddit.com/r/MicrosoftWord/comments/apa19o/word_applies_chciago_citation_style_incorrectly/
1549777747.0;False;ap1931;True;False;t3_ap1931;2;False;/r/MicrosoftWord/comments/ap1931/how_to_print_all_the_way_to_the_edge_in_microsoft/;1;I want to print a document exactly how it looks on the screen. No white spaces around the page, no resizing. Just exactly how it appears on the screen. I found [this](https://www.xaprb.com/blog/2014/11/01/print-full-bleed-microsoft-word/) helpful website. But I cannot find how to set non-printable area in MS Word 2007 on Windows 7. Kindly Help. Thank You.;False;How to Print All the Way to the Edge in Microsoft Word;https://www.reddit.com/r/MicrosoftWord/comments/ap1931/how_to_print_all_the_way_to_the_edge_in_microsoft/
1549751455.0;False;aoxl0l;True;False;t3_aoxl0l;1;False;/r/MicrosoftWord/comments/aoxl0l/can_i_create_an_infobox_character_template_on_word/;2;I've been wanting to experiment with this for a while, but have been struggling with the idea. An infobox character template are typically used by Wikipedia and wikis to describe certain fictional or real characters like [this](https://en.wikipedia.org/wiki/Template:Infobox_character). ;False;"Can I create an ""Infobox character"" template on Word?";https://www.reddit.com/r/MicrosoftWord/comments/aoxl0l/can_i_create_an_infobox_character_template_on_word/
