created_utc;edited;id;is_self;locked;name;num_comments;over_18;permalink;score;selftext;spoiler;title;url
1551211163.0;False;av3spx;False;False;t3_av3spx;0;False;/r/Slack/comments/av3spx/slack_fanboy_reads_tweets_about_new_slack_logo/;2;;False;Slack fanboy reads tweets about new Slack logo;https://www.youtube.com/watch?v=Z__KkKo0ilA&feature=youtu.be
1551129667.0;False;auqjf1;True;False;t3_auqjf1;2;False;/r/Slack/comments/auqjf1/dark_mojave_theme_for_the_desktop_app/;9;Easy to run the dark theme on desktop Slack app with npx command to do it automatically[https://github.com/elv1n/slack-dark-mojave-theme](https://github.com/elv1n/slack-dark-mojave-theme);False;Dark Mojave Theme for the desktop App;https://www.reddit.com/r/Slack/comments/auqjf1/dark_mojave_theme_for_the_desktop_app/
1551113565.0;False;auncn3;True;False;t3_auncn3;4;False;/r/Slack/comments/auncn3/what_slack_chanels_do_you_guys_find_are_really/;6;Anything that is fun & engaging?! Like, #movieclub #bookclib #watercooler #randomIm on the culture committee and looking for ideas to help our remote team stay engaged and fun :) ;False;What Slack #chanels do you guys find are really fun for your employees?;https://www.reddit.com/r/Slack/comments/auncn3/what_slack_chanels_do_you_guys_find_are_really/
1551140031.0;False;ausgne;True;False;t3_ausgne;4;False;/r/Slack/comments/ausgne/question_running_slack_in_chrome_is_there_any_way/;1;Hey all,Im running Slack in Chrome, and one thing I've run into recently is that it limits you to 12 direct/group message slots and removes them as you ad more. now that we added more employees, im having to re-add users and groups. Any way to expand that?Thanks in advance!;False;[Question] Running slack in Chrome, is there any way to have it show more than 12 direct message contacts?;https://www.reddit.com/r/Slack/comments/ausgne/question_running_slack_in_chrome_is_there_any_way/
1551112272.0;False;aun3wv;True;False;t3_aun3wv;2;False;/r/Slack/comments/aun3wv/simple_todo_list_app/;2;I'm looking for a very straight forward todo list app that will prompt new members with a list of ToDo's.  It will be 5 or so line items that each user can check off as they complete them.  My search is bringing me to apps that seem overly complicated for this task (Workast) or isn't in line with our service policy.  Any recommendations appreciated.;False;Simple todo list app?;https://www.reddit.com/r/Slack/comments/aun3wv/simple_todo_list_app/
1551124372.0;False;auph9h;True;False;t3_auph9h;1;False;/r/Slack/comments/auph9h/will_the_screensharing_for_the_slack_linux_client/;1;"Hello,&#x200B;we ware that close to use slack as substitute for hangous or skyke in our company, until we notices a tiny detail that turned out to be a major blocker: we use screensharing a lot in our meetings, and as we all have 2, sometomes 3 monitors, it's vital that i am able to share only 1 monitor that i choose, and not all 3 simultanously. Image 3 Full HD Screen shared at once. Yes, thats useless. In hangouts i can even choose which Windos to share. The Slack Windows Client offers this possibility  to some extenx as well, but not the Linux client. So, asking the slack team, they know about it, and yes, it's on their roadmap, but they wouldn't say until when this will work. Could be next month, next year or never. So, question is: what do you think about the slack development? Do they generally care about such things or is expanding the userbase more important and the small bunch of linus geeks will be left with this crappy half assed screensharing thingy? Thanks for sharing your opinion. Cheers! ";False;Will the screensharing for the Slack Linux client ever be fixed?;https://www.reddit.com/r/Slack/comments/auph9h/will_the_screensharing_for_the_slack_linux_client/
1551122179.0;False;aup1uf;True;False;t3_aup1uf;4;False;/r/Slack/comments/aup1uf/best_way_to_use_slack_as_a_freelancer/;1;I'm a total slack n00b, and i'm worried that adding my clients to my slack will allow them to converse with each other.  I just want each client in their own place.  What's the easiest way to do that?  Aside from getting invites to all of their channels (some of which cannot invite me because they aren't in their companies IT dept).;False;Best way to use slack as a freelancer?;https://www.reddit.com/r/Slack/comments/aup1uf/best_way_to_use_slack_as_a_freelancer/
1551089951.0;False;aujqdu;True;False;t3_aujqdu;5;False;/r/Slack/comments/aujqdu/slack_notification_issue/;4;"So i recently got my entire team on slack and the biggest challenge has been to turn on notifications on each device and most of the time they are unable to receive timely notification of messages that we send each other on the channel.Receiving notifications is the most crucial thing and why not  automatically default to allow all notifications / ask the user while entering the workspace to specifically mention all the required setting for notifications.&#x200B;";False;Slack notification issue;https://www.reddit.com/r/Slack/comments/aujqdu/slack_notification_issue/
1551116225.0;False;aunv7b;True;False;t3_aunv7b;7;False;/r/Slack/comments/aunv7b/external_guest_access_after_deleting_workspace/;0;We are planning to deactivate our users and delete our workspace. We have one user who is a guest of another Slack workspace. When we deactivate his account and delete our workspace will his existing business email address be able to receive an invite to the guest workspace? Is there a better way to handle this?;False;External guest access after deleting workspace;https://www.reddit.com/r/Slack/comments/aunv7b/external_guest_access_after_deleting_workspace/
1551115600.0;False;aunqty;True;False;t3_aunqty;11;False;/r/Slack/comments/aunqty/i_need_a_suggestion_for_a_bot/;1;So i want a bot that can send a message every 15 minutes. Does anybody knows one? ;False;I need a suggestion for a bot;https://www.reddit.com/r/Slack/comments/aunqty/i_need_a_suggestion_for_a_bot/
1551089806.0;1551164578.0;aujpu5;True;False;t3_aujpu5;12;False;/r/Slack/comments/aujpu5/annoying_red_badges_for_other_slack_team/;2;"So let's assume I'm working on project #1&#x200B;And then project #2 starts spamming me and I see red slack badges everywhere and I'm forced to read what project #2 is spamming to me.&#x200B;Any solution to this to only show red badges for current project ?&#x200B;&#x200B;[Issue](https://i.redd.it/4zb0m9v53vi21.png)";False;Annoying red badges for other slack team.;https://www.reddit.com/r/Slack/comments/aujpu5/annoying_red_badges_for_other_slack_team/
1551086828.0;False;aujda0;True;False;t3_aujda0;4;False;/r/Slack/comments/aujda0/no_notifications_from_slack_on_samsung_galaxy_s7/;1;On my Samsung Galaxy s7 I get no notifications from Slack when the app is closed.It's like it's not running in the background. Only when the app is in the front, I get the notifications.I tried following the steps [here](https://get.slack.help/hc/en-us/articles/360001559367-Troubleshoot-Slack-notifications), I tried searching if I have an app for battery optimization, and searching through the settings menus. Nothing helps.I do get notifications from other apps, like WhatsApp.Did it happen to anyone?;False;No notifications from slack on Samsung Galaxy s7;https://www.reddit.com/r/Slack/comments/aujda0/no_notifications_from_slack_on_samsung_galaxy_s7/
1550991645.0;1550992577.0;au5i0h;True;False;t3_au5i0h;3;False;/r/Slack/comments/au5i0h/another_tool_to_help_remove_slack_messages/;10;Hi everyone. I'd like to share a tool I recently wrote to help delete my own messages on a slack workspace. I was successfully able to use [slack-cleaner](https://github.com/kfei/slack-cleaner) to remove older files, and older messages from a number of channels,. However, I found slack-cleaner to be bit painful to discover which channels to remove messages from, and it doesn't do much to retry on failures.To solve the first issue, slack's search is pretty useful for finding messages prior to a certain date for a given user.  So after a little bit of coding and testing, I've made my tool available which should be able to run in the background and clean up any old messages of yours.If you think this might be useful to you, give `deslackify` a go, and please let me know what you think:https://github.com/bboe/deslackifyIt requires python to run, can be installed via `pip install deslackify`, and then run via:    deslackify --token TOKEN --before YYYY-MM-DD USERNAMEFor example, if I wanted to delete all my messages prior to 2018 I could run it via:    deslackify --token TOKEN --before 2018-01-01 bboeThanks!;False;Another tool to help remove slack messages;https://www.reddit.com/r/Slack/comments/au5i0h/another_tool_to_help_remove_slack_messages/
1550784926.0;False;at8st3;True;False;t3_at8st3;3;False;/r/Slack/comments/at8st3/i_wonder_if_theres_an_employee_at_slack_whos_sole/;12;;False;I wonder if there's an employee at Slack who's sole responsibility is to reply to tweets / questions on reddit about dark mode.;https://www.reddit.com/r/Slack/comments/at8st3/i_wonder_if_theres_an_employee_at_slack_whos_sole/
1550780738.0;False;at7yyn;True;False;t3_at7yyn;8;False;/r/Slack/comments/at7yyn/is_there_a_night_mode_option_for_slack/;7;;False;Is there a night mode option for Slack?;https://www.reddit.com/r/Slack/comments/at7yyn/is_there_a_night_mode_option_for_slack/
1550762578.0;False;at4bt2;False;False;t3_at4bt2;2;False;/r/Slack/comments/at4bt2/is_slack_hipaa_compliant/;6;;False;Is Slack HIPAA Compliant?;https://www.hipaanswers.com/is-slack-hipaa-compliant/
1550775600.0;False;at6xy2;True;False;t3_at6xy2;4;False;/r/Slack/comments/at6xy2/slack_on_apple_tv/;2;Any options out there to monitor Slack on an Apple TV?  My office has a large TV and would like to monitor Slack channels, DMs etc.;False;Slack on Apple TV;https://www.reddit.com/r/Slack/comments/at6xy2/slack_on_apple_tv/
1550769249.0;False;at5nct;False;False;t3_at5nct;2;False;/r/Slack/comments/at5nct/trouble_with_slack_notifications_ios_120/;1;;False;Trouble with Slack Notifications iOS 12.0;https://imgur.com/a/amrYZxZ
1550618941.0;False;asgylw;False;False;t3_asgylw;5;False;/r/Slack/comments/asgylw/my_bosss_dedicated_slack_keyboard/;59;;False;My boss’s dedicated Slack keyboard;https://i.redd.it/oxsmiinp0mh21.jpg
1550628358.0;False;asiitj;True;False;t3_asiitj;1;False;/r/Slack/comments/asiitj/slack_app_learning_resources/;3;"infrastructure novice developer here and new to slack apps. Process I'm hoping to achieve is as follows:\- user enters slash command in slack with a variable\- slack calls third party internal api and uses the variable in part of the query\- information is then presented back to user in slack&#x200B;The idea is our help desk gets a call and wants to us to check something. We then manually log in and verify health. I'd like to instead provide the hd with self service options but I am having a hard time finding any documentation that explains how to do this in Slack.  I'm finding a lot that explains how to send messages/alerts/etc. to slack, but not much where the user runs a command from slack and information is provided. ";False;slack app learning resources;https://www.reddit.com/r/Slack/comments/asiitj/slack_app_learning_resources/
1550588715.0;False;asbbpn;True;False;t3_asbbpn;5;False;/r/Slack/comments/asbbpn/am_i_the_only_one_who_thinks_slack_isnt_that_great/;8;"Interesting proposition [in this article](https://guild.co/blog/am-i-on-the-only-one-who-thinks-slack-isnt-that-great/) by Ashley Friedlein: *""Slack, valued at $7.1bn at its last fundraising last August, announced this week that it plans to go public with a direct listing (like Spotify did).**Slack recently said it has more than 10 million daily active users in 150 countries. Slack is beloved in particular with start-ups and even more particularly with remote working dev teams.**So am I the only one who doesn't quite fully 'get it'?""*";False;Am I the only one who thinks Slack isn't that great?;https://www.reddit.com/r/Slack/comments/asbbpn/am_i_the_only_one_who_thinks_slack_isnt_that_great/
1550598886.0;False;asd7gs;True;False;t3_asd7gs;0;False;/r/Slack/comments/asd7gs/getting_duplicate_notifications_on_android_app/;1;I turned on notifications on my phone in case I'm away from my Mac, but now I'm getting a notification sound and temporary visual notification on my phone for every message I get in Slack that already shows on my Mac...If my Mac screen is on and Slack is running, I want the notifications there, not on my phone.If my Mac screen is off, even with the Slack app running, I want audible and visible notifications to my phone, and a notification badge of number of still-unread on the Mac app icon.I'm not seeing how to configure this.;False;Getting duplicate notifications on Android app while Mac app is open;https://www.reddit.com/r/Slack/comments/asd7gs/getting_duplicate_notifications_on_android_app/
1550595078.0;False;ascgns;True;False;t3_ascgns;5;False;/r/Slack/comments/ascgns/video_calls_never_work_for_me_what_am_i_doing/;1;Every single time I try to have a video call with someone, the video doesn't work on my end. I can see and hear the other person, and they can usually hear me, but they can't see me. The thing just keeps spinning and loading forever and ever and the video part never works. I've googled it and I've read all of the troubleshooting stuff on their site but I still cannot figure it out. Everything looks like it's set up the right way and it just makes no sense. Has anyone else had this problem and were you able to resolve it? I just don't know what to do.;False;"Video calls never work for me; what am I doing wrong?";https://www.reddit.com/r/Slack/comments/ascgns/video_calls_never_work_for_me_what_am_i_doing/
1550514003.0;False;as06kj;True;False;t3_as06kj;1;False;/r/Slack/comments/as06kj/potential_slack_scam/;10;"I typed in the domain for a slack group but I left out the ""m"" in com. It took me to some weird website that tried getting me to add it as an extension. Just thought I'd warn people just in case this was some sort of scam. Upon trying a second time I now can't access it.";False;Potential Slack scam;https://www.reddit.com/r/Slack/comments/as06kj/potential_slack_scam/
1550515179.0;False;as0ewp;True;False;t3_as0ewp;1;False;/r/Slack/comments/as0ewp/fill_out_forms_database_in_slack_access_them/;2;"Here is the situation.&#x200B;Team is on Slack.&#x200B;Entire team goes to site, takes inventory involving 4 text questions and 4 picture uploads.Team then returns to site later and needs to access the data again.&#x200B;Ideally the the form/database is also stored in GDrive .  Doesn't need to bee updated, just stored once the form is created.&#x200B;I've seen mission, google sheets, etc but I was envisioning something along the lines of a script that uploads all the files when a certain phrase is used.&#x200B;";False;Fill Out Forms / Database in Slack & Access Them Lateer;https://www.reddit.com/r/Slack/comments/as0ewp/fill_out_forms_database_in_slack_access_them/
1550493262.0;False;arwsvs;True;False;t3_arwsvs;4;False;/r/Slack/comments/arwsvs/what_chat_services_that_can_replace_email/;1;I like Slack but it's for company only. I would like to have a chat service that can replace emails. Skype? Discord? The nice thing of emails is that you can have formatting.;False;What chat services that can replace email?;https://www.reddit.com/r/Slack/comments/arwsvs/what_chat_services_that_can_replace_email/
1550245980.0;False;aqxwuz;False;False;t3_aqxwuz;4;False;/r/Slack/comments/aqxwuz/dark_theme_powershell_script/;4;;False;Dark Theme Powershell Script;https://adminscriptbank.wordpress.com/2019/02/15/ps-dark-theme-for-slack/
1550271987.0;False;ar2hhk;True;False;t3_ar2hhk;1;False;/r/Slack/comments/ar2hhk/force_users_to_fill_out_some_fields_of/;1;"What I'm imagining is maybe you have two fields of information that interests you in a particular thread. For example (1) Issue type (2) Location. You can make a new thread with whatever sentence you want of course, but also, slack won't allow you to post without you first filling these two things out. Anything like this?&#x200B;&#x200B;";False;Force users to fill out some fields of information before creating a new thread on a channel?;https://www.reddit.com/r/Slack/comments/ar2hhk/force_users_to_fill_out_some_fields_of/
1550246116.0;False;aqxxpi;True;False;t3_aqxxpi;2;False;/r/Slack/comments/aqxxpi/how_should_i_snooze_notification_on_macbook/;3;"&#x200B;https://i.redd.it/7zxyoeo28rg21.png";False;how should i snooze notification on macbook?;https://www.reddit.com/r/Slack/comments/aqxxpi/how_should_i_snooze_notification_on_macbook/
1550204170.0;False;aqsq6r;False;False;t3_aqsq6r;4;False;/r/Slack/comments/aqsq6r/slack_competitor_mattermost_raises_20_million/;12;;False;Slack Competitor Mattermost Raises $20 Million;https://techstartups.com/2019/02/11/slack-competitor-mattermost-raises-20-million-bring-team-collaboration-messaging-security-conscious-enterprises/
1550169126.0;False;aqmwkt;True;False;t3_aqmwkt;3;False;/r/Slack/comments/aqmwkt/automatic_reply_to_sender_if_someone_posts_in_a/;3;Hello Slackers, I tried to research this question on google and this sub but couldn’t find an answer. I am subscribed to a channel (let’s call it X) and I want, whenever any user sends a public message in that channel, for me to send them an automatic personal message (not visible to entire thread). Is that feasible? Thanks;False;Automatic reply to sender if someone posts in a channel that I am subscribed to;https://www.reddit.com/r/Slack/comments/aqmwkt/automatic_reply_to_sender_if_someone_posts_in_a/
1550159555.0;False;aql5cu;True;False;t3_aql5cu;7;False;/r/Slack/comments/aql5cu/slack_bot_repeater/;2;Anyone know where I can find a tutorial or guide on bot creation. We're looking for what I hope is something simple, just need a bot to listen to one channel and repost all messages to another;False;Slack Bot Repeater;https://www.reddit.com/r/Slack/comments/aql5cu/slack_bot_repeater/
1550099506.0;False;aqcwgf;True;False;t3_aqcwgf;6;False;/r/Slack/comments/aqcwgf/slack_bot_sends_scheduled_messages_to_channels/;3;I’m trying to build a slack bot that sends messages to channels that are scheduled. Kind of like ‘/remind’ but from my own slack bot. I have written my both in python but I am having trouble using slack client or slacker modules because their reminders.add methods do not take a bot token. Is there any way to get around that?;False;Slack Bot Sends Scheduled Messages to Channels;https://www.reddit.com/r/Slack/comments/aqcwgf/slack_bot_sends_scheduled_messages_to_channels/
1550081057.0;False;aq9fpa;True;False;t3_aq9fpa;1;False;/r/Slack/comments/aq9fpa/help_post_local_server_paths_in_slack/;3;"Is there a way to post a clickable file path to network locations in Slack?  Over Mattermost app we are able to send links such as ""file:///Volumes/Server/Job/filename.ext"" but I can't figure out how to make links except for urls in Slack.";False;[help] post local server paths in Slack?;https://www.reddit.com/r/Slack/comments/aq9fpa/help_post_local_server_paths_in_slack/
1550065371.0;False;aq6pf5;True;False;t3_aq6pf5;1;False;/r/Slack/comments/aq6pf5/screen_sharing_on_linux_mint_with_dual_monitor/;3;I can screen share but both screens are visualized at the same time and you can't see a shit. Why I don't have the option to choose which screen to share the same way as it's on windows (and macos i guess) ?;False;Screen sharing on Linux Mint with dual monitor;https://www.reddit.com/r/Slack/comments/aq6pf5/screen_sharing_on_linux_mint_with_dual_monitor/
1550071650.0;False;aq7owv;True;False;t3_aq7owv;7;False;/r/Slack/comments/aq7owv/app_integration_question/;1;Looking at some apps, specifically a chess bot to play with a colleague. Wondering if all users and members of our work community would see that the chess app has been installed? Is there a way to keep it private between two colleagues. Don’t wanna hear the “you should be working at work” speech either. Just answer the question lol Thanks!!! ;False;App integration question;https://www.reddit.com/r/Slack/comments/aq7owv/app_integration_question/
1549985322.0;False;apug2d;True;False;t3_apug2d;1;False;/r/Slack/comments/apug2d/send_all_users_an_individual_message_from_a/;3;"Hey,   I got a request from a coworker to send out a anonymous message to all users with a new brand teaser video in a individual message on Slack. Anyone have any ideas how to do this without using a general channel and tagging [@everyone](https://www.reddit.com/user/everyone)? Like an app or using slackbot or something, we have admin rights!&#x200B;Thanks!";False;Send all users an individual message from a Slackbot?;https://www.reddit.com/r/Slack/comments/apug2d/send_all_users_an_individual_message_from_a/
1549972900.0;False;apsmy7;True;False;t3_apsmy7;11;False;/r/Slack/comments/apsmy7/why_i_am_getting_all_the_time_channel_not_found/;6;"Hi, &#x200B;I am having some tests like: &#x200B;`curl -X POST -H 'Authorization: Bearer xoxp-000000000000-000000000000-000000000000-ffffffffffffffffffffffffffffffff' \``-H 'Content-type: application/json' \`   `--data '{""channel"":""XXXXXXXXX""}'` [`https://slack.com/api/channels.info`](https://slack.com/api/channels.info)And always returning: `{""ok"":false,""error"":""channel_not_found"",""warning"":""missing_charset"",""response_metadata"":{""warnings"":[""missing_charset""]}}`&#x200B;&#x200B;and I checked the channels using different api as **chat.postMessage** and its finding the same channel without any problem, but some methods are just not working. Any of you did find the same issue????? Don't understand why is happening this, I tried Public and Private channels with the same result. &#x200B;Thanks very much&#x200B;";False;Why I am getting all the time channel_not_found when trying channels.info;https://www.reddit.com/r/Slack/comments/apsmy7/why_i_am_getting_all_the_time_channel_not_found/
1549981383.0;False;apttdt;True;False;t3_apttdt;0;False;/r/Slack/comments/apttdt/busylight_for_slack/;3;Anyone know if you can get something like this: https://www.busylight.com/en/ that is compatible with slack? Also, has to work on MacOS. Thanks;False;BusyLight for Slack;https://www.reddit.com/r/Slack/comments/apttdt/busylight_for_slack/
1549943509.0;False;app16e;True;False;t3_app16e;4;False;/r/Slack/comments/app16e/why_does_every_slack_workplace_need_a_password/;4;"I'm new to Slack and I joined two workplaces, and I was surprised to see that I had to enter my ""Full name"" and a new password for each workplace. Does anyone know why joining a workplace requires you to do that? Just trying to figure out how it works.";False;Why does every Slack workplace need a password?;https://www.reddit.com/r/Slack/comments/app16e/why_does_every_slack_workplace_need_a_password/
1549913329.0;False;apjxn9;False;False;t3_apjxn9;0;False;/r/Slack/comments/apjxn9/custom_slash_command_integration_demo_with_a/;3;;False;Custom slash command integration demo with a visual builder;https://pipegears.com/slack-slash-integration/
1549906429.0;False;apinam;True;False;t3_apinam;3;False;/r/Slack/comments/apinam/how_do_i_get_also_sent_to_the_channel_for_my/;1;"&#x200B;https://i.redd.it/tmew6egy5zf21.png";False;"how do I get ""also sent to the channel"" for my replies?";https://www.reddit.com/r/Slack/comments/apinam/how_do_i_get_also_sent_to_the_channel_for_my/
1549664575.0;False;aolvf3;True;False;t3_aolvf3;0;False;/r/Slack/comments/aolvf3/small_inventory_tracking_bot/;4;Hi guys. I was wondering if there is any bot or easy solution for the following: my coworkers and I want to set up somewhat of a mini marketplace where we can buy and sell clothes from each other. If somebody posts an available item people can comment below that they’re interested. Id love to find out if there was a bot that consolidates all the items that are still available and can be marked off once somebody buys it. Is there any easy solution? ;False;Small inventory tracking bot;https://www.reddit.com/r/Slack/comments/aolvf3/small_inventory_tracking_bot/
1549659528.0;False;aol10e;True;False;t3_aol10e;2;False;/r/Slack/comments/aol10e/logging_volunteer_hours/;6;"Hey folks, got a slack team set up, but I need some (very simple) way of being able to log the volunteers my volunteers work. It isn’t specifically related to a project as such, so finding it hard to find an app which will be useful. Basically; I want to set up a channel, with a spreadsheet like page, where the volunteers can log their own hours, if possible it would be amazing if that data could be rounded up weekly or something by a bot. Thanks. ";False;Logging volunteer hours;https://www.reddit.com/r/Slack/comments/aol10e/logging_volunteer_hours/
1549656534.0;False;aokica;True;False;t3_aokica;3;False;/r/Slack/comments/aokica/how_to_setup_daily_email_digest_from_one_channel/;3;"I'm trying to create a daily email digest of messages from one channel but the email settings seem to only be once every 15min and once an hour.&#x200B; Here's my use case: I'm a graduate student and our department uses Slack for lots of things.  Our lab has about 10 different channels for different projects and one of them is called *labname-general.* This channel averages about 2-3 messages a day and nothing is super time critical.  My advisor never remembers to check slack (it's just not a high enough priority and return on time).  I want to be able to send a daily digest of all messages on this channel via e-mail (My advisor comes from a world where everything is email).&#x200B;For now I'll try the 1hour approach - but him seemed hesitant to have something email him that often. &#x200B;";False;[How To] Setup daily email digest from one channel;https://www.reddit.com/r/Slack/comments/aokica/how_to_setup_daily_email_digest_from_one_channel/
