created_utc;edited;id;is_self;locked;name;num_comments;over_18;permalink;score;selftext;spoiler;title;url
1549651813.0;False;aojp05;True;False;t3_aojp05;0;False;/r/Slack/comments/aojp05/create_your_own_classification_bot_on_slack/;2;My first experience on creating bot on Slack. Read on[https://prakhartechviz.blogspot.com/2019/01/slack-bot-image-classifier.html](https://prakhartechviz.blogspot.com/2019/01/slack-bot-image-classifier.html);False;Create your own classification bot on Slack;https://www.reddit.com/r/Slack/comments/aojp05/create_your_own_classification_bot_on_slack/
1549647172.0;False;aoivmx;True;False;t3_aoivmx;5;False;/r/Slack/comments/aoivmx/multiple_emoji_reactions/;0;I'm curious to understand why Slack allows multiple [emoji reactions](https://get.slack.help/hc/en-us/articles/206870317-Emoji-reaction) from a single person on a message? From a user perspective, does this feature solve anything or just a cool/fun thing to have in business communication? Also, by allowing a Slack user to react with more than one emoji reaction, does it not nullify the purpose of getting/analyzing feedback to that message? Please share your feedback/thoughts on this! TIA ;False;Multiple Emoji Reactions;https://www.reddit.com/r/Slack/comments/aoivmx/multiple_emoji_reactions/
1549551979.0;False;ao4mpk;True;False;t3_ao4mpk;3;False;/r/Slack/comments/ao4mpk/slackbotemojis_in_only_one_channel/;2;Is it possible to restrict emojis or automated Slackbot responses to only one channel?;False;Slackbot/Emojis in only one channel?;https://www.reddit.com/r/Slack/comments/ao4mpk/slackbotemojis_in_only_one_channel/
1549529429.0;False;ao1sp6;True;False;t3_ao1sp6;2;False;/r/Slack/comments/ao1sp6/email_rebound_in_slack/;2;"I've set up the ""bring emails into slack"" free feature, and it keeps rebounding between my email and Slack ad infinitum:email is redirected => slackbot shows notification => *if message not read*, Slack sends email => email is redirected => etcI haven't found a way to stop slackbot from sending emails... any ideas?I suppose I could add a filter in my email that removes those slackbot emails, but to me that would be the last resort.";False;Email rebound in Slack;https://www.reddit.com/r/Slack/comments/ao1sp6/email_rebound_in_slack/
1549515486.0;1549516127.0;ao0654;True;False;t3_ao0654;8;False;/r/Slack/comments/ao0654/who_can_read_private_messages_and_dms_in/;3;I get that IT can have access to DMs and private messages - that is the job of IT.Are you a slack admin that can access private messages? Or history?What enterprise slack user roles allow for these permissions?There are some non-IT people that have access to implement plug-ins and I suspect they have access to my private message history but are workspace owners. I don't abuse slack and I don't want to be paranoid.I don't think its fair if a peer has access to your private messages and they are not in IT. They have an advantage because they can basically spy on you, steal your ideas, etc.(edit: punctuation and clarification);False;Who can read private messages and DMs in enterprise slack?;https://www.reddit.com/r/Slack/comments/ao0654/who_can_read_private_messages_and_dms_in/
1549463574.0;False;anr976;True;False;t3_anr976;4;False;/r/Slack/comments/anr976/slack_and_offline_desktop/;3;Hi all, we are deciding on Teams vs Slack where I work. I was wondering if Slack has any desktop offline support, and/or at least for the mobile apps is there something similar? Thanks! ;False;Slack and offline desktop?;https://www.reddit.com/r/Slack/comments/anr976/slack_and_offline_desktop/
1549454939.0;False;anq2pz;True;False;t3_anq2pz;3;False;/r/Slack/comments/anq2pz/what_is_your_favourite_appintegration_in_slack/;3;I'm trying to optimize it for a team of 15 and browsing all the apps. Does anything stand out for you?;False;What is your favourite app/integration in slack, and why?;https://www.reddit.com/r/Slack/comments/anq2pz/what_is_your_favourite_appintegration_in_slack/
1549459781.0;False;anqpa3;True;False;t3_anqpa3;2;False;/r/Slack/comments/anqpa3/getting_a_notification_when_a_specific_user_posts/;1;I'm new to slack so I'm not sure if this is possible. Basically I'm in a large group, and we have a head person who posts infrequently in various channels. This head person's posts are usually pretty important. Is there any way to get a notification badge whenever they post in a channel?;False;Getting a notification when a specific user posts?;https://www.reddit.com/r/Slack/comments/anqpa3/getting_a_notification_when_a_specific_user_posts/
1549409910.0;False;ankakx;True;False;t3_ankakx;0;False;/r/Slack/comments/ankakx/slack_moderation_for_open_communities/;6;"Hey, since there have been a few waves of attackers spamming Slack communities, we have released an open-source bot to allow you to quickly respond to bad actors. Using this project, you can quickly create rules that monitor your channels and automatically delete messages and block users when they behave badly.&#x200B;In time we hope to use this project to allow Community Admins to have more advanced options such as disabling file sharing for new users and allowing specific people more granular permissions.&#x200B;Check out the project here:[https://github.com/foqal/slack-moderator](https://github.com/foqal/slack-moderator)&#x200B;";False;Slack Moderation for Open Communities;https://www.reddit.com/r/Slack/comments/ankakx/slack_moderation_for_open_communities/
1549405473.0;False;anjjkf;True;False;t3_anjjkf;1;False;/r/Slack/comments/anjjkf/how_to_type_tildes/;2;In Slack, how can I make tildes appear in a message without triggering the strikethrough formatting? I want actual tilde characters to show up (\~like this\~ , ~~but not like this~~ ). I tried typing two tildes and also escaping with a backtick... The backtick kindof worked in that it supressed the strikethrough, but then the backtick was visible.;False;How to type tildes?;https://www.reddit.com/r/Slack/comments/anjjkf/how_to_type_tildes/
1549403964.0;False;anj9z6;True;False;t3_anj9z6;6;False;/r/Slack/comments/anj9z6/email_to_slack/;1;Can you email into a specific channel rather than just to Slackbot?;False;Email to slack;https://www.reddit.com/r/Slack/comments/anj9z6/email_to_slack/
1549371210.0;False;andt22;True;False;t3_andt22;7;False;/r/Slack/comments/andt22/autoposting_articleblogreddit_posts_to_a_private/;4;Basically, I am trying to make Slack my default news/RSS reader. Is there a way Slack will automatically post article/blog/Reddit links to a private channel as they go live? Any app would do.;False;Auto-posting article/blog/Reddit posts to a private channel?;https://www.reddit.com/r/Slack/comments/andt22/autoposting_articleblogreddit_posts_to_a_private/
1549395929.0;False;anhvml;True;False;t3_anhvml;2;False;/r/Slack/comments/anhvml/slack_app_for_editorstracking_articles/;1;I'm the (brand new) chief editor for a startup and currently manage six content writers. Looking for a Slack compatible app that will allow people to create an article with a start date and due date, allow me to edit and if possible, allow me and the writer to track it through the entire publishing process. Boss is looking for a freemium service and recommended looking into Asana. Any suggestions?Thank you!;False;Slack App for Editors/Tracking Articles?;https://www.reddit.com/r/Slack/comments/anhvml/slack_app_for_editorstracking_articles/
1549331197.0;1549349887.0;an934z;True;False;t3_an934z;8;False;/r/Slack/comments/an934z/slack_ios_notifications_spontaneously_disappear/;6;I have repeatedly caught Slack for iOS red-handed: Slack notifications frequently disappear from the lock screen/notifications area without me clearing them or opening the app. This usually happens within a few seconds. Most of the time I hear the notification sound, and then by the time I look at the lock screen the notification has disappeared. Obviously if I miss the sound, this means I miss the message.A couple of times I have been watching the lock screen as a notification comes in. I see the notification appear and then clear itself after a couple of seconds without any input from me.Yesterday I even experienced a soundless notification. I was using a headset, and I heard the faint pop of the iOS audio subsystem coming online, but no sound played. When I checked the lock screen there was no notification. A minute later I looked in slack, and sure enough, there was a minute old message there which I would have missed.Do any other iOS users experience this? My experiences with Slack support have been positive, but I haven't tried them on this one because I have no way to consistently replicate the issue. It's frustratingly random.EDIT: Just experienced another incident like the last one I mentioned. It literally cut the notification tone short. Only the first third of the sound played, no notification visible, what the hell???;False;Slack iOS Notifications Spontaneously Disappear;https://www.reddit.com/r/Slack/comments/an934z/slack_ios_notifications_spontaneously_disappear/
1549310574.0;False;an5mlu;False;False;t3_an5mlu;0;False;/r/Slack/comments/an5mlu/slack_confidentially_files_to_go_public/;18;;False;Slack confidentially files to go public;https://www.cnbc.com/2019/02/04/slack-confidentially-files-to-go-public.html
1549326844.0;False;an8f54;True;False;t3_an8f54;5;False;/r/Slack/comments/an8f54/how_would_i_go_about_turning_this_is_so_sad_alexa/;2;Our slack team is getting creative and we were wondering if there’s a way to do this or maybe there already is;False;How would I go about turning ‘This is so sad, Alexa play Despacito’ into a bot?;https://www.reddit.com/r/Slack/comments/an8f54/how_would_i_go_about_turning_this_is_so_sad_alexa/
1549317879.0;False;an6zcd;True;False;t3_an6zcd;1;False;/r/Slack/comments/an6zcd/channel_acl_management/;1;Is anyone familiar with a method or tool for restricting channel access. I can see how to lock down public/private channel creation in a workspace, I can see where you block people from inviting users to a workspace - but I want the channels membership to be managed too.If we can't outright block non-owners/admins from inviting people into channels, is there a way to auto-kick users based on criteria (such as non-owner/admin invitation)Thank you!;False;Channel ACL management;https://www.reddit.com/r/Slack/comments/an6zcd/channel_acl_management/
1549314233.0;False;an6b7c;True;False;t3_an6b7c;3;False;/r/Slack/comments/an6b7c/companies_that_use_slack_to_communicate/;1;Hello, does anyone here use Slack in their workplace to serve as a community for customers?If not your own workplace, do you know of any other companies that openly use Slack as a Customer Support / Online Community platform? And how effective is it?;False;Companies that use Slack to communicate externally with customers?;https://www.reddit.com/r/Slack/comments/an6b7c/companies_that_use_slack_to_communicate/
1549311079.0;False;an5q69;True;False;t3_an5q69;0;False;/r/Slack/comments/an5q69/send_audio_messages_on_slack/;1;"[**Talk-Talk.me**](https://Talk-Talk.me)  :  This is the easiest way to send audio messages directly on Slack.Spend less time typing and more time on what really matters!&#x200B;https://i.redd.it/megncj5pzle21.pngSimply use **/vm** slash command to start recording your audio.No external integration needed! When you're finished, your audio is uploaded to your Slack channel or direct message as an attachment.";False;Send audio messages on Slack !;https://www.reddit.com/r/Slack/comments/an5q69/send_audio_messages_on_slack/
1549289573.0;False;an2105;True;False;t3_an2105;4;False;/r/Slack/comments/an2105/question_slack_says_im_active_30_minutes_before_i/;2;Question, Slack says I'm active 30 minutes before I login to PC, how is this possible?;False;Question, Slack says I'm active 30 minutes before I login to PC, how is this possible?;https://www.reddit.com/r/Slack/comments/an2105/question_slack_says_im_active_30_minutes_before_i/
1549156138.0;False;amkof3;True;False;t3_amkof3;3;False;/r/Slack/comments/amkof3/why_is_slack_trying_to_access_my_network_drives/;4;"My Slack Mac app takes a long time to start up, mostly in the ""Not Responding"" state, and it appears to be blocking on file access, since it throws up several ""There was a problem connecting to..."" errors for a server that is no longer on my network. This is with a fresh download and after erasing `Library/Application Support/Slack`. What is it trying to do?Edit: I stopped it by removing those mounts from my login items, but I'd still like to know what it's up to.";False;Why is Slack trying to access my network drives?;https://www.reddit.com/r/Slack/comments/amkof3/why_is_slack_trying_to_access_my_network_drives/
1549117509.0;1549142132.0;amehfw;True;False;t3_amehfw;5;False;/r/Slack/comments/amehfw/knowledge_management_wiki_document_management/;4;We are comprised of about 15 team members, none of which are in the same place. We have been successful with Slack and it seems that it's a good anchor. We have two problems that we need to solve: 1) organizational notes/tidbits/snippets that are searchable 2) structured, managed (versioning and permissions) internal documentation (technical, business process, and policies and procedures). We have Slack, gSuite (most of our content is in Google Drive), and use various Zoho products for (CRM, Project Management, Support). We have an ad-hoc collection of Evernote notebooks that some of us share. Being able to quickly get a snippet from Slack or email into a central repository would be important, but we also need to create/manage more traditional material. Also best. if whatever we find works well on mobile. Any experiences with this are appreciated. I don't want to gamble on a startups' product, nor do I want to overspend on a high-end product that's overkill (e.g. I took a peek at Guru).;False;Knowledge Management, Wiki, Document Management & Slack;https://www.reddit.com/r/Slack/comments/amehfw/knowledge_management_wiki_document_management/
1549089244.0;False;ambman;True;False;t3_ambman;0;False;/r/Slack/comments/ambman/question_about_unread_settings_specifically_on/;3;"Is there a way to prevent a channel with unread messages from moving itself to the ""unread"" category, and simply staying in place in the channels list?I'd prefer it if all the channels stayed in the same grouping/order no matter which ones had new messages and which didn't.On desktop, it works just the way I want, but I cannot seem to find a setting on mobile that controls this.";False;Question about unread settings, specifically on the mobile app, not desktop;https://www.reddit.com/r/Slack/comments/ambman/question_about_unread_settings_specifically_on/
1549046667.0;False;am5aou;True;False;t3_am5aou;5;False;/r/Slack/comments/am5aou/selective_trigger_for_rss_feeds_in_slack_channel/;2;"Good morning, afternoon or evening,So I have a channel in my workspace with a few weather related IFTTT's. The other day I added any RSS feed for NWS alerts, warnings, advisories, etc. Problem is, as they update every few minutes, if there's no real update, I get spammed with a ""There are no active watches, warnings or advisories... "" (etc.)  until there really is a winner. So what I want to do is suppress the ""No news"" crap and just deliver anything but the ""There are no active..."" announcements. Sample trigger words might be ""tornado"", ""thunderstorm"", ""snow"", ""blizzard"", ""watch"", ""warning"", ""advisory"". Does this make sense?FWIW, I'm in the early stages of learning Python (again!). So if anyone wants to share an example, please keep it fairly simple! 😉All hints, tips, etc; are appreciated!";False;Selective Trigger for RSS Feeds In Slack Channel;https://www.reddit.com/r/Slack/comments/am5aou/selective_trigger_for_rss_feeds_in_slack_channel/
1549032239.0;False;am2oh1;True;False;t3_am2oh1;2;False;/r/Slack/comments/am2oh1/export_yammer_posts_to_slack/;1;Does anyone know if it would be possible to somehow export files or posts from Yammer, and import them to Slack? Is it possible to upload a .csv file to fill a dedicated #channel, so that one channel is a long scroll of Yammer history?;False;Export Yammer posts to Slack;https://www.reddit.com/r/Slack/comments/am2oh1/export_yammer_posts_to_slack/
1548964083.0;False;alte1w;False;False;t3_alte1w;8;False;/r/Slack/comments/alte1w/i_can_type_6_numbers_in_3_seconds/;21;;False;I can type 6 numbers in 3 seconds!;https://i.redd.it/t6mzknowbtd21.png
1548983121.0;1548987944.0;alwgz6;True;False;t3_alwgz6;0;False;/r/Slack/comments/alwgz6/slack_and_use_google_calendar_introducing_gonebusy/;3;"[www.gonebusy.com](https://www.gonebusy.com)We ❤️ Slack too, and just can't deal with having to clunk around Google Calendar when making events, checking schedules, finding a Hangout or Zoom link?  It just got so much easier:`/gonebusy [ <notion of time> | book | feedback | help | ... ]`  –  Access to all Gonebusy functionality without  having to invite a bot.  Slash commands only see the payload you send them.`/today`   –  Quick shortcut for today's events.  In a meeting right now?  ""Join  Meeting"" and stop fumbling around to find that Hangout/Zoom/UberConference  link...[https://slack.com/apps/A2TM3CS8N-gonebusy](https://slack.com/apps/A2TM3CS8N-gonebusy)Stay warm out there!&#x200B;";False;❤️ Slack and use Google Calendar? Introducing Gonebusy! 👀;https://www.reddit.com/r/Slack/comments/alwgz6/slack_and_use_google_calendar_introducing_gonebusy/
1548993014.0;False;alxyu1;True;False;t3_alxyu1;3;False;/r/Slack/comments/alxyu1/notify_when_a_user_messages_in_a_public_channel/;0;So sometimes our VP sends a message in a public slack channel who doesn't @mention people he tends to look for.  I was hoping putting his name and @mention name in the keyword notifications would help trigger an alert if he ever sent a message, but nope.Any suggestions? ;False;Notify when a user messages in a public channel?;https://www.reddit.com/r/Slack/comments/alxyu1/notify_when_a_user_messages_in_a_public_channel/
1548961061.0;False;alsutx;True;False;t3_alsutx;0;False;/r/Slack/comments/alsutx/hello_i_have_a_user_with_versions_331_and_3310/;1;When I try to uninstall the cursor spins for about 1 second, but nothing happens. Has something happened on Slack's end to cause this?;False;Hello, I have a user with versions 3.3.1 and 3.3.1.0 installed. 3.3.1 will not uninstall, is this a known issue?;https://www.reddit.com/r/Slack/comments/alsutx/hello_i_have_a_user_with_versions_331_and_3310/
1548859991.0;False;aldeql;True;False;t3_aldeql;1;False;/r/Slack/comments/aldeql/slack_vs_zoho_cliq/;3;My company uses the Zoho suite but we do not currently use Zoho Cliq. We use Slack right now but I think getting the integrations to the rest of Zoho may be worth switching to Cliq. We are using the Slack app for Zoho CRM that automatically sends some messages to Slack through slackbot.I am looking for anyone who switched from Slack to Cliq or from Cliq to Slack.1. Which do you like better?2. Why did you switch?3. Would you switch back after trying both?Thanks!;False;Slack vs Zoho Cliq;https://www.reddit.com/r/Slack/comments/aldeql/slack_vs_zoho_cliq/
1548867390.0;False;aleoxz;True;False;t3_aleoxz;6;False;/r/Slack/comments/aleoxz/slack_doesnt_resize_properly_in_windows/;1;Reduce the size of slack in windows to less than a third of the screen and it can't show all of the message \[doesn't wrap text properly\], or even hide the sidebar.Ridiculous. This is how you lose users quick.;False;Slack doesn't resize properly in windows;https://www.reddit.com/r/Slack/comments/aleoxz/slack_doesnt_resize_properly_in_windows/
1548860915.0;False;aldk4c;True;False;t3_aldk4c;0;False;/r/Slack/comments/aldk4c/slack_on_ios_changes_notification_sound_on_text/;1;I am finding that after I receive a Slack notification (from work) subsequent iMessage texts (personal, usually) now have the Slack notification sound.Any else encountered this and have a fix? TIAiOS 12.1.2 / Slack 3.6.1 / iPhone XR;False;Slack on iOS changes notification sound on text messages;https://www.reddit.com/r/Slack/comments/aldk4c/slack_on_ios_changes_notification_sound_on_text/
1548795126.0;False;al4kw9;False;False;t3_al4kw9;3;False;/r/Slack/comments/al4kw9/this_annoys_me_so_much/;10;;False;This annoys me so much;https://i.redd.it/ydt1qihkdfd21.png
1548806193.0;False;al6iu0;True;False;t3_al6iu0;3;False;/r/Slack/comments/al6iu0/notification_dot_wont_go_away_on_ios/;2;This problem seems to have started after the recent update with the new logo.  On my workspace list, there is a white dot in the corner of one of my workspaces.  I have gone through every single channel and see nothing unread.  The desktop app shows no notifications either.  I've tried **Reset Cache on Next Launch** but the problem persists.  I prefer not to reinstall slack because I have so many workspaces to sign into but if there's no other choice...iPhone x  12.1.2;False;Notification dot won't go away on iOS;https://www.reddit.com/r/Slack/comments/al6iu0/notification_dot_wont_go_away_on_ios/
1548805120.0;False;al6cq3;True;False;t3_al6cq3;1;False;/r/Slack/comments/al6cq3/different_notification_sounds_per_channel/;2;I saw an earlier post that has been archived.  Wondering if anyone knows how to set notification sounds to be different per channel and message.;False;Different notification sounds per channel;https://www.reddit.com/r/Slack/comments/al6cq3/different_notification_sounds_per_channel/
1548797707.0;1548811953.0;al51v2;True;False;t3_al51v2;5;False;/r/Slack/comments/al51v2/how_to_automatically_push_out_an_article_shared/;2;Hi all - if someone posting some interesting articles in their Slack channel, if the readers add a reaction (it could be a thumb up) to that particular article, the article will automatically gets push out to Twitter as a tweet. Could you please show me how to do that? Thank you.;False;How to automatically push out an article shared in Slack channel to Twitter?;https://www.reddit.com/r/Slack/comments/al51v2/how_to_automatically_push_out_an_article_shared/
1548758394.0;False;akytjt;False;False;t3_akytjt;0;False;/r/Slack/comments/akytjt/why_do_i_get_a_black_background_on_my_message/;4;;False;Why do I get a black background on my message notifications?;https://i.redd.it/i2qfuaq8ccd21.png
1548774592.0;False;al0wep;True;False;t3_al0wep;5;False;/r/Slack/comments/al0wep/what_do_these_numbers_next_to_the_channel_names/;1;"When I'm searching for a channel by using this quick navigate function thingy, &#x200B;As I type, these numbers on the right side of the channel names change. &#x200B;At first, I thought this is like a similarity score between the search keyword and the channel name but sometimes I see decimal points or negative numbers.&#x200B;Does anyone know what these numbers mean?https://i.redd.it/up7e42lhodd21.png";False;What do these numbers next to the channel names mean?;https://www.reddit.com/r/Slack/comments/al0wep/what_do_these_numbers_next_to_the_channel_names/
1548739800.0;False;akwv7r;True;False;t3_akwv7r;1;False;/r/Slack/comments/akwv7r/what_does_inactive_mean_in_slack/;5;Does that imply that the user is no longer availing slack's services and s/he is unable to receive ongoing notifications of announcements etc?;False;What does inactive mean in Slack?;https://www.reddit.com/r/Slack/comments/akwv7r/what_does_inactive_mean_in_slack/
1548747609.0;False;akxr85;False;False;t3_akxr85;0;False;/r/Slack/comments/akxr85/how_to_build_a_meetup_slack_app_with_standard/;2;;False;How to Build a Meetup Slack App with Standard Library;https://medium.com/@janeth_10755/how-to-build-a-meetup-slack-app-with-standard-library-52f96b27d95a
1548748532.0;False;akxufx;True;False;t3_akxufx;4;False;/r/Slack/comments/akxufx/how_can_i_sync_workspaces_teams_across_several/;1;;False;How can I sync workspaces (teams) across several devices ?;https://www.reddit.com/r/Slack/comments/akxufx/how_can_i_sync_workspaces_teams_across_several/
1548743042.0;False;akx9hj;True;False;t3_akx9hj;2;False;/r/Slack/comments/akx9hj/how_to_check_the_list_of_members_in/;1;I want to see people who have joined a slack workspace in descending/ascending order of their joining date.;False;How to check the list of members in descending/ascending order of their joining date?;https://www.reddit.com/r/Slack/comments/akx9hj/how_to_check_the_list_of_members_in/
1548718782.0;False;aktpu3;True;False;t3_aktpu3;1;False;/r/Slack/comments/aktpu3/turn_channel_notifications_off_for_all_users/;1;As an admin, is there a way to turn off notifications for all users?  I have some channels that are regularly posted in by a bot, but I don't want any of my users to be notified when this happens.   I don't want to have to explain to each user how to turn off notifications for this one channel. ;False;Turn channel notifications off for all users?;https://www.reddit.com/r/Slack/comments/aktpu3/turn_channel_notifications_off_for_all_users/
1548692970.0;False;akp2zs;True;False;t3_akp2zs;1;False;/r/Slack/comments/akp2zs/keyboard_shortcut_to_open_actionsmore_actions/;2;So I can Shift F6 to move focus back up to messages and navigate with arrows, but I can't do anything with these highlighted messages. Is there a way to open the actions dialog with a keyboard shortcut? Pressing tab a few times toggles the sub-focus to the elements in the message, but it takes 8 tab presses before it reaches the 'more actions' dialog. Would be neat if I could edit/delete messages without having to use the mouse to hover over them.;False;Keyboard shortcut to open Actions/More Actions message dialogs.;https://www.reddit.com/r/Slack/comments/akp2zs/keyboard_shortcut_to_open_actionsmore_actions/
