created_utc;edited;id;is_self;locked;name;num_comments;over_18;permalink;score;selftext;spoiler;title;url
1553403178.0;False;b4smuv;True;False;t3_b4smuv;2;False;/r/Slack/comments/b4smuv/slack_apps_can_act_as_unfurlers_for_up_to_five/;5;[Here](https://api.slack.com/docs/message-link-unfurling#registering_your_domain_names) is where I read the statement about the limitation.;False;"""Slack apps can act as unfurlers for up to five registered domains."" Why is there a limit of five? What should I do if I want to unfurl for more domains?";https://www.reddit.com/r/Slack/comments/b4smuv/slack_apps_can_act_as_unfurlers_for_up_to_five/
1553405638.0;False;b4sxy2;True;False;t3_b4sxy2;9;False;/r/Slack/comments/b4sxy2/we_are_no_longer_supporting_this_version_of_your/;1;"As it turns out the version of the browser that I am stuck with is end-of-life'd in the particular release of my Linux desktop.I plan on eventually upgrading my Linux OS to a newer release, but I'll be damned if I don't feel like doing it just to use slack.It's kind of a bummer that they're booting people just because their browser is a bit out-of-date.  I don't pay to use slack, so it's no big deal; however the company I work for does, so I guess I don't use slack from home anymore.";False;We are no longer supporting this version of your browser, so you’ll need to update it or get the app;https://www.reddit.com/r/Slack/comments/b4sxy2/we_are_no_longer_supporting_this_version_of_your/
1553350735.0;1553351368.0;b4jnfh;True;False;t3_b4jnfh;5;False;/r/Slack/comments/b4jnfh/the_right_workflow_for_project_managers/;2;Hey fellow redditors,I have been introducing slack to our company and after almost 4 weeks it's going quite well. The only ones complaining are our project- / accountmanagers. For them slack is another channel they have to watch and they are getting frustrated about it. Just to give you an example:\- answering phone calls from the client\- receiving What'sApp messages from external contractors\- incoming eMails from clients\- shoveling every information into slack instead of just forwarding an eMail to the teamand the last part is the most annoying for them, because the constantly have to switch between slack & emailclient. Watch for messages here and there.Any thoughts on that? How to make their lives easier? Because when they stop using slack everyone will go back to email.;False;The right workflow for project managers;https://www.reddit.com/r/Slack/comments/b4jnfh/the_right_workflow_for_project_managers/
1553303538.0;False;b4d4pb;True;False;t3_b4d4pb;2;False;/r/Slack/comments/b4d4pb/can_others_see_the_files_i_upload_to_myself_in/;3;When clicking on *More Items*, then *All Files*, who can see what?Can everyone see what they have normal privileges to see?I'm wondering because I can see all my files uploaded, but I wanted to be sure others couldn't see all my test garbage/reminders that I slack to myself from that page. It seems like it's limited to the normal public settings, but I'm not certain.;False;Can others see the files I upload to myself in the More Items > All Files section, when filtering by my slack name?;https://www.reddit.com/r/Slack/comments/b4d4pb/can_others_see_the_files_i_upload_to_myself_in/
1553295406.0;False;b4bqaw;True;False;t3_b4bqaw;1;False;/r/Slack/comments/b4bqaw/how_to_make_slackbot_responses_respond_to_exact/;0;"Is there really not a way to do this?If I want the slackbot to say> You meant ""Hello""whenever anyone says> Heyit will still fire when they say> Oh HeyIs there a way to limit it to an exact phrase?";False;How to make Slackbot responses respond to exact phrases?;https://www.reddit.com/r/Slack/comments/b4bqaw/how_to_make_slackbot_responses_respond_to_exact/
1553258871.0;False;b44nzr;True;False;t3_b44nzr;6;False;/r/Slack/comments/b44nzr/best_channel_organization/;5;"Hello eveyrone,I work in a small communication agency (30 employees) in France and my enterprise recently switched to Slack.Personally, I am quite happy with this new tool but I find that there's sometimes to many flooding and that information isn't well organized.As of now, we have channels by projet which is very fine but otherwise, every other type of information goes to the general channel.I would like to propose my boss a new channel organization to help prevent flooding and the dispersion of information.&#x200B;What channels would you recommend to create ?";False;Best channel organization;https://www.reddit.com/r/Slack/comments/b44nzr/best_channel_organization/
1553276686.0;False;b481om;True;False;t3_b481om;3;False;/r/Slack/comments/b481om/i_would_like_to_know_how_to_add_my_slack_channels/;2;"I run a company that has a monthly membership program. All members interact with each other constantly and I've been using Slack as a communication platform. I know Slack is supposed to be meant for Company/Employee relationships but I'd like to see some sort of Company/Employee/Customer integration as well. I use Google Sites to run my classes and our customers are on it constantly. Having Slack embedded onto a page on my site would be awesome. I used Chatilio but Chatilio is only for ""customer support"" and talking from the site to Slack. Does anyone have a solution? ";False;I would like to know how to add my Slack channels to my Google Site.;https://www.reddit.com/r/Slack/comments/b481om/i_would_like_to_know_how_to_add_my_slack_channels/
1553231785.0;False;b411hx;False;False;t3_b411hx;0;False;/r/Slack/comments/b411hx/slack_introduced_encryption_key_addon_to_prevent/;5;;False;Slack Introduced Encryption Key Add-on to Prevent Data Breaching;http://blog.thinkwik.com/slack-introduced-encryption-key-add-prevent-data-breaching/
1553224063.0;1553247238.0;b3zwcq;True;False;t3_b3zwcq;0;False;/r/Slack/comments/b3zwcq/cast_desktop_app_only_to_chromecast_specifically/;3;"EDIT: Posted this multiple places and coming up blank everywhere. Does anyone know at least a way I can open a Chrome Window settings with a keyboard shortcut? Or better yet launch the ""Cast"" button in those settings with a keyboard shortcut? Or BEST yet cast to Chromecast only the Window I am on/the app I am on, with (you guessed it) a keyboard shortcut? 3rd party extensions and software are fine! Thanks again guys.I am looking to project or cast a specific desktop app only to my external monitor/tv with Chromecast and wondering how to do this or if there is a third party application I can use to accomplish this.Mostly for Slack. I cannot share my screen in browser version and had to install desktop, now all my calls/video goes through the desktop app. I need it set up where I can watch my presenters screen on Chromecast monitor while I work on my laptop following in the background.Same with GoToMeeting, but I can get a Chrome window to pop up, I just need to get to the options/controls to be able to Cast and forgot the keyboard shortcuts. Can anyone show me Chrome keyboard shortcuts to cast, show the control panel or even get the address bar to appear, I forgot that shortcut. Thanks!";False;Cast Desktop App Only to Chromecast - Specifically Slack?;https://www.reddit.com/r/Slack/comments/b3zwcq/cast_desktop_app_only_to_chromecast_specifically/
1553248114.0;False;b434o8;False;False;t3_b434o8;0;False;/r/Slack/comments/b434o8/the_only_tools_you_need_to_maximise_productivity/;0;;False;The Only Tools You Need To Maximise Productivity;https://medium.com/@hello_16463/6-tools-you-need-to-empower-your-dream-team-5321a8dd424
1553186075.0;False;b3soit;True;False;t3_b3soit;3;False;/r/Slack/comments/b3soit/how_do_you_organize_work_in_slack_or_am_i_the/;5;"**Slack is where work happens** — it couldn’t be truer than that when I look at the time I spend and the messages I receive on an average workday. I am regularly searching for messages and discussions. I use to miss actions that I talked about. I have the feeling it is growing out of my control. &#x200B;What's your take on this? Any recommendations. I don't want to ""export"" those conversations/actions into trello or some other external tool as it feels like duplicating things. ";False;How do you organize work in Slack? - or am I the only one?;https://www.reddit.com/r/Slack/comments/b3soit/how_do_you_organize_work_in_slack_or_am_i_the/
1553138468.0;False;b3llbs;True;False;t3_b3llbs;5;False;/r/Slack/comments/b3llbs/automatically_add_reaction_to_a_starred_message/;5;"Is there a way to automatically add a reaction to a message that I have starred?&#x200B;I used starred messages as my 'to do' list or to indicate that I need to get back to someone on something. I've been adding the eyes reaction so people know that I've seen it, but would love just to star a message and have the Eyes reactio auto added.&#x200B;I looked here but it doesn't seem like I can use starred messages as a trigger: [http://altitudelabs.com/blog/create-a-slackbot-using-botkit/](http://altitudelabs.com/blog/create-a-slackbot-using-botkit/)&#x200B;Zapier could also do it it, but only up to 100 starred messages in a month, which I think I would blow through!";False;Automatically add Reaction to a Starred message;https://www.reddit.com/r/Slack/comments/b3llbs/automatically_add_reaction_to_a_starred_message/
1553108894.0;False;b3g0hv;True;False;t3_b3g0hv;7;False;/r/Slack/comments/b3g0hv/how_do_i_find_out_who_invited_me_when/;1;"I already tried looking at my e-mail for the notifications, but they were either not on or I disabled them as soon as I first joined my company's Slack workspace. I tried Googling on ""who invited me to a channel in slack"", but all of them lead to How to Invite people guides. Is there a better way to find this out, if I'm not the admin of the workspace itself?";False;How do I find out: Who invited me & when;https://www.reddit.com/r/Slack/comments/b3g0hv/how_do_i_find_out_who_invited_me_when/
1553042592.0;1553050781.0;b35dxp;True;False;t3_b35dxp;4;False;/r/Slack/comments/b35dxp/anyone_use_a_minimalist_type_of_phone_with_slack/;6;I would like to downgrade to a simpler or cheaper phone so I spend less time on my phone but I need Slack and Gmail. I was hoping for something like the remake of the Nokia 3310 but I don't think it has access to the Google Play Store. Any thoughts or suggestions on this? Does anyone use a cheap phone?;False;Anyone use a minimalist type of phone with Slack?;https://www.reddit.com/r/Slack/comments/b35dxp/anyone_use_a_minimalist_type_of_phone_with_slack/
1553061450.0;False;b38c3q;False;False;t3_b38c3q;0;False;/r/Slack/comments/b38c3q/please_help_me_graduate_just_take_this_10_minute/;0;;False;PLEASE HELP ME GRADUATE! Just take this 10 minute survey.;https://usc.qualtrics.com/jfe/form/SV_baoREWSJOzE3jyR
1553007208.0;False;b2yd2f;True;False;t3_b2yd2f;0;False;/r/Slack/comments/b2yd2f/manage_membership_requests_on_public_workspace/;7;On the page [Manage how people sign up for your workspace](https://get.slack.help/hc/en-us/articles/115004856503-Manage-how-people-sign-up-for-your-workspace), It is very well described how to handle invites to our workspace. But then what? Does anyone who uses the invite-link also get accepted to the workspace without me doing anything? As the admin, I'd like to manually accept or deny membership for each of the requests. Do I have to alter some settings in order to achieve this functionality? ;False;Manage membership requests on public workspace;https://www.reddit.com/r/Slack/comments/b2yd2f/manage_membership_requests_on_public_workspace/
1552959273.0;False;b2r574;False;False;t3_b2r574;9;False;/r/Slack/comments/b2r574/slack_using_24_gigs_of_ram_what_the_actual_f/;19;;False;Slack using 24+ Gigs of RAM. What the actual f***? Anyone ever had such an issue?;https://i.redd.it/g17w9q9obzm21.jpg
1552977528.0;False;b2tzg6;True;False;t3_b2tzg6;3;False;/r/Slack/comments/b2tzg6/anonymous_feedback_poll_app_for_slack/;2;Hey guys, Please suggest us an anonymous feedback & poll app. Thanks. ;False;Anonymous feedback & poll app for Slack;https://www.reddit.com/r/Slack/comments/b2tzg6/anonymous_feedback_poll_app_for_slack/
1552932297.0;False;b2lxla;True;False;t3_b2lxla;1;False;/r/Slack/comments/b2lxla/is_there_a_gif_bot_that_will_post_the_gif_without/;7;"Seems like it breaks some of the ""magic"" of gifs when you see what the search term is. Every app I look at always has the keyword as part of the message.";False;Is there a gif bot that will post the gif without also posting the keywords used?;https://www.reddit.com/r/Slack/comments/b2lxla/is_there_a_gif_bot_that_will_post_the_gif_without/
1552930501.0;False;b2lk68;True;False;t3_b2lk68;1;False;/r/Slack/comments/b2lk68/is_there_a_method_to_webhook_slack_messages_to/;1;Hello there!  So, my friends and I use Slack and Discord, and I would love to output any Slack messages to our Discord server. However, I noted that outgoing webhooks are a legacy feature for slack, and I am only seeing **incoming** webhook abilities.  Is there any way to create a link between a Slack and Discord server?  Thank you!;False;Is there a method to webhook Slack messages to Discord?;https://www.reddit.com/r/Slack/comments/b2lk68/is_there_a_method_to_webhook_slack_messages_to/
1552874375.0;False;b2czti;True;False;t3_b2czti;3;False;/r/Slack/comments/b2czti/inventory_app_for_food_service/;0;It's been difficult to work on Google Sheets for two years. Our stats are very labor intensive and subject to a lot of tampering. I've been looking for a way to integrate inventory to Slack, checking the stock of the ingredients, automatically deducting stock based off of sales / recipe, receiving deliveries and projecting the intended sales the items can produce, and outputting graphs of our consumption too.Is there anything out there for Slack that can do this? A bit of a tall order.;False;Inventory App for Food Service;https://www.reddit.com/r/Slack/comments/b2czti/inventory_app_for_food_service/
1552908072.0;False;b2hhz3;True;False;t3_b2hhz3;3;False;/r/Slack/comments/b2hhz3/who_the_hell_thought_it_was_a_good_idea_to_make_a/;0;"&#x200B;[I mean, what the hell?](https://i.redd.it/xmpj34833vm21.png)&#x200B;";False;Who the hell thought it was a good idea to make a swastika-style tray icon at Slack?;https://www.reddit.com/r/Slack/comments/b2hhz3/who_the_hell_thought_it_was_a_good_idea_to_make_a/
1552791008.0;False;b20ol9;True;False;t3_b20ol9;5;False;/r/Slack/comments/b20ol9/slack_slash_command_to_my_own_server/;4;Has anyone done this/can anyone help me with this? I know how to get this working with things like Azure, but we host a lot of customer servers in data centers that aren't popular, so there aren't any nifty tutorials for it. Would I need to set up an iis website with a public dns so that it would receive the command? I'm doing this with powershell BTW.;False;Slack Slash Command to my own server;https://www.reddit.com/r/Slack/comments/b20ol9/slack_slash_command_to_my_own_server/
1552776731.0;False;b1yfim;True;False;t3_b1yfim;8;False;/r/Slack/comments/b1yfim/how_does_slack_compare_to_apps_like_teamviewer/;4;We often use Teamviewer's free service although it's started giving alerts about suspecting commercial usage, so I'm considering upgrading to a paid Slack account to be able to use its own screensharing (as well as its group calls).I can't find any demos or comparisons about how it performs. Anyone here have any hands-on experience you could share?;False;How does Slack compare to apps like Teamviewer for screen sharing?;https://www.reddit.com/r/Slack/comments/b1yfim/how_does_slack_compare_to_apps_like_teamviewer/
1552707943.0;False;b1o665;False;False;t3_b1o665;6;False;/r/Slack/comments/b1o665/wow_slack_now_supports_block_kit_payloads_slack/;10;;False;Wow. Slack now supports Block Kit Payloads #Slack;https://i.redd.it/k6vyt0zhjem21.png
1552704528.0;False;b1nnz9;True;False;t3_b1nnz9;1;False;/r/Slack/comments/b1nnz9/know_which_channels_to_join/;5;Just joined my new company and there are so many Slack channels for my team and fun ones too, not sure which ones I need to be in but time consuming to discover them all manually. has anyone else faced this issue?;False;Know which channels to join?;https://www.reddit.com/r/Slack/comments/b1nnz9/know_which_channels_to_join/
1552672338.0;False;b1hydk;True;False;t3_b1hydk;4;False;/r/Slack/comments/b1hydk/how_to_convince_coworkers_of_slack_over/;6;Hello,We're a company of 50 ish people of which a lot are devs and network engineers. We are currently using WhatsApp because 'everyone already has it'. We do have slack for a few people but a lot of colleagues are not willing to move because 'it looks not very handy and easy to use'.Now they are starting to move partly to Telegram but this is still more aimed at personal use than team use i feel.Any tips and reasons why slack is better or reasons to move are welcome. I'm not going to force anyone but I just want people to see why slack can be very good, aka the way I see it.;False;How to convince coworkers of slack over WhatsApp/Telegram?;https://www.reddit.com/r/Slack/comments/b1hydk/how_to_convince_coworkers_of_slack_over/
1552690280.0;False;b1ld6y;True;False;t3_b1ld6y;7;False;/r/Slack/comments/b1ld6y/just_me_is_that_cool_with_slack/;2;So for the last few years I've been using Slack at work for its intended purpose -- to talk to coworkers -- *but* I also gave it quite a workout sending *myself* links and notes so that I would have them when I went from one computer to another. I recently changed jobs and my new job doesn't use Slack...but I'm pretty spoiled for sending myself links and notes for computer-hopping purposes. Am I allowed to signup with a free account and use it solely to message myself in this way?Over the years I've tried other solutions like leaving links and notes for myself in a notepad file on Dropbox that was synced across all the computers I use, and I've also tried just keeping a Google Docs page open on all computers and dropping links and notes in there...but neither option is as convenient or feels as instant and 'lightweight' as Slack.;False;Just Me - Is that cool with Slack?;https://www.reddit.com/r/Slack/comments/b1ld6y/just_me_is_that_cool_with_slack/
1552684410.0;False;b1kal5;True;False;t3_b1kal5;0;False;/r/Slack/comments/b1kal5/apps_by_channel/;2;Looks like slack does not support enabling apps by channel. Seems like a reasonable ask. Have you seen a need for this in your teams?;False;Apps by channel;https://www.reddit.com/r/Slack/comments/b1kal5/apps_by_channel/
1552645525.0;False;b1d84u;False;False;t3_b1d84u;6;False;/r/Slack/comments/b1d84u/how_can_i_remove_all_threads_from_my_sidebar/;0;;False;How can I remove 'All Threads' from my sidebar?;https://i.redd.it/syv5ri6qe9m21.png
1552612456.0;False;b18lbl;True;False;t3_b18lbl;3;False;/r/Slack/comments/b18lbl/take_ownership_of_workspace_when_current_owner_is/;5;Is there any way to take ownership of a Slack Workspace when the original Owner is long gone? We have a free workspace account setup for my job and there's a ton of people in there that have left the company that I would like to remove. Unfortunately, the person who owns the workspace has left the company too. Is there any way to take ownership of it, especially since they haven't logged in for over a year?;False;Take Ownership of Workspace when Current Owner is Long Gone?;https://www.reddit.com/r/Slack/comments/b18lbl/take_ownership_of_workspace_when_current_owner_is/
1552617919.0;False;b19h44;True;False;t3_b19h44;4;False;/r/Slack/comments/b19h44/moved_slack_bot_to_heroku_and_icon_no_longer/;1;"I recently moved my slack bot to heroku from openshift, and it still works fine, but it no longer displays an icon and appears like I'm the one posting its messages, not the bot. &#x200B;I've tried using the OAuth access token for the bot but it fails on startup because SlackClient (python) fails to logon.  Tried the Bot User OAuth Access token and it boots, but doesn't respond to messages. &#x200B;Which token should I be using to pass to SlackClient? Do I need to generate new tokens because of the move?";False;Moved slack bot to heroku and icon no longer displays;https://www.reddit.com/r/Slack/comments/b19h44/moved_slack_bot_to_heroku_and_icon_no_longer/
1552554857.0;1552556721.0;b0y4r4;True;False;t3_b0y4r4;0;False;/r/Slack/comments/b0y4r4/linux_desktop_cannot_sign_in_via_browser_xdgopen/;6;Since the last update, I no longer get the usual sign in option in the linux desktop version of Slack. I need to sign in using the website.This prompts a link for xdg-open to start the program, but nothing happens when I click it.Trying this via the terminal opens the program, but doesn't sign me in. Can't seem to find anything related to this problem, but surely I'm not the only one..? ;False;[Linux Desktop] Cannot sign in via browser (xdg-open);https://www.reddit.com/r/Slack/comments/b0y4r4/linux_desktop_cannot_sign_in_via_browser_xdgopen/
1552548530.0;False;b0xeja;True;False;t3_b0xeja;6;False;/r/Slack/comments/b0xeja/best_practices_in_using_slack_at_a_new_startup/;5;Hi there, we are planning to use slack for our new organisation. We would love to hear some of the best practices in using slack. For reference, we are a team of 3 that provides consultancy services!;False;Best practices in using slack at a new startup;https://www.reddit.com/r/Slack/comments/b0xeja/best_practices_in_using_slack_at_a_new_startup/
1552559461.0;False;b0ypl3;True;False;t3_b0ypl3;2;False;/r/Slack/comments/b0ypl3/upgrading_to_paid_account/;2;I'm a member of various communities and I keep seeing messages saying I have run out of space. If I get a paid account will I have unlimited access in terms of storage for all workspaces or for one?;False;Upgrading to Paid account;https://www.reddit.com/r/Slack/comments/b0ypl3/upgrading_to_paid_account/
1552546287.0;False;b0x48u;True;False;t3_b0x48u;4;False;/r/Slack/comments/b0x48u/slash_commands/;3; What is the best or useful slash command for programming do you integrate on your slack? ;False;Slash commands.;https://www.reddit.com/r/Slack/comments/b0x48u/slash_commands/
1552499294.0;False;b0oxkj;True;False;t3_b0oxkj;4;False;/r/Slack/comments/b0oxkj/slack_app_feedback/;2;Anyone interested to try out my Slack app,[Dort.io](https://dort.io), where you can pre-save SQL queries and invoke reports from Slack just by pressing button? I know security is a concern, I made sure only AWS lambda can access your password, and is stored encrypted(AES-256).Note: My website is not mobile optimised yet!;False;Slack app feedback;https://www.reddit.com/r/Slack/comments/b0oxkj/slack_app_feedback/
1552507363.0;False;b0ql5g;True;False;t3_b0ql5g;2;False;/r/Slack/comments/b0ql5g/unable_to_send_direct_messages_from_mac_app/;1;All of a sudden I can't start new DMs from the Mac app.  Has anyone ever had this happen to them?  I click on the + next to Direct Messages, and nothing happens.  Add channel and new channel work fine.;False;Unable to send direct messages from Mac App;https://www.reddit.com/r/Slack/comments/b0ql5g/unable_to_send_direct_messages_from_mac_app/
1552401099.0;False;b08fii;False;False;t3_b08fii;11;False;/r/Slack/comments/b08fii/slack_mobile_app_gets_its_own_dark_mode_in_latest/;26;;False;Slack mobile app gets its own 'dark mode' in latest update;https://www.techradar.com/news/slack-mobile-app-gets-its-own-dark-mode-in-latest-update
1552405425.0;False;b098fw;True;False;t3_b098fw;0;False;/r/Slack/comments/b098fw/should_files_shared_in_a_private_channel_be/;2;"We have private channels in our workspace. When a new member joins the workspace, if he/she clicks a user's name and then go to ""View files"", the new member can access the files shared by that user even in channels this new member does not have access. I can't figure what is (if there is one) the option to disable the access of files shared in private channels.&#x200B;Is there a way to make the files shared in a private channel unavailable for people without access to that channel? Shouldn't this be the standard?";False;Should files shared in a private channel be available for users without access to that channel?;https://www.reddit.com/r/Slack/comments/b098fw/should_files_shared_in_a_private_channel_be/
1552410959.0;False;b0acfr;True;False;t3_b0acfr;9;False;/r/Slack/comments/b0acfr/why_slack_over_whatsappor_any_other_messenger/;0;;False;Why Slack over Whatsapp(or any other messenger)?;https://www.reddit.com/r/Slack/comments/b0acfr/why_slack_over_whatsappor_any_other_messenger/
1552407703.0;False;b09oug;True;False;t3_b09oug;1;False;/r/Slack/comments/b09oug/importatnt_question_about_sharing_a_slack_access/;1;Hello Guys   there is a private workship that costs around 1000$ and it will be hosted on slack ?  me and my friends want to buy one access for all of us   is there is anyway to make this possible ?  sharing the account or using a screen sharing software or what ever ?  Pelase help !!;False;Importatnt question about sharing a slack access ?;https://www.reddit.com/r/Slack/comments/b09oug/importatnt_question_about_sharing_a_slack_access/
