created_utc;edited;id;is_self;locked;name;num_comments;over_18;permalink;score;selftext;spoiler;title;url
1548668128.0;False;aklwn1;True;False;t3_aklwn1;3;False;/r/Slack/comments/aklwn1/how_to_connect_your_html_form_to_slack/;2;Wouldn't it be great to get a Slack message every time someone fills out your contact form? Getform - Slack integration gives you this opportunity. You can read our latest blog post to automate your workflow for your forms.[https://blog.getform.io/how-to-integrate-your-html-form-to-slack/](https://blog.getform.io/how-to-integrate-your-html-form-to-slack/);False;How to connect your HTML form to Slack;https://www.reddit.com/r/Slack/comments/aklwn1/how_to_connect_your_html_form_to_slack/
1548668298.0;False;aklx5m;True;False;t3_aklx5m;3;False;/r/Slack/comments/aklx5m/about_publishing_the_app/;1;I have created a bot in Slack but I am not able to publish it. Whenever I send a message from that bot..It sends it on my behalf. I am not able to figure out where I am going wrong..Can anyone help?;False;About publishing the app;https://www.reddit.com/r/Slack/comments/aklx5m/about_publishing_the_app/
1548623229.0;False;akftnf;True;False;t3_akftnf;9;False;/r/Slack/comments/akftnf/how_frequently_does_slack_delete_all_channel/;2;A week after posting them? Two weeks? ;False;How frequently does slack delete all channel messages?;https://www.reddit.com/r/Slack/comments/akftnf/how_frequently_does_slack_delete_all_channel/
1548576552.0;False;aka8rg;True;False;t3_aka8rg;3;False;/r/Slack/comments/aka8rg/app_for_pinterest/;2;"So basically, I want an app or some sort of *something* that will post not only my new pins to any desired channel (I can easily use zapier for that) , but all my old ones too. And on top of that, a bonus would be so that I can time it to repeat this process after a set amount of time.&#x200B;Basically, I just want to create picture board channels, but since I don't have slack premium, any messages get deleted. I want to avoid this by having some sort of bot that posts all of my old pins every week or so which creates the illusion that there was never any deletion to begin with.&#x200B;&#x200B;";False;App for pinterest?;https://www.reddit.com/r/Slack/comments/aka8rg/app_for_pinterest/
1548546882.0;False;ak6niu;True;False;t3_ak6niu;5;False;/r/Slack/comments/ak6niu/anyone_else_frustrated_that_you_cant_simply_login/;6; Having to log into a specific Slack and then move from there seems cumbersome to me and not very intuitive. I'm on 3. It seems like it would be so much easier if I could log into Slack and then have a menu or dashboard where I could easily select which Slack I want to go to. Does anyone else have this irritation, or know an easy way around it? I like Slack a lot and would probably use it more with other groups if that aspect of it weren't so clunky to me. Thanks for any responses.;False;Anyone else frustrated that you can't simply login to Slack with your email and password?;https://www.reddit.com/r/Slack/comments/ak6niu/anyone_else_frustrated_that_you_cant_simply_login/
1548445795.0;False;ajsu75;True;False;t3_ajsu75;5;False;/r/Slack/comments/ajsu75/send_video_on_mobile_is_this_on_road_map/;1;I know this is a work tool.Sometimes my team wants to send a quick video to show a problem in the server room or to show something.Pictures are great but if it is something that is moving it does not help.I am not trying to make Slack into the new snapchat but am I the only one who wants to do this?How do you record and share videos with your Slack teamates?Looking for suggestions, thanks;False;Send video on mobile - Is this on road map?;https://www.reddit.com/r/Slack/comments/ajsu75/send_video_on_mobile_is_this_on_road_map/
1548438663.0;False;ajrl2g;True;False;t3_ajrl2g;9;False;/r/Slack/comments/ajrl2g/is_there_a_way_to_utilize_collborative_workspaces/;1;I'm looking to be able to share editable documents securly with colleagues within Slack. I know we can use google docs or directly upload files into a channel, but I'm looking to see if any other functions exist. Thanks a lot!;False;Is there a way to utilize collborative workspaces in a slack channel, akin to micosoft teams?;https://www.reddit.com/r/Slack/comments/ajrl2g/is_there_a_way_to_utilize_collborative_workspaces/
1548411613.0;False;ajnpk9;True;False;t3_ajnpk9;1;False;/r/Slack/comments/ajnpk9/tool_to_migrate_hipchat_emoticons_to_slack/;3;During our switch to Slack we were faced with mass amounts of emoticons that were crucial to our users, but no API methods to migrate them.So we've made our own emoticons migration tool using Selenium: [https://github.com/Unity-Group/slack-emoji-upload](https://github.com/Unity-Group/slack-emoji-upload)Hope it proves useful.;False;Tool to migrate Hipchat emoticons to Slack;https://www.reddit.com/r/Slack/comments/ajnpk9/tool_to_migrate_hipchat_emoticons_to_slack/
1548408310.0;False;ajndvv;True;False;t3_ajndvv;3;False;/r/Slack/comments/ajndvv/scheduled_automated_video_calls/;2;"Hi.I work in a remote team and we do a couple of video calls every day to talk to each other a little bit: a sort of remote coffee-break. Now we do this manually but sometimes we forgot to start the call or we do it too late.So we would like to set up a service that twice a day posts a message to a slack channel with a link to a video call so that our team just clicks on that link to join the call and talk to each other.&#x200B;With IFTT we are able to send a message at a scheduled time, but I still didn't find a way to automatically start a video call. We can use the slack calls, hangouts, meet or other systems.&#x200B;Any ideas?thank you!&#x200B;";False;Scheduled automated video calls;https://www.reddit.com/r/Slack/comments/ajndvv/scheduled_automated_video_calls/
1548370235.0;False;ajibt7;True;False;t3_ajibt7;0;False;/r/Slack/comments/ajibt7/does_slack_strip_exif_location_data_from_images/;5;I see 2017 complaints about Slack not removing EXIF GPS data from shared image files, but I have recently tried sharing and then redownloading an image and the EXIF data was missing. Can anyone confirm?;False;Does Slack Strip EXIF Location Data From Images?;https://www.reddit.com/r/Slack/comments/ajibt7/does_slack_strip_exif_location_data_from_images/
1548418625.0;False;ajogof;False;False;t3_ajogof;11;False;/r/Slack/comments/ajogof/slack_vs_discord_which_one_is_better_for/;0;;False;Slack vs Discord - Which One Is Better for Businesses?;https://www.troopmessenger.com/blogs/discord-vs-slack-which-one-is-better-for-businesses
1548379812.0;False;ajjtdo;True;False;t3_ajjtdo;1;False;/r/Slack/comments/ajjtdo/anyone_know_of_a_plugin_that_will_pull_a_photo/;1;"I'm looking for a plugin that would be able to pull a random image from an established folder stored in something like Google Drive or Box. For example, I would type ""/command givemeaphoto"" and it would pull a photo at random from the album. Does anyone know if something like this exists? So far my Googling has not been fruitful.";False;Anyone know of a plugin that will pull a photo from a Drive or Box folder?;https://www.reddit.com/r/Slack/comments/ajjtdo/anyone_know_of_a_plugin_that_will_pull_a_photo/
1548264724.0;False;aj24ou;False;False;t3_aj24ou;3;False;/r/Slack/comments/aj24ou/when_your_girlfriend_breaks_up_with_you_but_you/;13;;False;When your girlfriend breaks up with you but you never loved her anyway;https://i.imgur.com/uw85OWe.png
1548285514.0;False;aj5x3j;True;False;t3_aj5x3j;2;False;/r/Slack/comments/aj5x3j/where_do_the_rest_of_slacks_styling_exist/;3;"I've done the `const cssPath ='https://cdn.rawgit.com/laCour/slack-night-mode/master/css/raw/black.css';` and that was a nice starting point, but I didn't like their styling. So I changed everything that I could in the available CSS in the `ssb-interop.js` file. Unfortunately, there are still a few things that I've yet to see the styling for.These include:\- 'More Unreads' tab in sidebar that is shown when you scroll down your sidebar\- Header where exists: channel name, star this channel, channel member list, start phone call icon, channel details icon, channel settings icon, search field, show activity icon, show starred items icons, more activity icon, What's New icon.\- notification badges on Slack groups\- message field font";False;Where do the rest of Slack's styling exist?;https://www.reddit.com/r/Slack/comments/aj5x3j/where_do_the_rest_of_slacks_styling_exist/
1548274754.0;False;aj3zm8;True;False;t3_aj3zm8;0;False;/r/Slack/comments/aj3zm8/desktop_client_notification_api/;1;Is it possible to access APIs to have another program or script to notify the user and doesnt go away on the windows desktop that they have an unread Direct Message?I can write something in Python likely but I need to be able to query the Slack server for unread DM flag or the client software.  (Note, I don't need to have the program/script read the message just that there is an unread message.;False;Desktop Client Notification API?;https://www.reddit.com/r/Slack/comments/aj3zm8/desktop_client_notification_api/
1548269166.0;False;aj2y9l;True;False;t3_aj2y9l;0;False;/r/Slack/comments/aj2y9l/how_random_are_slackbot_responses/;1;;False;How random are Slackbot responses?;https://www.reddit.com/r/Slack/comments/aj2y9l/how_random_are_slackbot_responses/
1548258304.0;False;aj0yq1;True;False;t3_aj0yq1;3;False;/r/Slack/comments/aj0yq1/slackbot_autoresponder_message_formatting/;1;"Short of asterisks for bold, underscores for ital, and tildes for strikethroughs, are there any other formatting options for Slackbot autoresponses?I'm trying to code in responses to commonly asked questions in the office, and things like ""overnight mailing addresses"" would really benefit from being formatted in an unordered list vs. a series of run-on phrases separated by a |.";False;Slackbot Autoresponder Message Formatting;https://www.reddit.com/r/Slack/comments/aj0yq1/slackbot_autoresponder_message_formatting/
1548256143.0;False;aj0lov;False;False;t3_aj0lov;1;False;/r/Slack/comments/aj0lov/expected_changes_in_slack_after_ipo/;0;;False;Expected changes in Slack after IPO;https://i.redd.it/gzhll8ysu6c21.png
1548149727.0;False;ail8qo;True;False;t3_ail8qo;16;False;/r/Slack/comments/ail8qo/if_you_could_teach_a_botassistant_to_do_one_thing/;7;"  Hi all - Nick from [Lexico](https://lexico.io/) here.The question is in the title, but really I was hoping some of the creative minds here could help me out with the following:If you could teach a bot/assistant to do one thing for you - at work, home, anywhere - what would it be?I'm really captivated by the idea of talking to a bot - the same way  you'd talk to your assistant or colleague - and have it perform tasks to  help with your job and your daily life.Some things that have been thrown up so far during exploration:&#x200B;* creating and emailing invoices to clients   * checking in with your team on Friday afternoon to record their availability in the following week   * creating builds/releases in a CI/CD pipeline and sharing results   * generating contracts/documents from templates   * recording what you eat and putting it into a food diary   * tracking gaming stats via Discord to find favourite maps/weapons/etc   If there's anyone willing to take it a step further - our (fairly  rudimentary) beta is live at the moment, hooked up to Slack and Zapier.I was hoping a few people would volunteer 15 minutes of their time  for a screen-share and walkthrough. There's a Starbucks voucher for  anyone who would be so kind :)";False;If you could teach a bot/assistant to do one thing for you, what would it be?;https://www.reddit.com/r/Slack/comments/ail8qo/if_you_could_teach_a_botassistant_to_do_one_thing/
1548163324.0;False;aimrre;True;False;t3_aimrre;4;False;/r/Slack/comments/aimrre/slack_tray_icon_no_notifications_linuxkde/;2;"I have this weird tray icon since recent update with their new Icon.  It does not change to give me any visual queue when there are missed messages.Screenshot: [https://i.imgur.com/opUh3tH.png](https://i.imgur.com/opUh3tH.png)Anyone else having this problem?  I am running Kubuntu 18.04 with the official PPA.If someone can send me a link where I can submit a bug report I'd be happy to do so.Thanks&#x200B;";False;Slack Tray Icon No Notifications (Linux/KDE);https://www.reddit.com/r/Slack/comments/aimrre/slack_tray_icon_no_notifications_linuxkde/
1548175042.0;False;aiolge;True;False;t3_aiolge;4;False;/r/Slack/comments/aiolge/bot_for_daily_google_calendar_reminder/;1;I want to have a way to send to my slack channel a reminder daily for my tomorrow's meeting schedule.  Is there a bot or IFTTT/zapier script to for this exact purpose?;False;Bot for daily google calendar reminder?;https://www.reddit.com/r/Slack/comments/aiolge/bot_for_daily_google_calendar_reminder/
1548127211.0;False;aiikdi;True;False;t3_aiikdi;2;False;/r/Slack/comments/aiikdi/specific_slack_group_keeps_reloading_win10/;3;"Heya folks.&#x200B;My Slack on Win10 just started doing this thing where one specific Slack will just periodically reload as if I had hit Ctrl-R. Happens while idle, while Im typing or even if Im not focused on Slack and it will focus on the app and reload the slack.  This JUST started mid last week around the update.  Anyone have any idea whats happening??  Cheers.";False;"Specific Slack ""group"" keeps reloading - Win10";https://www.reddit.com/r/Slack/comments/aiikdi/specific_slack_group_keeps_reloading_win10/
1548113980.0;False;aigkcv;False;False;t3_aigkcv;3;False;/r/Slack/comments/aigkcv/slacks_new_logo_reminds_me_of_the_swedish_liberal/;4;;False;"Slacks new logo reminds me of the Swedish liberal party ""Liberalerna""";https://i.redd.it/tjazobk34vb21.png
1548114151.0;False;aigle9;True;False;t3_aigle9;6;False;/r/Slack/comments/aigle9/questions_about_administration_of_a_plus_account/;1;As I say in the title, I've got some questions about how administration of a Plus account works.   * Who administers the account?  Is there a single person who has the keys to the whole thing?  Or can you have a group of people who have equal access?     * Whatever the answer to that question is, is it the same for the user provisioning? * How hard is the SSO to get set up?;False;Questions about administration of a Plus account;https://www.reddit.com/r/Slack/comments/aigle9/questions_about_administration_of_a_plus_account/
1548111291.0;False;aig42s;True;False;t3_aig42s;7;False;/r/Slack/comments/aig42s/is_there_a_way_to_create_a_channel_where_every/;0;"For example:  A Channel names ""Expenses"" - each input would be directly input to a spreadsheet  eg - Hardware store - $56.66";False;Is there a way to create a channel where every input is collected into a spreadsheet.;https://www.reddit.com/r/Slack/comments/aig42s/is_there_a_way_to_create_a_channel_where_every/
1548094463.0;False;aicvg7;True;False;t3_aicvg7;3;False;/r/Slack/comments/aicvg7/poll_direct_messages_vs_channel_messages/;2;For anyone who sees the slack analytics summary for your team, do you typically see more messages in channels, or in DMs? ;False;Poll - Direct messages vs. channel messages;https://www.reddit.com/r/Slack/comments/aicvg7/poll_direct_messages_vs_channel_messages/
1548061854.0;False;ai8f47;True;False;t3_ai8f47;18;False;/r/Slack/comments/ai8f47/dark_theme_for_desktop_app/;8;"The new logo and colors are good an all, but what about a dark theme? Last time I heard, it was coming ""soon"" a year ago.";False;Dark theme for desktop app?;https://www.reddit.com/r/Slack/comments/ai8f47/dark_theme_for_desktop_app/
1548071736.0;False;ai9fyr;True;False;t3_ai9fyr;1;False;/r/Slack/comments/ai9fyr/what_do_these_specific_privacy_settings_mean/;2;"Hey /r/slack users!I was looking at our https://INSERT_COMPANY_NAME_HERE.slack.com/account/workspace-settings#retention page and it says the following:    Public Channels    Messages are never deleted, but edit and deletion history is discarded    Private Channels    Messages are never deleted, but edit and deletion history is discarded    Direct Messages    Messages are never deleted, but edit and deletion history is discarded    Files    Files are never deletedWhat does ""edit and deletion history is discarded"" mean? does it mean that deleted messages are never actually deleted or that deleted messages are also deleted from the history?thanks in advance!";False;What do these specific privacy settings mean?;https://www.reddit.com/r/Slack/comments/ai9fyr/what_do_these_specific_privacy_settings_mean/
1547999404.0;False;ahyr0u;False;False;t3_ahyr0u;18;False;/r/Slack/comments/ahyr0u/does_anyone_else_think_the_new_logo_looks_like_it/;41;;False;Does anyone else think the new logo looks like it belongs to a hospital?;https://i.imgur.com/AOEMjLe.jpg
1548054254.0;False;ai7m3j;True;False;t3_ai7m3j;2;False;/r/Slack/comments/ai7m3j/slacks_gif_encoding_is_atrocious/;2;"I tried posting a gif showing some workflow stuff today in a channel for work. Slack re-compressed the gif with whatever thing they have behind the scenes to standardize their gifs, which is fine except that the end result was not only larger (2.5mb vs the 1.8mb original), but was completely illegible. Examples here:[My version](http://files.jjcm.org/myGif.gif)[Slack's encoded version](http://files.jjcm.org/wtfSlack.gif)This is really unacceptable for a modern day chat tool, and it's a fairly simple fix. I really hope Slack gets on this.-------If any of the slack devs are out there, this can be solved pretty easily I think. I suspect what's happening is slack's encoding method isn't using a palette for the gifs, which creates a far lossier end result. Here's a ffmpeg script that I used for encoding that resulted in my version above:     #!/bin/sh    palette=""/tmp/palette.png""    filters=""fps=25,scale=500:-1:flags=lanczos""    ffmpeg -v warning -i $1 -vf ""$filters,palettegen"" -y $palette    ffmpeg -v warning -i $1 -i $palette -lavfi ""$filters [x]; [x][1:v] paletteuse"" -y $2";False;Slack's gif encoding is atrocious;https://www.reddit.com/r/Slack/comments/ai7m3j/slacks_gif_encoding_is_atrocious/
1548009622.0;False;ai0se7;False;False;t3_ai0se7;0;False;/r/Slack/comments/ai0se7/slacking/;1;;False;Slacking;https://i.redd.it/39iwne2i6mb21.png
1547935155.0;False;ahqs8t;True;False;t3_ahqs8t;3;False;/r/Slack/comments/ahqs8t/how_to_see_everyone_who_reacted_to_a_post/;3;Im running a giveaway in my slack and it happens that 154 users have entered, but slack only allows me to see 56 of them... Is there anyway for me to see every reaction?;False;How to see EVERYONE who reacted to a post?;https://www.reddit.com/r/Slack/comments/ahqs8t/how_to_see_everyone_who_reacted_to_a_post/
1547840142.0;False;ahe3xt;False;False;t3_ahe3xt;1;False;/r/Slack/comments/ahe3xt/new_slack_logo_upside_down_is_google_photos_logo/;24;;False;New Slack logo upside down is Google Photos logo;https://twitter.com/asherhunt/status/1086273229474263041
1547861665.0;False;ahhgrl;True;False;t3_ahhgrl;0;False;/r/Slack/comments/ahhgrl/slack_logo_evolution/;0;[https://9gag.com/gag/a9KE4NZ](https://9gag.com/gag/a9KE4NZ);False;Slack Logo Evolution;https://www.reddit.com/r/Slack/comments/ahhgrl/slack_logo_evolution/
1547863351.0;False;ahhp85;True;False;t3_ahhp85;6;False;/r/Slack/comments/ahhp85/my_team_use_slack_ask_question_and_question_how/;1;is it api or bot?;False;my team use slack ask question and question, how can I categorize these conversation to build a knowledge document?;https://www.reddit.com/r/Slack/comments/ahhp85/my_team_use_slack_ask_question_and_question_how/
1547833900.0;False;ahd1dr;True;False;t3_ahd1dr;2;False;/r/Slack/comments/ahd1dr/slacks_new_logo_first_thing_i_saw/;4;"&#x200B;https://i.redd.it/ix85k7utx7b21.png";False;Slack's new logo - First thing I saw;https://www.reddit.com/r/Slack/comments/ahd1dr/slacks_new_logo_first_thing_i_saw/
1547839116.0;False;ahdxpa;True;False;t3_ahdxpa;0;False;/r/Slack/comments/ahdxpa/the_new_slack_logo_looks_like_a_bottom_up_view_of/;2;;False;The new slack logo looks like a bottom up view of a mopper;https://www.reddit.com/r/Slack/comments/ahdxpa/the_new_slack_logo_looks_like_a_bottom_up_view_of/
1547779014.0;False;ah5rwf;False;False;t3_ah5rwf;13;False;/r/Slack/comments/ah5rwf/slack_has_updatedfixed_their_website_favicons/;36;;False;Slack has updated/fixed their website favicons;https://i.redd.it/ijaw1yq2g3b21.png
1547804204.0;False;ah8u08;False;False;t3_ah8u08;1;False;/r/Slack/comments/ah8u08/slack_icon_replacement_for_macos_instruction/;8;;False;Slack Icon Replacement for MacOS + Instruction;https://dribbble.com/shots/5863220-Free-Alternative-Slack-Mac-Icon-Sketch-File
1547816892.0;False;aha9ov;False;False;t3_aha9ov;0;False;/r/Slack/comments/aha9ov/for_those_who_want_the_old_slack_logo_back_an/;5;;False;For those who want the old Slack logo back + an alternate new slack logo. I've made a step by step guide on getting the old Slack logo back on your MacOS here.;https://dribbble.com/shots/5864888-Free-Alternative-Slack-Mac-Icon-Sketch-File
1547847985.0;False;ahfevk;True;False;t3_ahfevk;4;False;/r/Slack/comments/ahfevk/how_do_i_get_my_bots_api/;0;"I am trying to set up Facebot and it requires, among other things, creating your own bot in Slack, which I did, and getting its API, which I am failing to find. Can anyone point me in the right direction?Thanks.&#x200B;Link to the Facebot set up (Github) - [https://github.com/Weetbix/facebot](https://github.com/Weetbix/facebot)";False;How do I get my bot's API?;https://www.reddit.com/r/Slack/comments/ahfevk/how_do_i_get_my_bots_api/
1547810485.0;False;ah9hqm;False;False;t3_ah9hqm;0;False;/r/Slack/comments/ah9hqm/how_to_keep_the_original_slack_app_icon_on_macos/;5;;False;How to Keep the Original Slack App Icon on macOS – Jeff Eisley – Medium;https://medium.com/jeff-eisley/how-to-keep-the-original-slack-app-icon-on-macos-a765aec19b80
1547840106.0;False;ahe3pk;True;False;t3_ahe3pk;5;False;/r/Slack/comments/ahe3pk/reenable_popup_menu_you_are_marked_as_away_would/;1;"So I accidentally, clicked the ""Don't ask me again, please"" during this prompt - You are marked as ""away"", would you like to switch to appear active ?&#x200B;&#x200B;https://i.redd.it/4cbpvej4h8b21.png&#x200B;I would like to re-enable this, any idea how to do it on the Desktop Client. I can't find anything in the menu/setting, also have reset the app data and reinstalled the app without any luck. ";False;"Re-enable pop-up menu - You are marked as ""away"", would you like to switch to appear active ?";https://www.reddit.com/r/Slack/comments/ahe3pk/reenable_popup_menu_you_are_marked_as_away_would/
1547795892.0;False;ah7zz2;False;False;t3_ah7zz2;0;False;/r/Slack/comments/ah7zz2/slacks_new_logo/;5;;False;Slack's New Logo;https://youtu.be/wiwwFQppCaU
1547721151.0;False;agwgwa;False;False;t3_agwgwa;46;False;/r/Slack/comments/agwgwa/new_slack_logo_recoloured_for_no_reason/;268;;False;New Slack Logo, recoloured for no reason;https://i.redd.it/usdoeq33oya21.png
1547771944.0;False;ah4ph5;True;False;t3_ah4ph5;1;False;/r/Slack/comments/ah4ph5/slacks_new_default_profile_pic_design/;19;I know everyone hates the new Slack logo (including me), but that's just a cosmetic thing with no real UI/UX impact.What is really infuriating is Slack's new default profile pic design (for users who didn't upload a profile pic). They are way too similar and difficult to distinguish. This actually negatively impacts UI/UX.Here's an example from a small slack workspace that has 6 users. This screenshot of the profile pics are for 3 different users. All 3 look extremely similar, and 2 of them are identical! There's only 6 users, they couldn't come up with a more distinct design for each?? It makes it difficult to visually distinguish who posted.https://i.imgur.com/mJf3Rey.png;False;Slack's new default profile pic design;https://www.reddit.com/r/Slack/comments/ah4ph5/slacks_new_default_profile_pic_design/
1547764315.0;False;ah3g0t;False;False;t3_ah3g0t;3;False;/r/Slack/comments/ah3g0t/who_let_the_ducks_out/;16;;False;Who let the ducks out?;https://twitter.com/matejkustec/status/1086023640464936962
1547762901.0;False;ah36xm;False;False;t3_ah36xm;1;False;/r/Slack/comments/ah36xm/john_gruber_pentagrams_range_of_possibilities_for/;13;;False;John Gruber: Pentagram’s ‘Range of Possibilities’ for Slack;https://daringfireball.net/2019/01/pentagram_slack_range_of_possibilities
1547764210.0;False;ah3fbn;True;False;t3_ah3fbn;4;False;/r/Slack/comments/ah3fbn/slacks_new_logo/;12;"&#x200B;https://i.redd.it/6ti13gf882b21.jpgInterpreted from [https://slackhq.com/say-hello-new-logo](https://slackhq.com/say-hello-new-logo)Many beautiful things—but without a sense of cohesion that you might expect. So here we are. Our in-house design and brand team, together with Michael Bierut and the team from [Pentagram](https://www.pentagram.com/work/slack), ~~worked to create a new~~ copied a tested method  and more ~~cohesive~~ successful visual identity. And we’re starting, today, with the logo.It uses a ~~simpler~~ copied color palette and, we believe, is ~~more refined~~ turned 180 to hide it, but still contains the spirit of the original. It’s an evolution, and one that can scale easily, and work better, in many more places. ";False;"Slacks ""New"" Logo";https://www.reddit.com/r/Slack/comments/ah3fbn/slacks_new_logo/
1547788994.0;False;ah766g;True;False;t3_ah766g;1;False;/r/Slack/comments/ah766g/any_way_to_add_a_users_status_for_modsadminsvip/;2;Is there a way to add a user status option that is only able to be set by admins?I want to achieve something similar to the Twitter verified checkmark for some users of my SlackThanks!;False;Any way to add a users status for mods/admins/VIP members?;https://www.reddit.com/r/Slack/comments/ah766g/any_way_to_add_a_users_status_for_modsadminsvip/
1547742043.0;False;agzef6;False;False;t3_agzef6;4;False;/r/Slack/comments/agzef6/hi_slack_i_fixed_your_logo/;21;;False;Hi Slack, I fixed your logo;https://i.imgur.com/w64ZJo5.png
