created_utc;edited;id;is_self;locked;name;num_comments;over_18;permalink;score;selftext;spoiler;title;url
1552667458.0;False;b1gzkn;True;False;t3_b1gzkn;1;False;/r/snapchat/comments/b1gzkn/27_m4f_firefighter_from_florida_stuck_at_work/;1;Dm me you’re username  18+ be normal don’t ghost in half a day on me lol looking for long term friendships ;False;27 [m4f] firefighter from florida stuck at work anyone wanna chat ?;https://www.reddit.com/r/snapchat/comments/b1gzkn/27_m4f_firefighter_from_florida_stuck_at_work/
1552664672.0;False;b1gggl;True;False;t3_b1gggl;1;False;/r/snapchat/comments/b1gggl/19_m4a_just_need_friends_tbh/;1;I'm just wanting someone to talk to, I'm bored as hell on my days off;False;19 [M4A] Just need friends tbh;https://www.reddit.com/r/snapchat/comments/b1gggl/19_m4a_just_need_friends_tbh/
1552662471.0;False;b1g1ji;True;False;t3_b1g1ji;0;False;/r/snapchat/comments/b1g1ji/23m4a_looking_for_new_snapchat_friends_on/;1;;False;23[M4A] looking for new Snapchat friends! On snapchats or ask !;https://www.reddit.com/r/snapchat/comments/b1g1ji/23m4a_looking_for_new_snapchat_friends_on/
1552658296.0;False;b1f9zt;True;False;t3_b1f9zt;1;False;/r/snapchat/comments/b1f9zt/30_m4a_bother_me/;1;All my work is basically done for the week yet here I am at work.  Someone bother me!  ;False;30 [M4A] BOTHER ME!;https://www.reddit.com/r/snapchat/comments/b1f9zt/30_m4a_bother_me/
1552656905.0;False;b1f19x;True;False;t3_b1f19x;1;False;/r/snapchat/comments/b1f19x/21_m4f_meeting_new_people_to_snap_and_chat_with/;0;Message me your snap if you want to chat. 9 in;False;21 [M4F] meeting new people to snap and chat with I’ll tell you a secret.;https://www.reddit.com/r/snapchat/comments/b1f19x/21_m4f_meeting_new_people_to_snap_and_chat_with/
1552656045.0;False;b1evsb;True;False;t3_b1evsb;1;False;/r/snapchat/comments/b1evsb/19_m4a/;1;Just a regular European guy who wants to improve English. Send me sometnig about you, your gender and where are you from and i will send my snap username. ;False;19 [M4A];https://www.reddit.com/r/snapchat/comments/b1evsb/19_m4a/
1552655372.0;False;b1erd7;True;False;t3_b1erd7;2;False;/r/snapchat/comments/b1erd7/23_m4a_truck_driver_looking_to_share_travels/;2;I’m an OTR truck driver and I’m looking to share my experiences with the world. So if you would like to see the sights that America has to offer DM me your username! ;False;23 [M4A] Truck Driver Looking to Share Travels;https://www.reddit.com/r/snapchat/comments/b1erd7/23_m4a_truck_driver_looking_to_share_travels/
1552654842.0;False;b1enya;True;False;t3_b1enya;1;False;/r/snapchat/comments/b1enya/16m4f_stuck_sick_at_home_hmu/;1;Got nothing to do today so message me ur snap and I’ll add;False;16[M4F] stuck sick at home hmu;https://www.reddit.com/r/snapchat/comments/b1enya/16m4f_stuck_sick_at_home_hmu/
1552653036.0;False;b1ecvr;True;False;t3_b1ecvr;1;False;/r/snapchat/comments/b1ecvr/21_m4f_meeting_new_people_tell_me_something_about/;1;If your interested message me your snap.;False;21 [M4F] meeting new people. Tell me something about yourself.;https://www.reddit.com/r/snapchat/comments/b1ecvr/21_m4f_meeting_new_people_tell_me_something_about/
1552643560.0;False;b1cykp;True;False;t3_b1cykp;1;False;/r/snapchat/comments/b1cykp/22m4a_looking_for_something_spicy/;1;A 18+ just about out life’s completely platonic but just an adult chat pm me your snap if interested ;False;22[M4A] Looking for something spicy;https://www.reddit.com/r/snapchat/comments/b1cykp/22m4a_looking_for_something_spicy/
1552642835.0;False;b1cva6;True;False;t3_b1cva6;18;False;/r/snapchat/comments/b1cva6/19_f4a_is_this_thing_on/;24;"Hiya! Bored and looking for someone to chat with, i do a bit of gaming, like to be active.DM a bit about you and we'll go from there ;)";False;19 [F4A] is this thing on?;https://www.reddit.com/r/snapchat/comments/b1cva6/19_f4a_is_this_thing_on/
1552636455.0;False;b1c2sq;True;False;t3_b1c2sq;1;False;/r/snapchat/comments/b1c2sq/19_m4f_looking_forward_to_meet_new_people/;1;I study design and photography.I draw and craft with my hands.Looking forward for inspiration from other cultures and making new friends can never hurtAhmad-alb 👻 ;False;19 [m4f] looking forward to meet new people;https://www.reddit.com/r/snapchat/comments/b1c2sq/19_m4f_looking_forward_to_meet_new_people/
1552634749.0;False;b1bv8p;True;False;t3_b1bv8p;1;False;/r/snapchat/comments/b1bv8p/22_m4aworking_night_shifts_bored/;2;Hello all im a 22 y.o guy from the us working night shifts looking for others that are night owls or in a different time zone that want to talk and make friends Im big into cars, games, movies and much more Pm me with you snap and some about you if youre looking to chat ;False;22 [M4A]-working night shifts bored;https://www.reddit.com/r/snapchat/comments/b1bv8p/22_m4aworking_night_shifts_bored/
1552634371.0;False;b1btkj;True;False;t3_b1btkj;1;False;/r/snapchat/comments/b1btkj/19_m4f_want_some_new_friends_to_talk_and_streak/;2;;False;19 [m4f] want some new friends to talk and streak... And who can keep streak..;https://www.reddit.com/r/snapchat/comments/b1btkj/19_m4f_want_some_new_friends_to_talk_and_streak/
1552633034.0;False;b1bne9;True;False;t3_b1bne9;1;False;/r/snapchat/comments/b1bne9/19m4f_its_easier_to_talk_to_girls_i_want_new/;2;;False;19[M4F] it’s easier to talk to girls, I want new friends;https://www.reddit.com/r/snapchat/comments/b1bne9/19m4f_its_easier_to_talk_to_girls_i_want_new/
1552631849.0;False;b1bhxc;True;False;t3_b1bhxc;1;False;/r/snapchat/comments/b1bhxc/21_m4f_need_friends/;2;Looking for new people to talk to. Im a big night owl and always up super late. Im a pretty nerdy guy, i love cooking, video games, and skateboarding. If you wanna know more pm me your snap info and maybe a few things about yourself as well :);False;21 [M4F] need friends!;https://www.reddit.com/r/snapchat/comments/b1bhxc/21_m4f_need_friends/
1552630172.0;False;b1b9v2;True;False;t3_b1b9v2;1;False;/r/snapchat/comments/b1b9v2/23_m4f_looking_for_a_girl_to_talk_to_and_have_a/;2;looking for a girl to talk to and have a couple of qustions maybe a girl can answer;False;23 [M4F] looking for a girl to talk to and have a couple of qustions maybe a girl can answer;https://www.reddit.com/r/snapchat/comments/b1b9v2/23_m4f_looking_for_a_girl_to_talk_to_and_have_a/
1552618869.0;False;b19mhv;True;False;t3_b19mhv;1;False;/r/snapchat/comments/b19mhv/37_m4f_looking_for_new_friends/;2;Hmu with your snapchat ;False;37 [m4f] looking for new friends;https://www.reddit.com/r/snapchat/comments/b19mhv/37_m4f_looking_for_new_friends/
1552618774.0;False;b19lxf;True;False;t3_b19lxf;1;False;/r/snapchat/comments/b19lxf/21_m4a_im_really_just_tryna_meet_talk_to_new/;1;;False;21 [M4A] i’m really just tryna meet & talk to new people. dm me your Snapchat & I’ll add you!;https://www.reddit.com/r/snapchat/comments/b19lxf/21_m4a_im_really_just_tryna_meet_talk_to_new/
1552614125.0;False;b18uve;True;False;t3_b18uve;6;False;/r/snapchat/comments/b18uve/23f4a/;4;Looking for some cool people to talk to. Apparently, the internet is the place to find em!Idk🤦🏻‍♀️🤷🏻‍♀️Hmu***please send age and username to inbox***;False;23[F4A];https://www.reddit.com/r/snapchat/comments/b18uve/23f4a/
1552612224.0;False;b18jyv;True;False;t3_b18jyv;4;False;/r/snapchat/comments/b18jyv/17m4m/;2;hi, for anyone reading this... i would like someone my age to talk and be friends w, and i could use some support and help from said person. i will not always require this but i have bipolar depression, adhd, aspergers (sorry i’m retarded, everyone hates that, don’t worry) and i really jus lost my will to do anything. i starve myself from time to time, hoping one time i’ll jus faint and black out for a while. if you’re around my age and you are willing to help a bro out please message me. thank you😭;False;17[M4M];https://www.reddit.com/r/snapchat/comments/b18jyv/17m4m/
1552611877.0;False;b18hvq;True;False;t3_b18hvq;8;False;/r/snapchat/comments/b18hvq/16_f4a_call_us/;1;Me and my friend would love to call people, I’m 16 and she’s 14. Message us? 13-18 ONLY please;False;16 [F4A] call us?;https://www.reddit.com/r/snapchat/comments/b18hvq/16_f4a_call_us/
1552607623.0;False;b17rg4;True;False;t3_b17rg4;2;False;/r/snapchat/comments/b17rg4/meta_is_the_top_right_person_on_the_send_to_tab/;1;Title ;False;[meta] Is the top right person on the Send to tab your #1 best friend?;https://www.reddit.com/r/snapchat/comments/b17rg4/meta_is_the_top_right_person_on_the_send_to_tab/
1552607591.0;False;b17r8u;True;False;t3_b17r8u;4;False;/r/snapchat/comments/b17r8u/31_f4a_snapchat_friends/;7;Florida girl here! Would like to just chat, snap with cool people , people who like to have actually convos and not disappear after a while. I’m a nurse so I’m usually busy part of the week but I try to go on here often😁 I’m married so I’m not looking for anything and no dirty chats, strictly platonic.  I usually snap everyday and chat, Would love to hear from you! 👋  message me something about you so I know who I’m adding! ;False;31 [F4A] snapchat friends;https://www.reddit.com/r/snapchat/comments/b17r8u/31_f4a_snapchat_friends/
1552607320.0;False;b17pjk;True;False;t3_b17pjk;1;False;/r/snapchat/comments/b17pjk/27m4f_late_night_chat_abut_anything_pm_me_your/;1;;False;27[m4f] late night chat abut anything. Pm me your age and name;https://www.reddit.com/r/snapchat/comments/b17pjk/27m4f_late_night_chat_abut_anything_pm_me_your/
1552604730.0;False;b178cs;True;False;t3_b178cs;1;False;/r/snapchat/comments/b178cs/20_m4f_british_guy_looking_for_girls_to_speak_to/;1;Dm me for my snap or send me yours;False;20 [M4F] British guy looking for girls to speak to preferably a similar age but I don't mind;https://www.reddit.com/r/snapchat/comments/b178cs/20_m4f_british_guy_looking_for_girls_to_speak_to/
1552603921.0;False;b172pd;True;False;t3_b172pd;1;False;/r/snapchat/comments/b172pd/43m4a_stuck_inside_during_a_bad_storm/;1;Come talk with me. Send me your snaps. Yay;False;43[M4A] Stuck inside during a bad storm;https://www.reddit.com/r/snapchat/comments/b172pd/43m4a_stuck_inside_during_a_bad_storm/
1552603615.0;False;b170n6;True;False;t3_b170n6;2;False;/r/snapchat/comments/b170n6/15_m4f_looking_for_ft_buddy/;1;Pm me for username;False;15 [M4F] Looking for ft buddy;https://www.reddit.com/r/snapchat/comments/b170n6/15_m4f_looking_for_ft_buddy/
1552600401.0;False;b16dfw;True;False;t3_b16dfw;1;False;/r/snapchat/comments/b16dfw/26_m4f/;1;another sleepless night, someone wanna keep me company? dm me your username and i will add you :)!;False;26 [M4F];https://www.reddit.com/r/snapchat/comments/b16dfw/26_m4f/
1552597694.0;False;b15tpk;True;False;t3_b15tpk;1;False;/r/snapchat/comments/b15tpk/15m4a_hmu_if_u_think_u_can_keep_up/;1;;False;15[M4A] Hmu if u think u can keep up;https://www.reddit.com/r/snapchat/comments/b15tpk/15m4a_hmu_if_u_think_u_can_keep_up/
1552594136.0;False;b153il;True;False;t3_b153il;1;False;/r/snapchat/comments/b153il/17_m4a_looking_for_friends_streaks/;4;Pm me your age and some of your interests :) some of mine include, videogames, longboarding, and watching Netflix :) ;False;17 [M4A] Looking for friends / streaks;https://www.reddit.com/r/snapchat/comments/b153il/17_m4a_looking_for_friends_streaks/
1552590094.0;False;b149n8;True;False;t3_b149n8;1;False;/r/snapchat/comments/b149n8/21_m4f_looking_to_meet_new_friends_who_want_to/;1;If your interested message me your snap.;False;21 [M4F] looking to meet new friends who want to snap and chat any age above 18.;https://www.reddit.com/r/snapchat/comments/b149n8/21_m4f_looking_to_meet_new_friends_who_want_to/
1552589913.0;False;b148am;True;False;t3_b148am;2;False;/r/snapchat/comments/b148am/23_m4f_looking_for_new_snap_friends_and_snap/;4;23 year old guy from the south. Into sports, working out, and video games! Pm me your snapchat names and I'll add you! ;False;23 [M4F] looking for new snap friends and snap streaks! Pm snap names!;https://www.reddit.com/r/snapchat/comments/b148am/23_m4f_looking_for_new_snap_friends_and_snap/
1552586856.0;False;b13mdj;True;False;t3_b13mdj;1;False;/r/snapchat/comments/b13mdj/17_m4f_spring_break_started/;1;I'm bored and need friends ;False;17 [M4F] Spring Break Started;https://www.reddit.com/r/snapchat/comments/b13mdj/17_m4f_spring_break_started/
1552582491.0;False;b12prp;True;False;t3_b12prp;1;False;/r/snapchat/comments/b12prp/23_m4f_looking_for_new_snap_friends_and_snap/;1;;False;23 [M4F] looking for new snap friends and snap streaks! Pm me your snapchat names and I'll add you!;https://www.reddit.com/r/snapchat/comments/b12prp/23_m4f_looking_for_new_snap_friends_and_snap/
1552580252.0;False;b1291z;True;False;t3_b1291z;1;False;/r/snapchat/comments/b1291z/21_m4f_looking_to_meet_new_friends_to_snap_and/;2;If you want pm me your snap.;False;21 [M4F] looking to meet new friends to snap and chat with. Tell me something about yourself.;https://www.reddit.com/r/snapchat/comments/b1291z/21_m4f_looking_to_meet_new_friends_to_snap_and/
1552578638.0;False;b11x6b;True;False;t3_b11x6b;1;False;/r/snapchat/comments/b11x6b/31_m4f_a_cute_canadian_looking_for_a_voice_or/;1;Just woke up and got nothing to do so I figured if anyobe is interested in voice or video chat...dm me a bit about yourself if you are interested ;False;31 [M4F] A cute Canadian looking for a voice or video chat;https://www.reddit.com/r/snapchat/comments/b11x6b/31_m4f_a_cute_canadian_looking_for_a_voice_or/
1552575534.0;False;b11ben;True;False;t3_b11ben;0;False;/r/snapchat/comments/b11ben/24f4a_stressed_depressed_ill_never_learn_how_to/;6;I like checking out other people’s stories, and though I don’t converse one on one too often, I’ll probably make quips on your story!I mainly share selfies, memes, and I work in an art gallery so I try to post some art every shift. Definitely not interested in or looking for intimacy or dick picks, there’s a sub for that if that’s what you want.Send me a message with your snap name, a short description of yourself and your dream pet.Look forward to hearing from you!;False;24[F4A] stressed, depressed, I’ll never learn how to dress;https://www.reddit.com/r/snapchat/comments/b11ben/24f4a_stressed_depressed_ill_never_learn_how_to/
1552577460.0;False;b11p2r;True;False;t3_b11p2r;1;False;/r/snapchat/comments/b11p2r/27_m4f_need_new_friends_someone_who_can_hold_a/;1;;False;27 [M4F] need new friends. Someone who can hold a conversation;https://www.reddit.com/r/snapchat/comments/b11p2r/27_m4f_need_new_friends_someone_who_can_hold_a/
1552575128.0;False;b118oz;True;False;t3_b118oz;1;False;/r/snapchat/comments/b118oz/20_m4f_looking_for_conversations/;1;Can be a friend, can be more, can be lessAhmad-albFind out.;False;20 [m4f] looking for conversations;https://www.reddit.com/r/snapchat/comments/b118oz/20_m4f_looking_for_conversations/
1552572549.0;False;b10rrj;True;False;t3_b10rrj;6;False;/r/snapchat/comments/b10rrj/17f4mlooking_for_young_people/;2;Looking for people to chat with that are under my age, I won’t accept people over it so don’t pm me.;False;17[F4M]Looking for young people;https://www.reddit.com/r/snapchat/comments/b10rrj/17f4mlooking_for_young_people/
1552569282.0;False;b107e5;True;False;t3_b107e5;4;False;/r/snapchat/comments/b107e5/17_m4a_trying_to_fill_my_map/;2;tryna fill my snapmap;False;17 [M4A] Trying to fill my map;https://www.reddit.com/r/snapchat/comments/b107e5/17_m4a_trying_to_fill_my_map/
1552558856.0;False;b0ymo7;True;False;t3_b0ymo7;1;False;/r/snapchat/comments/b0ymo7/23_m4f_looking_for_new_friends_all_over_the_world/;1;;False;23 [M4F] looking for new friends all over the world;https://www.reddit.com/r/snapchat/comments/b0ymo7/23_m4f_looking_for_new_friends_all_over_the_world/
1552558341.0;False;b0ykam;True;False;t3_b0ykam;1;False;/r/snapchat/comments/b0ykam/19m4a_friends_c/;3;Want some new people to chat and be friends with! (Nothing sexual please n ty);False;19[M4A] Friends c:;https://www.reddit.com/r/snapchat/comments/b0ykam/19m4a_friends_c/
1552554985.0;False;b0y5af;True;False;t3_b0y5af;1;False;/r/snapchat/comments/b0y5af/18_m4f_in_the_hospital_with_a_broken_back_need/;4;;False;18 [M4F] in the hospital with a broken back need some company;https://www.reddit.com/r/snapchat/comments/b0y5af/18_m4f_in_the_hospital_with_a_broken_back_need/
1552554470.0;False;b0y339;True;False;t3_b0y339;1;False;/r/snapchat/comments/b0y339/21m4a_animal_lover_wants_to_see_your_pets/;1;I have a dog ,I like to share his pictures . Ask me for my snap or tell yours if you are a animal lover too;False;21[M4A] Animal lover wants to see your pets;https://www.reddit.com/r/snapchat/comments/b0y339/21m4a_animal_lover_wants_to_see_your_pets/
1552544610.0;False;b0wwh8;True;False;t3_b0wwh8;3;False;/r/snapchat/comments/b0wwh8/16_f4a_friends/;8;I’m a 16 year old girl from Michigan looking for new friends, pm me and we can talk? Message me your age and where you’re from, and some of your interests. (14-19 ONLY please, and no creeps) I’m looking forward to speaking with you :D;False;16 [F4A] friends?;https://www.reddit.com/r/snapchat/comments/b0wwh8/16_f4a_friends/
1552543568.0;False;b0wrmo;True;False;t3_b0wrmo;1;False;/r/snapchat/comments/b0wrmo/19m4a_just_turned_19_id_like_to_talk_to_people/;1;;False;19[M4A] Just turned 19 I’d like to talk to people from all over the world pm for my snap;https://www.reddit.com/r/snapchat/comments/b0wrmo/19m4a_just_turned_19_id_like_to_talk_to_people/
1552537630.0;False;b0vywl;True;False;t3_b0vywl;1;False;/r/snapchat/comments/b0vywl/29_m4f/;1;I work as a Mortician/Coroner looking to kill some time. ;False;29 [M4F];https://www.reddit.com/r/snapchat/comments/b0vywl/29_m4f/
1552535647.0;False;b0voby;True;False;t3_b0voby;1;False;/r/snapchat/comments/b0voby/25_m4m/;1;Hey I'm just a 25 year old guy from Australia looking for some more male friends. I don't really have many. I don't really mind where you're from. I do like to chat both in the chat section but also thru selfies and the like so people who are okay with that are preferred 😊I'm not good at these introductions, but hopefully we can use that to get to know each other, hah. I don't have any age preference, as long as you're happy talking to me. DM/message me your snap and I'll add you. 😁😁;False;25 [M4M];https://www.reddit.com/r/snapchat/comments/b0voby/25_m4m/
1552530676.0;False;b0uweh;True;False;t3_b0uweh;1;False;/r/snapchat/comments/b0uweh/19m4a_2am_and_awake_someone_please_entertain_me/;1;Pm me for snap;False;19[M4A] 2am and awake someone please entertain me;https://www.reddit.com/r/snapchat/comments/b0uweh/19m4a_2am_and_awake_someone_please_entertain_me/
1552529215.0;False;b0unvo;True;False;t3_b0unvo;1;False;/r/snapchat/comments/b0unvo/23m4f_bored_at_work_anyone_want_to_talk_i_have/;1;I work 24 hour shifts so I sometimes get pretty bored! If you think you’re entertaining (even slightly) message me your snap and I’ll add you! I have two puppers named Ranger and Bentley that you’ll get blessed with constantly soooo I don’t think there’s really a down side! Message it up!;False;23[M4F] Bored at work. Anyone want to talk? I have puppers to snap!;https://www.reddit.com/r/snapchat/comments/b0unvo/23m4f_bored_at_work_anyone_want_to_talk_i_have/
1552526145.0;False;b0u5tk;True;False;t3_b0u5tk;1;False;/r/snapchat/comments/b0u5tk/26_m4f_gay_guy_wanting_to_swap_with_a_girl/;0;;False;26 [m4f] gay guy wanting to swap with a girl;https://www.reddit.com/r/snapchat/comments/b0u5tk/26_m4f_gay_guy_wanting_to_swap_with_a_girl/
1552522366.0;False;b0ti88;True;False;t3_b0ti88;2;False;/r/snapchat/comments/b0ti88/22m4a_cure_my_boredom_please_and_help_me_get_out/;1;I’m suffering hard from depression and would love some friends to talk to long term just send your snap name I’ll add anyone ;False;22[M4A] cure my boredom please and help me get out of my slump;https://www.reddit.com/r/snapchat/comments/b0ti88/22m4a_cure_my_boredom_please_and_help_me_get_out/
1552522121.0;False;b0tgfm;True;False;t3_b0tgfm;1;False;/r/snapchat/comments/b0tgfm/30_m4f_sporty_guy_who_likes_to_challenge_himself/;1;;False;30 [M4F] Sporty guy who likes to challenge himself but is also a huge nerd;https://www.reddit.com/r/snapchat/comments/b0tgfm/30_m4f_sporty_guy_who_likes_to_challenge_himself/
1552517774.0;False;b0snn1;True;False;t3_b0snn1;1;False;/r/snapchat/comments/b0snn1/19_m4a_looking_for_people_that_are_chill/;1;If you have 300 views or more I will do a shoutout for a shoutout! PM me your usernames and I will add everyone that PMs me asap.;False;19 [M4A] Looking for people that are chill;https://www.reddit.com/r/snapchat/comments/b0snn1/19_m4a_looking_for_people_that_are_chill/
1552516280.0;False;b0sd7f;True;False;t3_b0sd7f;4;False;/r/snapchat/comments/b0sd7f/28_f4a_please_help_cure_my_boredom/;5;Just bored at work. Message me your snapchat. Tell me a little about yourself. No dick pics please. I'll just laugh at it and block you ❤;False;28 [F4A] please help cure my boredom!!;https://www.reddit.com/r/snapchat/comments/b0sd7f/28_f4a_please_help_cure_my_boredom/
1552516243.0;False;b0scyn;True;False;t3_b0scyn;1;False;/r/snapchat/comments/b0scyn/17_m4f_looking_for_a_friend/;0;Please dont skip me cuz I'm underage;False;17 [M4F] Looking for a friend;https://www.reddit.com/r/snapchat/comments/b0scyn/17_m4f_looking_for_a_friend/
1552515794.0;False;b0s9og;True;False;t3_b0s9og;1;False;/r/snapchat/comments/b0s9og/17_m4a/;0;Dm your snap;False;17 [M4A];https://www.reddit.com/r/snapchat/comments/b0s9og/17_m4a/
1552515006.0;1552787629.0;b0s462;True;False;t3_b0s462;1;False;/r/snapchat/comments/b0s462/16m4a_tryna_fill_up_ma_map_hmu_if_you_also_tryna/;1;;False;16[M4A] tryna fill up ma map HMU if you also tryna start a streak;https://www.reddit.com/r/snapchat/comments/b0s462/16m4a_tryna_fill_up_ma_map_hmu_if_you_also_tryna/
1552513956.0;False;b0rwp7;True;False;t3_b0rwp7;1;False;/r/snapchat/comments/b0rwp7/14m4f/;0;Message me for snap. I'm from Ohio so I may take a little bit of time depending on time differences;False;14[M4F];https://www.reddit.com/r/snapchat/comments/b0rwp7/14m4f/
1552513888.0;False;b0rw85;True;False;t3_b0rw85;1;False;/r/snapchat/comments/b0rw85/35_m4f_dad_here_love_to_chat_and_send_pics_also/;0;;False;35 [M4F] Dad Here , love to chat and send pics. Also love attention , PM me for my snap;https://www.reddit.com/r/snapchat/comments/b0rw85/35_m4f_dad_here_love_to_chat_and_send_pics_also/
1552513285.0;False;b0rrza;True;False;t3_b0rrza;1;False;/r/snapchat/comments/b0rrza/23_m4a_bored_lookin_for_streaks_and_friends/;1;;False;23 [M4A] bored.. Lookin for streaks and friends;https://www.reddit.com/r/snapchat/comments/b0rrza/23_m4a_bored_lookin_for_streaks_and_friends/
1552513239.0;False;b0rrmm;True;False;t3_b0rrmm;1;False;/r/snapchat/comments/b0rrmm/24_m4f_bored_aussie/;0;;False;24 [m4f] bored aussie;https://www.reddit.com/r/snapchat/comments/b0rrmm/24_m4f_bored_aussie/
1552513237.0;False;b0rrm4;True;False;t3_b0rrm4;1;False;/r/snapchat/comments/b0rrm4/30_m4f/;0;i'm stuck in a hotel in a city where I don't know anyone, down to talk/snap about whatever;False;30 [M4F];https://www.reddit.com/r/snapchat/comments/b0rrm4/30_m4f/
1552513176.0;False;b0rr77;True;False;t3_b0rr77;1;False;/r/snapchat/comments/b0rr77/36_m4f_just_a_bidding_evening_in_germany/;0;Send me a message if you wanna know more;False;36 [M4F] -Just a bidding evening in Germany;https://www.reddit.com/r/snapchat/comments/b0rr77/36_m4f_just_a_bidding_evening_in_germany/
1552508791.0;False;b0qvko;True;False;t3_b0qvko;1;False;/r/snapchat/comments/b0qvko/26_m4a_bored_at_work/;0;;False;26 [m4a] bored at work;https://www.reddit.com/r/snapchat/comments/b0qvko/26_m4a_bored_at_work/
1552508106.0;False;b0qqjs;True;False;t3_b0qqjs;1;False;/r/snapchat/comments/b0qqjs/19_m4f/;0;Bad bitches is the only thing that I like 😤😂;False;19 [M4F];https://www.reddit.com/r/snapchat/comments/b0qqjs/19_m4f/
1552506290.0;False;b0qd5u;True;False;t3_b0qd5u;6;False;/r/snapchat/comments/b0qd5u/18_f4a/;13;lol just bored tbh;False;18 [F4A];https://www.reddit.com/r/snapchat/comments/b0qd5u/18_f4a/
1552505987.0;False;b0qatg;True;False;t3_b0qatg;1;False;/r/snapchat/comments/b0qatg/27_m4f_wants_friends_to_snap_and_chat_to/;1;A bit about me.I enjoy horror movies, gaming, the beach, gym and footballPM me your usernames ;False;27 [M4F] wants friends to snap and chat to;https://www.reddit.com/r/snapchat/comments/b0qatg/27_m4f_wants_friends_to_snap_and_chat_to/
1552505932.0;False;b0qafk;True;False;t3_b0qafk;6;False;/r/snapchat/comments/b0qafk/22_f4m_looking_to_talk_and_more_dm_me_for_snap/;0;;False;22 [F4M] looking to talk and more..🍭😽 dm me for snap;https://www.reddit.com/r/snapchat/comments/b0qafk/22_f4m_looking_to_talk_and_more_dm_me_for_snap/
1552505923.0;False;b0qad2;True;False;t3_b0qad2;0;False;/r/snapchat/comments/b0qad2/21_m4f_trynna_have_some_streaks_going_hmu/;1;;False;21 [M4F] trynna have some streaks going hmu!;https://www.reddit.com/r/snapchat/comments/b0qad2/21_m4f_trynna_have_some_streaks_going_hmu/
1552505721.0;False;b0q8wd;True;False;t3_b0q8wd;1;False;/r/snapchat/comments/b0q8wd/16_m4a_lookin_to_fill_my_snap_mapnew_streaks/;1;Dm for username :));False;16 [M4A] Lookin to fill my snap map/new streaks!!;https://www.reddit.com/r/snapchat/comments/b0q8wd/16_m4a_lookin_to_fill_my_snap_mapnew_streaks/
1552502949.0;False;b0pnz0;True;False;t3_b0pnz0;4;False;/r/snapchat/comments/b0pnz0/25f4a_streak_obsessed/;0;Let’s get some streaks going. ;False;25[F4A] Streak obsessed;https://www.reddit.com/r/snapchat/comments/b0pnz0/25f4a_streak_obsessed/
1552498536.0;False;b0os2w;True;False;t3_b0os2w;2;False;/r/snapchat/comments/b0os2w/23_m4f_looking_for_new_snap_friends_and_snap/;3;;False;23 [M4F] looking for new snap friends and snap streaks!! Pm me your snapchat names and I'll add you!!;https://www.reddit.com/r/snapchat/comments/b0os2w/23_m4f_looking_for_new_snap_friends_and_snap/
