created_utc;edited;id;is_self;locked;name;num_comments;over_18;permalink;score;selftext;spoiler;title;url
1552181254.0;False;azamkg;True;False;t3_azamkg;1;False;/r/snapchat/comments/azamkg/25m4f_drinking_buddies/;1;Just relaxing having a few drinks. PM me your username.  :);False;25[M4F] drinking buddies?;https://www.reddit.com/r/snapchat/comments/azamkg/25m4f_drinking_buddies/
1552174415.0;False;az9l9z;True;False;t3_az9l9z;1;False;/r/snapchat/comments/az9l9z/30m4a_chat_and_friends/;6;Hey! Gf left for the weekend and I’m bored outta my mind! Let’s chat and be friends! Big fan of basket weaving. (Oh that was a joke)  but seriously hit me up for chat and snap and friends! I’m also drinking so cool people to talk too would be nice :) ;False;30[M4A] chat and friends;https://www.reddit.com/r/snapchat/comments/az9l9z/30m4a_chat_and_friends/
1552172397.0;False;az99qk;True;False;t3_az99qk;1;False;/r/snapchat/comments/az99qk/20f4a/;4;Very bored and looking to make some new friends on snap! ;False;20[F4A];https://www.reddit.com/r/snapchat/comments/az99qk/20f4a/
1552166971.0;False;az8ci5;True;False;t3_az8ci5;6;False;/r/snapchat/comments/az8ci5/23_f4a_heading_home_from_work_entertain_me/;6;Going home. Pm for Snap!;False;23 [F4A] Heading home from work. Entertain me!;https://www.reddit.com/r/snapchat/comments/az8ci5/23_f4a_heading_home_from_work_entertain_me/
1552166934.0;False;az8c8z;True;False;t3_az8c8z;16;False;/r/snapchat/comments/az8c8z/17_f4a_just_looking_for_friends_lol/;11;;False;17 [F4A] just looking for friends lol;https://www.reddit.com/r/snapchat/comments/az8c8z/17_f4a_just_looking_for_friends_lol/
1552163446.0;False;az7qfn;True;False;t3_az7qfn;1;False;/r/snapchat/comments/az7qfn/23m4f_message_me_your_snap_and_i_ll_add_you/;1;;False;23[M4F] message me your snap and I ll add you;https://www.reddit.com/r/snapchat/comments/az7qfn/23m4f_message_me_your_snap_and_i_ll_add_you/
1552162813.0;False;az7mmh;True;False;t3_az7mmh;2;False;/r/snapchat/comments/az7mmh/18_m4a_streaks_or_chats/;1;I want more points :))))If you want to start a streak or just want to talk, dm.Miss me with dem nudz and bring me the real thing, memes pls;False;18 [M4A] streaks or chats;https://www.reddit.com/r/snapchat/comments/az7mmh/18_m4a_streaks_or_chats/
1552161964.0;False;az7hcw;True;False;t3_az7hcw;1;False;/r/snapchat/comments/az7hcw/43_m4f_father_and_dog_dad_to_four_looking_for/;4;;False;43 [M4F] Father and dog dad to four, looking for adults to talk to and snap with to help make the work week go by. Lots of sarcasm and dogs. If you’re interested hmu;https://www.reddit.com/r/snapchat/comments/az7hcw/43_m4f_father_and_dog_dad_to_four_looking_for/
1552161892.0;False;az7gw1;True;False;t3_az7gw1;1;False;/r/snapchat/comments/az7gw1/19_m4a/;2;Someone talk to me all night. Thanks in advanced message me usernames ;False;19 [M4A];https://www.reddit.com/r/snapchat/comments/az7gw1/19_m4a/
1552159546.0;False;az71t1;True;False;t3_az71t1;1;False;/r/snapchat/comments/az71t1/24_m4f_bored_af_if_you_got_memes_i_want_them_now/;1;;False;24 [M4F] bored af, if you got memes I want them now;https://www.reddit.com/r/snapchat/comments/az71t1/24_m4f_bored_af_if_you_got_memes_i_want_them_now/
1552157834.0;False;az6r3b;True;False;t3_az6r3b;2;False;/r/snapchat/comments/az6r3b/19_f4f_memes_steaks/;1;Would love some more girl friends to share memes with and start a streak. DM for username;False;19 [F4F] Memes & Steaks 🥰🔥;https://www.reddit.com/r/snapchat/comments/az6r3b/19_f4f_memes_steaks/
1552150162.0;False;az5e2b;True;False;t3_az5e2b;3;False;/r/snapchat/comments/az5e2b/21_m4f_looking_for_streak_friends/;1;Hey I’d like to have a few people to have streaks with :) thanks;False;21 [M4F] Looking for streak friends;https://www.reddit.com/r/snapchat/comments/az5e2b/21_m4f_looking_for_streak_friends/
1552149133.0;False;az57ks;True;False;t3_az57ks;1;False;/r/snapchat/comments/az57ks/19_m4f_i_like_long_convos_and_video_games/;1;;False;19 [M4F] I like long convos and video games;https://www.reddit.com/r/snapchat/comments/az57ks/19_m4f_i_like_long_convos_and_video_games/
1552149091.0;False;az57bv;True;False;t3_az57bv;3;False;/r/snapchat/comments/az57bv/24f4m_looking_for_people_to_chat_with_mainly/;4;Send a short introduction about yourself and your username and I’ll add ya.;False;"24[F4M] Looking for people to chat with; mainly about anything— really.";https://www.reddit.com/r/snapchat/comments/az57bv/24f4m_looking_for_people_to_chat_with_mainly/
1552148983.0;False;az56ml;True;False;t3_az56ml;1;False;/r/snapchat/comments/az56ml/15_m4f_keep_me_company_for_the_evening_also_im/;1;DM or PM me your snap if you are under 20yo. :)The more active the better.;False;15 [M4F] Keep me company for the evening. :) Also im down for new streaks.;https://www.reddit.com/r/snapchat/comments/az56ml/15_m4f_keep_me_company_for_the_evening_also_im/
1552147300.0;False;az4w6j;True;False;t3_az4w6j;1;False;/r/snapchat/comments/az4w6j/19m4f_looking_for_new_streaks/;1;;False;19[M4F] looking for new streaks;https://www.reddit.com/r/snapchat/comments/az4w6j/19m4f_looking_for_new_streaks/
1552145708.0;False;az4my3;True;False;t3_az4my3;1;False;/r/snapchat/comments/az4my3/37_m4f_bored_at_work/;1;Help me kill time while at work. Hmu for my snapchat ;False;37 [m4f] bored at work;https://www.reddit.com/r/snapchat/comments/az4my3/37_m4f_bored_at_work/
1552145569.0;False;az4m86;True;False;t3_az4m86;1;False;/r/snapchat/comments/az4m86/17m4a_lookin_people_to_make_friends_with_or_just/;5;No creeps please ;False;17[M4A] Lookin people to make friends with or just streaks;https://www.reddit.com/r/snapchat/comments/az4m86/17m4a_lookin_people_to_make_friends_with_or_just/
1552138083.0;False;az3hkz;True;False;t3_az3hkz;2;False;/r/snapchat/comments/az3hkz/34_m4f_looking_for_people_to_talk_to_and_have/;1;;False;34 [M4F] looking for people to talk to and have conversations with.;https://www.reddit.com/r/snapchat/comments/az3hkz/34_m4f_looking_for_people_to_talk_to_and_have/
1552135872.0;False;az36w4;True;False;t3_az36w4;1;False;/r/snapchat/comments/az36w4/48m4f_looking_for_some_chat/;1;48 male home bored on a Saturday morning. Looking to chat with a female about anything.  If you are bored to hit me up .  Snapchat tbone9270 ;False;48[m4f] Looking for some chat;https://www.reddit.com/r/snapchat/comments/az36w4/48m4f_looking_for_some_chat/
1552133648.0;False;az2wwg;True;False;t3_az2wwg;1;False;/r/snapchat/comments/az2wwg/25_m4f_looking_someone_to_whom_i_can_share/;1;Hello, I'm 25 yo male from Belarus, I am full of empathy and excitements, especially now;False;25 [M4F] looking someone to whom i can share emotions and be shared with;https://www.reddit.com/r/snapchat/comments/az2wwg/25_m4f_looking_someone_to_whom_i_can_share/
1552133577.0;False;az2wln;True;False;t3_az2wln;0;False;/r/snapchat/comments/az2wln/17_m4a_from_the_uk/;3;Hey hows it going? Im a 17 year old lad from the UK and im just looking for someone to chat to. Chat about what you may ask? Well hobby wise im a big sports fan, particularly football and i also enjoy working out and fitness in general. Also i'm a bit of a nerd at heart and i enjoy gaming and reading as well. If any of that interests you hit me up. Word of warning though im all about dad jokes and puns.;False;17 [M4A] from the UK;https://www.reddit.com/r/snapchat/comments/az2wln/17_m4a_from_the_uk/
1552130015.0;False;az2hg8;True;False;t3_az2hg8;3;False;/r/snapchat/comments/az2hg8/23m4f_looking_for_someone_to_snap_with_pref/;1;;False;23[M4F] looking for someone to snap with, pref longterm. Drop your snap and I ll add you;https://www.reddit.com/r/snapchat/comments/az2hg8/23m4f_looking_for_someone_to_snap_with_pref/
1552127839.0;False;az289w;True;False;t3_az289w;1;False;/r/snapchat/comments/az289w/35_m4f_late_or_early_nightmorning_depending_on/;1;Fresh kicks on, lookin for a lady with a creative way to take em off... DMs open!;False;35 [m4f] late or early night/morning depending on where u at....;https://www.reddit.com/r/snapchat/comments/az289w/35_m4f_late_or_early_nightmorning_depending_on/
1552124805.0;False;az1vw8;True;False;t3_az1vw8;1;False;/r/snapchat/comments/az1vw8/24_m4f_working_night_shift_looking_for_groups/;1;;False;24 [M4F] working night shift looking for groups, friends, and streaks!!(:;https://www.reddit.com/r/snapchat/comments/az1vw8/24_m4f_working_night_shift_looking_for_groups/
1552120230.0;False;az1e6w;True;False;t3_az1e6w;1;False;/r/snapchat/comments/az1e6w/36_m4f_start_the_day_with_a_german_guy/;1;Just send me a message;False;36 [M4F] - Start the day with a German guy;https://www.reddit.com/r/snapchat/comments/az1e6w/36_m4f_start_the_day_with_a_german_guy/
1552115054.0;False;az0ts9;True;False;t3_az0ts9;1;False;/r/snapchat/comments/az0ts9/27m4f_doctor_needs_help_getting_through_this/;0;Send me your username;False;27[M4F] doctor needs help getting through this boring shift;https://www.reddit.com/r/snapchat/comments/az0ts9/27m4f_doctor_needs_help_getting_through_this/
1552114834.0;False;az0sup;True;False;t3_az0sup;1;False;/r/snapchat/comments/az0sup/20_m4f_truth_game_all_ages/;0;PM me for my user and ask a question!;False;20 [M4F] - Truth game | All ages!;https://www.reddit.com/r/snapchat/comments/az0sup/20_m4f_truth_game_all_ages/
1552114047.0;False;az0pl4;True;False;t3_az0pl4;2;False;/r/snapchat/comments/az0pl4/23_m4a_bored_beyond_everything_and_cant_sleep/;0;;False;23 [M4A] bored beyond everything and can’t sleep.. help? Message me and I’ll add..;https://www.reddit.com/r/snapchat/comments/az0pl4/23_m4a_bored_beyond_everything_and_cant_sleep/
1552112445.0;False;az0irr;True;False;t3_az0irr;1;False;/r/snapchat/comments/az0irr/25_m4fa_up_late_and_bored/;0;Pms welcome with snap name:) just up late and bored;False;25 [m4fa] up late and bored;https://www.reddit.com/r/snapchat/comments/az0irr/25_m4fa_up_late_and_bored/
1552111144.0;False;az0cvd;True;False;t3_az0cvd;1;False;/r/snapchat/comments/az0cvd/18_m4f_im_sick_and_bored_and_want_people_to_talk/;0;Pm me your user and I’ll add;False;18 [M4F] I’m sick and bored and want people to talk to;https://www.reddit.com/r/snapchat/comments/az0cvd/18_m4f_im_sick_and_bored_and_want_people_to_talk/
1552110936.0;False;az0bz8;True;False;t3_az0bz8;1;False;/r/snapchat/comments/az0bz8/30_m4a_looking_to_nerd_out_about_music_and_video/;0;Looking for new friends to talk about the important things. ;False;30 [M4A] looking to nerd out about music and video games etc.;https://www.reddit.com/r/snapchat/comments/az0bz8/30_m4a_looking_to_nerd_out_about_music_and_video/
1552110227.0;False;az08qg;True;False;t3_az08qg;6;False;/r/snapchat/comments/az08qg/24_f4a_late_night_stoner/;2;Lookin' for a smoking/drinking buddy? I'm yo gal. Frequently up very late. Hit me up with your age, gender, and snap and I'll add you.;False;24 [F4A] Late night stoner;https://www.reddit.com/r/snapchat/comments/az08qg/24_f4a_late_night_stoner/
1552109204.0;False;az03y6;True;False;t3_az03y6;2;False;/r/snapchat/comments/az03y6/22_m4r_let_me_rate_your_girl/;0;😉Good evening all, if you think you have the hottest girl in the land pm me, and I'll judge her 😜 guys and girls who want to show off send me your snap;False;22 [M4R] Let me rate your girl;https://www.reddit.com/r/snapchat/comments/az03y6/22_m4r_let_me_rate_your_girl/
1552108636.0;False;az01aa;True;False;t3_az01aa;2;False;/r/snapchat/comments/az01aa/24_m4r_is_if_the_mustache_that_makes_people_ghost/;1;The mystery continues! I think the stache is pretty cool lolPM me! My hobbies include: video games and sportsHere is me!https://imgur.com/a/6WVNZki;False;24 [m4r] is if the mustache that makes people ghost me?;https://www.reddit.com/r/snapchat/comments/az01aa/24_m4r_is_if_the_mustache_that_makes_people_ghost/
1552108458.0;False;az00dt;True;False;t3_az00dt;1;False;/r/snapchat/comments/az00dt/16_m4f/;1;Sad boi come cheer me,up pls ;False;16 [M4F];https://www.reddit.com/r/snapchat/comments/az00dt/16_m4f/
1552105659.0;False;ayzm7j;True;False;t3_ayzm7j;1;False;/r/snapchat/comments/ayzm7j/25m4f_late_night_just_looking_to_talk/;1;Anyone wanna talk PMs open!:);False;25[M4F] late night just looking to talk;https://www.reddit.com/r/snapchat/comments/ayzm7j/25m4f_late_night_just_looking_to_talk/
1552103050.0;1552106973.0;ayz8wh;True;False;t3_ayz8wh;1;False;/r/snapchat/comments/ayz8wh/24m4f_looking_for_older_women_to_talk_to_make/;1;Pm your Snap 😁;False;24[M4F] looking for older women to talk to make friends;https://www.reddit.com/r/snapchat/comments/ayz8wh/24m4f_looking_for_older_women_to_talk_to_make/
1552100556.0;False;ayyvym;True;False;t3_ayyvym;1;False;/r/snapchat/comments/ayyvym/31_m4f_bored_at_work/;1;Looking for someone to help keep me entertained ( I don't necessarily mean in a dirty way either) while I finish the last couple hours at work! I work in a dispensary in Canada! countybuds is my name! ;False;31 [M4F] bored at work!;https://www.reddit.com/r/snapchat/comments/ayyvym/31_m4f_bored_at_work/
1552098421.0;False;ayyl4z;True;False;t3_ayyl4z;1;False;/r/snapchat/comments/ayyl4z/20_m4a_lets_trade_photos_of_cats/;1;Pm me your username;False;20 [M4A] let's trade photos of cats;https://www.reddit.com/r/snapchat/comments/ayyl4z/20_m4a_lets_trade_photos_of_cats/
1552098279.0;1552197096.0;ayykf0;True;False;t3_ayykf0;18;False;/r/snapchat/comments/ayykf0/27_f4a_its_hard_making_friends_when_youre_an_adult/;33;Looking to talk to people on a boring Friday night. Send me your snap. Edit: this got way more traction than i expected. I dont have the ability to respond to all 200+ messages so i promise as time goes on, ill weed out and keep finding quality people!! Thanks for making my weekend awesome, y'all!!! ❤;False;27 [f4a] it's hard making friends when you're an adult.;https://www.reddit.com/r/snapchat/comments/ayykf0/27_f4a_its_hard_making_friends_when_youre_an_adult/
1552094559.0;False;ayy0rc;True;False;t3_ayy0rc;1;False;/r/snapchat/comments/ayy0rc/43_m4a_new_friends_on_a_friday_night/;2;Home alone all weekend and want som new chat friends. Send me your snap. Yay;False;43 [M4A] new friends on a Friday night;https://www.reddit.com/r/snapchat/comments/ayy0rc/43_m4a_new_friends_on_a_friday_night/
1552094322.0;False;ayxzgm;True;False;t3_ayxzgm;1;False;/r/snapchat/comments/ayxzgm/18_m4f_im_looking_for_new_friends_from_all_over/;1;PM or dm for my snap :) ;False;18 [M4F] I'm looking for new friends from all over the world;https://www.reddit.com/r/snapchat/comments/ayxzgm/18_m4f_im_looking_for_new_friends_from_all_over/
1552093807.0;False;ayxwls;True;False;t3_ayxwls;1;False;/r/snapchat/comments/ayxwls/24_m4a_boring_friday_night/;1;PMs welcome. Just bored looking to talk on a Friday;False;24 [M4A] boring Friday night;https://www.reddit.com/r/snapchat/comments/ayxwls/24_m4a_boring_friday_night/
1552093549.0;False;ayxv54;True;False;t3_ayxv54;1;False;/r/snapchat/comments/ayxv54/25_m4m_looking_for_nerdy_friends_to_chat_with/;2;Hey guys, I am your typical gay nerd workaholic. I just moved and am looking to make some new friends. I am into D&D, Magic the gathering, JRPGs, and of course reading.Message me for my username.;False;25 [M4M] Looking for nerdy friends to chat with.;https://www.reddit.com/r/snapchat/comments/ayxv54/25_m4m_looking_for_nerdy_friends_to_chat_with/
1552093356.0;False;ayxu1j;True;False;t3_ayxu1j;1;False;/r/snapchat/comments/ayxu1j/25m4a_drinking_buddies/;1;Just relaxing having a few drinks, looking for newborn people to talk to. PM me your username ;False;25[M4A] drinking buddies?;https://www.reddit.com/r/snapchat/comments/ayxu1j/25m4a_drinking_buddies/
1552092912.0;False;ayxrjk;True;False;t3_ayxrjk;1;False;/r/snapchat/comments/ayxrjk/16m4f/;1;I’m super bored right now. I need someone to talk to. Pm me for my Snapchat username.;False;16[M4F];https://www.reddit.com/r/snapchat/comments/ayxrjk/16m4f/
1552092472.0;False;ayxp2v;True;False;t3_ayxp2v;1;False;/r/snapchat/comments/ayxp2v/17_m4a_just_bored_and_looking_to_talk_to_more/;0;I like sports, movies, memes and a lot more. I’m just looking for people my age to talk to. Message your snap or ask for mine;False;17 [M4A] Just Bored and looking to talk to more people on snap;https://www.reddit.com/r/snapchat/comments/ayxp2v/17_m4a_just_bored_and_looking_to_talk_to_more/
1552089141.0;1552243865.0;ayx5dc;True;False;t3_ayx5dc;6;False;/r/snapchat/comments/ayx5dc/18_a4a_pointspam_groups/;23;Hey there, I’m creating a spam/point group! Pm me a photo of your snapcode to be in the group!;False;18 [A4A] Point/Spam Groups!;https://www.reddit.com/r/snapchat/comments/ayx5dc/18_a4a_pointspam_groups/
1552087824.0;False;aywxnr;True;False;t3_aywxnr;3;False;/r/snapchat/comments/aywxnr/27_t4m_new_snapchat_who_dis/;0;My Snapchat was erased American guys only let’s chat mtf trans girl here;False;27 [T4M] new Snapchat who dis;https://www.reddit.com/r/snapchat/comments/aywxnr/27_t4m_new_snapchat_who_dis/
1552087349.0;False;aywuty;True;False;t3_aywuty;1;False;/r/snapchat/comments/aywuty/19_m4f_welsh_guy_looking_for_new_friends_streaks/;1;;False;19 [M4F] Welsh guy Looking for new friends :) Streaks / Snaps, message for my snapchat :);https://www.reddit.com/r/snapchat/comments/aywuty/19_m4f_welsh_guy_looking_for_new_friends_streaks/
1552087226.0;False;aywu1d;True;False;t3_aywu1d;1;False;/r/snapchat/comments/aywu1d/20_m4f_bored_with_nothing_to_do/;1;PM for my user! I'm an open book.;False;20 [M4F] - Bored with nothing to do.;https://www.reddit.com/r/snapchat/comments/aywu1d/20_m4f_bored_with_nothing_to_do/
1552086045.0;False;aywm2w;True;False;t3_aywm2w;9;False;/r/snapchat/comments/aywm2w/14_f4m_looking_for_new_people_to_talk_to/;4;pm your snap and age, pls no creeps :);False;14 [F4M] looking for new people to talk to;https://www.reddit.com/r/snapchat/comments/aywm2w/14_f4m_looking_for_new_people_to_talk_to/
1552085199.0;False;aywg8q;True;False;t3_aywg8q;3;False;/r/snapchat/comments/aywg8q/20_f4m_looking_for_new_people_to_talk_to/;0;Nothing lewd please, v easy to talk to ;False;20 [F4M] looking for new people to talk to;https://www.reddit.com/r/snapchat/comments/aywg8q/20_f4m_looking_for_new_people_to_talk_to/
1552083611.0;False;ayw5kg;True;False;t3_ayw5kg;6;False;/r/snapchat/comments/ayw5kg/17f4m_looking_for_people_to_talk_to/;4;Looking for people to talk to, no older than 20 please. Pm me if you wanna talk;False;17[F4M] Looking for people to talk to;https://www.reddit.com/r/snapchat/comments/ayw5kg/17f4m_looking_for_people_to_talk_to/
1552082638.0;False;ayvyw7;True;False;t3_ayvyw7;1;False;/r/snapchat/comments/ayvyw7/25_m4f_just_looking_for_new_friends/;2;PM me your username.;False;25 [M4F] just looking for new friends;https://www.reddit.com/r/snapchat/comments/ayvyw7/25_m4f_just_looking_for_new_friends/
1552081662.0;False;ayvsdy;True;False;t3_ayvsdy;1;False;/r/snapchat/comments/ayvsdy/22m4f_just_looking_for_friends/;2;I’m kinda lonely I’m bi and I do have a lot of friends so I would love some new people to talk to pm me ;False;22[M4F] just looking for friends;https://www.reddit.com/r/snapchat/comments/ayvsdy/22m4f_just_looking_for_friends/
1552080173.0;False;ayvifh;True;False;t3_ayvifh;1;False;/r/snapchat/comments/ayvifh/25_m4f_bored_and_lonely/;1;Are you bored and lonely? Same! Hmu if you wanna snapI'm a nerd with a love for horror movies. I like pokemon, resident evil, overwatch and a huge fan of Jacksepticeye PM to find out more and tell me about yourself!;False;25 [M4F] bored and lonely;https://www.reddit.com/r/snapchat/comments/ayvifh/25_m4f_bored_and_lonely/
1552077187.0;1552079782.0;ayuyom;True;False;t3_ayuyom;1;False;/r/snapchat/comments/ayuyom/36_m4f_wanna_enjoy_a_friday_evening_with_a_german/;1;Just send me a message if you wanna know how a German evening is like;False;36 [M4F] - Wanna enjoy a Friday evening with a German?;https://www.reddit.com/r/snapchat/comments/ayuyom/36_m4f_wanna_enjoy_a_friday_evening_with_a_german/
1552075739.0;False;ayup0y;True;False;t3_ayup0y;1;False;/r/snapchat/comments/ayup0y/27_m4f_looking_for_something_new_longer_term/;1;;False;27 [M4F] looking for something new, longer term friend who can be honest and truthful;https://www.reddit.com/r/snapchat/comments/ayup0y/27_m4f_looking_for_something_new_longer_term/
1552070998.0;False;aytsek;True;False;t3_aytsek;1;False;/r/snapchat/comments/aytsek/23_m4f_looking_for_a_little_chitchat_snaps_laugh/;1;;False;23 [M4F] looking for a little chitchat, snaps, laugh, pref smth longterm. Drop your snap and I ll add you;https://www.reddit.com/r/snapchat/comments/aytsek/23_m4f_looking_for_a_little_chitchat_snaps_laugh/
1552066090.0;False;aysuo0;True;False;t3_aysuo0;1;False;/r/snapchat/comments/aysuo0/32_m4a_anything_interesting/;0;Pm for add;False;32 [M4A] anything interesting?;https://www.reddit.com/r/snapchat/comments/aysuo0/32_m4a_anything_interesting/
1552061427.0;False;ayryoz;True;False;t3_ayryoz;2;False;/r/snapchat/comments/ayryoz/19m4a_looking_for_people_to_snap_maybe_have/;1;;False;19[M4A] looking for people to snap. Maybe have streaks or just a random conversation. HMU.;https://www.reddit.com/r/snapchat/comments/ayryoz/19m4a_looking_for_people_to_snap_maybe_have/
1552055681.0;False;ayqxo2;True;False;t3_ayqxo2;1;False;/r/snapchat/comments/ayqxo2/23_m4f_looking_to_make_friends_andor_fill_my_map/;1;You know the drill, hit me up if you want more info.Message for my username or just send me yours;False;23 [M4F] - looking to make friends and/or fill my map, whatever you wanna do. Im from Australia;https://www.reddit.com/r/snapchat/comments/ayqxo2/23_m4f_looking_to_make_friends_andor_fill_my_map/
1552053191.0;False;ayqi5a;True;False;t3_ayqi5a;1;False;/r/snapchat/comments/ayqi5a/21_m4f_meeting_new_friends_tell_me_something/;1;Message me your snap if your interested.;False;21 [M4F] meeting new friends. Tell me something about yourself.;https://www.reddit.com/r/snapchat/comments/ayqi5a/21_m4f_meeting_new_friends_tell_me_something/
1552052274.0;False;ayqcrt;True;False;t3_ayqcrt;8;False;/r/snapchat/comments/ayqcrt/26_f4m_entertain_me/;2;Send me your user and all add you ;False;26 [F4M] - entertain me;https://www.reddit.com/r/snapchat/comments/ayqcrt/26_f4m_entertain_me/
1552041377.0;False;ayou5k;True;False;t3_ayou5k;1;False;/r/snapchat/comments/ayou5k/23m4f_looking_for_someone_to_snap_with_pref/;1;;False;23[M4F] looking for someone to snap with, pref longterm. Drop your snap and I ll add you;https://www.reddit.com/r/snapchat/comments/ayou5k/23m4f_looking_for_someone_to_snap_with_pref/
1552036196.0;False;ayo849;True;False;t3_ayo849;2;False;/r/snapchat/comments/ayo849/25_m4f_tired_of_feeling_lonely_and_abandoned/;1;Do you feel like everyone abandons you? Me too, let's get to know each other! PM me if you're interestedI'm a simple nerd who just wants long term friendships, I like pokemon, overwatch and resident evil. I enjoy horror movies and my favorite shows are how I met your mother and friends ;False;25 [M4F] tired of feeling lonely and abandoned;https://www.reddit.com/r/snapchat/comments/ayo849/25_m4f_tired_of_feeling_lonely_and_abandoned/
1552035955.0;False;ayo73k;True;False;t3_ayo73k;1;False;/r/snapchat/comments/ayo73k/21_m4f_looking_to_text_and_trade_pics/;1;Girls only! Send me your snapchat name if you want to have a nice conversation and trade pics with me.I‘ll add you;False;21 [M4F] looking to text and trade pics;https://www.reddit.com/r/snapchat/comments/ayo73k/21_m4f_looking_to_text_and_trade_pics/
1552035885.0;False;ayo6tc;True;False;t3_ayo6tc;1;False;/r/snapchat/comments/ayo6tc/15m4alooking_for_some_new_friends/;0;Whatever male or female,please message me...;False;15[M4A]looking for some new friends;https://www.reddit.com/r/snapchat/comments/ayo6tc/15m4alooking_for_some_new_friends/
1552034735.0;False;ayo27t;True;False;t3_ayo27t;2;False;/r/snapchat/comments/ayo27t/17_m4a_my_night_is_at_your_leisure/;0;Msg me your snap or ask for mine ;False;17 [M4A] my night is at your leisure;https://www.reddit.com/r/snapchat/comments/ayo27t/17_m4a_my_night_is_at_your_leisure/
1552033638.0;False;ayny0o;True;False;t3_ayny0o;1;False;/r/snapchat/comments/ayny0o/33m4a/;0;Looking for someone to chat with at times.;False;33[M4A];https://www.reddit.com/r/snapchat/comments/ayny0o/33m4a/
1552031352.0;False;aynoli;True;False;t3_aynoli;3;False;/r/snapchat/comments/aynoli/20_m4a_hey_everyone/;0;Just looking for some people to chat with or start streaks with;False;20 [M4A] hey everyone;https://www.reddit.com/r/snapchat/comments/aynoli/20_m4a_hey_everyone/
1552026449.0;False;ayn2zj;True;False;t3_ayn2zj;1;False;/r/snapchat/comments/ayn2zj/25_m4f_thursday_evening_chats/;0;Come keep me company this evening;False;25 [M4F] - Thursday evening chats;https://www.reddit.com/r/snapchat/comments/ayn2zj/25_m4f_thursday_evening_chats/
1552021729.0;False;aymg5c;True;False;t3_aymg5c;1;False;/r/snapchat/comments/aymg5c/26_m4f_night_shift/;1;Work nights in an ER. Been kinda down lately. Someone keep me awake and entertained!!Not shy. You can ask/send me anything. PM me for my Snapchat name. ;False;26 [m4f] night shift;https://www.reddit.com/r/snapchat/comments/aymg5c/26_m4f_night_shift/
1552021409.0;False;aymedn;True;False;t3_aymedn;1;False;/r/snapchat/comments/aymedn/25_m4f_bored_at_work_lets_chat/;1;Hey there! It’s a slow night on my end but I love to get to know some new people. I’m easy going and laid back but like to think I’m interesting to talk to. Shoot me a message and let’s chat! ;False;25 [m4f] bored at work, let’s chat!;https://www.reddit.com/r/snapchat/comments/aymedn/25_m4f_bored_at_work_lets_chat/
1552021132.0;False;aymcx9;True;False;t3_aymcx9;1;False;/r/snapchat/comments/aymcx9/31_m4f_started_up_my_snap_again/;1;Looking for some new people to chat/snap with! 420 friendly! 18+ only please! PM for snap if interested! ;False;31 [M4F] Started up my snap again!;https://www.reddit.com/r/snapchat/comments/aymcx9/31_m4f_started_up_my_snap_again/
