created_utc;edited;id;is_self;locked;name;num_comments;over_18;permalink;score;selftext;spoiler;title;url
1553108142.0;False;b3fv66;True;False;t3_b3fv66;1;False;/r/snapchat/comments/b3fv66/24_f4a_pm_me_for_my_username/;2;I need new buddies.I have pretty bad issues with anxiety so I don't have many friends. I love reading books, animals, drawing, painting, photography, video games, and learning about random things. Add me if you'd like(: my username on snap IS NOT the same as my username on here.;False;24 [F4A] PM me for my username.;https://www.reddit.com/r/snapchat/comments/b3fv66/24_f4a_pm_me_for_my_username/
1553106370.0;False;b3fibu;True;False;t3_b3fibu;2;False;/r/snapchat/comments/b3fibu/23m4f_from_southeast_united_states_looking_for/;2;;False;23[M4F] from southeast United States! looking for people from all over to start streaks with! Pm me your snapchat names!;https://www.reddit.com/r/snapchat/comments/b3fibu/23m4f_from_southeast_united_states_looking_for/
1553104688.0;False;b3f5sl;True;False;t3_b3f5sl;1;False;/r/snapchat/comments/b3f5sl/21_m4f_anyone_in_the_us_looking_for_snap_streaks/;1;;False;21 [M4F] anyone in the U.S. looking for snap streaks, conversations or anything in between? Message me, I’m bored;https://www.reddit.com/r/snapchat/comments/b3f5sl/21_m4f_anyone_in_the_us_looking_for_snap_streaks/
1553097602.0;False;b3dqjj;True;False;t3_b3dqjj;1;False;/r/snapchat/comments/b3dqjj/18m4f_stoned_and_looking_to_chat/;1;Hey I’m 18 from the USA currently on my spring break and I just smoked and I’m looking to chat/friendships/streaks Pm me your snap;False;18[m4f] stoned and looking to chat;https://www.reddit.com/r/snapchat/comments/b3dqjj/18m4f_stoned_and_looking_to_chat/
1553094244.0;False;b3d3by;True;False;t3_b3d3by;2;False;/r/snapchat/comments/b3d3by/18_m4a_new_streaks/;1;PM me for username, just want to start up some new streaks with people;False;18 [M4A] New Streaks;https://www.reddit.com/r/snapchat/comments/b3d3by/18_m4a_new_streaks/
1553093872.0;False;b3d0n8;True;False;t3_b3d0n8;1;False;/r/snapchat/comments/b3d0n8/23_m4a_hi_im_from_germany/;1;;False;23 [M4A] hi I'm from Germany;https://www.reddit.com/r/snapchat/comments/b3d0n8/23_m4a_hi_im_from_germany/
1553086130.0;False;b3blpl;True;False;t3_b3blpl;1;False;/r/snapchat/comments/b3blpl/23_m4a_humpday_lull_keeo_me_from_dying_of_boredom/;2;;False;23 [M4A] humpday lull keeo me from dying of boredom;https://www.reddit.com/r/snapchat/comments/b3blpl/23_m4a_humpday_lull_keeo_me_from_dying_of_boredom/
1553079967.0;False;b3ao4a;True;False;t3_b3ao4a;1;False;/r/snapchat/comments/b3ao4a/16f4f_would_love_to_meet_new_people/;2;;False;16[F4F] would love to meet new people!;https://www.reddit.com/r/snapchat/comments/b3ao4a/16f4f_would_love_to_meet_new_people/
1553079018.0;False;b3aj51;True;False;t3_b3aj51;1;False;/r/snapchat/comments/b3aj51/16_m4f_wanna_start_streaks_and_maybe_more/;0;;False;"16 [M4F] wanna start streaks and maybe more ;)";https://www.reddit.com/r/snapchat/comments/b3aj51/16_m4f_wanna_start_streaks_and_maybe_more/
1553078059.0;False;b3aelc;True;False;t3_b3aelc;1;False;/r/snapchat/comments/b3aelc/17_m4m_lets_talk_p/;0;"Hey all,&#x200B;17m from australia, up for anything tbh lol. hit me up with your snap. &#x200B;Just keep it around my age please&#x200B;fairly bi-curious too";False;17 [m4m] lets talk :P;https://www.reddit.com/r/snapchat/comments/b3aelc/17_m4m_lets_talk_p/
1553077471.0;False;b3abuv;True;False;t3_b3abuv;1;False;/r/snapchat/comments/b3abuv/24_m4f_bored_at_work_need_new_friends/;1;;False;24 [m4f] bored at work. Need new friends!;https://www.reddit.com/r/snapchat/comments/b3abuv/24_m4f_bored_at_work_need_new_friends/
1553073844.0;False;b39v74;True;False;t3_b39v74;2;False;/r/snapchat/comments/b39v74/29_m4a_i_want_friends_to_have_im_new_on_snapchat/;3;;False;29 [m4a] I want friends to have I'm new on snapchat 😐;https://www.reddit.com/r/snapchat/comments/b39v74/29_m4a_i_want_friends_to_have_im_new_on_snapchat/
1553072070.0;False;b39nk3;True;False;t3_b39nk3;1;False;/r/snapchat/comments/b39nk3/26_m4f_looking_for_friends/;1;looking for friends dm username and i will add you :);False;26 [m4f] looking for friends;https://www.reddit.com/r/snapchat/comments/b39nk3/26_m4f_looking_for_friends/
1553065131.0;False;b38t8j;True;False;t3_b38t8j;1;False;/r/snapchat/comments/b38t8j/26_m4a_its_late/;1;Anyone up and feel like chatting? ;False;26 [m4a] its late 😬;https://www.reddit.com/r/snapchat/comments/b38t8j/26_m4a_its_late/
1553058069.0;False;b37vjc;True;False;t3_b37vjc;2;False;/r/snapchat/comments/b37vjc/28m4f_bored_aussie_guy_at_work/;1;Come help beat my afternoon Bordem,send me you Snapchat and let's chat 😄;False;28[m4f] bored Aussie guy at work;https://www.reddit.com/r/snapchat/comments/b37vjc/28m4f_bored_aussie_guy_at_work/
1553057365.0;False;b37rzj;True;False;t3_b37rzj;1;False;/r/snapchat/comments/b37rzj/17m4f_new_streaks/;1;Msg me for my username or yours;False;17[M4F] New Streaks?;https://www.reddit.com/r/snapchat/comments/b37rzj/17m4f_new_streaks/
1553056472.0;False;b37n9w;True;False;t3_b37n9w;4;False;/r/snapchat/comments/b37n9w/meta_cant_add_friend_on_snapchat/;1;Was snapchatting a friend last night just fine. Messages today went through on my end, but never showed on hers apparently, and now it shows up that were not added on each others snapchats. But when i click add, it just spins forever.  Ive let it sit for 15 minutes and it doesnt change.;False;[META] Can't add friend on snapchat;https://www.reddit.com/r/snapchat/comments/b37n9w/meta_cant_add_friend_on_snapchat/
1553051298.0;False;b36ung;True;False;t3_b36ung;1;False;/r/snapchat/comments/b36ung/23m4f_looking_for_new_snap_friends_and_snap/;1;;False;23[M4F] looking for new snap friends and snap streaks!;https://www.reddit.com/r/snapchat/comments/b36ung/23m4f_looking_for_new_snap_friends_and_snap/
1553051130.0;False;b36toi;True;False;t3_b36toi;1;False;/r/snapchat/comments/b36toi/16_m4f_hey/;1;16 male loves sports and its a totally goofball down for memes or just talking about whatever basically down to,talk whenever you need,a,bro ;False;16 [M4F] Hey;https://www.reddit.com/r/snapchat/comments/b36toi/16_m4f_hey/
1553049252.0;False;b36ie5;True;False;t3_b36ie5;1;False;/r/snapchat/comments/b36ie5/23_m4f_im_bored_lets_chat/;1;Pm for username ;False;23 [M4F] I’m bored, let’s chat?!;https://www.reddit.com/r/snapchat/comments/b36ie5/23_m4f_im_bored_lets_chat/
1553049029.0;False;b36h0c;True;False;t3_b36h0c;1;False;/r/snapchat/comments/b36h0c/21_m4f_looking_for_new_snap_streaks_conversation/;1;;False;21 [M4F] looking for new snap streaks, conversation or anything in between? Message me;https://www.reddit.com/r/snapchat/comments/b36h0c/21_m4f_looking_for_new_snap_streaks_conversation/
1553049012.0;False;b36gwt;True;False;t3_b36gwt;1;False;/r/snapchat/comments/b36gwt/28_m4f_looking_to_chat_long_term/;1;Hey looking to chat long term and streaks, interested? Send me a message with your snap :);False;28 [m4f] looking to chat long term;https://www.reddit.com/r/snapchat/comments/b36gwt/28_m4f_looking_to_chat_long_term/
1553048395.0;False;b36dd7;True;False;t3_b36dd7;1;False;/r/snapchat/comments/b36dd7/20_m4a_looking_for_some_new_buds/;1;Let's chat about anything and/or streaks;False;20 [M4A] looking for some new buds;https://www.reddit.com/r/snapchat/comments/b36dd7/20_m4a_looking_for_some_new_buds/
1553048000.0;False;b36azh;True;False;t3_b36azh;1;False;/r/snapchat/comments/b36azh/17_m4a_keep_me_busy_today_looking_to_meet_everyone/;1;Msg me your snap or ask for mine ;False;17 [M4A] keep me busy today Looking to meet everyone :);https://www.reddit.com/r/snapchat/comments/b36azh/17_m4a_keep_me_busy_today_looking_to_meet_everyone/
1553047962.0;False;b36aro;True;False;t3_b36aro;1;False;/r/snapchat/comments/b36aro/28_m4f_off_work_at_a_decent_time_for_once/;1;Lets chat! I’m a nerd who loves to workout, hike, tattoos and just overall adventure. I want to get to know you more too! Talk to you soon. ;False;28 [M4F] - Off work at a decent time for once;https://www.reddit.com/r/snapchat/comments/b36aro/28_m4f_off_work_at_a_decent_time_for_once/
1553046702.0;False;b3635u;True;False;t3_b3635u;1;False;/r/snapchat/comments/b3635u/22m4f_just_looking_for_friends/;1;I’m a loner but I’m trying to fix that a few snap friends could help with that I’m a bi I love video games and movies chill pm your snap or sent through the chat option I’ll add you ;False;22[M4F] just looking for friends;https://www.reddit.com/r/snapchat/comments/b3635u/22m4f_just_looking_for_friends/
1553046598.0;False;b362jj;True;False;t3_b362jj;1;False;/r/snapchat/comments/b362jj/19_m4f_i_need_some_new_friends/;0;Hey, I'm just looking to meet new people and actually become friends. I work a lot so i do not get out much. I will chat with all, but I get along better with females. PM for my snap or pm me yours.;False;19 [M4F] I need some new friends;https://www.reddit.com/r/snapchat/comments/b362jj/19_m4f_i_need_some_new_friends/
1553045699.0;False;b35x28;True;False;t3_b35x28;1;False;/r/snapchat/comments/b35x28/16_m4f_need_some_suggestions_on_some_things/;1;Anybody want to help me decorate my room? I like video games and certain movies and tv shows like the office and Trailer Park Boys. I also like technology. Pm me for my Snapchat and I’ll send some pics of my room so you can know what you’re working with. ;False;16 [m4f] need some suggestions on some things;https://www.reddit.com/r/snapchat/comments/b35x28/16_m4f_need_some_suggestions_on_some_things/
1553044753.0;False;b35rb4;True;False;t3_b35rb4;1;False;/r/snapchat/comments/b35rb4/26_m4f_my_name_is_raj/;1;Hi, I like to watch tv shows and movies. and I'm finishing my cs degree at radford uniPM me for snap or send me your snap;False;26 [M4F] My name is Raj;https://www.reddit.com/r/snapchat/comments/b35rb4/26_m4f_my_name_is_raj/
1553044077.0;False;b35n6l;True;False;t3_b35n6l;1;False;/r/snapchat/comments/b35n6l/26_m4f_pm_wellcome/;1;;False;26 [m4f] pm wellcome;https://www.reddit.com/r/snapchat/comments/b35n6l/26_m4f_pm_wellcome/
1553043202.0;False;b35hrh;True;False;t3_b35hrh;1;False;/r/snapchat/comments/b35hrh/16_m4f_i_need_more_streaks_and_people_to_text/;1;;False;16 [M4F] I need more streaks and people to text when I'm bored. I'm losing most of my friends so🤷🏼‍♂️ pm me for my username;https://www.reddit.com/r/snapchat/comments/b35hrh/16_m4f_i_need_more_streaks_and_people_to_text/
1553040765.0;False;b352qe;True;False;t3_b352qe;1;False;/r/snapchat/comments/b352qe/28_m4f_bored_at_work/;1;So bored at work! Send me your Snapchat and let chat 😄;False;28 [m4f] bored at work;https://www.reddit.com/r/snapchat/comments/b352qe/28_m4f_bored_at_work/
1553040205.0;False;b34yrx;True;False;t3_b34yrx;1;False;/r/snapchat/comments/b34yrx/meta_turn_off_notifications_other_people_are/;5;I really don't need two notifications for every one message that I get. Is there a way to turn off the notification that someone else is typing?;False;[meta] turn off notifications other people are typing;https://www.reddit.com/r/snapchat/comments/b34yrx/meta_turn_off_notifications_other_people_are/
1553039140.0;False;b34ro4;True;False;t3_b34ro4;1;False;/r/snapchat/comments/b34ro4/23_m4a/;0;Bored, just pm me for add!;False;23 [M4A];https://www.reddit.com/r/snapchat/comments/b34ro4/23_m4a/
1553038423.0;False;b34mua;True;False;t3_b34mua;1;False;/r/snapchat/comments/b34mua/24f4a_long_drive_ahead_of_me_snap_buds/;3;Just message me & we can chat haha & no I’m not driving. :p ;False;24[F4A] long drive ahead of me — snap buds?;https://www.reddit.com/r/snapchat/comments/b34mua/24f4a_long_drive_ahead_of_me_snap_buds/
1553037798.0;False;b34ioe;True;False;t3_b34ioe;1;False;/r/snapchat/comments/b34ioe/16m4f_bored/;1;Looking for someone around my age. Dm with your age and something about yourself.;False;16[M4F] bored;https://www.reddit.com/r/snapchat/comments/b34ioe/16m4f_bored/
1553028653.0;False;b32p9l;True;False;t3_b32p9l;0;False;/r/snapchat/comments/b32p9l/36m4f_looking_for_new_friends_for_conversations/;1;Hey there.So, I have the evenings alone with my son and I can only take so many youtube videos of Minecraft and dinosaurs before I start to get bored.  Looking for some new friends to chat with, and sorry fellas, but I find it easier to talk to women.I like reading, mostly sci-fi and fantasy, comics, gaming, tabletop RPGs, coffee, dark beer, cooking, science, especially Biology, hockey (Let's Go Blues!), the list goes on.Send me a PM if you'd interested in chatting!Talk to you soon!;False;36[M4F] - Looking for new friends for conversations and snaps;https://www.reddit.com/r/snapchat/comments/b32p9l/36m4f_looking_for_new_friends_for_conversations/
1553031379.0;False;b3391s;True;False;t3_b3391s;1;False;/r/snapchat/comments/b3391s/16_m4a_post_memes_daily_as_well_as_sfs_anyone_can/;1;;False;16 [M4A] post memes daily as well as sfs anyone can add and I'll add back (dm me for username);https://www.reddit.com/r/snapchat/comments/b3391s/16_m4a_post_memes_daily_as_well_as_sfs_anyone_can/
1553031256.0;False;b3386g;True;False;t3_b3386g;1;False;/r/snapchat/comments/b3386g/30_m4a_i_have_like_9000_hobbies_so_we_probably/;1;I fix big buildings by day and be a lazy home body by night. i dont want to see your wiener, i have one and im not interested in more thank you. ;False;30 [M4A] I have like 9000 hobbies so we probably have something in common;https://www.reddit.com/r/snapchat/comments/b3386g/30_m4a_i_have_like_9000_hobbies_so_we_probably/
1553029694.0;False;b32ws6;True;False;t3_b32ws6;1;False;/r/snapchat/comments/b32ws6/18m4a/;1;Bored and need new people to talk to!!;False;18[M4A];https://www.reddit.com/r/snapchat/comments/b32ws6/18m4a/
1553029232.0;False;b32tea;True;False;t3_b32tea;1;False;/r/snapchat/comments/b32tea/16m4a_like_to_meet_some_new_friends_to_have_some/;1;Just  be friendly.;False;16[m4a] Like to meet some new friends to have some chats with.;https://www.reddit.com/r/snapchat/comments/b32tea/16m4a_like_to_meet_some_new_friends_to_have_some/
1553028256.0;False;b32mb2;True;False;t3_b32mb2;1;False;/r/snapchat/comments/b32mb2/25m4f_music_producer_looking_for_people_to_chat/;1;Figured I'd have some light hearted conversations and maybe tease back and forth a bit if you're into that;False;25[M4F] Music producer looking for people to chat and maybe tease with message your snap!;https://www.reddit.com/r/snapchat/comments/b32mb2/25m4f_music_producer_looking_for_people_to_chat/
1553026692.0;1553026937.0;b32b6o;True;False;t3_b32b6o;2;False;/r/snapchat/comments/b32b6o/21_f4a/;2;I'm interesting in conversing with others of a similar age, though no one over 25 or below 16. Mainly more from England since I have a ton of people from other countries and would like to balance it out. I do streaks and also blue arrows. Message me for my username. ;False;21 [F4A];https://www.reddit.com/r/snapchat/comments/b32b6o/21_f4a/
1553024220.0;False;b31stn;True;False;t3_b31stn;15;False;/r/snapchat/comments/b31stn/21f4a_im_in_for_a_long_shift_at_work_plz_snap_me/;10;;False;21[F4A] I’m in for a long shift at work. Plz snap me so time can go faster!;https://www.reddit.com/r/snapchat/comments/b31stn/21f4a_im_in_for_a_long_shift_at_work_plz_snap_me/
1553020920.0;False;b314py;True;False;t3_b314py;2;False;/r/snapchat/comments/b314py/18_m4f_looking_for_someone_to_entertain_me_on/;1;;False;18 [M4F] Looking for someone to entertain me on this lonely night;https://www.reddit.com/r/snapchat/comments/b314py/18_m4f_looking_for_someone_to_entertain_me_on/
1553019624.0;False;b30vjc;True;False;t3_b30vjc;1;False;/r/snapchat/comments/b30vjc/27m4f_i_am_just_bored_today/;0;Hi there, I am just bored today and looking for someone to have some talks today. Can be either stupid about nothing or meaningful about life. I am open minded :);False;27[M4F] I am just bored today;https://www.reddit.com/r/snapchat/comments/b30vjc/27m4f_i_am_just_bored_today/
1553017847.0;False;b30ig1;True;False;t3_b30ig1;1;False;/r/snapchat/comments/b30ig1/21_m4f_looking_for_new_friends_to_snap_with_im_up/;1;Message me your snap if your interested. ;False;21 [M4F] looking for new friends to snap with. I’m up for anything tell me something about yourself;https://www.reddit.com/r/snapchat/comments/b30ig1/21_m4f_looking_for_new_friends_to_snap_with_im_up/
1553016846.0;False;b30b5d;True;False;t3_b30b5d;7;False;/r/snapchat/comments/b30b5d/17f4a_any_southwestern_college_students/;10;I’m 17F from NM. I like to Xbox and watch Netflix...hit me up and give me your snap username. ;False;17[F4A] Any southwestern college students??;https://www.reddit.com/r/snapchat/comments/b30b5d/17f4a_any_southwestern_college_students/
1553014546.0;False;b2zu2b;True;False;t3_b2zu2b;2;False;/r/snapchat/comments/b2zu2b/23m4f_looking_for_new_snap_friends_and_snap/;1;;False;23[M4F] looking for new snap friends and snap streaks! Pm me your snapchat names and I'll add you!;https://www.reddit.com/r/snapchat/comments/b2zu2b/23m4f_looking_for_new_snap_friends_and_snap/
1553012783.0;False;b2zhao;True;False;t3_b2zhao;2;False;/r/snapchat/comments/b2zhao/23_m4a_looking_for_new_friends_and_people_who/;1;;False;23 [M4A] looking for new friends and people who want to talk about Musik, Sport and maybe other things;https://www.reddit.com/r/snapchat/comments/b2zhao/23_m4a_looking_for_new_friends_and_people_who/
1553012394.0;False;b2zeel;True;False;t3_b2zeel;1;False;/r/snapchat/comments/b2zeel/44m4f_somewhere_over_the_rainbow/;0;I shall find longerterm friends. If you are up for daily or fairly daily banter about life and occasional selfie wars, may my next pot of gold be your friendship ;False;44[M4F] - somewhere over the rainbow;https://www.reddit.com/r/snapchat/comments/b2zeel/44m4f_somewhere_over_the_rainbow/
1553011698.0;False;b2z9bv;True;False;t3_b2z9bv;1;False;/r/snapchat/comments/b2z9bv/20_f4a_looking_to_make_new_friends_to_talk_to/;0;Message me for info! 💕;False;20 [F4A] Looking to make new friends to talk to while I'm not working!;https://www.reddit.com/r/snapchat/comments/b2z9bv/20_f4a_looking_to_make_new_friends_to_talk_to/
1553011490.0;False;b2z7t1;True;False;t3_b2z7t1;1;False;/r/snapchat/comments/b2z7t1/21m4f_looking_for_new_snap_friends/;1;Message for user :);False;21[m4f] looking for new snap friends :);https://www.reddit.com/r/snapchat/comments/b2z7t1/21m4f_looking_for_new_snap_friends/
1553007151.0;False;b2ycon;True;False;t3_b2ycon;1;False;/r/snapchat/comments/b2ycon/21_m4f_meeting_new_friends_up_for_anything_we_can/;1;Message me your snap if your interested. 9 in;False;21 [M4F] meeting new friends. Up for anything we can snap or chat about pretty much anything. Tell me something about yourself I’ll tell you my secret.;https://www.reddit.com/r/snapchat/comments/b2ycon/21_m4f_meeting_new_friends_up_for_anything_we_can/
1553004815.0;False;b2xwso;True;False;t3_b2xwso;1;False;/r/snapchat/comments/b2xwso/18_m4a_from_aus_looking_for_mates_to_chat_to/;1;;False;18 [M4A] From Aus looking for mates to chat to.;https://www.reddit.com/r/snapchat/comments/b2xwso/18_m4a_from_aus_looking_for_mates_to_chat_to/
1552998379.0;False;b2ws7b;True;False;t3_b2ws7b;1;False;/r/snapchat/comments/b2ws7b/21m4f_looking_to_meet_new_people_to_snap_or_chat/;1;Message me your snap if your interested. 9 in;False;21[M4F] looking to meet new people to snap or chat with up for anything we can talk about whatever. Tell me something about yourself;https://www.reddit.com/r/snapchat/comments/b2ws7b/21m4f_looking_to_meet_new_people_to_snap_or_chat/
1552997809.0;False;b2wp36;True;False;t3_b2wp36;2;False;/r/snapchat/comments/b2wp36/21f4a_uk_based_friends_that_are_nigerian/;1;;False;21[F4A] Uk based friends that are Nigerian;https://www.reddit.com/r/snapchat/comments/b2wp36/21f4a_uk_based_friends_that_are_nigerian/
1552988711.0;False;b2vebc;True;False;t3_b2vebc;3;False;/r/snapchat/comments/b2vebc/21f4r_super_bored_tonight_and_looking_for/;0;Nothing weird. Just looking for someone to talk to. Please be in the US. Pm me your age and user ❤️😍😚;False;21[F4R] super bored tonight and looking for attention. Give me attention please ❤️;https://www.reddit.com/r/snapchat/comments/b2vebc/21f4r_super_bored_tonight_and_looking_for/
1552987918.0;False;b2vana;True;False;t3_b2vana;1;False;/r/snapchat/comments/b2vana/24_m4f_need_some_motivation_to_finish_my_uni_work/;1;Pm for snap;False;24 [M4F] need some motivation to finish my uni work;https://www.reddit.com/r/snapchat/comments/b2vana/24_m4f_need_some_motivation_to_finish_my_uni_work/
1552986347.0;False;b2v3hu;True;False;t3_b2v3hu;1;False;/r/snapchat/comments/b2v3hu/25_m4a_im_an_english_teacher/;1;If you need help with your English, either as a first or foreign language, then send me a message and I will add you! ;False;25 [M4A] I’m an English teacher!;https://www.reddit.com/r/snapchat/comments/b2v3hu/25_m4a_im_an_english_teacher/
1552982716.0;False;b2uo12;True;False;t3_b2uo12;2;False;/r/snapchat/comments/b2uo12/20_f4m_a_cats_jaw_cant_move_sideways/;2;"I just gave you an fact you probably won’t ever need or want and I don’t even have a cat. Yup just started spring break and already bored. PM and save me...please.p.s. it took me WAY to long to find a fact I wanted to use as a title;)";False;20 [F4M] a cats jaw cant move sideways;https://www.reddit.com/r/snapchat/comments/b2uo12/20_f4m_a_cats_jaw_cant_move_sideways/
1552977537.0;False;b2tzhq;True;False;t3_b2tzhq;1;False;/r/snapchat/comments/b2tzhq/28_m4f_anyone_over_30_that_wants_to_be_friends/;3;Send me a pm if you do :);False;28 [M4F] - Anyone over 30 that wants to be friends?;https://www.reddit.com/r/snapchat/comments/b2tzhq/28_m4f_anyone_over_30_that_wants_to_be_friends/
1552974695.0;False;b2tles;True;False;t3_b2tles;1;False;/r/snapchat/comments/b2tles/18_m4f_lets_chat_im_up_all_night_pm_usernames/;1;;False;18 [M4F] let’s chat I’m up all night pm usernames;https://www.reddit.com/r/snapchat/comments/b2tles/18_m4f_lets_chat_im_up_all_night_pm_usernames/
1552972653.0;False;b2tb9d;True;False;t3_b2tb9d;1;False;/r/snapchat/comments/b2tb9d/17_m4f_hmu_4_streaks_n_views/;1;hmu4streaksnviews->jxzebadua;False;17 [M4F] - Hmu 4 streaks n views;https://www.reddit.com/r/snapchat/comments/b2tb9d/17_m4f_hmu_4_streaks_n_views/
1552971621.0;False;b2t5x8;True;False;t3_b2t5x8;1;False;/r/snapchat/comments/b2t5x8/28_m4f_who_else_had_a_long_day/;1;I sure did. But a bit about me. I love working out, anime, video games, tattoos, mountains, and most of all, adventure! Look for some friends while I’m traveling around a bit. Hit me up!;False;28 [M4F] - Who else had a long day?;https://www.reddit.com/r/snapchat/comments/b2t5x8/28_m4f_who_else_had_a_long_day/
1552971129.0;False;b2t3ce;True;False;t3_b2t3ce;1;False;/r/snapchat/comments/b2t3ce/21_m4f_need_new_friends/;1;Looking for new people to talk to. Im a big night owl and always up super late. Im a pretty nerdy guy, i love cooking, video games, and skateboarding. If you wanna know more pm me your snap info and maybe a few things about yourself as well :);False;21 [M4F] need new friends :);https://www.reddit.com/r/snapchat/comments/b2t3ce/21_m4f_need_new_friends/
1552970950.0;False;b2t2f3;True;False;t3_b2t2f3;1;False;/r/snapchat/comments/b2t2f3/23_m4a_looking_for_new_faces_from_around_the_globe/;2;Share daily life, memes, stories and views around the city! Im based in Edinburgh. Would love to with someone who's open minded and is happy to have a conversation. Plain and simple 👌👌 hit me up for the username! ;False;23 [m4a] looking for new faces from around the globe;https://www.reddit.com/r/snapchat/comments/b2t2f3/23_m4a_looking_for_new_faces_from_around_the_globe/
1552969448.0;False;b2sucu;True;False;t3_b2sucu;1;False;/r/snapchat/comments/b2sucu/17_m4a_just_trying_to_make_friends_of_all_genders/;2;;False;17 [M4A] - Just trying to make friends of all genders, yep I’m bi;https://www.reddit.com/r/snapchat/comments/b2sucu/17_m4a_just_trying_to_make_friends_of_all_genders/
1552968740.0;False;b2sqjr;True;False;t3_b2sqjr;1;False;/r/snapchat/comments/b2sqjr/24m4f_looking_for_anyone_to_talk_to_on_snapchat/;2;California, Male, and mildly interesting;False;24[M4F] looking for anyone to talk to on snapchat!;https://www.reddit.com/r/snapchat/comments/b2sqjr/24m4f_looking_for_anyone_to_talk_to_on_snapchat/
1552967617.0;False;b2sk7s;True;False;t3_b2sk7s;24;False;/r/snapchat/comments/b2sk7s/21f4a/;15;Never tried talking to other people outside my friends circle might as well try something new! ;False;21[F4A];https://www.reddit.com/r/snapchat/comments/b2sk7s/21f4a/
1552967007.0;False;b2sgy1;True;False;t3_b2sgy1;1;False;/r/snapchat/comments/b2sgy1/19_m4a_filling_my_map_streaks/;2;hmu;False;19 [M4A] Filling my map / streaks;https://www.reddit.com/r/snapchat/comments/b2sgy1/19_m4a_filling_my_map_streaks/
1552966925.0;False;b2sghj;True;False;t3_b2sghj;1;False;/r/snapchat/comments/b2sghj/20_m4f_homemade_popcorn_is_so_good/;2;What's your favorite homemade snack? PM me for my user 😃;False;20 [M4F] - Homemade popcorn is so good.;https://www.reddit.com/r/snapchat/comments/b2sghj/20_m4f_homemade_popcorn_is_so_good/
1552965562.0;False;b2s8lq;True;False;t3_b2s8lq;1;False;/r/snapchat/comments/b2s8lq/21m4f_need_new_snap_friends/;2;Message me for user :);False;21[m4f] need new snap friends;https://www.reddit.com/r/snapchat/comments/b2s8lq/21m4f_need_new_snap_friends/
1552964356.0;False;b2s1ad;True;False;t3_b2s1ad;1;False;/r/snapchat/comments/b2s1ad/26_m4f_hey_there_bored_at_work_lets_chat/;2;As the title says it’s a pretty slow night for me and I’d love some company! I like to think I have some pretty cool hobbies and am happy to hear about yours! Also, if coffee is your thing then I’m your guy, so there’s that. Shoot me a message and let’s talk!;False;26 [m4f] hey there! Bored at work, let’s chat!;https://www.reddit.com/r/snapchat/comments/b2s1ad/26_m4f_hey_there_bored_at_work_lets_chat/
