created_utc;edited;id;is_self;locked;name;num_comments;over_18;permalink;score;selftext;spoiler;title;url
1553471010.0;False;b53aol;True;False;t3_b53aol;2;False;/r/snapchat/comments/b53aol/24_m4a_im_bored_and_wanna_meet_different_people/;0;DM me for my snap 😊;False;24 [M4A] im bored and wanna meet different people around the world;https://www.reddit.com/r/snapchat/comments/b53aol/24_m4a_im_bored_and_wanna_meet_different_people/
1553470298.0;False;b5367t;True;False;t3_b5367t;1;False;/r/snapchat/comments/b5367t/27_m4f_looking_for_new_longterm_friendships/;1;;False;27 [m4f] looking for new longterm friendships :);https://www.reddit.com/r/snapchat/comments/b5367t/27_m4f_looking_for_new_longterm_friendships/
1553468663.0;False;b52vnr;True;False;t3_b52vnr;1;False;/r/snapchat/comments/b52vnr/18_m4f_looking_for_decent_friends_and_steaks/;1;Really introverted person who just wants to have chill chats with cool people ! ;False;18 [M4F] Looking for decent friends and steaks.;https://www.reddit.com/r/snapchat/comments/b52vnr/18_m4f_looking_for_decent_friends_and_steaks/
1553468394.0;False;b52twe;True;False;t3_b52twe;16;False;/r/snapchat/comments/b52twe/19_f4a_college_girl_looking_to_fill_my_snapmap/;28;I’m a 19 year old New Jersey education major! Don’t be a creep please. I like having real conversations with people and I’m an overall chill person. But yeah just don’t be a creep. Please give me time to reply it doesn't get easy trying to keep up with tons of conversations but I will try my best!;False;19 [F4A] College girl looking to fill my snapmap;https://www.reddit.com/r/snapchat/comments/b52twe/19_f4a_college_girl_looking_to_fill_my_snapmap/
1553467581.0;False;b52onw;True;False;t3_b52onw;1;False;/r/snapchat/comments/b52onw/16m4f/;1;looking for convos and ppl to stay up late with ;False;16[M4F];https://www.reddit.com/r/snapchat/comments/b52onw/16m4f/
1553464747.0;False;b5261l;True;False;t3_b5261l;1;False;/r/snapchat/comments/b5261l/28_m4f_bored_aussie_here/;2;Like a red head? Or like an Aussie? Sitting at home bored with nothing to do? Looking to find someone new to talk to? Well I have the opportunity for you!Send me your Snapchat if you are any of the above and let's chat 😀😀;False;28 [m4f] bored aussie here;https://www.reddit.com/r/snapchat/comments/b5261l/28_m4f_bored_aussie_here/
1553464092.0;False;b521od;True;False;t3_b521od;4;False;/r/snapchat/comments/b521od/15_f4a_im_just_bored_convos_but_we_could_do/;12;just a bi Canadian girl. pm ur user if u want to get to know each other more🙈;False;15 [F4A] im just bored. convos but we could do streaks;https://www.reddit.com/r/snapchat/comments/b521od/15_f4a_im_just_bored_convos_but_we_could_do/
1553463658.0;False;b51yng;True;False;t3_b51yng;1;False;/r/snapchat/comments/b51yng/17_m4a_add_to_my_friend_list/;1;GIVE ME YOUR SNAP AND I'LL ADD YOU!!! Or VICE VERSA!!!;False;17 [M4A] Add to my friend list!;https://www.reddit.com/r/snapchat/comments/b51yng/17_m4a_add_to_my_friend_list/
1553463526.0;False;b51xqu;True;False;t3_b51xqu;1;False;/r/snapchat/comments/b51xqu/22m4mfriendslonely_too/;1;anybody lonely and looking for friends? People who are barely making it by too and want to become deep friends. I don't want to talk to people who barely talk and can't talk every day. Or are weird. Message me for my snap;False;22[M4M]-Friends?Lonely too?;https://www.reddit.com/r/snapchat/comments/b51xqu/22m4mfriendslonely_too/
1553462821.0;False;b51suc;True;False;t3_b51suc;1;False;/r/snapchat/comments/b51suc/32_m4f_oregon_home_alone_and_just_taking_it/;0;"Hi PM your user name and let's chat. I'm 32, living near Corvallis/Albany area. I'm looking to snap and share some stories. &#x200B;kskndahouz";False;32 [M4F] Oregon, home alone and just taking it really easy this Sunday. Let's snap!;https://www.reddit.com/r/snapchat/comments/b51suc/32_m4f_oregon_home_alone_and_just_taking_it/
1553462742.0;False;b51sb7;True;False;t3_b51sb7;1;False;/r/snapchat/comments/b51sb7/21_m4a/;1;I like personality. I also like cars, vidya games, and almost all types of music. I’m very easy to talk to and get along with. So PM if you wanna ;False;21 [M4A];https://www.reddit.com/r/snapchat/comments/b51sb7/21_m4a/
1553461707.0;False;b51kwf;True;False;t3_b51kwf;2;False;/r/snapchat/comments/b51kwf/16_m4f_officially_16_anyone_want_snapchat_on_my/;2; I’m lookin for some more streaks or some more people to talk to in general. I’m 16 and live in the south east US. Lmk if you are interested in Snapchating!;False;16 [m4f] officially 16! Anyone want Snapchat on my birthday?;https://www.reddit.com/r/snapchat/comments/b51kwf/16_m4f_officially_16_anyone_want_snapchat_on_my/
1553460605.0;False;b51cz4;True;False;t3_b51cz4;1;False;/r/snapchat/comments/b51cz4/21_m4f_cop_in_louisiana_looking_for_a_long_term/;0;Pm me your username;False;21 [M4F] Cop in Louisiana looking for a long term friend;https://www.reddit.com/r/snapchat/comments/b51cz4/21_m4f_cop_in_louisiana_looking_for_a_long_term/
1553459971.0;False;b518kz;True;False;t3_b518kz;1;False;/r/snapchat/comments/b518kz/30_m4a_al_us_looking_for_people_from_around_the/;1;;False;30 [M4A] AL, US. Looking for people from around the world.;https://www.reddit.com/r/snapchat/comments/b518kz/30_m4a_al_us_looking_for_people_from_around_the/
1553459538.0;False;b515iu;True;False;t3_b515iu;1;False;/r/snapchat/comments/b515iu/24m4f_do_any_of_you_read_the_sunday_paper/;1;;False;24[M4F] Do any of you read the Sunday paper?;https://www.reddit.com/r/snapchat/comments/b515iu/24m4f_do_any_of_you_read_the_sunday_paper/
1553459401.0;False;b514j3;True;False;t3_b514j3;1;False;/r/snapchat/comments/b514j3/14_m4f_dm_me_for_snap/;1;Title says it all. I’m up for basically whatever. Hmu if interested ;False;14 [M4F] Dm me for snap;https://www.reddit.com/r/snapchat/comments/b514j3/14_m4f_dm_me_for_snap/
1553457729.0;False;b50s5l;True;False;t3_b50s5l;1;False;/r/snapchat/comments/b50s5l/21_m4a_looking_to_add_more_people_on_snap_and/;1;pm me your snapchat;False;21 [M4A] looking to add more people on snap and start snap streaks;https://www.reddit.com/r/snapchat/comments/b50s5l/21_m4a_looking_to_add_more_people_on_snap_and/
1553453957.0;False;b5000f;True;False;t3_b5000f;4;False;/r/snapchat/comments/b5000f/19_f4a_what_do_you_call_a_dog_that_does_magic/;3;hi, I’m bored... nice to meeet u. hmu for my snap y’all   I try my best to add everyone but I’ll prob just send u my snap name tbh. ;False;19 [F4A] what do you call a dog that does magic tricks?;https://www.reddit.com/r/snapchat/comments/b5000f/19_f4a_what_do_you_call_a_dog_that_does_magic/
1553453764.0;False;b4zynq;True;False;t3_b4zynq;1;False;/r/snapchat/comments/b4zynq/22_m4f_pilot_wanting_friends/;2;Hey just a guy who is a pilot looking for friends to add to my Snapchat. Preferably females, but not looking to do anything NSFW unless you take it there. I travel the world on a weekly basis and work keeps me occupied. Wanting to talk about anything and everything (jobs, pets, life, issues, etc). Looking for female friends because honestly they are easier to talk to (lol) HMU! PM for username;False;22 [M4F] Pilot Wanting Friends;https://www.reddit.com/r/snapchat/comments/b4zynq/22_m4f_pilot_wanting_friends/
1553453404.0;False;b4zw5r;True;False;t3_b4zw5r;1;False;/r/snapchat/comments/b4zw5r/17_m4a_new_streaks_maybe/;1;Gonna be bored af today, hmu w your snaps. ;False;17 [M4A] New streaks? Maybe?;https://www.reddit.com/r/snapchat/comments/b4zw5r/17_m4a_new_streaks_maybe/
1553453092.0;False;b4zu25;True;False;t3_b4zu25;1;False;/r/snapchat/comments/b4zu25/25m4a_looking_for_new_friends/;1;Send me your username along with a joke or something.Here's an old native American proverb to give you some wisdom.Man who goes to bed with itchy bum. Wakes up with stinky finger.;False;25[M4A] looking for new friends;https://www.reddit.com/r/snapchat/comments/b4zu25/25m4a_looking_for_new_friends/
1553451310.0;False;b4zhcc;True;False;t3_b4zhcc;1;False;/r/snapchat/comments/b4zhcc/21_m4f_bored_and_depressed_and_stuck_with_family/;2;Hey, I’m stuck with family for the next two days and it’s the worst decision ive made because they’re just criticizing me left right and center and I’d love to chat with someone who wouldn’t.Pop me your user if your up for a chat 😁;False;21 [M4F] Bored and Depressed and stuck with family;https://www.reddit.com/r/snapchat/comments/b4zhcc/21_m4f_bored_and_depressed_and_stuck_with_family/
1553450420.0;False;b4zauq;True;False;t3_b4zauq;9;False;/r/snapchat/comments/b4zauq/17f4a_searching_for_someone_to_do_streaks_with/;3;;False;17[F4A] searching for someone to do streaks with;https://www.reddit.com/r/snapchat/comments/b4zauq/17f4a_searching_for_someone_to_do_streaks_with/
1553450410.0;False;b4zarr;True;False;t3_b4zarr;1;False;/r/snapchat/comments/b4zarr/25_m4a_new_friends/;2;Normal guy looking for other chill people to talk to regularly. I’m on snap a lot so your messages will never go unread or ignored. Hmu and pm me your user if you wanna chat :);False;25 [M4A] New friends;https://www.reddit.com/r/snapchat/comments/b4zarr/25_m4a_new_friends/
1553450275.0;False;b4z9tb;True;False;t3_b4z9tb;5;False;/r/snapchat/comments/b4z9tb/19_f4a_college_girl_on_a_four_hour_road_trip/;8;Entertain me :p;False;19 [F4A] college girl on a four hour road trip;https://www.reddit.com/r/snapchat/comments/b4z9tb/19_f4a_college_girl_on_a_four_hour_road_trip/
1553450210.0;False;b4z9cn;True;False;t3_b4z9cn;1;False;/r/snapchat/comments/b4z9cn/21_m4f_i_want_to_see_your_dog/;2;Yes I want to get to know you, but I also want to see your dog. A lot, please. Or maybe your other pets, I don't judge. I love to witness adorableness! If you don't have pets then that's okay too (:Slide into my DMs. Show me your doggo.;False;21 [M4F] I want to see your dog;https://www.reddit.com/r/snapchat/comments/b4z9cn/21_m4f_i_want_to_see_your_dog/
1553423001.0;False;b4uw41;True;False;t3_b4uw41;0;False;/r/snapchat/comments/b4uw41/44m4f_if_non_active_why/;1;Add me then. Hate ghosts. Looking for longerterm friends who converse and selfie war one another on pretty regular basis. Like to be active. You should as well. Lol;False;44[M4F] - If non active why;https://www.reddit.com/r/snapchat/comments/b4uw41/44m4f_if_non_active_why/
1553449747.0;False;b4z625;True;False;t3_b4z625;1;False;/r/snapchat/comments/b4z625/31m4f_english_guy_looking_for_chat_with_someone/;2;Hi be good to hear from you ;False;31[M4F] English guy looking for chat with someone around the world;https://www.reddit.com/r/snapchat/comments/b4z625/31m4f_english_guy_looking_for_chat_with_someone/
1553449541.0;False;b4z4kp;True;False;t3_b4z4kp;1;False;/r/snapchat/comments/b4z4kp/17m4a_greetings_from_india/;1;Well, I'm almost 18. Lets talk about anything, really. PM me your snaps:);False;17[M4A] Greetings from India;https://www.reddit.com/r/snapchat/comments/b4z4kp/17m4a_greetings_from_india/
1553446713.0;False;b4yka7;True;False;t3_b4yka7;14;False;/r/snapchat/comments/b4yka7/28_f4m_seeking_some_interesting/;15;Conversation to brighten up my Sunday.;False;28 [F4M] seeking some interesting;https://www.reddit.com/r/snapchat/comments/b4yka7/28_f4m_seeking_some_interesting/
1553444474.0;False;b4y5dj;True;False;t3_b4y5dj;1;False;/r/snapchat/comments/b4y5dj/25m4f_lets_chat/;1;My names Zach I’m 25 from Colorado. Just looking for some girls to talk to. Currently going through a lot and just want to chat and snap. ;False;25[M4F] Let’s Chat!;https://www.reddit.com/r/snapchat/comments/b4y5dj/25m4f_lets_chat/
1553440035.0;False;b4xbfx;True;False;t3_b4xbfx;1;False;/r/snapchat/comments/b4xbfx/25_m4f_sunday_laziness_not_getting_out_of_bed/;2;come keep me company;False;25 [M4F] - Sunday laziness = not getting out of bed;https://www.reddit.com/r/snapchat/comments/b4xbfx/25_m4f_sunday_laziness_not_getting_out_of_bed/
1553439894.0;False;b4xahg;True;False;t3_b4xahg;0;False;/r/snapchat/comments/b4xahg/21m4f_looking_for_a_fun_way_to_end_the_weekend/;2;Shoot me a message for username;False;21[M4F] Looking for a fun way to end the weekend!;https://www.reddit.com/r/snapchat/comments/b4xahg/21m4f_looking_for_a_fun_way_to_end_the_weekend/
1553437408.0;False;b4wuwu;True;False;t3_b4wuwu;1;False;/r/snapchat/comments/b4wuwu/19_m4m_looking_for_a_long_term_friendship_to_talk/;1;;False;19 [M4M] looking for a long term friendship to talk about anything. Pm me your username.;https://www.reddit.com/r/snapchat/comments/b4wuwu/19_m4m_looking_for_a_long_term_friendship_to_talk/
1553436622.0;False;b4wq5t;True;False;t3_b4wq5t;1;False;/r/snapchat/comments/b4wq5t/18_m4f_streaks_and_convos_im_bored/;7;;False;18 [M4F] streaks and convos, I’m bored 😐;https://www.reddit.com/r/snapchat/comments/b4wq5t/18_m4f_streaks_and_convos_im_bored/
1553435118.0;False;b4whg1;True;False;t3_b4whg1;3;False;/r/snapchat/comments/b4whg1/22_m4a_looking_for_long_time_friends/;1;Heey! I'm 22 and from the Netherlands! I'd love to make some new friends here. Bonus points if you're part of the LGBTQ+ community. ;False;22 [M4A] looking for long time friends!;https://www.reddit.com/r/snapchat/comments/b4whg1/22_m4a_looking_for_long_time_friends/
1553429907.0;False;b4vqvo;True;False;t3_b4vqvo;1;False;/r/snapchat/comments/b4vqvo/25_m4f_bored_lets_snap_each_other/;2;"Save the Eart because it is the only planet with chocolate. Ohhh and send me your snap name. I will add you ;)";False;25 [M4F] Bored. Let’s snap each other.;https://www.reddit.com/r/snapchat/comments/b4vqvo/25_m4f_bored_lets_snap_each_other/
1553427218.0;False;b4venf;True;False;t3_b4venf;1;False;/r/snapchat/comments/b4venf/18_m4a_can_i_hit_your_juul_bro_please_brooooooo/;1;Just pm me ur username I'll add you up;False;18 [M4A] can I hit your juul bro? PLEASE BROOOOOOO;https://www.reddit.com/r/snapchat/comments/b4venf/18_m4a_can_i_hit_your_juul_bro_please_brooooooo/
1553422447.0;False;b4utma;True;False;t3_b4utma;1;False;/r/snapchat/comments/b4utma/18m4f_looking_for_someone_to_chat_with/;1;"I’m looking for someone to talk with a lot and do streaks with. Talking dirty is always welcome ;)PM me your username";False;18[M4F] Looking for someone to chat with;https://www.reddit.com/r/snapchat/comments/b4utma/18m4f_looking_for_someone_to_chat_with/
1553422296.0;False;b4usy0;True;False;t3_b4usy0;1;False;/r/snapchat/comments/b4usy0/23_m4m_snapstreak_n_friends/;1;Message to start a streak and talk ;False;23 [M4M] - Snapstreak n friends;https://www.reddit.com/r/snapchat/comments/b4usy0/23_m4m_snapstreak_n_friends/
1553418570.0;False;b4udmu;True;False;t3_b4udmu;1;False;/r/snapchat/comments/b4udmu/20_m4f_just_woke_up_stuck_with_the_cat_anyone/;1;;False;20 [M4F] just woke up, stuck with the cat. Anyone wanna chat? Hmu with your add;https://www.reddit.com/r/snapchat/comments/b4udmu/20_m4f_just_woke_up_stuck_with_the_cat_anyone/
1553418383.0;False;b4ucw2;True;False;t3_b4ucw2;1;False;/r/snapchat/comments/b4ucw2/19m4fsnapschatsstreaks/;1;Bored. Lets talk about anything or just share dumb snaps.Hmu with your name or ask for mine.Any age welcome.;False;19[M4F]Snaps/Chats/Streaks;https://www.reddit.com/r/snapchat/comments/b4ucw2/19m4fsnapschatsstreaks/
1553414939.0;False;b4tzl0;True;False;t3_b4tzl0;1;False;/r/snapchat/comments/b4tzl0/21_m4f_late_night_cant_sleep_still_looking_for/;2;;False;21 [M4F] late night... can’t sleep still.. looking for some good conversation. pm me if interested and awake.;https://www.reddit.com/r/snapchat/comments/b4tzl0/21_m4f_late_night_cant_sleep_still_looking_for/
1553412221.0;False;b4tp58;True;False;t3_b4tp58;2;False;/r/snapchat/comments/b4tp58/26_f4a_laid_back_convosinteresting_accents_send/;9;;False;26 [F4A] laid back convos..interesting accents.. send me your age and a decent joke and I’ll send you my username;https://www.reddit.com/r/snapchat/comments/b4tp58/26_f4a_laid_back_convosinteresting_accents_send/
1553404127.0;False;b4sr5x;True;False;t3_b4sr5x;0;False;/r/snapchat/comments/b4sr5x/29_m4a_just_got_off_work_and_bored_like_crazy/;1;Just lost a lot of weight so normally my story has Fitness posts. Please don’t be creepy (yes, even guys have to say that) and I guess I have to say I’m straight as well.... Shoot me your username in a message.;False;29 [M4A] Just got off work and bored like crazy. Looking for interesting people to chat with. Also, if you want to story lurk or fill your map - add me too.;https://www.reddit.com/r/snapchat/comments/b4sr5x/29_m4a_just_got_off_work_and_bored_like_crazy/
1553411726.0;False;b4tn8k;True;False;t3_b4tn8k;1;False;/r/snapchat/comments/b4tn8k/21m4a/;2;"PM if interested, We can literally talk about anything; food, animals, problems, name it. I think I’m pretty cool 😅";False;21[M4A];https://www.reddit.com/r/snapchat/comments/b4tn8k/21m4a/
1553411154.0;False;b4tkzz;True;False;t3_b4tkzz;1;False;/r/snapchat/comments/b4tkzz/18m4fa_lets_talk_im_pretty_bored/;1;;False;18[m4f/a] let’s talk, I’m pretty bored;https://www.reddit.com/r/snapchat/comments/b4tkzz/18m4fa_lets_talk_im_pretty_bored/
1553406409.0;False;b4t184;True;False;t3_b4t184;1;False;/r/snapchat/comments/b4t184/20_m4f_longterm_friends_that_are_open_any_age/;1;PM me for my user;False;20 [M4F] - Long-term friends that are open | Any age;https://www.reddit.com/r/snapchat/comments/b4t184/20_m4f_longterm_friends_that_are_open_any_age/
1553406015.0;False;b4szhx;True;False;t3_b4szhx;8;False;/r/snapchat/comments/b4szhx/18f4a_sad_hoe_hours/;9;not really but i’m big bored and could use some company so pm me your user or ask for mine if you wanna talk or start a streak uwu ;False;18[F4A] sad hoe hours 😔;https://www.reddit.com/r/snapchat/comments/b4szhx/18f4a_sad_hoe_hours/
1553405051.0;False;b4svf7;True;False;t3_b4svf7;1;False;/r/snapchat/comments/b4svf7/21_m4a_in_socal_message_me_for_the_add/;1;Saucy Saturday;False;21 [m4a] in socal message me for the add :);https://www.reddit.com/r/snapchat/comments/b4svf7/21_m4a_in_socal_message_me_for_the_add/
1553404895.0;False;b4suqb;True;False;t3_b4suqb;2;False;/r/snapchat/comments/b4suqb/23_m4f_deployed_looking_for_friends/;1;Who’s tryna slide in my DMs?;False;23 [m4f] deployed, looking for friends;https://www.reddit.com/r/snapchat/comments/b4suqb/23_m4f_deployed_looking_for_friends/
1553403553.0;False;b4sohe;True;False;t3_b4sohe;1;False;/r/snapchat/comments/b4sohe/15m4a_australian_need_some_friends_haha/;1;:D ;False;15[M4A] Australian & Need some friends haha;https://www.reddit.com/r/snapchat/comments/b4sohe/15m4a_australian_need_some_friends_haha/
1553403425.0;False;b4snx3;True;False;t3_b4snx3;1;False;/r/snapchat/comments/b4snx3/21_m4f_bored_at_work/;1;Its 10pm and ill be here untill 2 am. Anyone wanna keep me company? Working in a bar kitchen is incredibly boring. Pm your snap!(:;False;21 [M4F] Bored at work;https://www.reddit.com/r/snapchat/comments/b4snx3/21_m4f_bored_at_work/
1553399469.0;False;b4s4st;True;False;t3_b4s4st;1;False;/r/snapchat/comments/b4s4st/21_m4m_bored_af_lets_talk_and_stuff_ask_for_snap/;2;Pm me your Snapchat or ask for mine;False;21 [M4M] bored af let’s talk and stuff. Ask for snap;https://www.reddit.com/r/snapchat/comments/b4s4st/21_m4m_bored_af_lets_talk_and_stuff_ask_for_snap/
1553398666.0;False;b4s0p0;True;False;t3_b4s0p0;1;False;/r/snapchat/comments/b4s0p0/20_m4f_idk_bored_i_guess_why_else_would_i_post/;1;Im just bored. I guess we could start a convo or something. Message me your snap or you could just ask for my and I’ll add you.;False;20 [M4F] Idk Bored I guess.. Why else would I post this. Lol;https://www.reddit.com/r/snapchat/comments/b4s0p0/20_m4f_idk_bored_i_guess_why_else_would_i_post/
1553398083.0;False;b4rxpv;True;False;t3_b4rxpv;2;False;/r/snapchat/comments/b4rxpv/19m4a_military_and_super_bored/;1;Just need people who can keep conversation. :) ;False;19[M4A] - Military and Super Bored.;https://www.reddit.com/r/snapchat/comments/b4rxpv/19m4a_military_and_super_bored/
1553396444.0;False;b4rosx;True;False;t3_b4rosx;1;False;/r/snapchat/comments/b4rosx/23_m4f_looking_for_new_friends/;1;I'm Niklas from Germany and if you're interested to chat with me I'm ready! ;False;23 [M4F] looking for new friends!;https://www.reddit.com/r/snapchat/comments/b4rosx/23_m4f_looking_for_new_friends/
1553396144.0;False;b4rn6j;True;False;t3_b4rn6j;1;False;/r/snapchat/comments/b4rn6j/21_m4f_im_getting_drunk_need_someone_to_vent_to_rq/;1;Message me your snap. Could use some input on my situation. ;False;21 [M4F] I’m getting drunk. Need someone to vent to rq;https://www.reddit.com/r/snapchat/comments/b4rn6j/21_m4f_im_getting_drunk_need_someone_to_vent_to_rq/
1553396020.0;False;b4rmhd;True;False;t3_b4rmhd;1;False;/r/snapchat/comments/b4rmhd/37_m4f_bored_as_hell/;1;;False;37 [m4f] Bored as hell.;https://www.reddit.com/r/snapchat/comments/b4rmhd/37_m4f_bored_as_hell/
1553395191.0;False;b4rhqv;True;False;t3_b4rhqv;14;False;/r/snapchat/comments/b4rhqv/19_f4a_get_drunk_and_snap/;28;message me your snapchat and i’ll add you! (: ;False;19 [F4A] get drunk and snap?;https://www.reddit.com/r/snapchat/comments/b4rhqv/19_f4a_get_drunk_and_snap/
1553394450.0;False;b4rdg8;True;False;t3_b4rdg8;4;False;/r/snapchat/comments/b4rdg8/23_f4a_drinking_and_bored_entertain_me_looking/;5;Pm for snap! ;False;23 [F4A] Drinking and bored! Entertain me! Looking for snap friends!;https://www.reddit.com/r/snapchat/comments/b4rdg8/23_f4a_drinking_and_bored_entertain_me_looking/
1553392173.0;False;b4r0bm;True;False;t3_b4r0bm;1;False;/r/snapchat/comments/b4r0bm/38_m4f_i_love_that_new_notification_feeling/;1;"Hi, I'm jem and I live in New Zealand. I might be a little older, but I do love some snapchat friends. I'm a generally pretty happy guy, so dont expect ""life sucks"" snaps from meLooking for some people to chat too daily, and wake up to notifications. I promise some kiwi accent and kitties. Surprise me with an orange envelope";False;38 [M4F] I love that new notification feeling :);https://www.reddit.com/r/snapchat/comments/b4r0bm/38_m4f_i_love_that_new_notification_feeling/
1553392090.0;False;b4qzsq;True;False;t3_b4qzsq;1;False;/r/snapchat/comments/b4qzsq/18m4f_convos_or_streaks/;0;DM me for snap!;False;18[M4F] Convos or Streaks!;https://www.reddit.com/r/snapchat/comments/b4qzsq/18m4f_convos_or_streaks/
1553391990.0;False;b4qz8u;True;False;t3_b4qz8u;1;False;/r/snapchat/comments/b4qz8u/19m4f_snaps_or_chats/;1;Borong Night.Lookin to get to know new people just pm me your snap or ask for mine:) .;False;19[M4F] Snaps or chats;https://www.reddit.com/r/snapchat/comments/b4qz8u/19m4f_snaps_or_chats/
1553391930.0;False;b4qyw6;True;False;t3_b4qyw6;1;False;/r/snapchat/comments/b4qyw6/24m4f_just_need_to_talk_to_someone/;1;Just looking for a good snap friendship not looking for anything sexual just a really want someone new to talk with ;False;24[m4f] just need to talk to someone;https://www.reddit.com/r/snapchat/comments/b4qyw6/24m4f_just_need_to_talk_to_someone/
1553391430.0;False;b4qvxv;True;False;t3_b4qvxv;6;False;/r/snapchat/comments/b4qvxv/28_f4m_my_snapchat_has_been_kinda_dry_lately/;8;Let's get a streak going. I'll send you pics of my cats or dog. Or what I'm eating. Or whatever I feel like. And you should too. Not looking for anything NSFW.;False;28 [f4m] my snapchat has been kinda dry lately;https://www.reddit.com/r/snapchat/comments/b4qvxv/28_f4m_my_snapchat_has_been_kinda_dry_lately/
1553388698.0;False;b4qglk;True;False;t3_b4qglk;1;False;/r/snapchat/comments/b4qglk/25_m4f_lets_gossip_about_people_we_dont_know/;1;;False;25 [M4F] Let's gossip about people we dont know;https://www.reddit.com/r/snapchat/comments/b4qglk/25_m4f_lets_gossip_about_people_we_dont_know/
1553388612.0;False;b4qg54;True;False;t3_b4qg54;3;False;/r/snapchat/comments/b4qg54/26_f4a_looking_for_nice_people_to_chat_with/;5;Hey guys, I've been pretty lonely and down for over a year now due to being in an accident and I'm looking for some chill nice people to get to know. I live in Canada and I have some health and physical issues but I hope that won't be a problem.. pm me your snap or ask for mine I guess. ;False;26 [F4A] - Looking for nice people to chat with;https://www.reddit.com/r/snapchat/comments/b4qg54/26_f4a_looking_for_nice_people_to_chat_with/
1553387884.0;False;b4qc15;True;False;t3_b4qc15;1;False;/r/snapchat/comments/b4qc15/37_m4a_bored_and_looking_to_talk_to_a_stranger/;1;;False;37 [M4A] bored and looking to talk to a stranger about life.;https://www.reddit.com/r/snapchat/comments/b4qc15/37_m4a_bored_and_looking_to_talk_to_a_stranger/
1553386224.0;False;b4q2mi;True;False;t3_b4q2mi;1;False;/r/snapchat/comments/b4q2mi/15_m4a_can_talk_about_anything_you_want_so_hmu/;0;;False;15 [M4A] can talk about anything you want so hmu;https://www.reddit.com/r/snapchat/comments/b4q2mi/15_m4a_can_talk_about_anything_you_want_so_hmu/
1553383886.0;False;b4pp0q;True;False;t3_b4pp0q;1;False;/r/snapchat/comments/b4pp0q/21m4f_having_a_lazy_saturday_night/;2;I had kind of a long day but I'm gonna have a few beers and chill out for a while. Would be nice to have some new chats to talk about whatever with, so if you're interested pm me or start a message or something!;False;21[M4F] Having a lazy Saturday night;https://www.reddit.com/r/snapchat/comments/b4pp0q/21m4f_having_a_lazy_saturday_night/
1553380304.0;False;b4p3y8;True;False;t3_b4p3y8;2;False;/r/snapchat/comments/b4p3y8/16_m4asnapmaps_from_all_over_the_world/;1;Looking to fill snapmaps all over the world , can have a chat . Interested in pets , culture , accent and video games;False;16 [M4A]-snapmaps from all over the world;https://www.reddit.com/r/snapchat/comments/b4p3y8/16_m4asnapmaps_from_all_over_the_world/
1553375741.0;False;b4oce4;True;False;t3_b4oce4;1;False;/r/snapchat/comments/b4oce4/24_m4a_im_currently_visiting_rome_hmu_if_you/;1;;False;24 [M4A] I’m currently visiting Rome. HMU if you wanna see Rome.;https://www.reddit.com/r/snapchat/comments/b4oce4/24_m4a_im_currently_visiting_rome_hmu_if_you/
