created_utc;edited;id;is_self;locked;name;num_comments;over_18;permalink;score;selftext;spoiler;title;url
1550801969.0;False;atbswh;True;False;t3_atbswh;1;False;/r/whatsapp/comments/atbswh/whatsapp_icloud_backup_storage_problem/;3;"Okay, somebody needs to explain this to me, please. On my iPhone I have iCloud Backup activated in WhatsApp's settings and it works well. I can see that the backup uses 5.9GB of my iCloud storage. In terms of my local iPhone storage, WhatsApp only uses 93.7MB. On my mom's iPhone, however, WhatsApp uses almost 6GB locally and is not able to initiate an iCloud backup even though she has more than enough space on iCloud. It says that there's not enough local storage available to perform the backup, which doesn't really make sense to me as the backup should not be created locally, but on iCloud instead. How can I solve this problem and make WhatsApp free up local storage?Thanks!&#x200B;PS and unrelated: In the [WhatsApp FAQ's](https://faq.whatsapp.com/en/iphone/28041113/?category=5245251) I read ""Using Archive Chat does not delete the chat, nor does it back up the chat to iCloud"". Is that true? Are chats that I archived not being backed up to iCloud (i.e. I would lose them wen I'd switch phones)?";False;WhatsApp iCloud Backup / Storage Problem;https://www.reddit.com/r/whatsapp/comments/atbswh/whatsapp_icloud_backup_storage_problem/
1550762890.0;1550767721.0;at4dtz;True;False;t3_at4dtz;1;False;/r/whatsapp/comments/at4dtz/whatsapp_fodler_missing_lost_all_photos_etc/;3;"Hi there folks,&#x200B;So, my cellphone (motorola C Plus, Android 7.0) has 8gb internal storage, I had all my whatsapp media saved on  it.I got tired of the short space and bougth a SD Card, setting him as internal storage too. The system asked if I wanted to move my files and apps to it and I checked yes.The next day I realised that all my whatsapp pictures and videos have gone missing, neither the folders existsThen I tried to uninstall e reinstall whatsapp, there's a backup (\~800mb) on google drive, but it gets stuck ""preparing to recover messages"" for hours and if I minimize the app it screws everything and pops up a message that they couldnt find any backup.&#x200B;And I cant recover it manually because there's no whatsapp folder (databases, media, etc)&#x200B;Anyone knows what can be done?&#x200B;Thaaaanks, \~non-native english speaker\~&#x200B;Edit: yep typo in the title";False;Whatsapp fodler missing, lost all photos etc;https://www.reddit.com/r/whatsapp/comments/at4dtz/whatsapp_fodler_missing_lost_all_photos_etc/
1550730921.0;False;aszwg9;True;False;t3_aszwg9;5;False;/r/whatsapp/comments/aszwg9/backing_up_from_ios_to_android/;2;How do I transfer my WhatsApp messages and media from ios to android? ;False;Backing up from ios to android;https://www.reddit.com/r/whatsapp/comments/aszwg9/backing_up_from_ios_to_android/
1550728291.0;False;aszij1;False;False;t3_aszij1;0;False;/r/whatsapp/comments/aszij1/whatsapp_admits_that_it_has_face_id_and_touch_id/;8;;False;WhatsApp admits that it has Face ID and Touch ID bugs: Activates Change authentication timer;https://www.gadgetbridge.com/news/whatsapp-admits-that-it-has-face-id-and-touch-id-bugs-activates-change-authentication-timer/
1550653561.0;False;asm75d;True;False;t3_asm75d;7;False;/r/whatsapp/comments/asm75d/learn_spanish/;3;Hi everyone. Wondering if any of you know of a WhatsApp group i could join to learn Spanish? I am a total beginner and would appreciate the help a lot. ;False;Learn Spanish;https://www.reddit.com/r/whatsapp/comments/asm75d/learn_spanish/
1550642054.0;False;askoq2;False;False;t3_askoq2;0;False;/r/whatsapp/comments/askoq2/how_to_share_your_location_using_whatsapp/;0;;False;How to share your location using WhatsApp;https://www.gadgetbridge.com/news/how-to-share-your-location-using-whatsapp/
1550627391.0;False;asicvc;True;False;t3_asicvc;2;False;/r/whatsapp/comments/asicvc/does_exporting_a_whatsapp_chat_notify_the_other/;2;Title;False;Does exporting a whatsapp chat notify the other person?;https://www.reddit.com/r/whatsapp/comments/asicvc/does_exporting_a_whatsapp_chat_notify_the_other/
1550619474.0;False;ash1qv;True;False;t3_ash1qv;0;False;/r/whatsapp/comments/ash1qv/help_with_search_function_for_old_messages/;1;"Since I upgraded my phone (from an iPhone 6 to an X), I successfully transferred all of my old messages, and they're still there when I scroll up manually (and also backed up onto the Cloud). However, the search function doesn't seem to register any of the messages sent/received before I switched phones. For example, if I search ""news"", only the messages sent after the transfer pop up.I have a similar problem with starred messages, since I starred quite a few important old messages for reference later. I can still see them in the starred messages window, but clicking them does nothing but bring me back to the chat page on the most recent message, and, in the window, I can only see the starred message and nothing else before or after. Has anyone had a similar problem after changing phones? It does make sense to me, sort of, but I'm more concerned with how to fix it, since I need to reference a lot of those old messages and finding them is almost impossible. Does anyone know what, if anything, I can do? I've tried to contact the Whatsapp helpdesk but they didn't really give a solution. Thanks!";False;Help with search function for old messages (transferred from prev. phone)?;https://www.reddit.com/r/whatsapp/comments/ash1qv/help_with_search_function_for_old_messages/
1550612023.0;False;asfpz4;True;False;t3_asfpz4;0;False;/r/whatsapp/comments/asfpz4/whatsapp_business_ios_testflight_beta/;1;Hey there, do we have some internal Testflights available?;False;WhatsApp Business iOS Testflight Beta;https://www.reddit.com/r/whatsapp/comments/asfpz4/whatsapp_business_ios_testflight_beta/
1550555436.0;False;as72dj;True;False;t3_as72dj;3;False;/r/whatsapp/comments/as72dj/how_do_i_stop_whatsapp_from_adding_my_country/;3;I recently moved from the US to Australia so I got WhatsApp to continue talking to my friends in the US. However it says that they aren’t on WhatsApp. I found out that WhatsApp is adding the Australian country code to my US contacts. Is there any way I can stop this? ;False;How do I stop WhatsApp from adding my country code to the rest of my contacts?;https://www.reddit.com/r/whatsapp/comments/as72dj/how_do_i_stop_whatsapp_from_adding_my_country/
1550533652.0;False;as3rr3;False;False;t3_as3rr3;0;False;/r/whatsapp/comments/as3rr3/i_may_or_i_may_not/;4;;False;I may or I may not;https://i.redd.it/ot3a10o3zeh21.jpg
1550517600.0;False;as0vd3;True;False;t3_as0vd3;4;False;/r/whatsapp/comments/as0vd3/deleted_messages/;2;I'm a noob so be easy on me please.So a contact of mine probably deleted the pics and videos they sent to me some time back. But they're deleted on my whatsapp as well. Is this normal? If so, is there any way to retrieve them?;False;Deleted messages?;https://www.reddit.com/r/whatsapp/comments/as0vd3/deleted_messages/
1550466397.0;False;artjxp;False;False;t3_artjxp;1;False;/r/whatsapp/comments/artjxp/its_time_to_descend_into_whatsapp/;7;;False;Its time to descend into whatsapp;https://i.redd.it/33mm1x74f9h21.jpg
1550421753.0;False;arm7ww;True;False;t3_arm7ww;12;False;/r/whatsapp/comments/arm7ww/how_do_i_add_1000_members_to_whatsapp_group/;1;I want to create a WhatsApp group for my business but the limit is set to only 250 members. Is there any way to increase it to 1000 or more. Please Help;False;How do I add 1000 members to WhatsApp group;https://www.reddit.com/r/whatsapp/comments/arm7ww/how_do_i_add_1000_members_to_whatsapp_group/
1550336047.0;False;araju7;False;False;t3_araju7;1;False;/r/whatsapp/comments/araju7/why_we_should_stop_forwarding_fake_messages_in/;1;;False;Why we should STOP forwarding fake messages in Whatsapp?;https://youtu.be/po2wfFW33hk
1550327089.0;False;ar97bk;False;False;t3_ar97bk;4;False;/r/whatsapp/comments/ar97bk/need_some_help/;1;;False;Need some help;https://i.redd.it/62hnlsjvwxg21.png
1550320618.0;False;ar8fmd;False;False;t3_ar8fmd;0;False;/r/whatsapp/comments/ar8fmd/what_is_predation_mode/;1;;False;What is predation mode?;https://i.redd.it/tggmb31mdxg21.png
1550320158.0;False;ar8dxi;True;False;t3_ar8dxi;1;False;/r/whatsapp/comments/ar8dxi/how_to_fix_wrong_whatsapp_numbers/;1;I’m back from UK and living in the UAE. Whenever I want to contact my friends I cannot find their whatsapp profile. I figured out that I have to put the country code (+971 in UAE) for my contacts in the contacts app so I can find them on whatsapp. Is WhatsApp still reading my contacts as UK numbers? (+44)How do I fix this? It’s getting annoying to add +971 in my contacts. ;False;How to fix wrong whatsapp numbers?;https://www.reddit.com/r/whatsapp/comments/ar8dxi/how_to_fix_wrong_whatsapp_numbers/
1550318515.0;False;ar87f8;True;False;t3_ar87f8;2;False;/r/whatsapp/comments/ar87f8/can_you_recover_deleted_numberscontact_from/;0;My flatmate deleted a contact and their phone number from Whatsapp when she was angry. She's now wanting to recover it, if she can.   Does anyone know if you can recover deleted numbers from Whatsapp?;False;CAN YOU RECOVER DELETED NUMBERS/CONTACT FROM WHATSAPP?;https://www.reddit.com/r/whatsapp/comments/ar87f8/can_you_recover_deleted_numberscontact_from/
1550317224.0;False;ar82o6;True;False;t3_ar82o6;1;False;/r/whatsapp/comments/ar82o6/if_i_report_whats_app_group_will_the_members_get/;2;There's one nazi group full of Germans;False;If I report whats app group will the members get notification about it ?;https://www.reddit.com/r/whatsapp/comments/ar82o6/if_i_report_whats_app_group_will_the_members_get/
1550287794.0;1550588341.0;ar4sqi;True;False;t3_ar4sqi;23;False;/r/whatsapp/comments/ar4sqi/im_being_stalked_on_whats_app_have_i_been_hacked/;8;"Guys, I really need explanations for these weird behaviors happening on WhatsApp:&#x200B;1. An unknown number finds his/her way into my private WhatsApp group. This group has just the core members of my startup (9 of us) and we discuss strictly business stuff. We all know each other. Presumably, if someone changes his number, WhatsApp notifies everyone; same for if someone joins. We only noticed this user only after he exits the group. Everyone was confused.  The group doesn't have a join url link. (Note: I'm the only admin and no, I don't drink alcohol or smoke weed) .2. An unknown number views my status update. Yet this number IS NOT on my contact list to begin with. After contacting this user and asking who he is, he blocks me immediately.&#x200B;There are more weird stuff examples I decide not to cite for security reasons.&#x200B;Without plausible explanations I'll stop using WhatsApp with immediate effect. By the way my privacy seettings are set to ""My contacts except....""https://i.redd.it/xgh90zkhoug21.jpg&#x200B;&#x200B;this is the screenshot for case 2. Yes I saved his/her/its name as Weird Stalker and I tried to engage with him following the incident:&#x200B;https://i.redd.it/uud5nd9yezg21.jpgPS: I have 2 reddit accounts and signed in differently on different devices so please ignore any confusion in my replies.&#x200B;&#x200B;After contacting whatsapp, this is the reply I received from them:https://i.redd.it/dv2g8wpjejh21.jpghttps://i.redd.it/h1rcirjkejh21.jpg&#x200B;their response doesn't solve anything. Here's what I have to say:* 1st paragraph: agreed. at least doesn't how they say things work.* 2nd paragraph: navigating to my whatsapp web session shows no active devices. so presumably no one has scanned my QR code. If someone actually hacked me using this route, I'd be really shocked and feel stupid because no one touches my phone.* Paragraph 3: Someone should educate me on how end to end encryption is relevant in CASE 1. i.e. What is the relevance of mentioning it here when the person has already found his way into the group? The person can still view whatever is going on in the group isn't' it?* Paragraph 4: I don't allow installation from 3rd party apps or apps that are not listed on the google play store. Also, to reiterate, no one touches my phone!! Not even my siblings";False;I'm being stalked on Whats App!! Have I been hacked?;https://www.reddit.com/r/whatsapp/comments/ar4sqi/im_being_stalked_on_whats_app_have_i_been_hacked/
1550223349.0;False;aquygd;False;False;t3_aquygd;0;False;/r/whatsapp/comments/aquygd/whatsapp_will_soon_let_you_decide_who_can_add_you/;1;;False;WhatsApp will soon let you decide who can add you to Groups;https://www.gadgetbridge.com/news/whatsapp-will-soon-let-you-decide-who-can-add-you-to-groups/
1550220892.0;False;aqupgk;True;False;t3_aqupgk;1;False;/r/whatsapp/comments/aqupgk/if_i_changeupdate_my_number_what_happens_if/;2;I've moved countries but my WhatsApp is still on my old number. I just don't want to miss out on any messages that might be sent from people that dont have my new number etc.However now I've been here a few months and I really need to change. I know that I can do the Change Number thing and that it will automatically move my groups etc to the new number but what about anyone else who tries to message me?;False;If I change/update my number, what happens if someone tried to WhatsApp me to my old number?;https://www.reddit.com/r/whatsapp/comments/aqupgk/if_i_changeupdate_my_number_what_happens_if/
1550218023.0;False;aquew4;False;False;t3_aquew4;0;False;/r/whatsapp/comments/aquew4/whatsapp_business_beta_for_ios_is_finally/;6;;False;WhatsApp Business beta for iOS is finally available today! | WABetaInfo;https://wabetainfo.com/whatsapp-business-beta-for-ios-is-finally-available-today/
1550211738.0;False;aqtpjr;False;False;t3_aqtpjr;4;False;/r/whatsapp/comments/aqtpjr/cant_add_new_group_memberidk_why/;5;;False;Can’t add new group member,idk why.;https://i.redd.it/gg1slwzvdog21.jpg
1550211240.0;False;aqtnc0;True;False;t3_aqtnc0;0;False;/r/whatsapp/comments/aqtnc0/android_voice_chat_when_screen_turned_off_switch/;1;using a nokia 7.1. during voice chat, my mic will be disable when the screen is off / switch to another app (i am still able to hear the other side, but they cant hear me)i tried another phone and it is working fine. is it the app? my phone? setting?thanks;False;(android) voice chat - when screen turned off / switch to another app, mic will be disable?;https://www.reddit.com/r/whatsapp/comments/aqtnc0/android_voice_chat_when_screen_turned_off_switch/
1550200394.0;False;aqs7cv;False;False;t3_aqs7cv;0;False;/r/whatsapp/comments/aqs7cv/how_to_reject_whatsapp_group_invitations/;2;;False;How to Reject WhatsApp Group Invitations;https://www.techsolutionclub.com/2019/02/how-to-reject-whatsapp-group-invitations.html
1550188135.0;False;aqqcik;True;False;t3_aqqcik;0;False;/r/whatsapp/comments/aqqcik/reset_notification_sound_android/;1;Hopefully this is an easy one. I was playing with the settings, and changed the notification sound in the app settings. I can't find the default sound now in the list to change it back. Any suggestions?;False;Reset notification sound? Android;https://www.reddit.com/r/whatsapp/comments/aqqcik/reset_notification_sound_android/
1550160500.0;False;aqlbc7;True;False;t3_aqlbc7;1;False;/r/whatsapp/comments/aqlbc7/having_troubles_restoring_messages/;2;I switched from j5 and p20 and I figured I could restore messages. So I made a back up (I had to do it manually as I chose not to save them automatically before).  I put it on google drive (size was about 600 mb).Then I switched to p20 and installed whatsapp, it asked me if I wanted to restore everything and I said yes.All I got back were pics and videos. And I got rejoined in group chats I've been part of, but with no messages in it.Pretty much all chat is nowhere to be seen. It's getting really frustrating and I can't figure what am I doing wrong. Cool off period between 6 digit activation codes is getting bigger and bigger and I don't know what to do anymore;False;Having troubles restoring messages;https://www.reddit.com/r/whatsapp/comments/aqlbc7/having_troubles_restoring_messages/
1550125159.0;False;aqgrpd;False;False;t3_aqgrpd;1;False;/r/whatsapp/comments/aqgrpd/ethical_alternatives_to_whatsapp_messenger_and/;2;;False;Ethical Alternatives to WhatsApp, Messenger and Skype;https://switching.social/ethical-alternatives-to-whatsapp-and-skype/
1550121985.0;False;aqgcq6;True;False;t3_aqgcq6;3;False;/r/whatsapp/comments/aqgcq6/handy_bookmark_for_sending_a_whatsapp_to_a_number/;10;"One annoying thing about Whatsapp is that you have to save a contact fist before being able to send them a message on whatsapp. I found this handy script that gets around this by using whatsapp web. Create a bookmark - edit the url and put this in:javascript:(window.open(""https://api.whatsapp.com/send?phone="" + window.prompt(""Phone number"","""")));Save it, click the bookmark and then enter the phone number in the popup - it will then open a window where you can message the number without saving as a contact.";False;Handy bookmark for sending a WhatsApp to a number without saving it as a contact first... (WhatsApp Web);https://www.reddit.com/r/whatsapp/comments/aqgcq6/handy_bookmark_for_sending_a_whatsapp_to_a_number/
1550074895.0;False;aq89kk;True;False;t3_aq89kk;4;False;/r/whatsapp/comments/aq89kk/no_last_seen_also_means_that_the_check_marks/;2;"So a friend recently changed their privacy settings to never show last seen but I also noticed that even after reading my messages and responding the check marks on my messages don't turn blue.&#x200B;Does that come with ""never show last seen""? ";False;No Last Seen also means that the check marks never turn blue?;https://www.reddit.com/r/whatsapp/comments/aq89kk/no_last_seen_also_means_that_the_check_marks/
1550060410.0;False;aq60k8;True;False;t3_aq60k8;0;False;/r/whatsapp/comments/aq60k8/rafael_deal_by_expose_modi_by_rahul/;0;;False;RAFAEL Deal By Expose Modi By Rahul;https://www.reddit.com/r/whatsapp/comments/aq60k8/rafael_deal_by_expose_modi_by_rahul/
1550056547.0;False;aq5jfc;False;False;t3_aq5jfc;2;False;/r/whatsapp/comments/aq5jfc/whatsapp_limits_forward_messages_to_5_recipients/;0;;False;WhatsApp limits forward messages to 5 recipients only - Mobiles Jin;https://www.mobilesjin.com/bs-applications/whatsapp-limits-forward-messages-to-5-recipients-only/
1550055705.0;False;aq5fsz;False;False;t3_aq5fsz;0;False;/r/whatsapp/comments/aq5fsz/radha_soami_status_in_hindi_2019/;0;;False;Radha Soami Status in Hindi 2019;http://happystatus.in/top-10-best-radha-soami-status-in-hindi-2019/
1550015556.0;False;aq02l7;False;False;t3_aq02l7;7;False;/r/whatsapp/comments/aq02l7/since_i_dont_have_a_phone_i_guess_i_cant_download/;10;;False;Since I don't have a phone, I guess I can't download whatsapp?;https://i.redd.it/sjtxajtg68g21.png
1550006757.0;False;apyhnu;True;False;t3_apyhnu;6;False;/r/whatsapp/comments/apyhnu/can_i_recover_a_blurred_picture_that_i_never/;1;Hi, sorry if the title is confusing. I have a private group I used to use to send notes, pictures, etc. A few months ago, when i had to restore my phone, I lost a few of the pictures I had in there and haven't managed to get them back. I can still see the blurry outline, but can't find a way to download it. Can anyone help me?;False;Can i recover a blurred picture that i never downloaded from a group only i participate?;https://www.reddit.com/r/whatsapp/comments/apyhnu/can_i_recover_a_blurred_picture_that_i_never/
1549991888.0;False;apvnqj;True;False;t3_apvnqj;2;False;/r/whatsapp/comments/apvnqj/whatsapp_for_ipad/;0;Now you can use up to 4 WhatsApp account on iPad  [https://itunes.apple.com/us/app/multitab-messenger/id1451596996?ls=1&mt=8](https://itunes.apple.com/us/app/multitab-messenger/id1451596996?ls=1&mt=8);False;WhatsApp for iPad;https://www.reddit.com/r/whatsapp/comments/apvnqj/whatsapp_for_ipad/
1549941467.0;False;apopqo;False;False;t3_apopqo;1;False;/r/whatsapp/comments/apopqo/top_5_new_features_in_whatsapp_in_2019/;0;;False;Top 5 New Features In WhatsApp in 2019;https://www.techsolutionclub.com/2019/02/Top-5-new-features-in-whatsapp.html?m=1
1549925195.0;False;apm460;True;False;t3_apm460;5;False;/r/whatsapp/comments/apm460/limit_to_reentering_a_group_many_times/;3;A bunch of friends and I have a group chat together, and as a joke I’ve left the chat multiple times, each with a longer period of time to be let back in. Is there a limit to the amount of times I can do this?And yes, I realize I should stop. ;False;Limit to re-entering a group many times?;https://www.reddit.com/r/whatsapp/comments/apm460/limit_to_reentering_a_group_many_times/
1549922008.0;False;apljob;True;False;t3_apljob;2;False;/r/whatsapp/comments/apljob/new_sim_card/;1;"HiI have a question, that might sound stupid , but: I had to take my phone to the store to change the screen, and had to take the current SIM card out. Meanwhile I lost that SIM Card, and there ´s nowhere to find it. I´,m worried because I had some friends contact on whatsapp, on that same SIM card. I was stupid enough not to save the contacct on my phone. It was the only way we had to comunicate. &#x200B;Is it possible that I can still have my frinds number on whatsapp since I still have the app installed, trough our converstations or something? And when I put a new sim card,will i still have old contacts? Hope it isnt too confusing";False;New SIM card;https://www.reddit.com/r/whatsapp/comments/apljob/new_sim_card/
1549912883.0;False;apjuo9;True;False;t3_apjuo9;2;False;/r/whatsapp/comments/apjuo9/weird_crackling_noise_when_recording_voice_chats/;0;So, recently WhatsApp started to record voice chats with a weird crackling noise. The issue is only here when I use WhatsApp, not on normal phone, Snapchat, any voice recorder or video camera. I deleted WhatsApp, I completely uninstalled it and reinstalled it and yet it is still there. Anybody got any ideas?;False;Weird crackling noise when recording voice chats;https://www.reddit.com/r/whatsapp/comments/apjuo9/weird_crackling_noise_when_recording_voice_chats/
1549829545.0;False;ap7u35;True;False;t3_ap7u35;10;False;/r/whatsapp/comments/ap7u35/the_file_you_picked_was_not_a_photo_issues/;1;I've just moved from IPhone to Huawei and am having issues sending photos. It's letting me send some but others are showing this error message. I'm not very good at technology so I would need it explained like I'm a dumbass. Does anyone know how to fix this? 😰;False;The file you picked was not a photo - issues sending photos on new phone;https://www.reddit.com/r/whatsapp/comments/ap7u35/the_file_you_picked_was_not_a_photo_issues/
1549827876.0;False;ap7ivm;False;False;t3_ap7ivm;0;False;/r/whatsapp/comments/ap7ivm/how_to_read_deleted_whatsapp_messages/;0;;False;How to read deleted whatsapp messages;https://youtu.be/Rbcq90mySIw
1549819684.0;False;ap62ea;True;False;t3_ap62ea;5;False;/r/whatsapp/comments/ap62ea/whatsapp_takeover_scam_i_am_now_locked_out_of_my/;1;Right so I just got hit by this whatsapp scam where I received a verification code, followed by a whatsapp message from a family member asking for the code. I sent it to him, but realized way too late that the English in the message was badly garbled. Not 10 seconds later I got logged out of my whatsapp account, and now I am locked out of it for 60+ hours.Anyone experienced this? What can you do?;False;Whatsapp takeover Scam. I am now locked out of my account (seems indefinite) and he is screwing around with all my contacts.;https://www.reddit.com/r/whatsapp/comments/ap62ea/whatsapp_takeover_scam_i_am_now_locked_out_of_my/
1549747469.0;False;aowx5n;True;False;t3_aowx5n;1;False;/r/whatsapp/comments/aowx5n/whatsapp_desktop_crashes_and_then_high_uses_of/;2;So recently Whatsapp for Desktop has been crashing on my laptop running Win10. After it crashes it then uses like 60% of the CPU. I think it has always happened after I want to send a link to someone. Is there any solution to this?;False;Whatsapp Desktop crashes and Then High uses of the CPU appear even though WhatsApp is not opened.;https://www.reddit.com/r/whatsapp/comments/aowx5n/whatsapp_desktop_crashes_and_then_high_uses_of/
1549736429.0;False;aouxfr;False;False;t3_aouxfr;4;False;/r/whatsapp/comments/aouxfr/does_anyone_know_why_whatsapp_needs_to_use_my/;13;;False;Does anyone know why WhatsApp needs to use my camera in the background?;https://i.redd.it/ivz32qzf4lf21.jpg
1549614048.0;False;aoei3z;True;False;t3_aoei3z;4;False;/r/whatsapp/comments/aoei3z/whatsapp_group/;0;Guys lets start a whatsapp where we post memes and videos or maybe even weekend party of yall. Who wants to start it with me ? ;False;Whatsapp Group;https://www.reddit.com/r/whatsapp/comments/aoei3z/whatsapp_group/
1549576913.0;1549642264.0;ao9828;True;False;t3_ao9828;1;False;/r/whatsapp/comments/ao9828/last_seen_is_earlier_than_the_hi_there_im_using/;4;Can someone please explain how someone can have a last seen of December 3rd but the time that they opened their account back up would be January 4th? That doesn’t make any sense because when they would log on at that time the last seen would be updated. ;False;Last seen is earlier than the “Hi there I’m using WhatsApp date”;https://www.reddit.com/r/whatsapp/comments/ao9828/last_seen_is_earlier_than_the_hi_there_im_using/
1549562493.0;False;ao6hu9;False;False;t3_ao6hu9;0;False;/r/whatsapp/comments/ao6hu9/whatsapp_deleting_2_million_accounts_a_month_to/;9;;False;WhatsApp 'deleting 2 million accounts a month' to stop fake news;https://www.theguardian.com/technology/2019/feb/06/whatsapp-deleting-two-million-accounts-per-month-to-stop-fake-news
1549562113.0;False;ao6fct;False;False;t3_ao6fct;2;False;/r/whatsapp/comments/ao6fct/new_whatsapp_group_link_75000_groups/;0;;False;New Whatsapp Group Link 75000 groups;https://meraonlineworld.com/new-whatsapp-group-link-75000-groups/
