created_utc;edited;id;is_self;locked;name;num_comments;over_18;permalink;score;selftext;spoiler;title;url
1552163552.0;False;az7r25;True;False;t3_az7r25;1;False;/r/whatsapp/comments/az7r25/notification_bug/;1;"Hey there,since WhatsApp beta version 2.19.26 I notice the following bug (tested on Galaxy S8, Galaxy S9+ and Galaxy S10+, all with Android P):If I reply to a WhatsApp message via the 'reply' option in the notification, the notification stays there and also has my reply in it (see screenshot).This android version is from Januar 30, so the issue persists for       over a month now. Is the issue known or is there any possible fix for that? Couldn't find anything so far.Thanks,Chris&#x200B;&#x200B;https://i.redd.it/f0kshb0pl5l21.jpg";False;Notification bug;https://www.reddit.com/r/whatsapp/comments/az7r25/notification_bug/
1552162244.0;False;az7j5k;True;False;t3_az7j5k;1;False;/r/whatsapp/comments/az7j5k/changed_number_now_loads_of_my_chats_are_just/;1;I just changed my number and I updated it within the app as per the official process. Now when I scroll down through my chats, many of the contacts I have chats with, are kow just phone numbers, no contact name etc, even though I have a contact saved. Any idea why? Or how I fix?;False;Changed number. Now loads of my chats are just nunbrs instead of ghe contacts. Why?;https://www.reddit.com/r/whatsapp/comments/az7j5k/changed_number_now_loads_of_my_chats_are_just/
1552153885.0;False;az61iz;True;False;t3_az61iz;4;False;/r/whatsapp/comments/az61iz/battery_use_accelerometer/;4;https://ibb.co/R24Z0W7What's up with the accelerometer usage here?;False;Battery use accelerometer?;https://www.reddit.com/r/whatsapp/comments/az61iz/battery_use_accelerometer/
1552139479.0;False;az3or6;True;False;t3_az3or6;0;False;/r/whatsapp/comments/az3or6/anyway_to_turn_off_the_hold_sound_during_video/;3;Holy hell is it annoying getting that BEEP. BEEP. Whenever i'm video calling someone and the other gets a phone call or wants to watch a SIMPLE video. There's also a weird bug where it'll put the other person on hold when they open netflix or crunchyroll. So annoying. ;False;Anyway to turn off the hold sound during video calls?;https://www.reddit.com/r/whatsapp/comments/az3or6/anyway_to_turn_off_the_hold_sound_during_video/
1552139473.0;1552142731.0;az3oq5;True;False;t3_az3oq5;2;False;/r/whatsapp/comments/az3oq5/sending_gifv_file_issue/;4;"Me and my lads sent many big gif files (\~15MB)  we created for quite some time.I recently discovered the so-called ""gifv"" format and i was blown away just before i found out  that .gifv is not a gif file and it is in fact a video file.Nevertheless i would like to know if there is a way to send a video/gifv file and have it  played as a gif (GIF button rather than a play button)?EDIT: apparently gifv is just an illusion, you upload the gif to a site which then converts it to mp4 and uses HTML5 to loop it like a gif.Do you have any other suggestions on how to send low sized yet good quality gifs? &#x200B;";False;"Sending "".gifv"" file issue";https://www.reddit.com/r/whatsapp/comments/az3oq5/sending_gifv_file_issue/
1552091061.0;1552091301.0;ayxgxx;True;False;t3_ayxgxx;11;False;/r/whatsapp/comments/ayxgxx/how_to_copy_the_whatsapp_chat_history_from_one/;1;I have two Samsung smartphones. One is a few years old. The other has been purchased recently. Let's call them the old phone and the new phone, respectively. Before purchasing the new phone I'd been using whatsapp on my old phone for a long time. After buying the new phone, I transferred the SIM card from the old phone to the new phone. I then installed Whatsapp on the new phone. The Whatsapp on the new phone has no chat history. Is there a way to copy the chat history from the Whatsapp on the old phone to the Whatsapp on the new phone?EDIT: No only the chat history, also the contacts.;False;How to copy the whatsapp chat history from one phone to another one?;https://www.reddit.com/r/whatsapp/comments/ayxgxx/how_to_copy_the_whatsapp_chat_history_from_one/
1552080290.0;False;ayvj8n;True;False;t3_ayvj8n;0;False;/r/whatsapp/comments/ayvj8n/tablets_dont_work_anymore/;1;"Hi there, i tried to install whatsapp on a tablet without simcard. It always worked with a workaround ( [https://www.gizbot.com/how-to/tips-tricks/you-can-use-whatsapp-without-sim-card-on-your-tablet-036104.html](https://www.gizbot.com/how-to/tips-tricks/you-can-use-whatsapp-without-sim-card-on-your-tablet-036104.html) ) but now it won't give me the option to get called or to get the sms on another device.&#x200B;Am i doing something wrong?";False;Tablets don't work anymore?;https://www.reddit.com/r/whatsapp/comments/ayvj8n/tablets_dont_work_anymore/
1552076186.0;False;ayus20;True;False;t3_ayus20;11;False;/r/whatsapp/comments/ayus20/whatsapp_is_the_worst_app_to_migrate_your_data/;1;"Recently I change my mobile experience from W10M to iOS and I felt everything was running smooth and it was a really great transition regarding cloud files, photos, videos and apps. The only problem I am facing is migrating whatsapp files and data. I have e-mail the whatsapp support team, search online, reddit and even talk to other people that use the app and the struggle is real. There are no official solution, unless you pay to use 3rd party apps. Meanwhile Viber, Telegram, Skype and other social network all do a great job of syncing flawless between devices. It seems whatsapp is the only app stuck the in stone age.I am posting this so I can better understand, here on reddit your personal though of this subject and if you also struggle at anytime trying to migrate data to another system. There are still a lot of people that are stuck on the app and even if they want to change or move from it that end up feeling stuck to it, since there are a lot of contacts and important data on it.&#x200B;I don't really know what the whatsapp team needs more, in order to focus there attention and priorities on a decent sync and migration option. Are there any petition going on or a website that we can vote for the future features that are crucial? That would be a great method to also improve and tackle this handicap once for all.";False;Whatsapp is the worst app to migrate your data and media!;https://www.reddit.com/r/whatsapp/comments/ayus20/whatsapp_is_the_worst_app_to_migrate_your_data/
1552066482.0;False;aysxef;False;False;t3_aysxef;18;False;/r/whatsapp/comments/aysxef/any_one_else_got_this_problem_with_there_status/;6;;False;Any one else got this problem with there status uploads? They just turn gray after a while.;https://i.redd.it/d3971okzkxk21.jpg
1552060302.0;False;ayrr6a;True;False;t3_ayrr6a;0;False;/r/whatsapp/comments/ayrr6a/shadow_helps_clone_and_run_multiple_social_game/;1;Did you have to frequently switch different social account of same app on your phone?Have you ever used two or more phones for keeping your accounts online just in case of missing any message from WhatsApp?Now, the black technology, Shadow Space has released! It can perfectly solve your problem! You can easily use one phone to log in multiple accounts and keep them all online at the same time! And you don’t need to worry about the message reception and data storage problem of different accounts, because they will work independently and with no interference to each other.-------Highlights--------★ Log in to multiple accounts of social networking apps or game apps at the same time on one device• Balance between users' life and work easily.• Double users' online gaming experience and have more fun.• Almost all apps are supported for a second account in Parallel Space. Data from both accounts won't interfere with each other.★ Switch fast between accounts with just one-tap• Run two accounts simultaneously and switch between them fast with one-tap to effective manage different accounts.· Simple interface operation. · APP‘s file small, low CPU Consume, low power consumption.· Quick cloning，all applications can be double-opened★ Shadow Space is a unique app-cloning technology. We do not install more applications in your phone, so that your phone will runs very smoothly!Google Play:https://play.google.com/store/apps/details?id=shadow.dual.multiple.parallel.app.cloner.double.whatsall;False;Shadow helps clone and run multiple social & game accounts on one phone.;https://www.reddit.com/r/whatsapp/comments/ayrr6a/shadow_helps_clone_and_run_multiple_social_game/
1552057222.0;1552073490.0;ayr71q;True;False;t3_ayr71q;3;False;/r/whatsapp/comments/ayr71q/change_phone_number/;1;HiIf a person block me on whatsapp and I change my  whatsapp number, will I be unblocked?;False;Change phone number;https://www.reddit.com/r/whatsapp/comments/ayr71q/change_phone_number/
1552052237.0;False;ayqcjy;True;False;t3_ayqcjy;2;False;/r/whatsapp/comments/ayqcjy/am_i_blocked_if_i_have_one_tick_but_can_see_their/;1;They never had their last seen or read receipts on. Sent a text days ago and no response and only one tick mark, but I can still their picture. Does that mean I am blocked or that something may be off with their phone? ;False;Am I blocked if I have one tick but can see their profile picture?;https://www.reddit.com/r/whatsapp/comments/ayqcjy/am_i_blocked_if_i_have_one_tick_but_can_see_their/
1552049595.0;False;aypxz8;False;False;t3_aypxz8;1;False;/r/whatsapp/comments/aypxz8/whatsapp_provides_a_ban_for_users_who_do_not_use/;2;;False;WhatsApp provides a ban for users who do not use official apps;https://techlapse.com/global/whatsapp-provides-a-ban-for-users-who-do-not-use-official-apps/
1552049160.0;False;aypvqw;True;False;t3_aypvqw;4;False;/r/whatsapp/comments/aypvqw/ive_created_an_ecommerce_addon_for_whatsapp/;2;Dear Friends, I've been working on this Android app that I'm really excited about and I'd love to share it here. Basically it's a product inventory app which allows you to share items to WhatsApp directly. With a link of your Catalogs. The link track a bunch of things such as visit duration and time spent on individual items of your Catalog. The idea behind the smart link is to gauge interest. It can be very insightful to know which of your items potential customers are more drawn towards. Think of it as insights to know which items to publish more of.In addition to the above, you can also send a potential customer a direct link with a PayPal.me generated dollar amount for an item.See landing page: [http://www.budgeat.co/sell](http://www.budgeat.co/sell)P.S. It's a paid App on the Play store. But I strongly believe that with the value you receive from such a tool, it's worth the money.;False;I've created an eCommerce Addon for WhatsApp;https://www.reddit.com/r/whatsapp/comments/aypvqw/ive_created_an_ecommerce_addon_for_whatsapp/
1552037231.0;False;ayocbx;True;False;t3_ayocbx;14;False;/r/whatsapp/comments/ayocbx/whatsapp_updated_by_itself_and_now_it_doesnt_show/;12;All the pictures are still on my SD but doesn't show anything.Any help???;False;Whatsapp updated by itself and now it doesn't show my media anymore;https://www.reddit.com/r/whatsapp/comments/ayocbx/whatsapp_updated_by_itself_and_now_it_doesnt_show/
1551991333.0;False;ayhfmo;True;False;t3_ayhfmo;4;False;/r/whatsapp/comments/ayhfmo/how_long_is_media_stored_in_my_iphone/;3;"I have some old conversations that do not have images anymore. When i click on image it says something like ""this image does not exist on your phone"" How long are images stored on my phone, id i do not save them on my camera roll?I have iPhone";False;How long is media stored in my iPhone;https://www.reddit.com/r/whatsapp/comments/ayhfmo/how_long_is_media_stored_in_my_iphone/
1551978846.0;False;ayf03y;False;False;t3_ayf03y;4;False;/r/whatsapp/comments/ayf03y/do_you_guys_have_this_kind_if_time_stamp_how_do_i/;1;;False;Do you guys have this kind if time stamp ?? How do I change the timespamp style ??;https://i.redd.it/iufmkslecqk21.jpg
1551972302.0;False;aydrdz;True;False;t3_aydrdz;0;False;/r/whatsapp/comments/aydrdz/psa_if_web_whatsapp_is_super_slow_try_to_enable/;1;Resizing the web page to half the size also works. I had this problem for a while and couldn't find a fix on the internet so i thought i would share this for people with the same problem :).;False;PSA if web WhatsApp is super slow try to enable hardware acceleration;https://www.reddit.com/r/whatsapp/comments/aydrdz/psa_if_web_whatsapp_is_super_slow_try_to_enable/
1551971910.0;False;aydoym;True;False;t3_aydoym;4;False;/r/whatsapp/comments/aydoym/can_i_save_conversations_on_a_hard_drive_or_usb/;2;I recently got a new phone and my conversations wouldn’t transfer from my old phone. Is the a way I can save them on a memory stick? It’s an iPhone 6 I should add ;False;Can I save conversations on a hard drive or USB?;https://www.reddit.com/r/whatsapp/comments/aydoym/can_i_save_conversations_on_a_hard_drive_or_usb/
1551960050.0;False;aybvfq;True;False;t3_aybvfq;0;False;/r/whatsapp/comments/aybvfq/how_do_i_get_whatsapp_web_to_use_the_full_height/;1;on my FHD screen it floats in the middle of the screen, wasting space top and bottom.[pic](https://imgur.com/a/2d1WA9b)how to get it to fill up all the space?;False;how do i get whatsapp web to use the full height of my screen? it;https://www.reddit.com/r/whatsapp/comments/aybvfq/how_do_i_get_whatsapp_web_to_use_the_full_height/
1551947472.0;1551947683.0;ayaeh6;True;False;t3_ayaeh6;0;False;/r/whatsapp/comments/ayaeh6/ipl_whatsapp_groups/;0;"Welcome to WhatsApp Join Group , Join Latest IPL WhatsApp Group Links List today again am back with one more WhatsApp gather interface i.e IPL WhatsApp aggregate connection, as all we realize that IPL matches will go hung on consistently, in the event that you were hunting down IPL WhatsApp Group Joining Links this is the perfect spot for you to participate in the gathering, But should and ought to pursue the tenets and Regulations of the gathering. Comedy, Singles, Crime & Horror Stories, Massage Exchange, Sex Education, Go Kart Racing. I would like to exchange entry to my groups with people in US, United Kingdom, Europe, Australia, Canada for those who have a great community of WhatsApp Group(s). If you are admin or know the admin of 1 Group which can add me, I'm willing to do 1 for 1 Exchange. We can also set up Mixed Countries Groups and make Good Communities for any niche & interest. Pls Contact me if you are interested. Thanks alot! P.S I need to verify that you are joining for good purposes, spamming & hardselling are not allowed in my Groups. &#x200B;All Type Of Group Available**Dream 11 Whatsapp Fantasy group , Jobs Whatsapp Group , Girls Number , IPL Groups , Earn Money Groups , Whatsapp Adult Group ,  Learn English Whatsapp Groups , IPL all Matches Prediction Available Comment Now**Whatsapp groups link[https://joingroup.site/2019/03/07/join-latest-ipl-whatsapp-group-links-list/](https://joingroup.site/2019/03/07/join-latest-ipl-whatsapp-group-links-list/)[https://joingroup.site/2019/03/07/join-latest-ipl-whatsapp-group-links-list/](https://joingroup.site/2019/03/07/join-latest-ipl-whatsapp-group-links-list/)[https://joingroup.site/2019/03/07/join-latest-ipl-whatsapp-group-links-list/](https://joingroup.site/2019/03/07/join-latest-ipl-whatsapp-group-links-list/)[https://joingroup.site/2019/03/07/join-latest-ipl-whatsapp-group-links-list/](https://joingroup.site/2019/03/07/join-latest-ipl-whatsapp-group-links-list/)[https://joingroup.site/2019/03/07/join-latest-ipl-whatsapp-group-links-list/](https://joingroup.site/2019/03/07/join-latest-ipl-whatsapp-group-links-list/)[https://joingroup.site/2019/03/07/join-latest-ipl-whatsapp-group-links-list/](https://joingroup.site/2019/03/07/join-latest-ipl-whatsapp-group-links-list/)[https://joingroup.site/2019/03/07/join-latest-ipl-whatsapp-group-links-list/](https://joingroup.site/2019/03/07/join-latest-ipl-whatsapp-group-links-list/)[https://joingroup.site/2019/03/07/join-latest-ipl-whatsapp-group-links-list/](https://joingroup.site/2019/03/07/join-latest-ipl-whatsapp-group-links-list/)[https://joingroup.site/2019/03/07/join-latest-ipl-whatsapp-group-links-list/](https://joingroup.site/2019/03/07/join-latest-ipl-whatsapp-group-links-list/)";False;IPL Whatsapp Groups;https://www.reddit.com/r/whatsapp/comments/ayaeh6/ipl_whatsapp_groups/
1551933637.0;False;ay8n0k;True;False;t3_ay8n0k;2;False;/r/whatsapp/comments/ay8n0k/whatsapp_imagesvideos_filtered_all_other_messages/;2;My understanding is that WhatsApp messages are encrypted (as long as both parties have up-to-date software).  How does Delta Airlines or a VPN block specifically images and video, but not regular text WhatsApp messages?;False;WhatsApp Images/Videos Filtered, All Other Messages Can Send;https://www.reddit.com/r/whatsapp/comments/ay8n0k/whatsapp_imagesvideos_filtered_all_other_messages/
1551916778.0;False;ay5xeu;True;False;t3_ay5xeu;2;False;/r/whatsapp/comments/ay5xeu/what_should_you_do_if_you_want_out_of_a_chat/;1;;False;What should you do if you want out of a chat group but not by exiting it and not ny asking the admin to remove you?;https://www.reddit.com/r/whatsapp/comments/ay5xeu/what_should_you_do_if_you_want_out_of_a_chat/
1551898843.0;False;ay2h4y;True;False;t3_ay2h4y;6;False;/r/whatsapp/comments/ay2h4y/whatsapp_backups/;1;Apologies in advance if this isn’t the right place for this, but wondered if anyone could help me out! Is it at all possible to transfer my WhatsApp chats from my iPhone 8 to my new google pixel 3? I’ve searched a lot and can’t seem to find a solid answer..;False;Whatsapp Backups;https://www.reddit.com/r/whatsapp/comments/ay2h4y/whatsapp_backups/
1551894183.0;False;ay1kdj;True;False;t3_ay1kdj;1;False;/r/whatsapp/comments/ay1kdj/unpopular_opinion_on_delete_for_everyone_sorry_if/;4;"Everyone sees this as a feature, I think it's an anti-feature. Personally I hate the idea that there is software on my phone acting against my will to delete content that I have been sent. Software running on your device should always be working for you, not other people.People should think twice before sending a message or picture and stand up for what they do, not invoke malware that they enforced on my device (by only using WhatsApp or similar message apps instead of SMS etc.). They shouldn't be allowed to delete data on my device, even if they ""created"" it. Ultimately they seem to have more power over my portable palmtop computer than I have, since I cannot prevent them from revoking messages.And if you do change your mind about something you did, you should man up and take responsibility for your actions. At most, there should be an option to send a ""hide"" (but still make retrievable at will) a message in case of typo or other similar error. And obviously cancel a send if the message wasn't delivered yet (messaging service companies have all the right to do whatever they want with their servers, as long as they don't touch what is already on my phone).All unsend does is pose any hacker/malicious user of a messaging platform in an unfair position, put people under the wrong assumption that anything done on the Internet can easily be undone, and potentially delete proof of legally binding contracts or communications. I deem this unacceptable.";False;"Unpopular opinion on ""Delete for Everyone"" (sorry if controversial)";https://www.reddit.com/r/whatsapp/comments/ay1kdj/unpopular_opinion_on_delete_for_everyone_sorry_if/
1551829603.0;False;axrzmo;True;False;t3_axrzmo;2;False;/r/whatsapp/comments/axrzmo/unable_to_sendreceive_messages_constantly/;3;So at the most crucial time (I’m literally flying abroad today) my WhatsApp is glitching. I can’t receive/send messages to people who will meet me at the airport overseas tonight. I’ve done a soft reset of my iPhone 6s, and deleted and re-installed the app, but each time it says “Connecting...” at the top of the screen and looks like its buffering.The app is the most updated version. Have any of you had issues like this? My FB Messenger is also not working, but other apps (like Reddit) and iMessage are fine. I can’t figure this out. Any ideas?;False;Unable to send/receive messages - constantly “Connecting...” Soft reset and reinstalling the app doesn’t work :(;https://www.reddit.com/r/whatsapp/comments/axrzmo/unable_to_sendreceive_messages_constantly/
1551827866.0;1552573955.0;axrowl;True;False;t3_axrowl;10;False;/r/whatsapp/comments/axrowl/anyone_feel_like_whatsapp_is_just_getting_worse/;8;I used to think that WhatsApp is a perfect app—no bugs, easy to use, fast… Nowadays bugs start appearing more frequently and they've added a few features that nobody really wants. To name a few*Bugs*1. Contact names won't update.2. When the “group info” button is pressed it will take you to the icon page rather than the actual info page.3. Some of your messages will “get stuck” and will not go out.4. Stickers don't load.5. App crashes everytime I try to send videos.6. _Waiting for this message. This may take a while._ This message appears too often and it's not even ”a while”, it's forever.*Useless features that nobody asked for*1. Stickers.2. Status updates.3. Ads (they're coming soon).Well I really hope they fix these problems and we can get a smooth user experience again.;False;Anyone feel like WhatsApp is just getting worse?;https://www.reddit.com/r/whatsapp/comments/axrowl/anyone_feel_like_whatsapp_is_just_getting_worse/
1551824268.0;False;axr1cm;True;False;t3_axr1cm;4;False;/r/whatsapp/comments/axr1cm/is_there_a_way_to_have_select_contacts_appear_in/;4;Is there a way to just have for example my two best friends appear in my WhatsApp contacts, without seeing the other contacts from my google contacts (and without them seeing my online status, etc).;False;Is there a way to have select contacts appear in WhatsApp?;https://www.reddit.com/r/whatsapp/comments/axr1cm/is_there_a_way_to_have_select_contacts_appear_in/
1551803809.0;False;axn4b0;True;False;t3_axn4b0;7;False;/r/whatsapp/comments/axn4b0/restore_both_local_and_google_drive_backup/;2;I own a Nexus 6P and Galaxy S5. My SIM is currently in the S5. The S5 has some of my WhatsApp messages saved locally and the Nexus 6P has my newer WhatsApp messages backed up to the cloud. How do I restore the local and cloud messages to the S5 at the same time? Thanks.;False;Restore both local and Google Drive backup;https://www.reddit.com/r/whatsapp/comments/axn4b0/restore_both_local_and_google_drive_backup/
1551793779.0;False;axlclw;False;False;t3_axlclw;2;False;/r/whatsapp/comments/axlclw/how_to_earn_money_from_whatsapp_2019/;0;;False;How To Earn Money From Whatsapp 2019;https://www.rohailvoice.com/2019/03/how-to-earn-money-from-whatsapp-2019.html
1551770529.0;False;axidp3;True;False;t3_axidp3;4;False;/r/whatsapp/comments/axidp3/i_have_been_barred_from_using_whatsapp/;3;I have been barred, have email their support but still can't log in. Anyone here experience the same issue before?https://i.redd.it/ci9lu1oj49k21.jpg;False;I have been barred from using WhatsApp;https://www.reddit.com/r/whatsapp/comments/axidp3/i_have_been_barred_from_using_whatsapp/
1551765312.0;1551945477.0;axho7n;True;False;t3_axho7n;0;False;/r/whatsapp/comments/axho7n/looking_for_us_europe_australia_canada_whatsapp/;0;I own serveral Business & Leisure WhatsApp Groups of varies interest. The people in my groups are mostly from Singapore, Malaysia & a few Indonesia numbers.Most of us are from Business Interest Groups e.g Biz World, IT DM Masterminds, Forex Discussion Forum, which I have made and attracted ppl to join my Leisure Groups like e.g Comedy, Singles, Crime & Horror Stories, Massage Exchange, Sex Education, Go Kart Racing.I would like to exchange entry to my groups with people in US, United Kingdom, Europe, Australia, Canada for those who have a great community of WhatsApp Group(s). If you are admin or know the admin of 1 Group which can add me, I'm willing to do 1 for 1 Exchange.We can also set up Mixed Countries Groups and make Good Communities for any niche & interest. Pls Contact me if you are interested. Thanks alot!P.S I need to verify that you are joining for good purposes, spamming & hardselling are not allowed in my Groups.;False;Looking for US, Europe, Australia, Canada WhatsApp Groups to Exchange/Add to My Singapore & Malaysia Contacts Groups;https://www.reddit.com/r/whatsapp/comments/axho7n/looking_for_us_europe_australia_canada_whatsapp/
1551759104.0;False;axgs6h;True;False;t3_axgs6h;1;False;/r/whatsapp/comments/axgs6h/sticker_folder_in_gallery/;1;my stickers are going to gallery of my cell phone,and everything is tainted, when sending an image the stickers appear next to the images someone knows how to solve this?;False;sticker folder in gallery;https://www.reddit.com/r/whatsapp/comments/axgs6h/sticker_folder_in_gallery/
1551741136.0;False;axdtv2;True;False;t3_axdtv2;10;False;/r/whatsapp/comments/axdtv2/unable_to_add_friend_to_whatsapp/;3;I'm not able to add my friend to WhatsApp.  He sent me a number, like + 42 6 312 653 68 77.  I tried search and nothing comes up.   He lives in Mexico, I'm in Canada.  Tried reinstalling, both Android app on phone and PC app.     ;False;Unable to add friend to WhatsApp;https://www.reddit.com/r/whatsapp/comments/axdtv2/unable_to_add_friend_to_whatsapp/
