created_utc;edited;id;is_self;locked;name;num_comments;over_18;permalink;score;selftext;spoiler;title;url
1548661116.0;False;akl89z;False;False;t3_akl89z;1;False;/r/whatsapp/comments/akl89z/whatsapp_gets_revamped_emojis_support_for/;1;;False;WhatsApp gets revamped emojis, support for fingerprint authentication in beta update: Report;https://www.gadgetbridge.com/news/whatsapp-gets-revamped-emojis-support-for-fingerprint-authentication-in-beta-update-report/
1548623558.0;False;akfvqt;True;False;t3_akfvqt;1;False;/r/whatsapp/comments/akfvqt/changing_whatsapp_number/;1;Hi! I'm changing my phone number and I don't want *ANY* of my contacts to have my new number. I'm not a part of any WhatsApp groups. If I change my number, will it notify anyone? Thankssss;False;Changing WhatsApp Number;https://www.reddit.com/r/whatsapp/comments/akfvqt/changing_whatsapp_number/
1548591022.0;False;akbind;False;False;t3_akbind;1;False;/r/whatsapp/comments/akbind/facebook_will_interconnect_whatsapp_instagram_and/;7;;False;Facebook will interconnect WhatsApp, Instagram and Messenger.;https://www.arreadah.com/2019/01/facebook-will-interconnect-whatsapp.html?m=1&hl=en
1548588508.0;False;akbaeh;True;False;t3_akbaeh;13;False;/r/whatsapp/comments/akbaeh/whatsapp_chat/;1;Is there a way to retrieve a deleted whatsapp chat ;False;WhatsApp chat;https://www.reddit.com/r/whatsapp/comments/akbaeh/whatsapp_chat/
1548554900.0;False;ak7s45;True;False;t3_ak7s45;0;False;/r/whatsapp/comments/ak7s45/is_there_anyway_to_block_someones_profile_picture/;1;So I’m texting an acquaintance now on WhatsApp but he has a new finance picture of him macking as a profile picture. Fucking awk...feeling like I’m 3rd wheeling just tryna catch up. Dudes marrying a single mom from Brazil...from the interwebz after a few months who had a more dope ex-gf who he cheated. (Literally face-palmed at the bar when I was informed this);False;Is there anyway to block someone’s profile picture?;https://www.reddit.com/r/whatsapp/comments/ak7s45/is_there_anyway_to_block_someones_profile_picture/
1548503298.0;False;ak08no;False;False;t3_ak08no;0;False;/r/whatsapp/comments/ak08no/how_to_read_whatsapp_deleted_message_simple_trick/;0;;False;How To Read Whatsapp Deleted Message!!! || Simple Trick 2019 || Whatsapp Messenger (NEW TRICK);https://youtu.be/C9t8BKdAW6M
1548501389.0;False;ak02kg;False;False;t3_ak02kg;1;False;/r/whatsapp/comments/ak02kg/hi_guys_really_hoping_someone_can_help_tearing_my/;1;;False;Hi guys, really hoping someone can help. Tearing my hair out here! WhatsApp isn't showing me a message preview via the notification bar. I've fiddled with notification settings and it's having no impact. Please help!;https://i.redd.it/3qmxaa844rc21.jpg
1548484428.0;False;ajykir;False;False;t3_ajykir;0;False;/r/whatsapp/comments/ajykir/best_keyboard_for_android_urduhindi/;2;;False;Best Keyboard for Android [Urdu/Hindi];https://www.youtube.com/attribution_link?a=rBcWDYCcQ4o&u=%2Fwatch%3Fv%3DLm56SO3Ye9A%26feature%3Dshare
1548453022.0;False;aju3h0;True;False;t3_aju3h0;6;False;/r/whatsapp/comments/aju3h0/rip_whatsapp/;2;;False;rip whatsapp?;https://www.reddit.com/r/whatsapp/comments/aju3h0/rip_whatsapp/
1548440866.0;False;ajrzaa;False;False;t3_ajrzaa;0;False;/r/whatsapp/comments/ajrzaa/facebook_plans_to_integrate_whatsapp_instagram/;2;;False;Facebook plans to integrate WhatsApp, Instagram & Facebook Messenger.;https://youtu.be/mqzkokRzYLY
1548434361.0;False;ajqtlj;False;False;t3_ajqtlj;0;False;/r/whatsapp/comments/ajqtlj/facebook_to_merge_instagram_whatsapp_and_messenger/;2;;False;FACEBOOK TO MERGE INSTAGRAM, WHATSAPP AND MESSENGER;https://www.independent.co.uk/life-style/gadgets-and-tech/news/facebook-instagram-whatsapp-messenger-app-merger-download-a8746376.html
1548425923.0;False;ajpg4a;False;False;t3_ajpg4a;22;False;/r/whatsapp/comments/ajpg4a/zuckerberg_plans_to_integrate_whatsapp_instagram/;26;;False;Zuckerberg Plans to Integrate WhatsApp, Instagram and Facebook Messenger;https://www.nytimes.com/2019/01/25/technology/facebook-instagram-whatsapp-messenger.html
1548419814.0;False;ajom4t;True;False;t3_ajom4t;4;False;/r/whatsapp/comments/ajom4t/whatsapp_desktop_using_100cpu/;4;"I have a laptop with an i7-770hq, today after sharing a google drive link what'sapp crashed the first 3 times i did try to past the link in the chat and press ""send"" ( the link is from a 600gb folder i don't know if that's important), after i was able to send the link my pc went crazy and in task manager there where 3 whatsapp instance using 100% of my cpu.how is thispossible ?pic from task manager [https://imgur.com/a/hOR7mSR](https://imgur.com/a/hOR7mSR) ";False;whatsapp desktop using 100%cpu;https://www.reddit.com/r/whatsapp/comments/ajom4t/whatsapp_desktop_using_100cpu/
1548403052.0;False;ajmvlg;False;False;t3_ajmvlg;1;False;/r/whatsapp/comments/ajmvlg/whatsapp_has_redesigned_some_emojis/;3;;False;WhatsApp has redesigned some emojis;https://wabetainfo.com/whatsapp-beta-for-android-2-19-21-whats-new/
1548397120.0;False;ajm8j4;False;False;t3_ajm8j4;0;False;/r/whatsapp/comments/ajm8j4/whatsapp_beta_for_android_gets_show_in_chat/;5;;False;WhatsApp beta for Android gets 'Show in chat', 'Rotate' and 'Forward' shortcuts for photos;https://www.gadgetbridge.com/news/whatsapp-beta-for-android-gets-show-in-chat-rotate-and-forward-shortcuts-for-photos/
1548375003.0;False;ajj2yx;False;False;t3_ajj2yx;5;False;/r/whatsapp/comments/ajj2yx/why_does_whatsapp_limit_the_transfer_of_messages/;2;;False;Why does WhatsApp limit the transfer of messages to five recipients?;https://www.arreadah.com/2019/01/why-does-whatsapp-limit-transfer-of.html?hl=en&skpage=1
1548346573.0;False;ajdzh8;False;False;t3_ajdzh8;0;False;/r/whatsapp/comments/ajdzh8/latest_android_developers_whatsapp_group_links/;1;;False;Latest Android Developers WhatsApp Group Links;https://meraonlineworld.com/latest-android-developers-whatsapp-group-links/
1548336971.0;False;ajcgyk;True;False;t3_ajcgyk;12;False;/r/whatsapp/comments/ajcgyk/can_i_send_a_massage_to_my_self_in_whatsapp/;3;I remember that you can, but i forgot how ;False;Can i send a massage to my self in whatsapp;https://www.reddit.com/r/whatsapp/comments/ajcgyk/can_i_send_a_massage_to_my_self_in_whatsapp/
1548334289.0;False;ajc3vt;False;False;t3_ajc3vt;0;False;/r/whatsapp/comments/ajc3vt/heres_how_you_can_get_unlimited_whatsapp_number/;0;;False;Here's how you can get unlimited whatsapp number within 60 seconds.;https://www.trickedtricks.com/textnow-tricks-to-get-free-us-number-within-60-seconds/
1548295717.0;False;aj7ika;True;False;t3_aj7ika;5;False;/r/whatsapp/comments/aj7ika/restore_backups_for_whatsapp_new_number/;1;Recently I was blocked from WhatsApp (message from them says that I've been a member of many WhatsApp groups) So I tried many different things but couldn't recover the account. I got a new number today. I need to know if there is any possibility to restore the previous number WhatsApp chats to my new number. I got many important chats for my life in that .plz if anybody knows something, let me know;False;restore backups for whatsapp new number;https://www.reddit.com/r/whatsapp/comments/aj7ika/restore_backups_for_whatsapp_new_number/
1548275621.0;False;aj45ca;True;False;t3_aj45ca;1;False;/r/whatsapp/comments/aj45ca/can_you_download_addons_for_whatsapp_for_ios/;0;Hey guys, sorry if this is a dumb question, but can you put addons your WhatsApp, app? Specifically for IOS (if you can do it for android that's cool too, would like to know if that's possible as well). If you can, how do you do it? Thank you so much. ;False;Can you download addons for WhatsApp? (for IOS);https://www.reddit.com/r/whatsapp/comments/aj45ca/can_you_download_addons_for_whatsapp_for_ios/
1548262299.0;False;aj1ood;True;False;t3_aj1ood;3;False;/r/whatsapp/comments/aj1ood/a_way_to_show_only_a_select_few_contacts_rather/;1;"I only use whatsapp to communicate with 4-5 people, i dont want to scroll through 100s of my contacts to find them. Is there a way to only show a few or ""starred"" contacts.?";False;A way to show only a select few contacts rather than entire phonebook?;https://www.reddit.com/r/whatsapp/comments/aj1ood/a_way_to_show_only_a_select_few_contacts_rather/
1548261008.0;False;aj1g5q;True;False;t3_aj1g5q;2;False;/r/whatsapp/comments/aj1g5q/transferring_data_from_old_phone_to_new_one/;1;A family member bought a new phone about a month ago and wants to recover all of the old photos that people had sent on groups, etc. I know that I can simply grab her old phone, log into her whatsapp account, and do a backup of the chats (I think that saves everything). Thing is, she's been using her new phone for a while now and has made some back ups...So Im not sure this method will work, since if I backup her old phone and then on the new one I download that backup, will this overwrite everything on the new phone and make her lose all of the new data (on the new phone)?? Or will this backup just fill in the old missing data and keep the new on as well?;False;Transferring data from old phone to new one;https://www.reddit.com/r/whatsapp/comments/aj1g5q/transferring_data_from_old_phone_to_new_one/
1548255669.0;False;aj0iyu;False;False;t3_aj0iyu;0;False;/r/whatsapp/comments/aj0iyu/how_to_save_whatsapp_status_in_gallery/;1;;False;How to save WhatsApp status in Gallery;https://www.howtechno.com/how-to-save-whatsapp-status/
1548240258.0;False;aiyhrc;True;False;t3_aiyhrc;0;False;/r/whatsapp/comments/aiyhrc/how_to_share_photos_and_videos_between_instagram/;4;"WhatsApp is a great platform to keep in touch with your loved ones across countries and phone brands, but posting on Instagram has not always been as easy as it should have been considering Zuckerberg (Facebook) owns both companies. Now whether you have iOS or Android, all it takes is just a few steps.&#x200B;The “Share on WhatsApp” feature has been available on Android for a while now, but iOS is not getting in on the action with a “share to WhatsApp” feature. However, if you own an iPhone, you may not notice the option because it is currently in a closed, invite-only beta.&#x200B;Before going any further, you will need to have the WhatsApp installed and set up on your phone to share anything from Instagram. Also remember that you can only share public Instagram posts to WhatsApp, which means no videos. Unlike with Twitter and Facebook, you don’t have to “link” your WhatsApp account to Instagram to be able to share posts to it. It performs just like Facebook Messenger does on Android. As long as you have WhatsApp on your phone, Instagram will detect it and display you the share option.&#x200B;In this article, we have mentioned how you can share Instagram stories, photos, and videos on WhatsApp. Because WhatsApp and Instagram are both owned by Facebook, there has been much integration done between these apps. Stories like status on Facebook and WhatsApp was mirrored from Instagram stories. To bring these apps even closer, Instagram supports sharing on WhatsApp. Here’s how.&#x200B;**How To Share Instagram Photos Or Videos On WhatsApp?**The process is the same for both iOS and Android with a few changes.https://i.redd.it/vxszfiu6j5c21.png* Open your Instagram and find the post you want to share on WhatsApp* Tap on the three dots icon on the top right of the photo or video* Select “share on WhatsApp” from the options.* WhatsApp will open, and after that, you can tap on “my status” to post it as your WhatsApp story.* Or you can choose a contact or group to send it to them in chat.Apart from WhatsApp, you’ll also get an option to share on Facebook as well. The Facebook Messenger sharing feature is also there on iOS app for both videos and photos. Only the link with a thumbnail is shared so people will still need to navigate to Instagram to see the actual video. To overcome this issue, you can download the post from Instagram and then send it on WhatsApp.&#x200B;**How To Download And Send Posts From Instagram On WhatsApp**&#x200B;**Android**https://i.redd.it/7wa4d96gj5c21.png1. Install an Instagram downloader app from google play.2. After installing the app, you need to get the link to the Instagram post. For that, you can copy the post link from Instagram. You should just tap on the three dots menu at the top right of the post and select “copy share URL.”3. Then download the post by entering the link into the downloader app.**iPhone**https://i.redd.it/xi0yvnwgj5c21.png1. Download an Instagram downloader from App store.2. Open your Instagram app and tap on the three dots icon above the post and select copy link.3. Paste the link in the download field and tap save video or save the image.&#x200B;This way the Instagram post will be saved to your camera roll, and you can then send it to WhatsApp.&#x200B;Source: instazood.com";False;How to Share Photos and Videos between Instagram and WhatsApp?;https://www.reddit.com/r/whatsapp/comments/aiyhrc/how_to_share_photos_and_videos_between_instagram/
1548235442.0;False;aixzfq;False;False;t3_aixzfq;0;False;/r/whatsapp/comments/aixzfq/whatsappa_mesaj_sınırı_geldi_büyük_blog_whatsapp/;0;;False;WhatsApp’a mesaj sınırı geldi - Büyük Blog - WhatsApp;http://buyukblog.com/whatsappa-mesaj-siniri-geldi/
1548187721.0;False;aiquvr;True;False;t3_aiquvr;6;False;/r/whatsapp/comments/aiquvr/found_a_big_security_bug_in_whatsapp/;1;So basically ive been using a chat with someone who blocked me as a way to transfer photos from my phone to my PC, however a second ago his pf and status popped up going back into my whatsapp on my PC, to then give me the message my phone has no connection,Now idk how this happened but looking on my phone im still blocked, reconnecting my phone it dissapears on desktop aswell, somehow the information came trough in this processTheres no way was unblocked because i have not spoken to this guy in 2 years and we barely knew each other in the first place, this was also clearly his current profile, not from before i was blocked;False;Found a big security bug in whatsapp;https://www.reddit.com/r/whatsapp/comments/aiquvr/found_a_big_security_bug_in_whatsapp/
1548181723.0;1548181926.0;aipsdo;True;False;t3_aipsdo;13;False;/r/whatsapp/comments/aipsdo/whatsapp_down_thread/;13;What happened? EDIT: ok it’s working for me now, go check everyone!;False;WhatsApp down thread;https://www.reddit.com/r/whatsapp/comments/aipsdo/whatsapp_down_thread/
1548181158.0;False;aipoq5;True;False;t3_aipoq5;3;False;/r/whatsapp/comments/aipoq5/webapp_mites_phone_notifications/;2;Hello there!Can't find the answer anywhere. At work I'm starting to use WhatsApp on Chrome through the webapp. But it seems that when connected, I didn't receive notifications on my phone anymore, which is slightly irritating (I can't close the window every single time I step away from my work station, sometimes quite urgently!). Does anyone know a fix for this? :) Thanks Edit: obviously title should read mutes...;False;Webapp mites phone notifications?;https://www.reddit.com/r/whatsapp/comments/aipoq5/webapp_mites_phone_notifications/
1548174887.0;False;aiokhx;False;False;t3_aiokhx;0;False;/r/whatsapp/comments/aiokhx/entrepreneur_whatsapp_group_link_of_2019/;1;;False;Entrepreneur WhatsApp Group Link Of 2019;https://www.whatzclub.com/2018/10/entrepreneur-whatsapp-group.html
1548155252.0;False;ailtbh;False;False;t3_ailtbh;0;False;/r/whatsapp/comments/ailtbh/whatsapp_limits_message_forwarding_to_curb_fake/;4;;False;Whatsapp Limits Message Forwarding To Curb Fake News;https://www.reddit.com/r/LatestPhoneZone/comments/ailpxd/whatsapp_limits_message_forwarding_to_curb_fake/
1548094837.0;False;aicxz3;False;False;t3_aicxz3;0;False;/r/whatsapp/comments/aicxz3/after_india_whatsapp_has_reduced_the_message/;1;;False;After India, Whatsapp has reduced the message forwarding feature's limit to users worldwide;http://thetechnologytrends.com/after-india-whatsapp-rolls-out-message-forwarding-limit-worldwide-heres-why/
1548083955.0;False;aib11p;False;False;t3_aib11p;1;False;/r/whatsapp/comments/aib11p/whatsapp_to_begin_limiting_message_forwarding_to/;8;;False;WhatsApp to begin limiting message forwarding to 5 individuals or groups to curb fake news;https://9to5google.com/2019/01/21/whatsapp-limiting-message-forwarding/
1548073747.0;False;ai9nti;False;False;t3_ai9nti;0;False;/r/whatsapp/comments/ai9nti/how_to_schedule_whatsapp_messages_the_easy_way/;0;;False;How to Schedule WhatsApp Messages? The easy way.;https://www.socialpositives.com/2015/10/how-to-schedule-whatsapp-messages/
1547945643.0;False;ahsgyw;True;False;t3_ahsgyw;2;False;/r/whatsapp/comments/ahsgyw/stickers/;3;Is there a good stickers app for iOS? I have been looking for one with Surprised pickachu sticker with no results ;False;Stickers;https://www.reddit.com/r/whatsapp/comments/ahsgyw/stickers/
1547938962.0;False;ahrepd;True;False;t3_ahrepd;6;False;/r/whatsapp/comments/ahrepd/receiving_messages_on_imessage_and_through/;1;I’ve been using WhatsApp for a long time, but to my recollection when I received messages on WhatsApp I didn’t also get a duplicate sent to my phone number via either iMessage or android SMS. Is there a way to keep WhatsApp messages on just WhatsApp? ;False;Receiving messages on imessage and through WhatsApp. Can i split them somehow?;https://www.reddit.com/r/whatsapp/comments/ahrepd/receiving_messages_on_imessage_and_through/
1547921545.0;False;ahoime;True;False;t3_ahoime;1;False;/r/whatsapp/comments/ahoime/transfer_whatsapp_backup_from_old_number_to_new/;1;"Hello,I have encountered following issue and I am seeking for your help. After initially verifying my Sim Card, I used WhatsApp for a long time even after my Sim Card expired. So I have been using my old inactive number for WhatsApp. Unfortunately, my old number has been recycled and someone else logged in (verified) this number on their phone. I was kicked out from WhatApp and have to verify again.I have the BackUp files saved on my phone, but they have been backuped with the old number on WhatsApp. Can I still use the BackUp files (done with the old number) when i verify WhatsApp with my new number? &#x200B;[https://www.androidrecovery.com/blog/transfer-whatsapp-to-new-phone-number.html](https://www.androidrecovery.com/blog/transfer-whatsapp-to-new-phone-number.html) says: **Warning**: The backup you made before are associated with the old phone number, so now it is necessary to make a new backup, which will be associated with the new phone number. &#x200B;And WhatsApp FAQ [https://faq.whatsapp.com/en/android/28000019/?category=5245251](https://faq.whatsapp.com/en/android/28000019/?category=5245251) states:  ### Restoring from a Google Drive backupIn order to successfully restore a Google Drive backup, **you need to use the same phone number and Google account used to create the backup**. &#x200B;I am using an Android have access to the same Google account. Any experiences or ideas?Thank you alot!";False;Transfer WhatsApp Backup from old number to new number;https://www.reddit.com/r/whatsapp/comments/ahoime/transfer_whatsapp_backup_from_old_number_to_new/
1547852931.0;False;ahg6yx;True;False;t3_ahg6yx;9;False;/r/whatsapp/comments/ahg6yx/last_seen_status_of_a_contact_not_updating_am_i/;5;"The ""Last seen"" status of one of my contacts is more than 2 weeks old. I've read that if you can't see his profile picture that means you are blocked, but he never had one so this isn't an indicator here. Am I blocked if his status hasn't changed for so long?";False;"""Last seen"" status of a contact not updating, am I blocked?";https://www.reddit.com/r/whatsapp/comments/ahg6yx/last_seen_status_of_a_contact_not_updating_am_i/
1547850809.0;False;ahfv6c;True;False;t3_ahfv6c;2;False;/r/whatsapp/comments/ahfv6c/can_a_blocked_person_see_my_newly_changed_number/;1;"Reposting because I messed up the title.&#x200B;I just blocked someone, and I'm about to change numbers. Can that person see my new number?";False;Can a blocked person see my newly changed number on What's App?;https://www.reddit.com/r/whatsapp/comments/ahfv6c/can_a_blocked_person_see_my_newly_changed_number/
1547829166.0;False;ahc7kw;True;False;t3_ahc7kw;2;False;/r/whatsapp/comments/ahc7kw/how_to_transfer_chats_from_android_to_iphone/;2;I started whatsapp on my iPhone and then began using an Android device without transferring to the new device. Now I want to switch back to my iPhone and want to transfer my Android chats to my iPhone while keeping the chats already on my iPhone. I can't use Google Drive on my iPhone for some reason, any ideas?;False;How to transfer chats from Android to iphone while keeping the original chat?;https://www.reddit.com/r/whatsapp/comments/ahc7kw/how_to_transfer_chats_from_android_to_iphone/
1547786681.0;False;ah6v5l;True;False;t3_ah6v5l;3;False;/r/whatsapp/comments/ah6v5l/can_someone_explain_to_me_why_whatsapp_when_it/;3;"I'm from Europe and my whole family is blonde, fair skinned and blue eyed. So this years holidays our niece brought it up, that everyone is in Whatsapp but there isn't a good emoji for her. She got teased my other girls that she should choose ""the appropriate emoji for her, oh no there isn't one hahahahaha"". Very mean...But as a company that claims to be all-inclusive, how can facebook/whatsapp forget this minority? Because well, lets be honest, blue eyed people are a huge minority in the world.I won't take the explanation that it wouldn't look as ""good"", because i'm on Twitch a lot and there are 100s of blue eyed emotes. Its either lazy, or just blatant racism? But I don't understand it.";False;Can Someone explain to me why Whatsapp when it comes to emoji's excludes the minorty with blue eyes?;https://www.reddit.com/r/whatsapp/comments/ah6v5l/can_someone_explain_to_me_why_whatsapp_when_it/
1547772140.0;False;ah4qjt;True;False;t3_ah4qjt;1;False;/r/whatsapp/comments/ah4qjt/whatsapp_backup_taking_10gb_on_icloud_but_only/;9;I realized that most of my images have been replaced with a question mark in whatsapp due to recovering barely 10% of whatever is stored on iCloud.How can I force whatsapp to restore everything on iCloud?;False;Whatsapp backup taking 10GB on iCloud but only restores 1GB with 90% of old media missing;https://www.reddit.com/r/whatsapp/comments/ah4qjt/whatsapp_backup_taking_10gb_on_icloud_but_only/
1547736181.0;False;agyetc;True;False;t3_agyetc;7;False;/r/whatsapp/comments/agyetc/woke_up_to_a_ban/;1;I got banned from WhatsApp today, I don't know why when I woke up I saw the pop-up like when you register your number in another phone while still signed in the old one, and tapped verify, put my number and then it told me my account was banned I did nothing and even used WhatsApp less the past weeks because I was trying to catch some rest from people but I have a lot of important things in my old account is there any way to recover my old number?Ps. I emailed WhatsApp support and the told me that I've sent too many subjections (only 2 wtf) and they not replying anymore :/;False;Woke up to a ban;https://www.reddit.com/r/whatsapp/comments/agyetc/woke_up_to_a_ban/
1547731932.0;False;agxshz;False;False;t3_agxshz;0;False;/r/whatsapp/comments/agxshz/whatsapp_will_allow_stickers_integration_for/;1;;False;WhatsApp will allow Stickers integration for third-party keyboards | WABetaInfo;https://wabetainfo.com/whatsapp-will-allow-stickers-integration-for-third-party-keyboards/
1547718769.0;False;agw7tf;False;False;t3_agw7tf;0;False;/r/whatsapp/comments/agw7tf/read_deleted_whatsapp_messages_with_easy_method/;0;;False;Read Deleted Whatsapp Messages With Easy Method | Read This Message Was ...;https://www.youtube.com/attribution_link?a=I4CFpx0NaqQ&u=%2Fwatch%3Fv%3DzdKa4bsetog%26feature%3Dshare
1547711415.0;False;agvhhb;False;False;t3_agvhhb;4;False;/r/whatsapp/comments/agvhhb/add_this_emoji_to_whatsapp_please_its_a_very/;7;;False;Add this emoji to whatsapp please, it's a VERY important emoji;https://i.redd.it/qc6eep25vxa21.jpg
1547660751.0;False;agnn3w;False;False;t3_agnn3w;0;False;/r/whatsapp/comments/agnn3w/indians_are_tired_of_fake_whatsapp_news_in_2019/;3;;False;Indians are Tired of Fake WhatsApp News in 2019;https://www.techretox.com/articles/indians-are-tired-of-fake-whatsapp-news-in-2019
1547650069.0;False;agltma;True;False;t3_agltma;0;False;/r/whatsapp/comments/agltma/whatsapp_disconnecting_from_desktop_app_after/;1;"Hey guys,I recently got a new Iphone XS Max and was having issues with my WhatsApp desktop app. When my phone goes to sleep/ screen turns black, my connection from WhatsApp seems to disconnect from the desktop app. In order to connect it back to the app, I need to unlock my phone. I tried to find some sort of ""Disconnect from app when iphone sleeps"" kind of option on my iphone, but can't seem to find it.If anyone could help me out it would be really appreciated.";False;WhatsApp disconnecting from desktop app after getting new Iphone;https://www.reddit.com/r/whatsapp/comments/agltma/whatsapp_disconnecting_from_desktop_app_after/
1547591544.0;False;age81r;True;False;t3_age81r;9;False;/r/whatsapp/comments/age81r/im_banned_from_whatsapp_about_1_week_already_but/;5;"I just banned from using whatsapp service. I just email to the whatsapp support and got a reply "" we banned you because violence to terms of whatsapp. But other users still still can see my whatsapp profile. Read of terms of whatsapp it say "" after 72 hours you got banned, nobody can see your account"". And now my account already banned for 1 week. I just wanna know my account is permenently banned or what? Thanks...";False;Im banned from whatsapp. About 1 week already. But other users still can see my profile. Help me;https://www.reddit.com/r/whatsapp/comments/age81r/im_banned_from_whatsapp_about_1_week_already_but/
