created_utc;edited;id;is_self;locked;name;num_comments;over_18;permalink;score;selftext;spoiler;title;url
1553465748.0;False;b52cnr;True;False;t3_b52cnr;0;False;/r/whatsapp/comments/b52cnr/last_seen_and_iwatch_drama_help/;1;Guys does anyone know if your last seen on WhatsApp refelects the last time you used WhatsApp even via iwatch or is it the last time you opened the app on your phone? Help a girl out;False;Last seen and iWatch drama, help!;https://www.reddit.com/r/whatsapp/comments/b52cnr/last_seen_and_iwatch_drama_help/
1553452222.0;False;b4znu8;False;False;t3_b4znu8;0;False;/r/whatsapp/comments/b4znu8/whatsapp_releases_a_new_feature_prepares_to/;2;;False;WhatsApp releases a new feature, prepares to launch an important other;https://muraselon.com/en/2019/03/whatsapp-new-feature-prepares/
1553440220.0;False;b4xcp2;True;False;t3_b4xcp2;3;False;/r/whatsapp/comments/b4xcp2/skipped_restore_backup/;1;So I reinstalled WhatsApp on my phone because of some issues, when I downloaded it and logged in with my number, I accidentally skipped the restore chat option. Now I lost all of my chats! There must be a way to restore my chats right?;False;Skipped restore backup;https://www.reddit.com/r/whatsapp/comments/b4xcp2/skipped_restore_backup/
1553435761.0;False;b4wkz9;True;False;t3_b4wkz9;0;False;/r/whatsapp/comments/b4wkz9/convo_history_for_blocked_person/;0;So i blocked someone on whatsapp and their name doesnt show up on the contact list anymore. Can i still see our conversation history without having to unblock them?;False;Convo history for blocked person;https://www.reddit.com/r/whatsapp/comments/b4wkz9/convo_history_for_blocked_person/
1553350448.0;False;b4jlpm;True;False;t3_b4jlpm;3;False;/r/whatsapp/comments/b4jlpm/hidden_last_see/;2;HelloAnyone know of a free way to see hidden last seens ?Thanks ;False;Hidden last see;https://www.reddit.com/r/whatsapp/comments/b4jlpm/hidden_last_see/
1553333078.0;False;b4h7ud;True;False;t3_b4h7ud;3;False;/r/whatsapp/comments/b4h7ud/how_to_disable_whatsapp_call_notification/;2;Before anyone suggest turning off notifications.. I have all settings to disabled whether it is in whatsapp or from the settings tab on my S9+. Text messages works and dont show up but voice/video calls can never fail to show on my screen... what is the actual problem? is it built up like this, bypassing my notification settings?;False;how to disable whatsapp call notification;https://www.reddit.com/r/whatsapp/comments/b4h7ud/how_to_disable_whatsapp_call_notification/
1553311940.0;False;b4eeu6;True;False;t3_b4eeu6;4;False;/r/whatsapp/comments/b4eeu6/how_to_still_see_whatsapp_last_seen/;2;Hey guysIf someone has disabled their WhatsApp last seen is there a way to still see it? Maybe through a 3rd party app?Thanks;False;How to still see WhatsApp last seen;https://www.reddit.com/r/whatsapp/comments/b4eeu6/how_to_still_see_whatsapp_last_seen/
1553296726.0;False;b4bywc;True;False;t3_b4bywc;3;False;/r/whatsapp/comments/b4bywc/why_arent_usernames_being_displayed/;1;I recently bought a new phone. On my old phone, I backed up my WhatsApp data to my Google Drive. Then, on my new phone, I restored that data after verifying. That all worked perfectly, and my contacts show up as their names in WhatsApp.However, in my group chats that have people whom I don't have in my contacts, I don't see a name next to them anymore. On my old phone, you would see a name on the right side which was whatever they used for their username. On my new phone with the latest WhatsApp, I don't see this.Is there any way I can get this back? It'd be a little awkward if I have to ask these people for their names.;False;Why aren't usernames being displayed?;https://www.reddit.com/r/whatsapp/comments/b4bywc/why_arent_usernames_being_displayed/
1553285472.0;False;b49tlo;True;False;t3_b49tlo;5;False;/r/whatsapp/comments/b49tlo/contacts_not_showing/;1;Hello,So im using whatsapp on my work phone and some of my contacts are not showing on whatsapp, I try adding them with the correct country code, +1 for US, +52 for Mex, and making sure whatsapp has access to my contacts, anyone has had the same issue?;False;Contacts not showing;https://www.reddit.com/r/whatsapp/comments/b49tlo/contacts_not_showing/
1553284323.0;False;b49l4e;True;False;t3_b49l4e;0;False;/r/whatsapp/comments/b49l4e/whats_app_web_notification_wont_go_away/;1;so I closed whats app on my computer and hit the log out of all devices option on my phone but the notification is stuck there and cant be swiped away. Pressing it opens the code scanner, and no devices are logged onto WhatsApp web. Very annoying bug.;False;Whats app web notification won't go away!;https://www.reddit.com/r/whatsapp/comments/b49l4e/whats_app_web_notification_wont_go_away/
1553256983.0;False;b44cxf;True;False;t3_b44cxf;4;False;/r/whatsapp/comments/b44cxf/how_to_send_gifs_on_whatsapp_desktop/;1;Sometimes i copy paste a link to a gif and it shows up as the actual gif on the chat where the other person can simply click on it and it plays.But other times i post a link and it just shows up as the actual link, which they have to click on and it will direct them to the website like imgur to see the gif in action. The latter is really annoying and defeats the purpose of sending someone a gif.So what makes the difference? Why does the gif feature work with some links but not with others? ;False;How to send gifs on whatsapp desktop;https://www.reddit.com/r/whatsapp/comments/b44cxf/how_to_send_gifs_on_whatsapp_desktop/
1553214648.0;False;b3ybpt;True;False;t3_b3ybpt;1;False;/r/whatsapp/comments/b3ybpt/cooldown_en_whatsapp/;2;Hola, ¿Alguien sabe a cerca del cooldown que recibe una persona al salirse de un grupo en WhatsApp? ;False;CoolDown en WhatsApp;https://www.reddit.com/r/whatsapp/comments/b3ybpt/cooldown_en_whatsapp/
1553197827.0;False;b3v41j;True;False;t3_b3v41j;1;False;/r/whatsapp/comments/b3v41j/downloaded_documents_cannot_be_opened_after/;1;I manually downloaded several files from a whatsapp chatgroup, after awhile the original sender deleted the files for everyone.The files are still in my whatsapp documents folder, but i can't seem to open/copy/send/share themI connected my phone to my pc, i cannot find them on my phone thru my pcAny advice ?;False;Downloaded documents cannot be opened after sender deleted them from the chat;https://www.reddit.com/r/whatsapp/comments/b3v41j/downloaded_documents_cannot_be_opened_after/
1553186574.0;False;b3ss6n;False;False;t3_b3ss6n;2;False;/r/whatsapp/comments/b3ss6n/a_collection_of_stickers_i_like/;4;;False;A collection of stickers I like.;https://play.google.com/store/apps/details?id=atifali.trendystickers
1553172471.0;False;b3q4di;True;False;t3_b3q4di;4;False;/r/whatsapp/comments/b3q4di/whatsapp_web_not_loading/;3;I am unable to load whatsapp web. After reading the QR code with the phone, the Android App crashes and the browser window loads forever.Tried different computers, browsers, phones, reinstalls etc. Nothing works.Can someone help?  thanks!;False;Whatsapp web not loading;https://www.reddit.com/r/whatsapp/comments/b3q4di/whatsapp_web_not_loading/
1553165669.0;False;b3p3wf;False;False;t3_b3p3wf;1;False;/r/whatsapp/comments/b3p3wf/كيفية_منع_حسابك_على_whatsapp_من_السرقة/;0;;False;كيفية منع حسابك على whatsapp من السرقة;https://www.elmanfi3a.com/2019/03/whatsapp.html?m=1
1553135134.0;False;b3l12g;True;False;t3_b3l12g;9;False;/r/whatsapp/comments/b3l12g/how_do_i_retrieve_my_old_conversations_back_its/;2;Monday, I went to change my actual number to google voice number to see if it will work on WhatsApp which it did and I automatically put my actual number back where I had gotten my old messages back but this time I didn’t. I also have an iPhone so I do not know what to do. 😐;False;How do I retrieve my old conversations back? It’s important.;https://www.reddit.com/r/whatsapp/comments/b3l12g/how_do_i_retrieve_my_old_conversations_back_its/
1553091331.0;False;b3cjfb;True;False;t3_b3cjfb;4;False;/r/whatsapp/comments/b3cjfb/how_can_i_use_the_ios_whatsapp_feature_that_shows/;5;"Hey guys. On iOS, if you type a certain word (let's say ""sun"", for example), its related emoji will appear (in this case, a sun obviously). Is that something that you can have on Android as well? I find it very useful. Thanks!";False;How can I use the iOS whatsapp feature that shows you emojis when you type their related words on Android?;https://www.reddit.com/r/whatsapp/comments/b3cjfb/how_can_i_use_the_ios_whatsapp_feature_that_shows/
1553031154.0;False;b337h8;True;False;t3_b337h8;3;False;/r/whatsapp/comments/b337h8/profile_picture/;3;Was thinking of putting my profile pic of me as a 1 year old. I'm 30 now but the pic is really nice.I always over think this stuff and see other contacts have their profile pics of a more recent pictures of themselves, is there like some stigma of having a picture of you as a baby or kid as profile pics on twitter facebook whatsapp when your a grown person?;False;Profile Picture;https://www.reddit.com/r/whatsapp/comments/b337h8/profile_picture/
1553016686.0;False;b309xf;True;False;t3_b309xf;12;False;/r/whatsapp/comments/b309xf/whatsapp_blackmail/;1;Got caught out. Meet a girl on tinder then the conversation moved over the whatsapp.Anycase some embarrasing things said and pics sent.One face pic on whatsapp.I assume the tinder pics were screenshot.How far can this be spread ? How embarrasing can this get ?She said she will share to social media.;False;Whatsapp blackmail;https://www.reddit.com/r/whatsapp/comments/b309xf/whatsapp_blackmail/
1553002789.0;False;b2xj7a;True;False;t3_b2xj7a;5;False;/r/whatsapp/comments/b2xj7a/is_the_messages_in_whatsapp_truly_encrypted/;4;Right after the shooting video started to circulate, my friend got it. At some point, the video disappear from the group and every attempt to send it again failed. So does this mean that whatsapp actually can read our messages? Or is this just happening to couple of my friends? ;False;Is the messages in whatsapp truly encrypted?;https://www.reddit.com/r/whatsapp/comments/b2xj7a/is_the_messages_in_whatsapp_truly_encrypted/
1552978854.0;False;b2u646;False;False;t3_b2u646;0;False;/r/whatsapp/comments/b2u646/notifications_from_whatsapp_coming_through_in_do/;3;;False;Notifications from Whatsapp coming through in Do Not Disturb-mode Android 9;https://www.reddit.com/r/AndroidQuestions/comments/b2u30k/notifications_from_whatsapp_coming_through_in_do/
1552961416.0;False;b2rj6m;True;False;t3_b2rj6m;2;False;/r/whatsapp/comments/b2rj6m/how_to_transfer_images_in_to_whatsapp_history/;1;Hello, I did install whatsapp business and by mistake I transferred some image documents from regular whatasapp to whatsapp business. Now that whatsapp business have been deleted and my images from there on my computers hard drive is there a way to transport them back to regular whatsapp? When use whatspp in chats I see thumbnails of these images but cant download them or use them. Is there a way to move them from my PC hard drive to my whatsapp so I can use these images there and they are fully usable in chat history?;False;How to transfer images in to WhatsApp history;https://www.reddit.com/r/whatsapp/comments/b2rj6m/how_to_transfer_images_in_to_whatsapp_history/
1552955535.0;False;b2qgqe;True;False;t3_b2qgqe;11;False;/r/whatsapp/comments/b2qgqe/get_youtube_to_play_in_pictureinpicture_mode/;2;No idea why it's not doing it anymore..YouTube used to always play PIP but now when I click a YouTube link, it plays in the Android app instead. IG links still play in PIP so I at least know the feature is working.Any idea on how I can get YouTube content to play strictly on PIP mode?Much thanks;False;Get YouTube to play in picture-in-picture mode;https://www.reddit.com/r/whatsapp/comments/b2qgqe/get_youtube_to_play_in_pictureinpicture_mode/
1552953200.0;False;b2q127;True;False;t3_b2q127;6;False;/r/whatsapp/comments/b2q127/is_there_a_way_to_login_to_whatsapp_phone_using/;2;My cousin is visiting me and he left his sim at home (in a different country). He is signed in to WhatsApp but he needs to wipe his phone for a sim we got him to work. I used his phone to login to the browser version of WhatsApp and the macOS app of WhatsApp. Is there a way I could sign back into the phone after I'm done reseting it through the Browser or the App version. Also maybe I could change the number but can he change it back when he leaves the country and will his contacts be able to contact him after changing into a new number. Thanks.;False;Is there a way to login to WhatsApp phone using Desktop Browser that is already signed in to your WhatsApp;https://www.reddit.com/r/whatsapp/comments/b2q127/is_there_a_way_to_login_to_whatsapp_phone_using/
1552937361.0;False;b2mxu0;True;False;t3_b2mxu0;1;False;/r/whatsapp/comments/b2mxu0/wathsapp/;0;Wathsapp ;False;Wathsapp;https://www.reddit.com/r/whatsapp/comments/b2mxu0/wathsapp/
1552909469.0;1552914317.0;b2hpeu;True;False;t3_b2hpeu;10;False;/r/whatsapp/comments/b2hpeu/changing_phone_temporarily/;1;"I have an iPhone X, which I broke the screen(Shame on me). I'll send it to be repaired in the shop.I'll use an Android device while my iPhone is been repaired. I want to keep my iPhone history(The phone will not be erase/wiped) when I switch back to iPhone after the repair.I remember that after verifing my number in another phone, the Whatsapp on iPhon will block access to the app without verifing the number again. My doubt is if it will keep the history in my iPhone when I verify it again after repair, or if it will be deleted.If it will be deleted, is that possible to restore from the last backup in the iCloud?Thanks!&#x200B;EDIT: Clarification: I don't want the history of conversations made in the Android, just the one present in the iPhone.";False;Changing phone temporarily;https://www.reddit.com/r/whatsapp/comments/b2hpeu/changing_phone_temporarily/
1552887589.0;False;b2evzz;True;False;t3_b2evzz;5;False;/r/whatsapp/comments/b2evzz/whatsapp_conversations_turned_into_facebook_ad/;11;Today, I decided to switch from my old smartwatch to a very nice analog watch. It took me a bit of tinkering because I have small wrists, but I got it done. Later, my friend on WhatsApp tells me about her day, I tell her about how I haven't done much but swap out watches. That's the only mention I have of it on a digital platform. This was out of the blue, I haven't looked up watches for sale, manuals, specs, nothing of the sort.And yet, 10 minutes after the conversation I pull up Facebook and there it is. An advertisement for some smartwatch.Call me a tinfoil hat conspirator, but this is *highly* alarming to me, as I go a long way to make sure that some things are kept private. I thought the fact these conversations were end to end encrypted, meant that the conversations were only available with the persons involved.Anybody have some insight?;False;WhatsApp conversations turned into Facebook ad?;https://www.reddit.com/r/whatsapp/comments/b2evzz/whatsapp_conversations_turned_into_facebook_ad/
1552870590.0;False;b2cech;True;False;t3_b2cech;1;False;/r/whatsapp/comments/b2cech/query/;1;If I’m removed from a group by the admin, do other people receive a notification?;False;Query;https://www.reddit.com/r/whatsapp/comments/b2cech/query/
1552820170.0;False;b241tl;True;False;t3_b241tl;22;False;/r/whatsapp/comments/b241tl/automatically_deleting_local_backup_after_upload/;3;I've thought about places to ask about this and thought that maybe someone on this subreddit might know a solution to my problem.Every night at 2:00AM, my phone makes a local back-up of WhatsApp. This back-up is about 400-500MB every night, and is uploaded to Google Drive the same night (if I have a Wi-Fi connection, which I do every night). However, after uploading the back-up file, WhatsApp does not delete the local files. After a few days, these take up gigabytes of storage on my phone.Is there any way to automatically delete the local backups after they are uploaded to the cloud?;False;Automatically deleting local back-up after upload to Google Drive;https://www.reddit.com/r/whatsapp/comments/b241tl/automatically_deleting_local_backup_after_upload/
1552818671.0;False;b23w4f;False;False;t3_b23w4f;2;False;/r/whatsapp/comments/b23w4f/do_you_suspect_your_whatsapp_account_was_hacked/;0;;False;Do You Suspect Your WhatsApp Account Was Hacked?;https://www.codeitbro.com/do-you-suspect-your-whatsapp-account-was-hacked/
1552794271.0;False;b215ck;True;False;t3_b215ck;0;False;/r/whatsapp/comments/b215ck/theres_still_some_mild_server_problems_i_see/;1;So I use Whatsapp as a medium for sending GIFs of a virtual federation of a videogame I'm playing with friends. Seems sometimes it takes 5 seconds to upload the GIFs, sometimes it drops and cannot send them for almost three minutes straight. I have to connect and disconnect from my WiFi or do the same thing with my mobile internet everytime it happens. It happened twice though, so nothing really annoying or concerning. It didn't happen before, it started after all the servers went down days ago.Anyone else experiencing trouble with Whatsapp from time to time?;False;There's still some mild server problems I see;https://www.reddit.com/r/whatsapp/comments/b215ck/theres_still_some_mild_server_problems_i_see/
1552784930.0;1552785114.0;b1zqv2;True;False;t3_b1zqv2;2;False;/r/whatsapp/comments/b1zqv2/whatsapp_facebook_group_automatic_forwarding/;2;"TL;DR: Is there a way to \*Automatically Forward or CROSSPOST\* messages that I send to a WhatsApp group that I admin to a FACEBOOK group/page? Or VICE VERSA?&#x200B;I started a WhatsApp group to notify people in my area about different meetups (that I've researched from going to 5 different event calendars). We are about 40 people now.&#x200B;I want to start a Facebook Group or Facebook Page where I can do a similar thing- share Events from all over the internet.   HOWEVER- I don't want to have to individually update the WhatsApp group and then go separately to update the Facebook Group or Page. I share tons of events and that would literally double the time.&#x200B;Is there a kind of AUTOMATIC FORWARDING MECHANISM or... mirroring? that would automatically share whatever I sent to the WhatsApp group to Facebook? Or... give me the option each time to share? ( crosspost, autopost, auto-post)&#x200B;OR VICE VERSA... and then I'll post to the Facebook Group and that'll automatically update the WhatsApp group?&#x200B;Thank you for your time and expertise!";False;WHATSAPP --> FACEBOOK GROUP, Automatic Forwarding/ Posting?;https://www.reddit.com/r/whatsapp/comments/b1zqv2/whatsapp_facebook_group_automatic_forwarding/
1552778752.0;False;b1yr4o;False;False;t3_b1yr4o;20;False;/r/whatsapp/comments/b1yr4o/problem_with_whatsapp_stuck_at_connecting_i_have/;6;;False;"Problem with WhatsApp. Stuck at ""connecting"". I have tried to downgrade, format. Can't get it to work. Suggestions?";https://i.redd.it/kv1nblxwekm21.jpg
1552774766.0;False;b1y3r5;True;False;t3_b1y3r5;5;False;/r/whatsapp/comments/b1y3r5/transfer_whatsapp_data_to_new_phone_android/;2;"Hello everyone,  Thank you for your time. This is not an ordinary request; I'll explain.  I need your kind help please regarding helping me transfer my WhatsApp application (complete with its history) from one phone to another. But there's a catch.  All ""conventional""/recommended methods have failed. Here's what I tried:  \- Backing up my conversation history to Google Drive then attempting to restore on the new phone  \- Manually copying multiple ""msgstore.db.crypt"" files from the old phone to the new one and attempting to back up from all of them  \- Deleting all backups on both Google Drive and phone memory and generating brand new ones, then trying all the above methodologies again  \- Deleting all WhatsApp media and doing all of the above steps again and again  \- Waiting 6 months (!!!) and attempting to backup again, doing all of the above steps  \- Making absolutely sure that both WhatsApp versions are the exact same version  \- Making absolutely sure that both WhatsApp versions are the latest version  In all attempts, the WhatsApp restore process fails at 24%.  Now on the bright side, when I (am forced to) go back to my old dying phone, it doesn't even go through a backup/restore process because all the data is already there. It just boots up WhatsApp at the state it was before I left it.  So my request is: I would please like help manually ""excavating"" my WhatsApp data from my old phone's system files to manually ""plant"" that data in my new phone's system files and all. I tried researching this and doing it myself but I don't know enough about Android's system file structure.  This is super important for me, because I have critical court evidence on there that I must preserve, and I cannot afford to ""start fresh"". Sadly, my old phone is now dying on me.  From the bottom of my heart, thank you very much.";False;Transfer WhatsApp data to new phone (Android);https://www.reddit.com/r/whatsapp/comments/b1y3r5/transfer_whatsapp_data_to_new_phone_android/
1552766974.0;1552767523.0;b1wpnr;True;False;t3_b1wpnr;2;False;/r/whatsapp/comments/b1wpnr/whatsapp_is_bad_and_people_working_on_it_should/;0;"Edit: I'm talking about the Android version specifically.It's a weird situation that the number one messaging app seems to have no designer working on the visual side. It's has the most uninspired, generic material design look possible from a couple years ago. And that ugly (iconic?) accent color everywhere makes it even more worse. No wallpaper can make it better. Using Whatsapp - and even seeing others use it - makes me depressed. I don't even mind that there's nothing special about it; it's just the looks that's killing all the joy to use the app. Mind you, I think ythqt for example stock Telegram is almost as ugly as WhatsApp. But at least they have Telegram X, which does things a lot better. Google Allo was just perfect when it comes to looks; it was so pretty that you wanted to use the app for the sake of it. It had conversation-specific themes, whick were shared among all participants. This made instantly obvious to whom were you talking to. However, WhatsApp doesn't even utilize profile pictures in group chats; This is why it's hard to keep track on who's talking what. And it misses that sense of conversation and interaction because of it.I guess Facebook wants to keep WhatsApp bad so they people would use Facebook Messenger instead.";False;WhatsApp is bad and people working on it should feel bad too;https://www.reddit.com/r/whatsapp/comments/b1wpnr/whatsapp_is_bad_and_people_working_on_it_should/
1552763895.0;False;b1w4k2;True;False;t3_b1w4k2;3;False;/r/whatsapp/comments/b1w4k2/whatsapp_web_without_phone/;1;Hi.I want to buy a dumb phone that doesn’t support WhatsApp, but still I want to use WhatsApp web, is there anyway to do so? Also, if I delete WhatsApp, will my contacts know that I don’t have it or still try to massage me and think I ignore them?Thanks;False;WhatsApp web without phone?;https://www.reddit.com/r/whatsapp/comments/b1w4k2/whatsapp_web_without_phone/
1552748795.0;False;b1te7w;True;False;t3_b1te7w;7;False;/r/whatsapp/comments/b1te7w/goodbye_whatsapp/;5;"Minutes ago I made the move and deleted my Whatsapp account.&#x200B;Concerns about privacy, the anounced unified backend of Facebook services and the will for more data thrift, among smaller annoyances, piled up to make the decision quite easy.&#x200B;Yesterday I texted my most important contacts about it and answered their replies. Some of them said they would leave too, if it wasn't for all their contacts and groups.&#x200B;I do fully understand that and I'm not saying everybody should leave now. But there are alternatives like Signal or Telegram which can be used alongside Whatsapp.&#x200B;My point here is: If you feel uncomfortable with Whatsapp you don't have to cut all relations. Just take the first step. If some make the move others will follow easier.&#x200B;Other Messengers aren't completely empty btw. I found an old friend on Telegram and with him had my first chat outside Whatsapp.";False;Goodbye Whatsapp;https://www.reddit.com/r/whatsapp/comments/b1te7w/goodbye_whatsapp/
1552742104.0;False;b1sb9n;True;False;t3_b1sb9n;2;False;/r/whatsapp/comments/b1sb9n/how_do_i_move_chats_from_an_oppo_to_ios/;1;I've been trying for at least an hour but Everytime i try and restore on my iphone it says no backups found ;False;How do i move chats from an oppo to iOS?;https://www.reddit.com/r/whatsapp/comments/b1sb9n/how_do_i_move_chats_from_an_oppo_to_ios/
1552742009.0;False;b1sarw;False;False;t3_b1sarw;1;False;/r/whatsapp/comments/b1sarw/had_a_conversation_on_whatsapp_this_morning/;4;;False;Had a Conversation on WhatsApp This morning;https://i.redd.it/bii44lmodhm21.jpg
